protocol,ip,port,country,country_code,city,anonymity,ssl,uptime_percent,asn,isp,latency_ms,last_checked
socks4,159.192.139.42,5678,Thailand,TH,Chon Buri,elite,true,11.71,AS131090,National Telecom Public Company Limited,2144.97,1780161244.2840793
socks4,125.25.57.57,4153,Thailand,TH,Bangkok,elite,true,42.74,AS23969,TOT Public Company Limited,1886.61,1780161240.5778394
socks4,1.179.151.165,31948,Thailand,TH,Ban Phru Nai,elite,true,10.45,AS131293,TOT Public Company Limited,8254.73,1780161240.2017865
socks4,49.229.36.214,4153,Thailand,TH,Bangkok,elite,true,16.49,AS45458,AIS-Corporate,2061.68,1780161238.5892591
http,223.204.193.82,8080,Thailand,TH,Pattaya,transparent,false,20.16,AS45758,Triple T Broadband Public Company Limited,7950.51,1780161217.3303063
http,101.109.119.24,8080,Thailand,TH,Khwaeng Thung Song Hong,transparent,false,5.24,AS23969,TOT Public Company Limited,4950.34,1780161215.3746395
socks5,125.24.156.113,7080,Thailand,TH,Thung Song,elite,true,56.88,AS23969,TOT Public Company Limited,4703.34,1780161201.9561782
socks5,8.213.195.191,1081,Thailand,TH,Bangkok,elite,true,2.05,AS45102,Alibaba Cloud (Singapore) Private Limited,6397.74,1780161182.5987155
socks5,8.213.195.191,30000,Thailand,TH,Bangkok,elite,true,2.13,AS45102,Alibaba Cloud (Singapore) Private Limited,6396.24,1780161181.0237074
http,117.18.127.239,8080,Thailand,TH,Nong Muang,transparent,true,59.09,AS56309,READYIDC CO,7018.69,1780161176.4644036
socks5,8.213.195.191,13,Thailand,TH,Bangkok,elite,true,1.56,AS45102,Alibaba Cloud (Singapore) Private Limited,13587.14,1780161174.2752397
socks5,8.213.195.191,80,Thailand,TH,Bangkok,elite,true,1.93,AS45102,Alibaba Cloud (Singapore) Private Limited,13641.63,1780161170.9166665
socks5,8.213.222.157,8080,Thailand,TH,Bangkok,elite,true,1.96,AS45102,"Alibaba (US) Technology Co., Ltd.",13668.57,1780161166.783294
socks5,8.213.222.157,10000,Thailand,TH,Bangkok,elite,true,1.85,AS45102,"Alibaba (US) Technology Co., Ltd.",13492.05,1780161166.4526925
http,43.251.205.146,8080,Thailand,TH,Bangkok,transparent,false,37.1,AS134100,"United Information Highway Co., Ltd.",9281.92,1780161155.3999393
http,203.150.128.155,8080,Thailand,TH,Bangkok,transparent,true,17.29,AS4618,Internet Thailand Company Ltd,2997.84,1780161295.651547
http,202.28.194.139,31280,Thailand,TH,Ratchathewi,elite,true,99.91,AS4621,Office of Info.Tech. Admin. for Educational Development,587.66,1780161290.6339083
