protocol,ip,port,country,country_code,city,anonymity,ssl,uptime_percent,asn,isp,latency_ms,last_checked
http,202.28.194.139,31280,Thailand,TH,Ratchathewi,elite,true,99.91,AS4621,Office of Info.Tech. Admin. for Educational Development,605.21,1780103964.141049
socks4,1.179.172.45,31225,Thailand,TH,Bangkok,elite,true,14.99,AS131293,TOT Public Company Limited,1000.38,1780103962.5417285
socks4,49.229.36.214,4153,Thailand,TH,Bangkok,elite,true,16.03,AS45458,AIS-Corporate,3973.68,1780103960.9572587
socks4,1.179.151.165,31948,Thailand,TH,Ban Phru Nai,elite,true,10.23,AS131293,TOT Public Company Limited,2023.23,1780103954.2908463
socks4,182.53.96.56,4145,Thailand,TH,Khwaeng Thung Song Hong,elite,true,11.11,AS23969,TOT Public Company Limited,8113.02,1780103954.2501352
socks4,183.88.240.139,4153,Thailand,TH,Pattaya,elite,true,42.92,AS45758,Triple T Broadband Public Company Limited,4051.79,1780103950.393402
http,103.10.228.119,8080,Thailand,TH,Ban Mai Khao,transparent,false,8.14,AS131090,CATBB,2383.55,1780103936.483408
http,203.146.80.98,8080,Thailand,TH,Nong Saeng,transparent,false,23.43,AS45458,Advanced Wireless Network Company Limited,7256.75,1780103922.5002944
http,150.107.29.165,3128,Thailand,TH,On Nut,transparent,false,5.79,AS136523,POPIDC,11739.45,1780103913.8466396
http,203.150.172.151,8080,Thailand,TH,Ban Lam Luk Ka,transparent,false,5.15,AS4618,Internet Thailand Company Ltd.,9482.84,1780103907.6070197
http,182.52.233.54,8080,Thailand,TH,Khwaeng Thung Song Hong,transparent,false,41.19,AS23969,TOT Public Company Limited,3860.22,1780103893.8756282
socks5,125.24.156.113,7080,Thailand,TH,Thung Song,elite,true,55.9,AS23969,TOT Public Company Limited,1149.61,1780103856.2347574
http,203.172.136.211,8080,Thailand,TH,Hang Dong,transparent,false,10.01,AS23974,Ministry of Education - EMISC,1905.67,1780103815.7738576
socks5,8.213.215.187,202,Thailand,TH,Bangkok,elite,true,2.82,AS45102,"Alibaba (US) Technology Co., Ltd.",6434.37,1780103635.094488
