protocol,ip,port,country,country_code,city,anonymity,ssl,uptime_percent,asn,isp,latency_ms,last_checked
socks4,1.179.151.165,31948,Thailand,TH,Ban Phru Nai,elite,true,9.84,AS131293,TOT Public Company Limited,2071.81,1779960590.4753985
socks5,125.24.156.113,7080,Thailand,TH,Thung Song,elite,true,55.84,AS23969,TOT Public Company Limited,8515.24,1779960587.5423057
socks4,125.25.57.57,4153,Thailand,TH,Bangkok,elite,true,41.02,AS23969,TOT Public Company Limited,1857.25,1779960586.190942
socks4,159.192.139.42,5678,Thailand,TH,Chon Buri,elite,true,10.92,AS131090,National Telecom Public Company Limited,2218.81,1779960584.9869883
socks4,1.179.172.45,31225,Thailand,TH,Bangkok,elite,true,14.47,AS131293,TOT Public Company Limited,4056.85,1779960563.716015
socks4,183.88.240.139,4153,Thailand,TH,Pattaya,elite,true,41.77,AS45758,Triple T Broadband Public Company Limited,987.07,1779960554.531316
http,110.171.40.132,8080,Thailand,TH,Bangkok,transparent,false,6.97,AS17552,True Internet Corporation CO. Ltd.,2168.51,1779960540.9678373
http,203.150.128.242,8080,Thailand,TH,Bangkok,transparent,false,50.15,AS4618,Internet Thailand Company Ltd,1253.72,1779960523.869582
http,202.28.194.139,31280,Thailand,TH,Ratchathewi,elite,true,99.92,AS4621,Office of Info.Tech. Admin. for Educational Development,602.27,1779960523.336671
http,125.25.33.181,8080,Thailand,TH,Bangkok,transparent,false,40.0,AS23969,TOT Public Company Limited,3284.97,1779960522.8244245
http,81.31.234.70,80,Thailand,TH,Bangkok,transparent,true,7.64,AS149766,Y.U.T Corporate Company Limited,5148.49,1779960506.3726614
socks5,8.213.195.191,104,Thailand,TH,Bangkok,elite,true,2.44,AS45102,Alibaba Cloud (Singapore) Private Limited,13530.84,1779959534.394473
