protocol,ip,port,country,country_code,city,anonymity,ssl,uptime_percent,asn,isp,latency_ms,last_checked
http,182.53.202.208,8080,Thailand,TH,Chiang Mai,anonymous,false,17.92,AS23969,TOT Public Company Limited,4762.64,1780117136.0412169
http,202.28.194.139,31280,Thailand,TH,Ratchathewi,elite,true,99.92,AS4621,Office of Info.Tech. Admin. for Educational Development,596.02,1780117118.6605737
socks4,49.229.36.214,4153,Thailand,TH,Bangkok,elite,true,16.14,AS45458,AIS-Corporate,4014.89,1780117108.8014495
socks4,159.192.139.42,5678,Thailand,TH,Chon Buri,elite,true,11.49,AS131090,National Telecom Public Company Limited,1170.25,1780117099.3143811
http,101.51.131.47,8080,Thailand,TH,Nakhon Pathom,transparent,false,34.02,AS23969,TOT Public Company Limited,5302.17,1780117083.2599447
http,49.48.81.197,8080,Thailand,TH,Nakhon Ratchasima,transparent,false,25.44,AS45758,Triple T Broadband Public Company Limited,2748.88,1780117056.778125
http,49.48.68.205,8080,Thailand,TH,Prasat,transparent,false,22.86,AS45758,Triple T Broadband Public Company Limited,3592.95,1780117044.311832
http,203.172.225.227,8080,Thailand,TH,Pom Prap Sattru Phai,transparent,true,9.81,AS23974,Ministry of Education - EMISC,6585.66,1780117042.457821
http,203.150.128.25,8080,Thailand,TH,Bangkok,transparent,false,21.81,AS4618,Internet Thailand Company Ltd,6180.06,1780117037.6067936
http,106.0.168.138,8080,Thailand,TH,Siao,transparent,true,9.61,AS23974,Ministry of Education - EMISC,3593.68,1780117036.2351856
