protocol,ip,port,country,country_code,city,anonymity,ssl,uptime_percent,asn,isp,latency_ms,last_checked
http,8.213.195.191,10000,Thailand,TH,Bangkok,elite,true,0.8,AS45102,Alibaba Cloud (Singapore) Private Limited,2402.8,1779982774.701202
http,184.82.161.85,8080,Thailand,TH,Roi Et,transparent,true,49.84,AS133481,AIS-Fibre,2471.28,1779982772.3839257
http,43.251.205.146,8080,Thailand,TH,Bangkok,transparent,true,37.19,AS134100,"United Information Highway Co., Ltd.",2566.8,1779982766.6850743
http,8.213.222.247,8443,Thailand,TH,Bangkok,elite,true,0.83,AS45102,"Alibaba (US) Technology Co., Ltd.",2394.01,1779982703.63714
http,202.28.194.139,31280,Thailand,TH,Ratchathewi,elite,true,99.92,AS4621,Office of Info.Tech. Admin. for Educational Development,601.97,1779982773.1088238
http,203.150.128.57,8080,Thailand,TH,Bangkok,transparent,true,49.11,AS4618,Internet Thailand Company Ltd,4226.11,1779982687.427381
