protocol,ip,port,country,country_code,city,anonymity,ssl,uptime_percent,asn,isp,latency_ms,last_checked
http,182.53.202.208,8080,Thailand,TH,Chiang Mai,anonymous,true,17.93,AS23969,TOT Public Company Limited,1404.07,1780139036.8245876
http,81.31.234.70,80,Thailand,TH,Bangkok,transparent,true,7.7,AS149766,Y.U.T Corporate Company Limited,6838.32,1780139022.9161801
http,1.20.207.205,8080,Thailand,TH,Ban Chang,transparent,true,4.25,AS23969,TOT Public Company Limited,1082.62,1780139011.4039035
http,43.251.205.146,8080,Thailand,TH,Bangkok,transparent,true,37.14,AS134100,"United Information Highway Co., Ltd.",1331.21,1780139001.7905269
http,223.204.193.82,8080,Thailand,TH,Pattaya,transparent,true,18.51,AS45758,Triple T Broadband Public Company Limited,1510.0,1780138992.448475
http,150.107.29.165,3128,Thailand,TH,On Nut,transparent,true,5.85,AS136523,POPIDC,18174.53,1780138921.3967032
http,125.25.33.181,8080,Thailand,TH,Bangkok,transparent,true,35.89,AS23969,TOT Public Company Limited,917.65,1780138888.4212656
http,202.28.194.139,31280,Thailand,TH,Ratchathewi,elite,true,99.92,AS4621,Office of Info.Tech. Admin. for Educational Development,574.89,1780138985.2369258
