protocol,ip,port,country,country_code,city,anonymity,ssl,uptime_percent,asn,isp,latency_ms,last_checked
http,223.204.177.198,3128,Thailand,TH,Pattani,transparent,true,27.7,AS45758,Triple T Broadband Public Company Limited,569.63,1780236594.9784663
http,124.121.58.80,8080,Thailand,TH,Bangkok,transparent,true,51.59,AS17552,TRUEBB,2608.35,1780236548.2446632
http,124.121.2.160,8080,Thailand,TH,Nakhon Ratchasima,transparent,true,54.63,AS17552,TRUEBB,3513.43,1780236542.8293233
http,180.180.218.250,8080,Thailand,TH,Rayong,transparent,true,4.98,AS23969,TOT Public Company Limited,785.17,1780236456.0441155
http,202.28.194.139,31280,Thailand,TH,Ratchathewi,elite,true,99.91,AS4621,Office of Info.Tech. Admin. for Educational Development,615.39,1780236601.1722717
http,49.48.71.119,8080,Thailand,TH,Prasat,transparent,true,26.64,AS45758,Triple T Broadband Public Company Limited,4043.53,1780236604.1010711
