protocol,ip,port,country,country_code,city,anonymity,ssl,uptime_percent,asn,isp,latency_ms,last_checked
http,182.52.233.54,8080,Thailand,TH,Khwaeng Thung Song Hong,transparent,true,42.85,AS23969,TOT Public Company Limited,4974.06,1780038535.2154193
http,49.48.68.205,8080,Thailand,TH,Prasat,transparent,true,22.82,AS45758,Triple T Broadband Public Company Limited,7677.4,1780038527.8840458
http,103.10.228.119,8080,Thailand,TH,Ban Mai Khao,transparent,true,8.08,AS131090,CATBB,8038.23,1780038525.8967566
http,223.204.177.198,3128,Thailand,TH,Pattani,transparent,true,61.82,AS45758,Triple T Broadband Public Company Limited,9318.85,1780038523.9640682
http,202.28.194.139,31280,Thailand,TH,Ratchathewi,elite,true,99.91,AS4621,Office of Info.Tech. Admin. for Educational Development,575.21,1780038531.5447557
