protocol,ip,port,country,country_code,city,anonymity,ssl,uptime_percent,asn,isp,latency_ms,last_checked
http,171.7.35.183,8080,Thailand,TH,Bangkok,transparent,true,24.38,AS45758,Triple T Broadband Public Company Limited,7600.85,1780016994.2918594
http,118.173.107.123,8080,Thailand,TH,Nakhon Phanom,transparent,true,21.4,AS23969,TOT Public Company Limited,8702.81,1780016975.898967
http,8.213.197.208,4002,Thailand,TH,Bangkok,elite,true,0.96,AS45102,"Alibaba (US) Technology Co., Ltd.",2388.33,1780016896.5878763
http,101.51.131.47,8080,Thailand,TH,Nakhon Pathom,transparent,true,34.84,AS23969,TOT Public Company Limited,10051.17,1780016858.6601913
http,125.27.192.162,8081,Thailand,TH,Khwaeng Thung Song Hong,transparent,true,11.14,AS23974,TOT Public Company Limited,6361.43,1780016811.9677596
http,203.172.225.227,8080,Thailand,TH,Pom Prap Sattru Phai,transparent,true,9.79,AS23974,Ministry of Education - EMISC,2355.67,1780016998.7207737
http,203.150.128.155,8080,Thailand,TH,Bangkok,transparent,true,6.9,AS4618,Internet Thailand Company Ltd,6355.95,1780016993.8866613
http,202.28.194.139,31280,Thailand,TH,Ratchathewi,elite,true,99.91,AS4621,Office of Info.Tech. Admin. for Educational Development,565.19,1780016987.8409162
