protocol,ip,port,country,country_code,city,anonymity,ssl,uptime_percent,asn,isp,latency_ms,last_checked
http,1.20.207.205,8080,Thailand,TH,Ban Chang,transparent,true,3.27,AS23969,TOT Public Company Limited,590.23,1780094373.4530032
http,8.213.195.191,37,Thailand,TH,Bangkok,elite,true,0.61,AS45102,Alibaba Cloud (Singapore) Private Limited,3400.89,1780094371.8219583
http,223.205.28.151,8080,Thailand,TH,Pattaya,transparent,true,49.2,AS45758,Triple T Broadband Public Company Limited,4758.2,1780094351.8356268
http,203.150.128.25,8080,Thailand,TH,Bangkok,transparent,true,22.28,AS4618,Internet Thailand Company Ltd,11145.03,1780094375.7892978
http,202.28.194.139,31280,Thailand,TH,Ratchathewi,elite,true,99.91,AS4621,Office of Info.Tech. Admin. for Educational Development,581.49,1780094345.6131518
