protocol,ip,port,country,country_code,city,anonymity,ssl,uptime_percent,asn,isp,latency_ms,last_checked
http,202.28.194.139,31280,Thailand,TH,Ratchathewi,elite,true,99.91,AS4621,Office of Info.Tech. Admin. for Educational Development,568.13,1780229652.226585
http,124.121.2.160,8080,Thailand,TH,Nakhon Ratchasima,transparent,true,61.33,AS17552,TRUEBB,1287.12,1780229641.545835
http,101.51.131.47,8080,Thailand,TH,Nakhon Pathom,transparent,true,34.43,AS23969,TOT Public Company Limited,3598.73,1780229639.5068054
http,203.150.113.103,8080,Thailand,TH,Ang Thong,transparent,true,53.89,AS4618,Internet Thailand Company Ltd.,6687.52,1780229503.3541944
http,49.48.44.43,8080,Thailand,TH,Bang Lamung,transparent,true,58.61,AS45758,Triple T Broadband Public Company Limited,2800.57,1780229647.365215
