protocol,ip,port,country,country_code,city,anonymity,ssl,uptime_percent,asn,isp,latency_ms,last_checked
http,150.107.29.165,3128,Thailand,TH,On Nut,transparent,true,5.98,AS136523,POPIDC,12233.49,1780165024.0574093
http,223.204.193.82,8080,Thailand,TH,Pattaya,transparent,true,20.44,AS45758,Triple T Broadband Public Company Limited,9003.94,1780164995.8758507
http,118.175.30.26,8080,Thailand,TH,Khwaeng Thung Song Hong,transparent,true,9.52,AS131293,TOT Public Company Limited,16192.02,1780164947.8001997
http,202.28.194.139,31280,Thailand,TH,Ratchathewi,elite,true,99.91,AS4621,Office of Info.Tech. Admin. for Educational Development,567.82,1780165159.7511547
http,203.150.166.170,8080,Thailand,TH,Khon Kaen,transparent,true,4.72,AS4618,Internet Thailand Company Ltd.,10421.6,1780165118.6183653
