protocol,ip,port,country,country_code,city,anonymity,ssl,uptime_percent,asn,isp,latency_ms,last_checked
http,118.173.107.123,8080,Thailand,TH,Nakhon Phanom,transparent,true,21.69,AS23969,TOT Public Company Limited,9692.75,1780055929.939301
http,101.109.119.24,8080,Thailand,TH,Khwaeng Thung Song Hong,transparent,true,5.23,AS23969,TOT Public Company Limited,10012.71,1780055925.992535
http,171.7.35.183,8080,Thailand,TH,Bangkok,transparent,true,34.56,AS45758,Triple T Broadband Public Company Limited,9067.72,1780055891.618618
http,101.51.131.47,8080,Thailand,TH,Nakhon Pathom,transparent,true,34.75,AS23969,TOT Public Company Limited,7810.54,1780055861.801401
http,223.204.177.198,3128,Thailand,TH,Pattani,transparent,true,51.81,AS45758,Triple T Broadband Public Company Limited,14054.45,1780055854.287816
http,203.150.128.25,8080,Thailand,TH,Bangkok,transparent,true,20.44,AS4618,Internet Thailand Company Ltd,1408.88,1780055976.8341854
http,202.28.194.139,31280,Thailand,TH,Ratchathewi,elite,true,99.91,AS4621,Office of Info.Tech. Admin. for Educational Development,597.4,1780055968.4018095
