protocol,ip,port,country,country_code,city,anonymity,ssl,uptime_percent,asn,isp,latency_ms,last_checked
http,49.48.66.22,8080,Thailand,TH,Prasat,transparent,true,31.81,AS45758,Triple T Broadband Public Company Limited,4609.62,1780006711.3798668
http,81.31.234.70,80,Thailand,TH,Bangkok,transparent,true,7.65,AS149766,Y.U.T Corporate Company Limited,2459.62,1780006708.4675136
http,171.7.35.183,8080,Thailand,TH,Bangkok,transparent,true,16.67,AS45758,Triple T Broadband Public Company Limited,1149.36,1780006673.762146
http,150.107.29.165,3128,Thailand,TH,On Nut,transparent,true,5.5,AS136523,POPIDC,21418.53,1780006653.6963549
http,202.28.194.139,31280,Thailand,TH,Ratchathewi,elite,true,99.91,AS4621,Office of Info.Tech. Admin. for Educational Development,585.81,1780006789.7110484
http,203.150.128.25,8080,Thailand,TH,Bangkok,transparent,true,8.52,AS4618,Internet Thailand Company Ltd,3763.83,1780006718.5318289
