protocol,ip,port,country,country_code,city,anonymity,ssl,uptime_percent,asn,isp,latency_ms,last_checked
http,43.251.205.146,8080,Thailand,TH,Bangkok,transparent,true,37.26,AS134100,"United Information Highway Co., Ltd.",2523.63,1780045179.128836
http,125.25.33.181,8080,Thailand,TH,Bangkok,transparent,true,41.89,AS23969,TOT Public Company Limited,4691.11,1780045158.403832
http,171.7.35.183,8080,Thailand,TH,Bangkok,transparent,true,32.36,AS45758,Triple T Broadband Public Company Limited,2372.69,1780045155.2597768
http,223.204.177.198,3128,Thailand,TH,Pattani,transparent,true,63.37,AS45758,Triple T Broadband Public Company Limited,17393.86,1780045094.9461927
http,118.175.30.26,8080,Thailand,TH,Khwaeng Thung Song Hong,transparent,true,9.4,AS131293,TOT Public Company Limited,6046.67,1780045086.4368298
http,83.118.60.147,8213,Thailand,TH,Bang Rak,anonymous,true,8.17,AS132280,Symphony Communication Public Company Limited,7742.45,1780045008.8370094
http,203.150.128.25,8080,Thailand,TH,Bangkok,transparent,true,18.24,AS4618,Internet Thailand Company Ltd,2467.02,1780045195.4009593
http,202.28.194.139,31280,Thailand,TH,Ratchathewi,elite,true,99.91,AS4621,Office of Info.Tech. Admin. for Educational Development,595.82,1780045190.7450304
http,203.146.80.98,8080,Thailand,TH,Nong Saeng,transparent,true,23.25,AS45458,Advanced Wireless Network Company Limited,2173.53,1780045179.8257203
http,182.52.66.38,8080,Thailand,TH,Bangkok,transparent,true,10.63,AS23969,TOT Public Company Limited,8265.99,1780045177.573358
