protocol,ip,port,country,country_code,city,anonymity,ssl,uptime_percent,asn,isp,latency_ms,last_checked
http,49.48.68.205,8080,Thailand,TH,Prasat,transparent,true,22.94,AS45758,Triple T Broadband Public Company Limited,3183.95,1780070001.7198532
http,223.205.28.151,8080,Thailand,TH,Pattaya,transparent,true,59.84,AS45758,Triple T Broadband Public Company Limited,2279.07,1780069979.4944248
http,124.122.115.165,8080,Thailand,TH,Bangkok,transparent,true,13.44,AS17552,"True Internet Co., Ltd.",1445.23,1780069952.9041233
http,182.52.66.38,8080,Thailand,TH,Bangkok,transparent,true,12.78,AS23969,TOT Public Company Limited,1938.01,1780069947.8396354
http,61.19.30.194,8188,Thailand,TH,Khlong San,transparent,true,34.83,AS9931,Data Comm. Dept. National Telecom Public Company Limited,1910.49,1780069944.853992
http,150.107.29.165,3128,Thailand,TH,On Nut,transparent,true,5.75,AS136523,POPIDC,11258.78,1780069898.163857
http,223.204.193.82,8080,Thailand,TH,Pattaya,transparent,true,15.86,AS45758,Triple T Broadband Public Company Limited,7622.02,1780069781.9688587
http,202.28.194.139,31280,Thailand,TH,Ratchathewi,elite,true,99.91,AS4621,Office of Info.Tech. Admin. for Educational Development,561.45,1780070066.535513
http,203.150.128.155,8080,Thailand,TH,Bangkok,transparent,true,13.57,AS4618,Internet Thailand Company Ltd,5041.28,1780070052.823041
http,202.183.236.218,8080,Thailand,TH,Sikao,transparent,true,12.32,AS45458,Advanced Wireless Network Company Limited,5503.26,1780070008.995925
http,182.52.233.54,8080,Thailand,TH,Khwaeng Thung Song Hong,transparent,true,42.39,AS23969,TOT Public Company Limited,4970.61,1780069916.2510972
