protocol,ip,port,country,country_code,city,anonymity,ssl,uptime_percent,asn,isp,latency_ms,last_checked
http,43.251.205.146,8080,Thailand,TH,Bangkok,transparent,true,37.19,AS134100,"United Information Highway Co., Ltd.",2362.79,1780009125.367809
http,171.7.35.183,8080,Thailand,TH,Bangkok,transparent,true,19.09,AS45758,Triple T Broadband Public Company Limited,7652.71,1780009118.6419053
http,150.95.26.146,7080,Thailand,TH,Bangkok,elite,true,9.04,AS135161,GMO-Z.COM PTE. LTD.,12565.29,1780009107.4998283
http,110.164.128.124,8080,Thailand,TH,Lak Si,transparent,true,12.81,AS45758,Triple T Broadband Public Company Limited,10144.59,1780009044.3715
http,81.31.234.70,80,Thailand,TH,Bangkok,transparent,true,7.66,AS149766,Y.U.T Corporate Company Limited,3789.17,1780009033.5758836
http,202.28.194.139,31280,Thailand,TH,Ratchathewi,elite,true,99.91,AS4621,Office of Info.Tech. Admin. for Educational Development,571.1,1780009159.5072422
