protocol,ip,port,country,country_code,city,anonymity,ssl,uptime_percent,asn,isp,latency_ms,last_checked
http,1.20.207.205,8080,Thailand,TH,Ban Chang,transparent,true,4.89,AS23969,TOT Public Company Limited,581.7,1780160608.7438586
http,202.28.194.139,31280,Thailand,TH,Ratchathewi,elite,true,99.91,AS4621,Office of Info.Tech. Admin. for Educational Development,583.6,1780160604.4779613
http,101.51.131.47,8080,Thailand,TH,Nakhon Pathom,transparent,true,33.91,AS23969,TOT Public Company Limited,4808.78,1780160603.498168
http,203.146.80.98,8080,Thailand,TH,Nong Saeng,transparent,true,23.53,AS45458,Advanced Wireless Network Company Limited,5157.73,1780160576.1969562
http,125.27.192.162,8081,Thailand,TH,Khwaeng Thung Song Hong,transparent,true,11.22,AS23974,TOT Public Company Limited,4817.2,1780160519.6456501
http,117.18.127.239,8080,Thailand,TH,Nong Muang,transparent,true,56.76,AS56309,READYIDC CO,14242.99,1780160469.7729166
http,106.0.168.138,8080,Thailand,TH,Siao,transparent,true,9.63,AS23974,Ministry of Education - EMISC,4788.12,1780160692.3086321
