protocol,ip,port,country,country_code,city,anonymity,ssl,uptime_percent,asn,isp,latency_ms,last_checked
http,171.7.35.183,8080,Thailand,TH,Bangkok,transparent,true,26.91,AS45758,Triple T Broadband Public Company Limited,540.37,1780027495.2987
http,223.204.193.82,8080,Thailand,TH,Pattaya,transparent,true,8.03,AS45758,Triple T Broadband Public Company Limited,7814.8,1780027485.95589
http,180.180.175.11,8080,Thailand,TH,Krathum Baen,transparent,true,10.44,AS23969,TOT Public Company Limited,2065.39,1780027473.2468612
http,43.251.205.146,8080,Thailand,TH,Bangkok,transparent,true,37.31,AS134100,"United Information Highway Co., Ltd.",3766.9,1780027364.5354922
http,202.28.194.139,31280,Thailand,TH,Ratchathewi,elite,true,99.91,AS4621,Office of Info.Tech. Admin. for Educational Development,589.67,1780027411.3978524
