protocol,ip,port,country,country_code,city,anonymity,ssl,uptime_percent,asn,isp,latency_ms,last_checked
http,8.213.195.191,37,Thailand,TH,Bangkok,elite,true,0.61,AS45102,Alibaba Cloud (Singapore) Private Limited,2877.21,1780079371.992391
http,203.172.136.211,8080,Thailand,TH,Hang Dong,transparent,true,10.01,AS23974,Ministry of Education - EMISC,9948.08,1780079367.0453496
http,8.213.222.247,106,Thailand,TH,Bangkok,elite,true,0.59,AS45102,"Alibaba (US) Technology Co., Ltd.",2389.81,1780079360.3187594
http,202.28.194.139,31280,Thailand,TH,Ratchathewi,elite,true,99.91,AS4621,Office of Info.Tech. Admin. for Educational Development,584.55,1780079341.7860057
http,61.19.30.194,8188,Thailand,TH,Khlong San,transparent,true,34.82,AS9931,Data Comm. Dept. National Telecom Public Company Limited,556.5,1780079258.839984
