protocol,ip,port,country,country_code,city,anonymity,ssl,uptime_percent,asn,isp,latency_ms,last_checked
http,182.53.202.208,8080,Thailand,TH,Chiang Mai,anonymous,true,17.92,AS23969,TOT Public Company Limited,1148.22,1779967493.8018482
http,43.251.205.146,8080,Thailand,TH,Bangkok,transparent,true,37.15,AS134100,"United Information Highway Co., Ltd.",11323.64,1779967476.3118424
http,202.28.194.139,31280,Thailand,TH,Ratchathewi,elite,true,99.92,AS4621,Office of Info.Tech. Admin. for Educational Development,572.65,1779967474.9804525
http,118.175.30.26,8080,Thailand,TH,Khwaeng Thung Song Hong,transparent,true,9.28,AS131293,TOT Public Company Limited,4342.42,1779967370.6816342
http,101.109.119.24,8080,Thailand,TH,Khwaeng Thung Song Hong,transparent,true,5.22,AS23969,TOT Public Company Limited,7829.91,1779967364.7414997
