protocol,ip,port,country,country_code,city,anonymity,ssl,uptime_percent,asn,isp,latency_ms,last_checked
http,8.213.197.208,8123,Thailand,TH,Bangkok,elite,true,1.08,AS45102,"Alibaba (US) Technology Co., Ltd.",2387.68,1779974946.8440566
http,101.51.131.47,8080,Thailand,TH,Nakhon Pathom,transparent,true,35.06,AS23969,TOT Public Company Limited,5771.61,1779974927.4719443
http,184.22.131.209,8080,Thailand,TH,Bangkok,transparent,true,35.66,AS133481,AIS-Fibre,9361.6,1779974829.7606819
http,203.150.128.242,8080,Thailand,TH,Bangkok,transparent,true,48.29,AS4618,Internet Thailand Company Ltd,2012.96,1779974972.8424816
http,202.28.194.139,31280,Thailand,TH,Ratchathewi,elite,true,99.92,AS4621,Office of Info.Tech. Admin. for Educational Development,674.63,1779974949.5634964
http,203.150.128.25,8080,Thailand,TH,Bangkok,transparent,true,1.02,AS4618,Internet Thailand Company Ltd,4238.19,1779974909.040859
