protocol,ip,port,country,country_code,city,anonymity,ssl,uptime_percent,asn,isp,latency_ms,last_checked
http,183.88.214.84,8080,Thailand,TH,Nakhon Ratchasima,transparent,true,8.78,AS45758,Triple T Broadband Public Company Limited,4354.64,1780130285.4918778
http,183.88.212.184,8080,Thailand,TH,Pattaya,transparent,true,5.43,AS45758,Triple T Broadband Public Company Limited,9959.26,1780130277.8381522
http,202.28.194.139,31280,Thailand,TH,Ratchathewi,elite,true,99.92,AS4621,Office of Info.Tech. Admin. for Educational Development,603.35,1780130258.518418
http,1.20.207.205,8080,Thailand,TH,Ban Chang,transparent,true,3.9,AS23969,TOT Public Company Limited,627.49,1780130203.7598686
http,125.25.33.181,8080,Thailand,TH,Bangkok,transparent,true,36.09,AS23969,TOT Public Company Limited,7656.7,1780130161.1051736
http,8.213.197.208,2083,Thailand,TH,Bangkok,elite,true,0.96,AS45102,"Alibaba (US) Technology Co., Ltd.",2392.52,1780130107.4245389
