protocol,ip,port,country,country_code,city,anonymity,ssl,uptime_percent,asn,isp,latency_ms,last_checked
http,203.172.201.226,8080,Thailand,TH,Yasothon,transparent,true,7.7,AS23974,Ministry of Education - EMISC,4431.32,1780076973.2349482
http,202.28.194.139,31280,Thailand,TH,Ratchathewi,elite,true,99.91,AS4621,Office of Info.Tech. Admin. for Educational Development,602.12,1780076963.543601
http,110.49.53.69,8081,Thailand,TH,Bangkok,transparent,true,5.22,AS45458,Advanced Wireless Network Company Limited,5838.38,1780076960.4382496
http,203.172.136.211,8080,Thailand,TH,Hang Dong,transparent,true,10.01,AS23974,Ministry of Education - EMISC,10966.5,1780076926.0814543
http,61.19.30.194,8188,Thailand,TH,Khlong San,transparent,true,34.82,AS9931,Data Comm. Dept. National Telecom Public Company Limited,7676.38,1780076829.6643863
