protocol,ip,port,country,country_code,city,anonymity,ssl,uptime_percent,asn,isp,latency_ms,last_checked
http,202.28.194.139,31280,Thailand,TH,Ratchathewi,elite,true,99.91,AS4621,Office of Info.Tech. Admin. for Educational Development,582.56,1780094989.76495
http,110.164.175.110,8080,Thailand,TH,Bangkok,transparent,true,9.68,AS45758,Triple T Broadband Public Company Limited,1565.38,1780094976.128916
http,202.29.215.78,8080,Thailand,TH,Ratchathewi,transparent,true,10.03,AS4621,Office of Info.Tech. Admin. for Educational Development,3615.71,1780094971.669306
http,110.171.40.132,8080,Thailand,TH,Bangkok,transparent,true,7.0,AS17552,True Internet Corporation CO. Ltd.,7895.31,1780094966.087885
http,203.150.128.155,8080,Thailand,TH,Bangkok,transparent,true,14.75,AS4618,Internet Thailand Company Ltd,6604.56,1780094960.8632658
