protocol,ip,port,country,country_code,city,anonymity,ssl,uptime_percent,asn,isp,latency_ms,last_checked
http,49.48.68.205,8080,Thailand,TH,Prasat,transparent,true,22.9,AS45758,Triple T Broadband Public Company Limited,3741.47,1780136382.5978591
http,61.19.30.194,8188,Thailand,TH,Khlong San,transparent,true,34.28,AS9931,Data Comm. Dept. National Telecom Public Company Limited,4894.22,1780136353.4364562
http,49.48.81.197,8080,Thailand,TH,Nakhon Ratchasima,transparent,true,25.36,AS45758,Triple T Broadband Public Company Limited,8868.43,1780136238.843865
http,101.51.131.47,8080,Thailand,TH,Nakhon Pathom,transparent,true,33.77,AS23969,TOT Public Company Limited,3292.11,1780136222.9686868
http,110.171.40.132,8080,Thailand,TH,Bangkok,transparent,true,7.02,AS17552,True Internet Corporation CO. Ltd.,3625.5,1780136166.7390244
http,202.28.194.139,31280,Thailand,TH,Ratchathewi,elite,true,99.92,AS4621,Office of Info.Tech. Admin. for Educational Development,636.96,1780136394.3259008
http,106.0.158.114,8080,Thailand,TH,Pom Prap Sattru Phai,transparent,true,5.8,AS23974,Ministry of Education - EMISC,1711.52,1780136220.6906416
