protocol,ip,port,country,country_code,city,anonymity,ssl,uptime_percent,asn,isp,latency_ms,last_checked
http,182.52.66.38,8080,Thailand,TH,Bangkok,transparent,true,10.42,AS23969,TOT Public Company Limited,2250.2,1780042796.598243
http,8.213.222.157,41,Thailand,TH,Bangkok,elite,true,0.68,AS45102,"Alibaba (US) Technology Co., Ltd.",2397.94,1780042773.5067413
http,124.122.115.165,8080,Thailand,TH,Bangkok,transparent,true,13.44,AS17552,"True Internet Co., Ltd.",5302.23,1780042763.5325005
http,171.7.35.183,8080,Thailand,TH,Bangkok,transparent,true,31.66,AS45758,Triple T Broadband Public Company Limited,595.09,1780042749.6619587
http,223.204.193.82,8080,Thailand,TH,Pattaya,transparent,true,11.8,AS45758,Triple T Broadband Public Company Limited,8763.52,1780042739.4718933
http,223.205.28.151,8080,Thailand,TH,Pattaya,transparent,true,76.98,AS45758,Triple T Broadband Public Company Limited,3589.07,1780042739.3467975
http,118.173.107.123,8080,Thailand,TH,Nakhon Phanom,transparent,true,21.58,AS23969,TOT Public Company Limited,7739.0,1780042735.3209348
http,182.52.233.54,8080,Thailand,TH,Khwaeng Thung Song Hong,transparent,true,42.73,AS23969,TOT Public Company Limited,8270.09,1780042651.9085627
http,202.28.194.139,31280,Thailand,TH,Ratchathewi,elite,true,99.91,AS4621,Office of Info.Tech. Admin. for Educational Development,577.05,1780042767.8951635
http,203.150.128.155,8080,Thailand,TH,Bangkok,transparent,true,10.78,AS4618,Internet Thailand Company Ltd,1939.34,1780042743.4718308
