protocol,ip,port,country,country_code,city,anonymity,ssl,uptime_percent,asn,isp,latency_ms,last_checked
http,125.27.192.162,8081,Thailand,TH,Khwaeng Thung Song Hong,transparent,true,11.24,AS23974,TOT Public Company Limited,5495.72,1780195141.5118725
http,180.180.175.11,8080,Thailand,TH,Krathum Baen,transparent,true,10.58,AS23969,TOT Public Company Limited,5214.73,1780195127.9603848
http,150.95.26.146,7080,Thailand,TH,Bangkok,elite,true,9.09,AS135161,GMO-Z.COM PTE. LTD.,9767.0,1780195109.2239134
http,101.109.133.170,8080,Thailand,TH,Mueang Samut Prakan,transparent,true,58.57,AS23969,TOT Public Company Limited,3061.33,1780195074.3598537
http,125.25.33.181,8080,Thailand,TH,Bangkok,transparent,true,37.31,AS23969,TOT Public Company Limited,12102.49,1780195062.551839
http,101.109.42.253,8080,Thailand,TH,Bangkok,transparent,true,42.39,AS23969,TOT Public Company Limited,4259.34,1780194953.367816
http,203.150.128.25,8080,Thailand,TH,Bangkok,transparent,true,27.47,AS4618,Internet Thailand Company Ltd,2786.19,1780195140.8893795
http,203.172.225.227,8080,Thailand,TH,Pom Prap Sattru Phai,transparent,true,9.85,AS23974,Ministry of Education - EMISC,8745.1,1780195105.929711
http,202.28.194.139,31280,Thailand,TH,Ratchathewi,elite,true,99.91,AS4621,Office of Info.Tech. Admin. for Educational Development,565.93,1780195096.4075596
http,203.146.80.102,8080,Thailand,TH,Nong Saeng,transparent,true,12.91,AS45458,Advanced Wireless Network Company Limited,4702.71,1780195081.2785747
http,49.48.205.240,8080,Thailand,TH,Phitsanulok,transparent,true,66.67,AS45758,Triple T Broadband Public Company Limited,1995.57,1780195142.1157482
http,61.19.145.66,8080,Thailand,TH,Khlong San,transparent,true,5.35,AS9931,National Telecom Public Company Limited,3030.92,1780195084.732864
