protocol,ip,port,country,country_code,city,anonymity,ssl,uptime_percent,asn,isp,latency_ms,last_checked
http,43.251.205.146,8080,Thailand,TH,Bangkok,transparent,true,37.56,AS134100,"United Information Highway Co., Ltd.",3657.51,1780235649.811828
http,202.28.194.139,31280,Thailand,TH,Ratchathewi,elite,true,99.91,AS4621,Office of Info.Tech. Admin. for Educational Development,603.82,1780235690.1668923
http,203.172.136.211,8080,Thailand,TH,Hang Dong,transparent,true,10.08,AS23974,Ministry of Education - EMISC,3620.32,1780235679.9790154
http,49.48.144.31,8080,Thailand,TH,Khon Kaen,transparent,true,45.43,AS45758,Triple T Broadband Public Company Limited,5614.59,1780235689.5738835
http,49.48.68.205,8080,Thailand,TH,Prasat,transparent,true,23.33,AS45758,Triple T Broadband Public Company Limited,3598.32,1780235686.789983
