protocol,ip,port,country,country_code,city,anonymity,ssl,uptime_percent,asn,isp,latency_ms,last_checked
http,150.95.26.146,7080,Thailand,TH,Bangkok,elite,true,9.06,AS135161,GMO-Z.COM PTE. LTD.,14927.18,1780067345.9905267
http,61.19.30.194,8188,Thailand,TH,Khlong San,transparent,true,34.78,AS9931,Data Comm. Dept. National Telecom Public Company Limited,584.71,1780067335.5020132
http,118.175.30.26,8080,Thailand,TH,Khwaeng Thung Song Hong,transparent,true,9.44,AS131293,TOT Public Company Limited,5605.12,1780067311.5468717
http,223.205.28.151,8080,Thailand,TH,Pattaya,transparent,true,59.53,AS45758,Triple T Broadband Public Company Limited,3648.51,1780067293.7298734
http,202.28.194.139,31280,Thailand,TH,Ratchathewi,elite,true,99.91,AS4621,Office of Info.Tech. Admin. for Educational Development,574.44,1780067385.3342166
http,182.52.66.38,8080,Thailand,TH,Bangkok,transparent,true,12.54,AS23969,TOT Public Company Limited,10204.49,1780067366.848057
