protocol,ip,port,country,country_code,city,anonymity,ssl,uptime_percent,asn,isp,latency_ms,last_checked
http,223.204.177.198,3128,Thailand,TH,Pattani,transparent,true,62.07,AS45758,Triple T Broadband Public Company Limited,596.33,1780039421.1033406
http,8.213.222.157,88,Thailand,TH,Bangkok,elite,true,0.73,AS45102,"Alibaba (US) Technology Co., Ltd.",2396.03,1780039395.1702662
http,110.164.128.124,8080,Thailand,TH,Lak Si,transparent,true,12.86,AS45758,Triple T Broadband Public Company Limited,1819.86,1780039285.5766325
http,203.150.128.155,8080,Thailand,TH,Bangkok,transparent,true,10.48,AS4618,Internet Thailand Company Ltd,1594.08,1780039783.0790045
http,203.150.172.151,8080,Thailand,TH,Ban Lam Luk Ka,transparent,true,5.15,AS4618,Internet Thailand Company Ltd.,6093.75,1780039763.0474815
http,202.28.194.139,31280,Thailand,TH,Ratchathewi,elite,true,99.91,AS4621,Office of Info.Tech. Admin. for Educational Development,597.84,1780039755.2399473
