protocol,ip,port,country,country_code,city,anonymity,ssl,uptime_percent,asn,isp,latency_ms,last_checked
socks5,125.24.156.113,7080,Thailand,TH,Thung Song,elite,true,55.96,AS23969,TOT Public Company Limited,6151.51,1780043301.9636655
socks5,8.213.222.157,9999,Thailand,TH,Bangkok,elite,true,1.99,AS45102,"Alibaba (US) Technology Co., Ltd.",7544.39,1780043065.6500564
socks5,8.213.222.157,31433,Thailand,TH,Bangkok,elite,true,2.13,AS45102,"Alibaba (US) Technology Co., Ltd.",8055.22,1780043039.2410176
socks5,8.213.195.191,8443,Thailand,TH,Bangkok,elite,true,2.25,AS45102,Alibaba Cloud (Singapore) Private Limited,9431.26,1780042770.6529553
socks5,8.213.222.247,8123,Thailand,TH,Bangkok,elite,true,1.64,AS45102,"Alibaba (US) Technology Co., Ltd.",6395.75,1780042647.2443779
