protocol,ip,port,country,country_code,city,anonymity,ssl,uptime_percent,asn,isp,latency_ms,last_checked
socks4,170.81.141.254,61437,Mexico,MX,Aguascalientes,elite,true,6.65,AS28418,Nueva RED Internet De Mexico S De RL De CV,773.17,1780227555.9584389
http,187.251.130.135,8080,Mexico,MX,Ciudad de Villa de Álvarez,transparent,false,11.66,AS22884,Total Play Telecomunicaciones SA De CV,9330.76,1780227548.0880735
http,177.229.218.54,999,Mexico,MX,Apodaca,transparent,false,11.24,AS262916,"Mega Cable, S.A. de C.V.",10750.56,1780227514.38022
http,187.251.224.167,80,Mexico,MX,León,transparent,false,14.56,AS22884,Total Play Telecomunicaciones SA De CV,4232.35,1780227504.648399
http,38.49.152.197,999,Mexico,MX,Irapuato,transparent,false,13.14,AS28458,IENTC S de RL de CV,9568.74,1780227503.3079143
http,148.230.4.241,999,Mexico,MX,Naranjos,transparent,false,89.39,AS265606,Digy Networks,2521.39,1780227500.5507278
http,38.123.220.190,8080,Mexico,MX,Loma Hermosa,transparent,false,9.43,AS174,Cogent Communications,3840.96,1780227497.3968036
http,38.123.220.194,999,Mexico,MX,Santa Cruz,transparent,false,25.24,AS174,Cogent Communications,1353.08,1780227485.2062192
http,187.216.141.46,3128,Mexico,MX,Unión de Tabiqueros del Río Grande de Morelia,transparent,true,7.95,AS8151,Uninet S.A. de C.V.,7411.8,1780227482.9981694
http,131.196.245.120,999,Mexico,MX,La Cañada,transparent,false,21.47,AS265561,Lantointernet SA De CV,1857.35,1780227481.7599907
http,38.210.20.239,999,Mexico,MX,Tapachula,transparent,false,9.47,AS272407,Jaime Gonzalez Galvan,5561.14,1780227479.2199078
http,38.7.21.116,999,Mexico,MX,Lázaro Cárdenas,transparent,false,22.28,AS28398,Internet Telefonia Y TV De Michoacan SA De CV,4188.45,1780227466.9594302
http,45.174.92.44,8087,Mexico,MX,San Juan Bautista Tuxtla,transparent,false,37.2,AS28429,Enlace de Datos y Redes SA de CV,11588.92,1780227463.3357742
http,38.194.246.34,999,Mexico,MX,Los Ramírez,transparent,true,41.96,AS28458,IENTC S de RL de CV,520.44,1780227459.214151
http,45.174.174.101,999,Mexico,MX,Simojovel de Allende,transparent,true,30.36,AS28435,Javier Tamayo Garcia,5884.97,1780227452.2038043
http,187.190.114.40,999,Mexico,MX,Úrsulo Galván,transparent,true,40.71,AS22884,Total Play Telecomunicaciones SA De CV,477.49,1780227451.454356
http,38.210.201.104,999,Mexico,MX,Aguascalientes,transparent,false,35.07,AS273250,Soluciones de Tecnologia Jah sa de Cv,3116.12,1780227440.6679037
http,154.27.196.242,999,Mexico,MX,Ciudad de Villa de Álvarez,transparent,false,42.14,AS270207,Cogent Communications,9606.31,1780227367.4274447
http,187.190.114.92,999,Mexico,MX,Plan del Palmar,transparent,false,18.3,AS22884,Total Play Telecomunicaciones SA De CV,5311.77,1780227344.399752
http,45.177.178.23,999,Mexico,MX,Pedro Escobedo,transparent,true,22.05,AS270158,Wantelco SAS de CV,430.56,1780227579.8892026
http,45.174.243.192,999,Mexico,MX,Champotón,transparent,true,28.58,AS265583,Sistemas Y Soluciones De Campeche SAS De CV,8636.61,1780227564.3224523
http,201.140.185.41,8081,Mexico,MX,Cancún,elite,false,57.44,AS28506,Sistemas de Communicacion GM S.A. de C.V.,9299.32,1780227556.5771363
socks5,201.165.172.3,1080,Mexico,MX,Guadalajara,elite,true,30.96,AS13999,"Mega Cable, S.A. de C.V.",4849.53,1780227487.6861603
http,45.190.76.103,999,Mexico,MX,Zapopan,transparent,false,6.08,AS265614,Meta Networks SA De CV,2562.25,1780227486.3598914
http,45.189.252.245,999,Mexico,MX,Alvarado,transparent,true,10.48,AS265613,Tracered SA De CV,3530.65,1780227445.7652779
socks5,64.177.83.56,1080,Mexico,MX,Querétaro City,elite,true,42.0,AS20473,"The Constant Company, LLC",2810.42,1780227541.3503234
http,5.102.109.41,999,Mexico,MX,San Juan del Río,transparent,true,36.85,AS270172,IPXO,8270.61,1780227515.3561463
