protocol,ip,port,country,country_code,city,anonymity,ssl,uptime_percent,asn,isp,latency_ms,last_checked
http,148.230.4.241,999,Mexico,MX,Naranjos,transparent,true,89.4,AS265606,Digy Networks,3403.48,1780230233.123849
http,45.174.92.44,8087,Mexico,MX,San Juan Bautista Tuxtla,transparent,true,37.17,AS28429,Enlace de Datos y Redes SA de CV,6394.61,1780230232.7925334
http,45.174.56.21,999,Mexico,MX,Puruándiro,transparent,false,14.01,AS270187,2M INGENIERIA Y SERVICIOS EN TELECOMUNICACIONES,9330.58,1780230218.7279334
http,187.216.141.46,3128,Mexico,MX,Unión de Tabiqueros del Río Grande de Morelia,transparent,false,7.98,AS8151,Uninet S.A. de C.V.,11730.03,1780230206.32958
http,38.123.220.190,8080,Mexico,MX,Loma Hermosa,transparent,false,9.43,AS174,Cogent Communications,9806.97,1780230205.0798357
http,45.231.170.137,999,Mexico,MX,Juárez,transparent,false,7.46,AS265547,"GigNet, S.A. de C.V.",8519.72,1780230191.2568862
http,38.123.220.175,999,Mexico,MX,Loma Hermosa,transparent,false,25.89,AS174,Cogent Communications,9307.94,1780230190.32507
http,186.96.160.220,999,Mexico,MX,Mexico City,transparent,false,28.9,AS22884,Total Play Telecomunicaciones SA De CV,2169.38,1780230169.2965662
http,45.184.124.9,1985,Mexico,MX,Chihuahua City,transparent,false,8.64,AS265598,Servicios y Asesoria Tecnobba S.A.S. de C.V.,3706.9,1780230167.5332656
http,201.150.6.201,8081,Mexico,MX,San Nicolás de los Garza,transparent,false,11.27,AS28539,Administradora de Servicios de Internet Sandur S.A. de C.V.,2363.44,1780230159.823472
http,38.210.201.104,999,Mexico,MX,Aguascalientes,transparent,false,35.06,AS273250,Soluciones de Tecnologia Jah sa de Cv,8712.1,1780230158.2394214
http,38.7.21.118,999,Mexico,MX,Lázaro Cárdenas,transparent,false,25.25,AS28398,Internet Telefonia Y TV De Michoacan SA De CV,644.55,1780230156.6544175
http,187.251.222.69,8080,Mexico,MX,Acolman,transparent,false,7.12,AS22884,Total Play Telecomunicaciones SA De CV,3920.89,1780230153.7090783
http,154.16.41.18,5555,Mexico,MX,Campeche,elite,false,9.11,AS32159,Gung HO LLC,14899.4,1780230152.899893
http,170.78.208.1,999,Mexico,MX,San Juan del Río,transparent,true,29.23,AS270158,Wantelco SAS de CV,3837.62,1780230152.832004
http,38.49.140.226,999,Mexico,MX,Pachuca,transparent,false,26.78,AS28458,IENTC S de RL de CV,8085.85,1780230149.374385
http,201.159.96.49,8081,Mexico,MX,General Escobedo,transparent,false,6.23,AS28539,Administradora de Servicios de Internet Sandur S.A. de C.V.,5163.48,1780230147.9158766
http,38.210.201.108,999,Mexico,MX,Aguascalientes,transparent,false,28.2,AS273250,Soluciones de Tecnologia Jah sa de Cv,2901.93,1780230139.9547834
http,187.190.114.57,999,Mexico,MX,Vicente Herrera,transparent,false,7.35,AS22884,Total Play Telecomunicaciones SA De CV,9423.71,1780230136.6288636
http,45.188.76.177,999,Mexico,MX,Villahermosa,transparent,false,24.77,AS265608,ONT NETWORKS SA de CV,12080.29,1780230131.1031706
http,45.190.78.20,999,Mexico,MX,Zapopan,transparent,false,20.39,AS265614,Meta Networks SA De CV,2730.02,1780230122.5812728
http,45.174.243.144,999,Mexico,MX,Champotón,transparent,false,26.89,AS265583,Sistemas Y Soluciones De Campeche SAS De CV,11591.56,1780230120.0532362
http,38.123.220.108,999,Mexico,MX,Manzana Sexta Parte Centro,transparent,false,23.08,AS174,Cogent Communications,10711.62,1780230110.3959734
http,187.188.15.249,8080,Mexico,MX,Venustiano Carranza,transparent,false,11.12,AS22884,Total Play Telecomunicaciones SA De CV,6604.09,1780230078.0993655
