protocol,ip,port,country,country_code,city,anonymity,ssl,uptime_percent,asn,isp,latency_ms,last_checked
http,45.174.92.44,8087,Mexico,MX,San Juan Bautista Tuxtla,transparent,true,37.04,AS28429,Enlace de Datos y Redes SA de CV,4342.89,1780121992.4281797
http,148.230.4.241,999,Mexico,MX,Naranjos,transparent,true,87.37,AS265606,Digy Networks,3563.98,1780121986.0059085
http,187.190.127.212,8081,Mexico,MX,Puerto Vallarta,transparent,false,14.38,AS22884,Total Play Telecomunicaciones SA De CV,5265.74,1780121963.363926
http,45.188.76.107,999,Mexico,MX,Villahermosa,transparent,false,3.69,AS265608,ONT NETWORKS SA de CV,14229.69,1780121962.351925
http,148.230.15.180,999,Mexico,MX,Francisco I. Madero,transparent,false,11.71,AS265606,Digy Networks,9122.48,1780121961.3878489
socks5,64.177.83.56,1080,Mexico,MX,Querétaro City,elite,true,37.43,AS20473,"The Constant Company, LLC",3941.8,1780121959.4211278
http,38.194.246.34,999,Mexico,MX,Los Ramírez,transparent,true,41.86,AS28458,IENTC S de RL de CV,5260.82,1780121957.8719473
http,5.102.109.41,999,Mexico,MX,San Juan del Río,transparent,false,36.78,AS270172,IPXO,10176.34,1780121940.6563733
http,38.210.201.100,999,Mexico,MX,Aguascalientes,transparent,false,25.57,AS273250,Soluciones de Tecnologia Jah sa de Cv,3828.35,1780121931.0309548
http,38.7.21.116,999,Mexico,MX,Lázaro Cárdenas,transparent,false,22.0,AS28398,Internet Telefonia Y TV De Michoacan SA De CV,15817.59,1780121928.5610802
http,187.216.229.150,8080,Mexico,MX,Mexico City,transparent,true,9.38,AS8151,Uninet S.A. de C.V.,13169.62,1780121900.6301806
http,38.7.21.118,999,Mexico,MX,Lázaro Cárdenas,transparent,true,25.07,AS28398,Internet Telefonia Y TV De Michoacan SA De CV,5239.2,1780121889.4579945
http,201.159.20.205,999,Mexico,MX,Mexicali,transparent,false,29.01,AS262913,"Konecta de Mexico, S. de R.L. de C.V.",3034.16,1780121885.4316764
http,45.190.78.20,999,Mexico,MX,Zapopan,transparent,false,20.27,AS265614,Meta Networks SA De CV,5634.86,1780121883.7979608
http,201.159.109.137,8081,Mexico,MX,General Escobedo,transparent,true,14.71,AS28539,Administradora de Servicios de Internet Sandur S.A. de C.V.,456.97,1780121877.3308957
http,38.49.150.131,999,Mexico,MX,Purísima de Cerro Grande,transparent,true,13.29,AS28458,IENTC S de RL de CV,493.1,1780121876.7245858
http,154.27.196.4,999,Mexico,MX,Ciudad de Villa de Álvarez,transparent,true,18.61,AS270207,Cogent Communications,3583.73,1780121872.371548
socks5,159.54.148.142,1080,Mexico,MX,La Cañada,elite,true,96.91,AS31898,Oracle Corporation,888.48,1780121849.3296156
socks5,201.165.172.3,1080,Mexico,MX,Guadalajara,elite,true,28.5,AS13999,"Mega Cable, S.A. de C.V.",8307.36,1780121714.7288775
