protocol,ip,port,country,country_code,city,anonymity,ssl,uptime_percent,asn,isp,latency_ms,last_checked
socks4,110.93.206.62,5678,Pakistan,PK,Karachi,elite,true,11.43,AS38193,TRANSWORLD ASSOCIATES (PVT) LIMITED,7942.58,1780070034.5891895
http,103.115.196.98,8080,Pakistan,PK,Lahore,transparent,false,17.86,AS152605,AMBITIONS COMMUNICATION SYSTEM (SMC-PRIVATE) LIMITED,8003.93,1780069995.7118149
http,39.49.164.180,8080,Pakistan,PK,Lahore,transparent,true,31.64,AS17557,Pakistan Telecommuication company limited,12159.95,1780069980.3319142
socks5,103.150.206.77,1080,Pakistan,PK,Faisalabad,elite,true,53.68,AS140594,Nadeem Abbas and Shayufta Rani,1942.02,1780069943.9711163
http,121.91.60.68,8080,Pakistan,PK,Rawalakot,transparent,false,8.76,AS138423,CMPak Limited,9490.75,1780069893.8563962
socks5,154.57.213.237,1080,Pakistan,PK,Islamabad,elite,true,61.75,AS135407,Trans World Enterprise Services (Private) Limited,1939.67,1780069855.5789886
socks5,103.121.120.242,1080,Pakistan,PK,Karachi,elite,true,94.88,AS131275,Logon Broadband Pvt. Limited,2160.96,1780069629.9605289
http,202.165.232.238,8080,Pakistan,PK,Lahore,transparent,false,24.56,AS136384,Optix Pakistan (Pvt.) Limited,11558.68,1780070070.016109
http,43.251.253.40,8080,Pakistan,PK,Lahore,transparent,false,37.92,AS136384,Optix Pakistan (Pvt.) Limited,6001.77,1780070045.4500785
http,202.154.241.199,808,Pakistan,PK,Islamabad,transparent,false,10.51,AS23966,LINKdotNET Telecom Limited,3766.92,1780069977.6777012
http,103.198.154.196,8080,Pakistan,PK,Lahore,transparent,false,22.14,AS151330,PLAY BROADBAND (PRIVATE) LIMITED,9744.87,1780069955.6021512
