protocol,ip,port,country,country_code,city,anonymity,ssl,uptime_percent,asn,isp,latency_ms,last_checked
socks4,110.93.206.62,5678,Pakistan,PK,Karachi,elite,true,11.95,AS38193,TRANSWORLD ASSOCIATES (PVT) LIMITED,1739.07,1780166964.149688
socks5,154.57.213.237,1080,Pakistan,PK,Islamabad,elite,true,67.02,AS135407,Trans World Enterprise Services (Private) Limited,8205.31,1780166952.4087164
socks5,103.150.206.77,1080,Pakistan,PK,Faisalabad,elite,true,55.71,AS140594,Nadeem Abbas and Shayufta Rani,1663.41,1780166949.8722515
http,202.165.232.238,8080,Pakistan,PK,Lahore,transparent,true,24.5,AS136384,Optix Pakistan (Pvt.) Limited,9807.87,1780166942.5485988
socks5,103.121.120.242,1080,Pakistan,PK,Karachi,elite,true,88.79,AS131275,Logon Broadband Pvt. Limited,1788.13,1780166938.3455822
socks5,182.184.119.180,1080,Pakistan,PK,Karachi,elite,true,58.1,AS17557,Pakistan Telecommuication company limited,4699.66,1780166921.8184972
socks5,175.107.244.164,1080,Pakistan,PK,Karachi,elite,true,54.67,AS9541,Cyber Internet Services Pakistan,8763.49,1780166889.3851337
http,43.245.131.90,8080,Pakistan,PK,Karachi,transparent,false,29.56,AS132165,Dynamic PPPoE Hub,4937.52,1780166846.6479058
http,110.39.183.34,8080,Pakistan,PK,Lahore,transparent,false,19.92,AS38264,Wateen Telecom Limited,5997.33,1780166795.6958983
socks5,103.236.134.210,1080,Pakistan,PK,Karachi,elite,true,90.48,AS38193,TRANSWORLD ASSOCIATES (PVT) LIMITED,786.71,1780167000.6227603
http,103.253.18.6,8080,Pakistan,PK,Faisalabad,transparent,false,8.56,AS151983,Orbit Internet Service Provider Pvt Ltd,12926.35,1780166879.6003034
