protocol,ip,port,country,country_code,city,anonymity,ssl,uptime_percent,asn,isp,latency_ms,last_checked
socks5,154.57.213.237,1080,Pakistan,PK,Islamabad,elite,true,69.8,AS135407,Trans World Enterprise Services (Private) Limited,1209.15,1780209299.323818
socks5,103.121.120.242,1080,Pakistan,PK,Karachi,elite,true,89.9,AS131275,Logon Broadband Pvt. Limited,2135.62,1780209293.7732775
socks4,103.146.137.81,1081,Pakistan,PK,Karachi,elite,true,5.84,AS139879,Galaxy Broadband (pvt.) Ltd.,627.91,1780209292.0174003
socks5,103.150.206.77,1080,Pakistan,PK,Faisalabad,elite,true,56.8,AS140594,Nadeem Abbas and Shayufta Rani,1664.53,1780209266.4451063
http,154.208.58.89,8080,Pakistan,PK,Lahore,elite,false,7.68,AS150750,IN CABLE INTERNET PRIVATE LIMITED,9787.95,1780209259.3386793
http,110.39.183.34,8080,Pakistan,PK,Lahore,transparent,true,20.18,AS38264,Wateen Telecom Limited,3769.61,1780209236.2518644
socks5,182.184.119.180,1080,Pakistan,PK,Karachi,elite,true,59.82,AS17557,Pakistan Telecommuication company limited,4239.05,1780209205.3606033
http,103.115.196.98,8080,Pakistan,PK,Lahore,transparent,false,18.02,AS152605,AMBITIONS COMMUNICATION SYSTEM (SMC-PRIVATE) LIMITED,14582.03,1780209163.466613
http,103.205.178.226,8080,Pakistan,PK,Karachi,transparent,false,19.87,AS38713,Satcomm,9001.82,1780209265.4118304
socks5,103.236.134.210,1080,Pakistan,PK,Karachi,elite,true,91.42,AS38193,TRANSWORLD ASSOCIATES (PVT) LIMITED,898.64,1780209228.8949964
http,43.251.253.40,8080,Pakistan,PK,Lahore,transparent,false,36.6,AS136384,Optix Pakistan (Pvt.) Limited,2445.66,1780209201.4261167
http,103.19.48.148,8080,Pakistan,PK,Islamabad,transparent,true,85.0,AS150371,Pace Telecom and Brodcasting Private Limited,5322.36,1780209140.7791102
http,43.245.131.90,8080,Pakistan,PK,Karachi,transparent,false,30.13,AS132165,Dynamic PPPoE Hub,11023.97,1780209135.8468401
http,58.27.206.37,8080,Pakistan,PK,Lahore,transparent,true,28.53,AS38264,Wateen Telecom (Pvt.) Ltd.,4287.29,1780209203.8704097
