protocol,ip,port,country,country_code,city,anonymity,ssl,uptime_percent,asn,isp,latency_ms,last_checked
socks4,110.93.206.62,5678,Pakistan,PK,Karachi,elite,true,12.21,AS38193,TRANSWORLD ASSOCIATES (PVT) LIMITED,3969.03,1780228764.4912403
socks4,103.146.137.233,1081,Pakistan,PK,Karachi,elite,true,6.24,AS139879,Galaxy Broadband (pvt.) Ltd.,1032.03,1780228763.6967297
socks5,103.236.134.210,1080,Pakistan,PK,Karachi,elite,true,92.12,AS38193,TRANSWORLD ASSOCIATES (PVT) LIMITED,1343.94,1780228751.2125993
socks5,182.184.119.180,1080,Pakistan,PK,Karachi,elite,true,60.43,AS17557,Pakistan Telecommuication company limited,2290.98,1780228735.7955265
socks5,103.150.206.77,1080,Pakistan,PK,Faisalabad,elite,true,57.19,AS140594,Nadeem Abbas and Shayufta Rani,2346.19,1780228718.2832136
socks5,154.57.213.237,1080,Pakistan,PK,Islamabad,elite,true,70.63,AS135407,Trans World Enterprise Services (Private) Limited,4369.71,1780228709.336645
socks5,103.121.120.242,1080,Pakistan,PK,Karachi,elite,true,90.64,AS131275,Logon Broadband Pvt. Limited,2578.61,1780228705.0244744
http,103.115.196.98,8080,Pakistan,PK,Lahore,transparent,false,18.07,AS152605,AMBITIONS COMMUNICATION SYSTEM (SMC-PRIVATE) LIMITED,13496.61,1780228692.1532202
socks5,175.107.244.164,1080,Pakistan,PK,Karachi,elite,true,56.85,AS9541,Cyber Internet Services Pakistan,1987.88,1780228681.6567588
http,43.245.131.90,8080,Pakistan,PK,Karachi,transparent,false,30.28,AS132165,Dynamic PPPoE Hub,9535.72,1780228651.5476396
http,103.253.18.6,8080,Pakistan,PK,Faisalabad,transparent,false,8.59,AS151983,Orbit Internet Service Provider Pvt Ltd,2527.7,1780228781.5070894
