protocol,ip,port,country,country_code,city,anonymity,ssl,uptime_percent,asn,isp,latency_ms,last_checked
socks4,103.146.137.61,1081,Pakistan,PK,Karachi,elite,true,2.02,AS139879,Galaxy Broadband (pvt.) Ltd.,621.37,1780017561.9538302
http,43.245.131.90,8080,Pakistan,PK,Karachi,transparent,false,27.87,AS132165,Dynamic PPPoE Hub,4133.6,1780017557.476314
socks5,154.57.213.237,1080,Pakistan,PK,Islamabad,elite,true,61.24,AS135407,Trans World Enterprise Services (Private) Limited,2228.59,1780017337.8481843
socks5,103.121.120.242,1080,Pakistan,PK,Karachi,elite,true,91.63,AS131275,Logon Broadband Pvt. Limited,2346.8,1780017263.1300771
socks5,103.150.206.77,1080,Pakistan,PK,Faisalabad,elite,true,53.37,AS140594,Nadeem Abbas and Shayufta Rani,832.81,1780017086.7111626
socks5,175.107.244.164,1080,Pakistan,PK,Karachi,elite,true,53.5,AS9541,Cyber Internet Services Pakistan,8034.4,1780016993.9957201
