protocol,ip,port,country,country_code,city,anonymity,ssl,uptime_percent,asn,isp,latency_ms,last_checked
socks4,103.146.137.61,1081,Pakistan,PK,Karachi,elite,true,2.03,AS139879,Galaxy Broadband (pvt.) Ltd.,626.41,1780052390.6832552
socks4,103.146.137.253,1081,Pakistan,PK,Karachi,elite,true,5.27,AS139879,Galaxy Broadband (pvt.) Ltd.,609.39,1780052390.5555892
socks4,110.93.206.62,5678,Pakistan,PK,Karachi,elite,true,11.32,AS38193,TRANSWORLD ASSOCIATES (PVT) LIMITED,7975.2,1780052382.5827618
socks5,182.184.119.180,1080,Pakistan,PK,Karachi,elite,true,56.39,AS17557,Pakistan Telecommuication company limited,8245.72,1780052371.6211767
socks5,103.150.206.77,1080,Pakistan,PK,Faisalabad,elite,true,53.57,AS140594,Nadeem Abbas and Shayufta Rani,3955.17,1780052273.450104
socks5,103.121.120.242,1080,Pakistan,PK,Karachi,elite,true,93.83,AS131275,Logon Broadband Pvt. Limited,790.98,1780052153.9764209
http,103.253.18.6,8080,Pakistan,PK,Faisalabad,transparent,false,8.51,AS151983,Orbit Internet Service Provider Pvt Ltd,2445.32,1780052317.5880282
