protocol,ip,port,country,country_code,city,anonymity,ssl,uptime_percent,asn,isp,latency_ms,last_checked
socks4,110.93.206.62,5678,Pakistan,PK,Karachi,elite,true,11.21,AS38193,TRANSWORLD ASSOCIATES (PVT) LIMITED,698.92,1780026838.0032308
http,43.245.131.90,8080,Pakistan,PK,Karachi,transparent,true,28.19,AS132165,Dynamic PPPoE Hub,938.42,1780026817.2200851
http,103.115.196.98,8080,Pakistan,PK,Lahore,transparent,true,17.74,AS152605,AMBITIONS COMMUNICATION SYSTEM (SMC-PRIVATE) LIMITED,1961.9,1780026785.9640481
socks5,103.121.120.242,1080,Pakistan,PK,Karachi,elite,true,91.84,AS131275,Logon Broadband Pvt. Limited,1797.78,1780026684.108122
socks5,154.57.213.237,1080,Pakistan,PK,Islamabad,elite,true,61.3,AS135407,Trans World Enterprise Services (Private) Limited,3810.81,1780026656.3365042
socks5,103.150.206.77,1080,Pakistan,PK,Faisalabad,elite,true,53.43,AS140594,Nadeem Abbas and Shayufta Rani,8233.75,1780026637.5740595
http,203.130.23.250,80,Pakistan,PK,Lahore,transparent,false,9.25,AS24435,"Supernet, PDS Limited",10804.19,1780026842.239865
http,103.253.18.6,8080,Pakistan,PK,Faisalabad,transparent,true,8.49,AS151983,Orbit Internet Service Provider Pvt Ltd,1727.75,1780026816.7438326
http,103.198.154.196,8080,Pakistan,PK,Lahore,transparent,false,21.98,AS151330,PLAY BROADBAND (PRIVATE) LIMITED,2321.68,1780026799.6654105
