protocol,ip,port,country,country_code,city,anonymity,ssl,uptime_percent,asn,isp,latency_ms,last_checked
socks4,103.146.137.81,1081,Pakistan,PK,Karachi,elite,true,5.62,AS139879,Galaxy Broadband (pvt.) Ltd.,4390.41,1780123770.628732
socks5,154.57.213.237,1080,Pakistan,PK,Islamabad,elite,true,62.37,AS135407,Trans World Enterprise Services (Private) Limited,3874.87,1780123733.280191
http,125.209.110.83,39617,Pakistan,PK,Karachi,elite,true,8.22,AS9260,Multinet 125-110/24,3805.52,1780123695.3041325
socks5,103.121.120.242,1080,Pakistan,PK,Karachi,elite,true,91.21,AS131275,Logon Broadband Pvt. Limited,9987.47,1780123691.9316468
socks5,103.150.206.77,1080,Pakistan,PK,Faisalabad,elite,true,53.98,AS140594,Nadeem Abbas and Shayufta Rani,2594.75,1780123690.4099586
socks5,182.184.119.180,1080,Pakistan,PK,Karachi,elite,true,56.64,AS17557,Pakistan Telecommuication company limited,2189.25,1780123609.4212892
socks5,103.236.134.210,1080,Pakistan,PK,Karachi,elite,true,89.7,AS38193,TRANSWORLD ASSOCIATES (PVT) LIMITED,801.46,1780123560.2864616
