protocol,ip,port,country,country_code,city,anonymity,ssl,uptime_percent,asn,isp,latency_ms,last_checked
socks4,125.209.110.83,1981,Pakistan,PK,Karachi,elite,true,12.82,AS9260,Multinet 125-110/24,1697.56,1780031100.3773541
socks4,110.93.206.62,5678,Pakistan,PK,Karachi,elite,true,11.23,AS38193,TRANSWORLD ASSOCIATES (PVT) LIMITED,693.64,1780031098.1874714
socks4,103.146.137.17,1081,Pakistan,PK,Karachi,elite,true,5.63,AS139879,Galaxy Broadband (pvt.) Ltd.,7938.73,1780031069.502001
http,154.208.58.89,8080,Pakistan,PK,Lahore,elite,false,7.57,AS150750,IN CABLE INTERNET PRIVATE LIMITED,8956.04,1780031003.923371
socks5,154.57.213.237,1080,Pakistan,PK,Islamabad,elite,true,61.33,AS135407,Trans World Enterprise Services (Private) Limited,1233.49,1780030881.4093838
socks5,103.150.206.77,1080,Pakistan,PK,Faisalabad,elite,true,53.44,AS140594,Nadeem Abbas and Shayufta Rani,9060.07,1780030811.5554147
socks5,182.184.119.180,1080,Pakistan,PK,Karachi,elite,true,56.3,AS17557,Pakistan Telecommuication company limited,3868.0,1780030777.6033978
socks5,103.121.120.242,1080,Pakistan,PK,Karachi,elite,true,92.23,AS131275,Logon Broadband Pvt. Limited,1374.11,1780030367.4072447
http,103.198.154.196,8080,Pakistan,PK,Lahore,transparent,true,22.0,AS151330,PLAY BROADBAND (PRIVATE) LIMITED,2075.8,1780030962.4131315
http,202.154.241.199,808,Pakistan,PK,Islamabad,transparent,false,10.46,AS23966,LINKdotNET Telecom Limited,3219.29,1780030949.200043
http,43.251.253.40,8080,Pakistan,PK,Lahore,transparent,false,37.81,AS136384,Optix Pakistan (Pvt.) Limited,4041.93,1780030916.7838829
