protocol,ip,port,country,country_code,city,anonymity,ssl,uptime_percent,asn,isp,latency_ms,last_checked
socks4,103.146.137.13,1081,Pakistan,PK,Karachi,elite,true,5.95,AS139879,Galaxy Broadband (pvt.) Ltd.,590.58,1780235958.2181814
socks4,103.146.137.113,1081,Pakistan,PK,Karachi,elite,true,6.08,AS139879,Galaxy Broadband (pvt.) Ltd.,663.43,1780235956.4670074
http,103.115.196.98,8080,Pakistan,PK,Lahore,transparent,false,18.08,AS152605,AMBITIONS COMMUNICATION SYSTEM (SMC-PRIVATE) LIMITED,5964.62,1780235951.036906
socks5,182.184.119.180,1080,Pakistan,PK,Karachi,elite,true,60.7,AS17557,Pakistan Telecommuication company limited,1419.71,1780235947.747603
socks4,110.93.206.62,5678,Pakistan,PK,Karachi,elite,true,12.23,AS38193,TRANSWORLD ASSOCIATES (PVT) LIMITED,3782.22,1780235947.387433
socks5,154.57.213.237,1080,Pakistan,PK,Islamabad,elite,true,70.82,AS135407,Trans World Enterprise Services (Private) Limited,1023.33,1780235939.443209
socks4,103.146.137.109,1081,Pakistan,PK,Karachi,elite,true,5.43,AS139879,Galaxy Broadband (pvt.) Ltd.,608.1,1780235935.3154442
http,110.39.183.34,8080,Pakistan,PK,Lahore,transparent,false,20.25,AS38264,Wateen Telecom Limited,3725.21,1780235933.2917926
socks5,103.236.134.210,1080,Pakistan,PK,Karachi,elite,true,91.95,AS38193,TRANSWORLD ASSOCIATES (PVT) LIMITED,4098.17,1780235929.9006877
socks5,103.150.206.77,1080,Pakistan,PK,Faisalabad,elite,true,57.3,AS140594,Nadeem Abbas and Shayufta Rani,2032.24,1780235923.7091749
socks5,175.107.244.164,1080,Pakistan,PK,Karachi,elite,true,56.88,AS9541,Cyber Internet Services Pakistan,8318.76,1780235917.255067
socks4,125.209.110.83,1981,Pakistan,PK,Karachi,elite,true,12.82,AS9260,Multinet 125-110/24,3703.7,1780235916.7794962
socks5,103.121.120.242,1080,Pakistan,PK,Karachi,elite,true,90.37,AS131275,Logon Broadband Pvt. Limited,9043.66,1780235817.5314772
http,58.27.206.37,8080,Pakistan,PK,Lahore,transparent,true,28.62,AS38264,Wateen Telecom (Pvt.) Ltd.,2968.17,1780235970.471855
