protocol,ip,port,country,country_code,city,anonymity,ssl,uptime_percent,asn,isp,latency_ms,last_checked
socks5,103.236.134.210,1080,Pakistan,PK,Karachi,elite,true,89.81,AS38193,TRANSWORLD ASSOCIATES (PVT) LIMITED,1166.56,1780121999.4840758
http,115.42.67.186,8080,Pakistan,PK,Karachi,transparent,false,10.17,AS132165,Connect Communication,8964.33,1780121943.9092312
http,103.253.18.6,8080,Pakistan,PK,Faisalabad,transparent,false,8.53,AS151983,Orbit Internet Service Provider Pvt Ltd,10325.02,1780121939.873898
socks5,103.121.120.242,1080,Pakistan,PK,Karachi,elite,true,91.4,AS131275,Logon Broadband Pvt. Limited,751.3,1780121904.675107
socks5,154.57.213.237,1080,Pakistan,PK,Islamabad,elite,true,62.32,AS135407,Trans World Enterprise Services (Private) Limited,2267.79,1780121891.1734343
socks5,175.107.244.164,1080,Pakistan,PK,Karachi,elite,true,53.72,AS9541,Cyber Internet Services Pakistan,12556.15,1780121837.0151458
socks5,103.150.206.77,1080,Pakistan,PK,Faisalabad,elite,true,53.96,AS140594,Nadeem Abbas and Shayufta Rani,4045.21,1780121697.9100578
