protocol,ip,port,country,country_code,city,anonymity,ssl,uptime_percent,asn,isp,latency_ms,last_checked
socks4,103.146.137.69,1081,Pakistan,PK,Karachi,elite,true,2.07,AS139879,Galaxy Broadband (pvt.) Ltd.,617.85,1780073692.2608597
socks4,103.146.137.53,1081,Pakistan,PK,Karachi,elite,true,5.43,AS139879,Galaxy Broadband (pvt.) Ltd.,661.62,1780073686.8699226
socks4,110.93.206.62,5678,Pakistan,PK,Karachi,elite,true,11.46,AS38193,TRANSWORLD ASSOCIATES (PVT) LIMITED,1725.19,1780073683.4011536
http,103.253.18.6,8080,Pakistan,PK,Faisalabad,transparent,false,8.52,AS151983,Orbit Internet Service Provider Pvt Ltd,9719.29,1780073655.6713853
socks5,154.57.213.237,1080,Pakistan,PK,Islamabad,elite,true,61.81,AS135407,Trans World Enterprise Services (Private) Limited,1050.11,1780073632.235804
http,58.27.206.37,8080,Pakistan,PK,Lahore,transparent,false,28.26,AS38264,Wateen Telecom (Pvt.) Ltd.,2289.83,1780073562.9921896
http,115.42.67.186,8080,Pakistan,PK,Karachi,transparent,true,10.15,AS132165,Connect Communication,9240.75,1780073547.0838747
socks5,103.121.120.242,1080,Pakistan,PK,Karachi,elite,true,94.46,AS131275,Logon Broadband Pvt. Limited,1789.04,1780073460.9554932
socks5,103.150.206.77,1080,Pakistan,PK,Faisalabad,elite,true,53.72,AS140594,Nadeem Abbas and Shayufta Rani,4786.52,1780073167.1687198
