protocol,ip,port,country,country_code,city,anonymity,ssl,uptime_percent,asn,isp,latency_ms,last_checked
socks4,110.93.206.62,5678,Pakistan,PK,Karachi,elite,true,12.23,AS38193,TRANSWORLD ASSOCIATES (PVT) LIMITED,3777.89,1780236599.289761
socks4,103.146.137.69,1081,Pakistan,PK,Karachi,elite,true,2.16,AS139879,Galaxy Broadband (pvt.) Ltd.,608.44,1780236597.8686707
socks5,103.121.120.242,1080,Pakistan,PK,Karachi,elite,true,90.38,AS131275,Logon Broadband Pvt. Limited,758.5,1780236594.602143
socks5,103.150.206.77,1080,Pakistan,PK,Faisalabad,elite,true,57.31,AS140594,Nadeem Abbas and Shayufta Rani,1258.21,1780236593.8063927
socks5,175.107.244.164,1080,Pakistan,PK,Karachi,elite,true,56.91,AS9541,Cyber Internet Services Pakistan,2247.94,1780236586.2390163
socks5,154.57.213.237,1080,Pakistan,PK,Islamabad,elite,true,70.84,AS135407,Trans World Enterprise Services (Private) Limited,1366.1,1780236548.4328094
http,182.176.164.41,8080,Pakistan,PK,Lahore,transparent,false,14.37,AS17557,Pakistan Telecommuication company limited,5919.47,1780236505.630521
http,110.39.183.34,8080,Pakistan,PK,Lahore,transparent,false,20.26,AS38264,Wateen Telecom Limited,2819.99,1780236430.0962453
http,202.154.241.199,808,Pakistan,PK,Islamabad,transparent,true,10.66,AS23966,LINKdotNET Telecom Limited,13923.47,1780236584.334224
socks5,103.236.134.210,1080,Pakistan,PK,Karachi,elite,true,91.98,AS38193,TRANSWORLD ASSOCIATES (PVT) LIMITED,2816.15,1780236481.7623737
http,103.19.48.148,8080,Pakistan,PK,Islamabad,transparent,false,54.36,AS150371,Pace Telecom and Brodcasting Private Limited,5429.13,1780236466.91321
