protocol,ip,port,country,country_code,city,anonymity,ssl,uptime_percent,asn,isp,latency_ms,last_checked
socks5,154.57.213.237,1080,Pakistan,PK,Islamabad,elite,true,70.97,AS135407,Trans World Enterprise Services (Private) Limited,2146.53,1780239537.458419
socks5,175.107.244.164,1080,Pakistan,PK,Karachi,elite,true,56.96,AS9541,Cyber Internet Services Pakistan,3726.7,1780239518.3297276
socks4,110.93.206.62,5678,Pakistan,PK,Karachi,elite,true,12.25,AS38193,TRANSWORLD ASSOCIATES (PVT) LIMITED,952.35,1780239498.9097047
socks5,103.121.120.242,1080,Pakistan,PK,Karachi,elite,true,90.48,AS131275,Logon Broadband Pvt. Limited,2361.9,1780239450.3823068
http,182.176.164.41,8080,Pakistan,PK,Lahore,transparent,false,14.38,AS17557,Pakistan Telecommuication company limited,13394.76,1780239437.2487977
http,110.39.183.34,8080,Pakistan,PK,Lahore,transparent,false,20.28,AS38264,Wateen Telecom Limited,4928.62,1780239391.221774
http,125.209.110.83,39617,Pakistan,PK,Karachi,elite,false,8.25,AS9260,Multinet 125-110/24,3769.86,1780239368.387953
http,103.253.18.6,8080,Pakistan,PK,Faisalabad,transparent,true,8.59,AS151983,Orbit Internet Service Provider Pvt Ltd,1750.94,1780239555.9731297
socks5,103.236.134.210,1080,Pakistan,PK,Karachi,elite,true,92.0,AS38193,TRANSWORLD ASSOCIATES (PVT) LIMITED,2583.48,1780239552.9411051
http,43.251.253.40,8080,Pakistan,PK,Lahore,transparent,false,36.42,AS136384,Optix Pakistan (Pvt.) Limited,16842.74,1780239552.5533457
http,103.19.48.148,8080,Pakistan,PK,Islamabad,transparent,false,52.87,AS150371,Pace Telecom and Brodcasting Private Limited,5992.23,1780239524.361219
http,103.255.151.169,8080,Pakistan,PK,Karachi,transparent,true,21.27,AS138985,Delta Networks,734.94,1780239491.5901096
