protocol,ip,port,country,country_code,city,anonymity,ssl,uptime_percent,asn,isp,latency_ms,last_checked
socks5,154.57.213.237,1080,Pakistan,PK,Islamabad,elite,true,67.22,AS135407,Trans World Enterprise Services (Private) Limited,3796.68,1780168182.7362409
socks5,103.150.206.77,1080,Pakistan,PK,Faisalabad,elite,true,55.73,AS140594,Nadeem Abbas and Shayufta Rani,815.1,1780168173.1745605
socks4,103.146.137.113,1081,Pakistan,PK,Karachi,elite,true,5.84,AS139879,Galaxy Broadband (pvt.) Ltd.,604.31,1780168172.8000736
socks5,175.107.244.164,1080,Pakistan,PK,Karachi,elite,true,54.76,AS9541,Cyber Internet Services Pakistan,1190.79,1780168172.3787725
socks4,110.93.206.62,5678,Pakistan,PK,Karachi,elite,true,11.95,AS38193,TRANSWORLD ASSOCIATES (PVT) LIMITED,714.65,1780168163.9115486
socks5,182.184.119.180,1080,Pakistan,PK,Karachi,elite,true,58.15,AS17557,Pakistan Telecommuication company limited,3097.39,1780168149.4810972
http,103.115.196.98,8080,Pakistan,PK,Lahore,transparent,false,17.94,AS152605,AMBITIONS COMMUNICATION SYSTEM (SMC-PRIVATE) LIMITED,2243.14,1780168146.0559223
socks5,103.121.120.242,1080,Pakistan,PK,Karachi,elite,true,88.97,AS131275,Logon Broadband Pvt. Limited,8348.57,1780168139.813303
http,110.39.183.34,8080,Pakistan,PK,Lahore,transparent,false,19.93,AS38264,Wateen Telecom Limited,8896.3,1780168137.996866
http,103.205.178.226,8080,Pakistan,PK,Karachi,transparent,true,19.4,AS38713,Satcomm,9494.93,1780168190.59192
http,58.27.206.37,8080,Pakistan,PK,Lahore,transparent,false,28.35,AS38264,Wateen Telecom (Pvt.) Ltd.,3214.69,1780168165.700982
socks5,103.236.134.210,1080,Pakistan,PK,Karachi,elite,true,90.38,AS38193,TRANSWORLD ASSOCIATES (PVT) LIMITED,8166.86,1780168158.9947305
http,103.255.66.109,8080,Pakistan,PK,Islamabad,transparent,true,10.78,AS150683,Transworld Enterprise Services,6203.6,1780168117.50025
http,103.253.18.6,8080,Pakistan,PK,Faisalabad,transparent,false,8.56,AS151983,Orbit Internet Service Provider Pvt Ltd,3428.77,1780168107.8850148
