protocol,ip,port,country,country_code,city,anonymity,ssl,uptime_percent,asn,isp,latency_ms,last_checked
socks4,103.146.137.65,1081,Pakistan,PK,Karachi,elite,true,5.26,AS139879,Galaxy Broadband (pvt.) Ltd.,957.37,1780133635.8055742
socks5,103.236.134.210,1080,Pakistan,PK,Karachi,elite,true,82.94,AS38193,TRANSWORLD ASSOCIATES (PVT) LIMITED,1781.99,1780133634.7099564
socks5,103.150.206.77,1080,Pakistan,PK,Faisalabad,elite,true,54.03,AS140594,Nadeem Abbas and Shayufta Rani,1981.95,1780133633.3821287
socks5,182.184.119.180,1080,Pakistan,PK,Karachi,elite,true,56.72,AS17557,Pakistan Telecommuication company limited,2595.61,1780133601.5785084
socks5,154.57.213.237,1080,Pakistan,PK,Islamabad,elite,true,62.53,AS135407,Trans World Enterprise Services (Private) Limited,765.48,1780133282.9357722
http,103.198.154.196,8080,Pakistan,PK,Lahore,transparent,true,22.11,AS151330,PLAY BROADBAND (PRIVATE) LIMITED,11494.66,1780133633.7952187
