protocol,ip,port,country,country_code,city,anonymity,ssl,uptime_percent,asn,isp,latency_ms,last_checked
socks5,103.121.120.242,1080,Pakistan,PK,Karachi,elite,true,87.38,AS131275,Logon Broadband Pvt. Limited,1803.39,1780153155.2106376
socks4,110.93.206.62,5678,Pakistan,PK,Karachi,elite,true,11.88,AS38193,TRANSWORLD ASSOCIATES (PVT) LIMITED,3821.06,1780153147.3157318
socks5,182.184.119.180,1080,Pakistan,PK,Karachi,elite,true,57.91,AS17557,Pakistan Telecommuication company limited,4142.98,1780153146.338128
socks5,154.57.213.237,1080,Pakistan,PK,Islamabad,elite,true,65.06,AS135407,Trans World Enterprise Services (Private) Limited,2210.92,1780153122.6826744
http,39.49.164.180,8080,Pakistan,PK,Lahore,transparent,false,30.62,AS17557,Pakistan Telecommuication company limited,4940.67,1780153078.8198702
socks5,103.236.134.210,1080,Pakistan,PK,Karachi,elite,true,87.07,AS38193,TRANSWORLD ASSOCIATES (PVT) LIMITED,3807.06,1780153183.3869236
