protocol,ip,port,country,country_code,city,anonymity,ssl,uptime_percent,asn,isp,latency_ms,last_checked
socks4,103.146.137.69,1081,Pakistan,PK,Karachi,elite,true,2.05,AS139879,Galaxy Broadband (pvt.) Ltd.,654.58,1780010953.4687667
socks4,125.209.110.83,1981,Pakistan,PK,Karachi,elite,true,12.78,AS9260,Multinet 125-110/24,3690.66,1780010904.3054667
socks5,103.150.206.77,1080,Pakistan,PK,Faisalabad,elite,true,53.36,AS140594,Nadeem Abbas and Shayufta Rani,8090.55,1780010901.4309142
socks5,175.107.244.164,1080,Pakistan,PK,Karachi,elite,true,53.48,AS9541,Cyber Internet Services Pakistan,7978.7,1780010872.4914515
http,39.49.164.180,8080,Pakistan,PK,Lahore,transparent,false,31.81,AS17557,Pakistan Telecommuication company limited,2942.76,1780010851.4239504
http,125.209.110.83,39617,Pakistan,PK,Karachi,elite,false,8.21,AS9260,Multinet 125-110/24,10278.63,1780010805.195922
socks5,154.57.213.237,1080,Pakistan,PK,Islamabad,elite,true,61.17,AS135407,Trans World Enterprise Services (Private) Limited,769.97,1780010780.3828764
socks5,103.121.120.242,1080,Pakistan,PK,Karachi,elite,true,91.74,AS131275,Logon Broadband Pvt. Limited,3753.4,1780010733.8657022
socks5,182.184.119.180,1080,Pakistan,PK,Karachi,elite,true,56.24,AS17557,Pakistan Telecommuication company limited,10162.55,1780010593.1282904
