protocol,ip,port,country,country_code,city,anonymity,ssl,uptime_percent,asn,isp,latency_ms,last_checked
socks5,103.150.206.77,1080,Pakistan,PK,Faisalabad,elite,true,56.4,AS140594,Nadeem Abbas and Shayufta Rani,2745.25,1780191592.9281974
http,103.115.196.98,8080,Pakistan,PK,Lahore,transparent,false,17.99,AS152605,AMBITIONS COMMUNICATION SYSTEM (SMC-PRIVATE) LIMITED,3460.52,1780191581.1351645
socks5,103.121.120.242,1080,Pakistan,PK,Karachi,elite,true,89.58,AS131275,Logon Broadband Pvt. Limited,1782.23,1780191578.423406
socks4,125.209.110.83,1981,Pakistan,PK,Karachi,elite,true,12.84,AS9260,Multinet 125-110/24,3690.15,1780191557.9870422
socks5,182.184.119.180,1080,Pakistan,PK,Karachi,elite,true,59.17,AS17557,Pakistan Telecommuication company limited,4586.32,1780191553.3155212
socks5,175.107.244.164,1080,Pakistan,PK,Karachi,elite,true,55.83,AS9541,Cyber Internet Services Pakistan,1700.25,1780191512.3124201
socks5,154.57.213.237,1080,Pakistan,PK,Islamabad,elite,true,69.04,AS135407,Trans World Enterprise Services (Private) Limited,2395.47,1780191501.3047295
socks5,103.236.134.210,1080,Pakistan,PK,Karachi,elite,true,91.18,AS38193,TRANSWORLD ASSOCIATES (PVT) LIMITED,1250.22,1780191574.2652352
http,103.198.154.196,8080,Pakistan,PK,Lahore,transparent,true,22.36,AS151330,PLAY BROADBAND (PRIVATE) LIMITED,3004.43,1780191539.5290065
http,202.165.232.238,8080,Pakistan,PK,Lahore,transparent,false,24.54,AS136384,Optix Pakistan (Pvt.) Limited,4629.9,1780191526.5050547
http,43.251.253.40,8080,Pakistan,PK,Lahore,transparent,false,36.66,AS136384,Optix Pakistan (Pvt.) Limited,12405.37,1780191516.3499868
http,103.253.18.6,8080,Pakistan,PK,Faisalabad,transparent,false,8.57,AS151983,Orbit Internet Service Provider Pvt Ltd,1868.75,1780191499.8189068
http,58.27.206.37,8080,Pakistan,PK,Lahore,transparent,false,28.41,AS38264,Wateen Telecom (Pvt.) Ltd.,10020.11,1780191443.5955229
