protocol,ip,port,country,country_code,city,anonymity,ssl,uptime_percent,asn,isp,latency_ms,last_checked
socks4,110.93.206.62,5678,Pakistan,PK,Karachi,elite,true,11.0,AS38193,TRANSWORLD ASSOCIATES (PVT) LIMITED,3767.44,1779961141.5187767
socks4,103.146.137.113,1081,Pakistan,PK,Karachi,elite,true,5.28,AS139879,Galaxy Broadband (pvt.) Ltd.,620.05,1779961139.2305095
http,103.255.66.109,8080,Pakistan,PK,Islamabad,transparent,false,10.69,AS150683,Transworld Enterprise Services,9858.33,1779961083.8766434
http,58.27.206.37,8080,Pakistan,PK,Lahore,transparent,false,28.22,AS38264,Wateen Telecom (Pvt.) Ltd.,5148.18,1779961072.3261817
socks5,154.57.213.237,1080,Pakistan,PK,Islamabad,elite,true,61.05,AS135407,Trans World Enterprise Services (Private) Limited,3777.14,1779960974.848425
socks5,103.121.120.242,1080,Pakistan,PK,Karachi,elite,true,95.95,AS131275,Logon Broadband Pvt. Limited,770.13,1779960826.3329468
socks5,103.150.206.77,1080,Pakistan,PK,Faisalabad,elite,true,53.23,AS140594,Nadeem Abbas and Shayufta Rani,4058.73,1779959983.2593796
