protocol,ip,port,country,country_code,city,anonymity,ssl,uptime_percent,asn,isp,latency_ms,last_checked
http,103.198.154.196,8080,Pakistan,PK,Lahore,transparent,false,22.45,AS151330,PLAY BROADBAND (PRIVATE) LIMITED,3852.89,1780237149.5918744
http,154.208.58.89,8080,Pakistan,PK,Lahore,elite,false,7.69,AS150750,IN CABLE INTERNET PRIVATE LIMITED,4419.25,1780237144.4366226
socks4,110.93.206.62,5678,Pakistan,PK,Karachi,elite,true,12.24,AS38193,TRANSWORLD ASSOCIATES (PVT) LIMITED,1762.14,1780237136.4886663
socks5,154.57.213.237,1080,Pakistan,PK,Islamabad,elite,true,70.86,AS135407,Trans World Enterprise Services (Private) Limited,765.66,1780237134.7073467
http,110.39.183.34,8080,Pakistan,PK,Lahore,transparent,false,20.27,AS38264,Wateen Telecom Limited,604.8,1780237115.2171059
http,43.251.253.40,8080,Pakistan,PK,Lahore,transparent,false,36.39,AS136384,Optix Pakistan (Pvt.) Limited,901.64,1780237114.9568393
socks5,103.121.120.242,1080,Pakistan,PK,Karachi,elite,true,90.4,AS131275,Logon Broadband Pvt. Limited,827.31,1780237083.1795464
socks5,103.236.134.210,1080,Pakistan,PK,Karachi,elite,true,92.01,AS38193,TRANSWORLD ASSOCIATES (PVT) LIMITED,1305.29,1780237066.5439825
socks5,103.150.206.77,1080,Pakistan,PK,Faisalabad,elite,true,57.32,AS140594,Nadeem Abbas and Shayufta Rani,1992.46,1780237038.757927
http,202.154.241.199,808,Pakistan,PK,Islamabad,transparent,false,10.67,AS23966,LINKdotNET Telecom Limited,3353.4,1780237145.2591531
http,58.27.206.37,8080,Pakistan,PK,Lahore,transparent,false,28.62,AS38264,Wateen Telecom (Pvt.) Ltd.,5954.44,1780237162.3390484
