protocol,ip,port,country,country_code,city,anonymity,ssl,uptime_percent,asn,isp,latency_ms,last_checked
socks4,110.93.206.62,5678,Pakistan,PK,Karachi,elite,true,11.11,AS38193,TRANSWORLD ASSOCIATES (PVT) LIMITED,741.52,1780001343.417455
http,125.209.110.83,39617,Pakistan,PK,Karachi,elite,false,8.2,AS9260,Multinet 125-110/24,4401.87,1780001289.786384
http,103.253.18.6,8080,Pakistan,PK,Faisalabad,transparent,false,8.48,AS151983,Orbit Internet Service Provider Pvt Ltd,4352.35,1780001253.9890797
socks5,103.121.120.242,1080,Pakistan,PK,Karachi,elite,true,91.75,AS131275,Logon Broadband Pvt. Limited,7936.67,1780000925.5609148
socks5,103.150.206.77,1080,Pakistan,PK,Faisalabad,elite,true,53.3,AS140594,Nadeem Abbas and Shayufta Rani,876.76,1780000622.5390182
