protocol,ip,port,country,country_code,city,anonymity,ssl,uptime_percent,asn,isp,latency_ms,last_checked
socks4,110.93.206.62,5678,Pakistan,PK,Karachi,elite,true,12.06,AS38193,TRANSWORLD ASSOCIATES (PVT) LIMITED,7828.62,1780193968.3876784
socks4,103.146.137.233,1081,Pakistan,PK,Karachi,elite,true,6.12,AS139879,Galaxy Broadband (pvt.) Ltd.,1635.45,1780193961.46574
socks5,154.57.213.237,1080,Pakistan,PK,Islamabad,elite,true,69.17,AS135407,Trans World Enterprise Services (Private) Limited,776.96,1780193961.3168736
socks5,175.107.244.164,1080,Pakistan,PK,Karachi,elite,true,55.93,AS9541,Cyber Internet Services Pakistan,4520.27,1780193938.7420144
socks5,103.121.120.242,1080,Pakistan,PK,Karachi,elite,true,89.71,AS131275,Logon Broadband Pvt. Limited,974.22,1780193933.6774874
http,43.245.131.90,8080,Pakistan,PK,Karachi,transparent,true,29.98,AS132165,Dynamic PPPoE Hub,4330.18,1780193930.1734705
socks5,182.184.119.180,1080,Pakistan,PK,Karachi,elite,true,59.26,AS17557,Pakistan Telecommuication company limited,7990.03,1780193923.9435303
http,103.198.154.196,8080,Pakistan,PK,Lahore,transparent,true,22.37,AS151330,PLAY BROADBAND (PRIVATE) LIMITED,9176.63,1780193966.5068176
socks5,103.236.134.210,1080,Pakistan,PK,Karachi,elite,true,91.32,AS38193,TRANSWORLD ASSOCIATES (PVT) LIMITED,1704.33,1780193964.850902
http,202.165.232.238,8080,Pakistan,PK,Lahore,transparent,false,24.54,AS136384,Optix Pakistan (Pvt.) Limited,5395.27,1780193950.1998606
http,202.69.38.82,8080,Pakistan,PK,Raiwind,transparent,false,5.77,AS23750,Gerrys Information Technology (PVT) Ltd,8215.97,1780193912.0718079
http,43.251.253.40,8080,Pakistan,PK,Lahore,transparent,false,36.65,AS136384,Optix Pakistan (Pvt.) Limited,6650.29,1780193814.2850132
