protocol,ip,port,country,country_code,city,anonymity,ssl,uptime_percent,asn,isp,latency_ms,last_checked
socks4,110.93.206.62,5678,Pakistan,PK,Karachi,elite,true,11.25,AS38193,TRANSWORLD ASSOCIATES (PVT) LIMITED,720.59,1780034090.4540424
socks5,182.184.119.180,1080,Pakistan,PK,Karachi,elite,true,56.33,AS17557,Pakistan Telecommuication company limited,1923.28,1780034039.6527379
socks5,103.150.206.77,1080,Pakistan,PK,Faisalabad,elite,true,53.46,AS140594,Nadeem Abbas and Shayufta Rani,859.27,1780034033.549064
http,154.208.58.89,8080,Pakistan,PK,Lahore,elite,false,7.57,AS150750,IN CABLE INTERNET PRIVATE LIMITED,14193.46,1780033985.5646029
http,221.120.218.66,8080,Pakistan,PK,Tandlianwala,transparent,false,35.49,AS17557,PTCL ITI Lahore 11,16100.3,1780033979.9333212
http,115.42.67.186,8080,Pakistan,PK,Karachi,transparent,false,10.09,AS132165,Connect Communication,5507.59,1780033936.0419357
socks5,103.121.120.242,1080,Pakistan,PK,Karachi,elite,true,92.56,AS131275,Logon Broadband Pvt. Limited,1799.02,1780033897.393191
socks5,154.57.213.237,1080,Pakistan,PK,Islamabad,elite,true,61.39,AS135407,Trans World Enterprise Services (Private) Limited,767.02,1780033783.2272327
http,103.198.154.196,8080,Pakistan,PK,Lahore,transparent,false,22.02,AS151330,PLAY BROADBAND (PRIVATE) LIMITED,5995.87,1780034052.0040138
