protocol,ip,port,country,country_code,city,anonymity,ssl,uptime_percent,asn,isp,latency_ms,last_checked
socks4,110.93.206.62,5678,Pakistan,PK,Karachi,elite,true,11.09,AS38193,TRANSWORLD ASSOCIATES (PVT) LIMITED,3811.97,1779994745.657222
http,182.176.164.41,8080,Pakistan,PK,Lahore,transparent,false,14.18,AS17557,Pakistan Telecommuication company limited,2833.73,1779994730.87189
socks5,103.150.206.77,1080,Pakistan,PK,Faisalabad,elite,true,53.3,AS140594,Nadeem Abbas and Shayufta Rani,3915.43,1779994438.4804058
socks5,154.57.213.237,1080,Pakistan,PK,Islamabad,elite,true,61.02,AS135407,Trans World Enterprise Services (Private) Limited,782.96,1779994437.907045
socks5,103.121.120.242,1080,Pakistan,PK,Karachi,elite,true,92.53,AS131275,Logon Broadband Pvt. Limited,794.15,1779994296.3379612
http,103.198.154.196,8080,Pakistan,PK,Lahore,transparent,false,21.9,AS151330,PLAY BROADBAND (PRIVATE) LIMITED,2182.12,1779994761.6278923
http,103.255.66.109,8080,Pakistan,PK,Islamabad,transparent,false,10.71,AS150683,Transworld Enterprise Services,10046.84,1779994678.4438684
http,202.165.232.238,8080,Pakistan,PK,Lahore,transparent,false,24.49,AS136384,Optix Pakistan (Pvt.) Limited,4260.43,1779994664.6571393
