protocol,ip,port,country,country_code,city,anonymity,ssl,uptime_percent,asn,isp,latency_ms,last_checked
socks4,103.146.137.65,1081,Pakistan,PK,Karachi,elite,true,4.95,AS139879,Galaxy Broadband (pvt.) Ltd.,620.3,1780047000.8403764
socks4,110.93.206.62,5678,Pakistan,PK,Karachi,elite,true,11.3,AS38193,TRANSWORLD ASSOCIATES (PVT) LIMITED,3756.16,1780046985.0053148
socks5,175.107.244.164,1080,Pakistan,PK,Karachi,elite,true,53.43,AS9541,Cyber Internet Services Pakistan,10436.42,1780046852.9360042
http,125.209.110.83,39617,Pakistan,PK,Karachi,elite,false,8.21,AS9260,Multinet 125-110/24,13512.71,1780046835.425687
socks5,103.150.206.77,1080,Pakistan,PK,Faisalabad,elite,true,53.54,AS140594,Nadeem Abbas and Shayufta Rani,2608.0,1780046830.5787446
socks5,154.57.213.237,1080,Pakistan,PK,Islamabad,elite,true,61.6,AS135407,Trans World Enterprise Services (Private) Limited,1776.43,1780046793.9242413
socks5,103.121.120.242,1080,Pakistan,PK,Karachi,elite,true,93.48,AS131275,Logon Broadband Pvt. Limited,2245.99,1780046505.803136
http,202.165.232.238,8080,Pakistan,PK,Lahore,transparent,true,24.53,AS136384,Optix Pakistan (Pvt.) Limited,10380.99,1780046983.547876
http,103.253.18.6,8080,Pakistan,PK,Faisalabad,transparent,true,8.5,AS151983,Orbit Internet Service Provider Pvt Ltd,899.1,1780046916.2733226
