protocol,ip,port,country,country_code,city,anonymity,ssl,uptime_percent,asn,isp,latency_ms,last_checked
socks4,110.93.206.62,5678,Pakistan,PK,Karachi,elite,true,11.14,AS38193,TRANSWORLD ASSOCIATES (PVT) LIMITED,1194.56,1780008838.464621
socks4,103.146.137.53,1081,Pakistan,PK,Karachi,elite,true,5.35,AS139879,Galaxy Broadband (pvt.) Ltd.,594.6,1780008836.7959797
http,43.245.131.90,8080,Pakistan,PK,Karachi,transparent,false,27.91,AS132165,Dynamic PPPoE Hub,5086.6,1780008799.8063343
http,39.49.164.180,8080,Pakistan,PK,Lahore,transparent,false,31.86,AS17557,Pakistan Telecommuication company limited,2565.77,1780008786.374776
socks5,182.184.119.180,1080,Pakistan,PK,Karachi,elite,true,56.24,AS17557,Pakistan Telecommuication company limited,1627.05,1780008690.7582932
socks5,103.150.206.77,1080,Pakistan,PK,Faisalabad,elite,true,53.35,AS140594,Nadeem Abbas and Shayufta Rani,1863.36,1780008503.6226506
socks5,154.57.213.237,1080,Pakistan,PK,Islamabad,elite,true,61.16,AS135407,Trans World Enterprise Services (Private) Limited,2022.39,1780008415.7146266
socks5,175.107.244.164,1080,Pakistan,PK,Karachi,elite,true,53.48,AS9541,Cyber Internet Services Pakistan,739.43,1780008346.3315296
socks5,103.121.120.242,1080,Pakistan,PK,Karachi,elite,true,91.44,AS131275,Logon Broadband Pvt. Limited,776.93,1780008149.2770352
http,58.27.206.37,8080,Pakistan,PK,Lahore,transparent,false,28.2,AS38264,Wateen Telecom (Pvt.) Ltd.,3174.66,1780008861.219189
http,103.198.154.196,8080,Pakistan,PK,Lahore,transparent,false,21.93,AS151330,PLAY BROADBAND (PRIVATE) LIMITED,5576.08,1780008849.2323472
