protocol,ip,port,country,country_code,city,anonymity,ssl,uptime_percent,asn,isp,latency_ms,last_checked
socks5,175.107.244.164,1080,Pakistan,PK,Karachi,elite,true,53.57,AS9541,Cyber Internet Services Pakistan,1244.66,1780090954.098752
socks5,103.236.134.210,1080,Pakistan,PK,Karachi,elite,true,88.89,AS38193,TRANSWORLD ASSOCIATES (PVT) LIMITED,3768.04,1780090951.2831645
http,202.154.241.199,808,Pakistan,PK,Islamabad,transparent,false,10.53,AS23966,LINKdotNET Telecom Limited,6797.93,1780090943.5048904
http,154.208.58.89,8080,Pakistan,PK,Lahore,elite,false,7.61,AS150750,IN CABLE INTERNET PRIVATE LIMITED,10644.5,1780090906.533142
socks5,103.150.206.77,1080,Pakistan,PK,Faisalabad,elite,true,53.81,AS140594,Nadeem Abbas and Shayufta Rani,3840.92,1780090891.7285652
socks5,154.57.213.237,1080,Pakistan,PK,Islamabad,elite,true,61.97,AS135407,Trans World Enterprise Services (Private) Limited,1279.68,1780090521.6558714
