protocol,ip,port,country,country_code,city,anonymity,ssl,uptime_percent,asn,isp,latency_ms,last_checked
socks5,103.150.206.77,1080,Pakistan,PK,Faisalabad,elite,true,53.66,AS140594,Nadeem Abbas and Shayufta Rani,4058.75,1780068252.443257
socks5,103.121.120.242,1080,Pakistan,PK,Karachi,elite,true,94.81,AS131275,Logon Broadband Pvt. Limited,816.36,1780068212.2636805
socks5,154.57.213.237,1080,Pakistan,PK,Islamabad,elite,true,61.7,AS135407,Trans World Enterprise Services (Private) Limited,7912.41,1780068206.6176212
http,103.115.196.98,8080,Pakistan,PK,Lahore,transparent,true,17.85,AS152605,AMBITIONS COMMUNICATION SYSTEM (SMC-PRIVATE) LIMITED,5229.1,1780068194.7518315
http,154.208.58.89,8080,Pakistan,PK,Lahore,elite,true,7.6,AS150750,IN CABLE INTERNET PRIVATE LIMITED,5203.52,1780068152.2509189
http,115.42.67.186,8080,Pakistan,PK,Karachi,transparent,false,10.14,AS132165,Connect Communication,2297.94,1780068109.1339831
http,39.49.164.180,8080,Pakistan,PK,Lahore,transparent,false,31.58,AS17557,Pakistan Telecommuication company limited,20052.21,1780068103.1878448
socks5,182.184.119.180,1080,Pakistan,PK,Karachi,elite,true,56.44,AS17557,Pakistan Telecommuication company limited,893.83,1780068022.9240503
http,202.165.232.238,8080,Pakistan,PK,Lahore,transparent,false,24.56,AS136384,Optix Pakistan (Pvt.) Limited,14467.79,1780068257.5338922
http,103.205.178.226,8080,Pakistan,PK,Karachi,transparent,true,18.56,AS38713,Satcomm,8942.23,1780068201.680871
http,103.255.66.109,8080,Pakistan,PK,Islamabad,transparent,false,10.74,AS150683,Transworld Enterprise Services,4221.08,1780068185.5272171
