protocol,ip,port,country,country_code,city,anonymity,ssl,uptime_percent,asn,isp,latency_ms,last_checked
socks4,125.209.110.83,1981,Pakistan,PK,Karachi,elite,true,12.91,AS9260,Multinet 125-110/24,3695.0,1780109057.9028413
socks5,103.121.120.242,1080,Pakistan,PK,Karachi,elite,true,91.64,AS131275,Logon Broadband Pvt. Limited,5522.38,1780109034.4076076
http,103.253.18.6,8080,Pakistan,PK,Faisalabad,transparent,false,8.53,AS151983,Orbit Internet Service Provider Pvt Ltd,7977.8,1780109002.7960258
socks5,175.107.244.164,1080,Pakistan,PK,Karachi,elite,true,53.65,AS9541,Cyber Internet Services Pakistan,3789.19,1780109002.1675386
socks5,154.57.213.237,1080,Pakistan,PK,Islamabad,elite,true,62.16,AS135407,Trans World Enterprise Services (Private) Limited,4492.35,1780108901.4464486
socks5,103.150.206.77,1080,Pakistan,PK,Faisalabad,elite,true,53.85,AS140594,Nadeem Abbas and Shayufta Rani,1961.0,1780108866.2208643
socks5,103.236.134.210,1080,Pakistan,PK,Karachi,elite,true,85.87,AS38193,TRANSWORLD ASSOCIATES (PVT) LIMITED,783.49,1780108810.0596867
