protocol,ip,port,country,country_code,city,anonymity,ssl,uptime_percent,asn,isp,latency_ms,last_checked
socks4,110.93.206.62,5678,Pakistan,PK,Karachi,elite,true,12.15,AS38193,TRANSWORLD ASSOCIATES (PVT) LIMITED,1792.06,1780214964.0200167
socks5,103.236.134.210,1080,Pakistan,PK,Karachi,elite,true,91.64,AS38193,TRANSWORLD ASSOCIATES (PVT) LIMITED,985.08,1780214961.254371
socks4,125.209.110.83,1981,Pakistan,PK,Karachi,elite,true,12.83,AS9260,Multinet 125-110/24,7814.77,1780214958.5775952
socks4,103.146.137.65,1081,Pakistan,PK,Karachi,elite,true,5.59,AS139879,Galaxy Broadband (pvt.) Ltd.,623.92,1780214957.7104897
socks5,154.57.213.237,1080,Pakistan,PK,Islamabad,elite,true,70.11,AS135407,Trans World Enterprise Services (Private) Limited,2099.99,1780214906.44508
socks5,103.150.206.77,1080,Pakistan,PK,Faisalabad,elite,true,56.94,AS140594,Nadeem Abbas and Shayufta Rani,8480.77,1780214899.439629
socks5,182.184.119.180,1080,Pakistan,PK,Karachi,elite,true,60.02,AS17557,Pakistan Telecommuication company limited,1027.32,1780214893.4901297
http,202.165.232.238,8080,Pakistan,PK,Lahore,transparent,false,24.58,AS136384,Optix Pakistan (Pvt.) Limited,3332.03,1780214884.8050642
http,103.19.48.148,8080,Pakistan,PK,Islamabad,transparent,true,75.56,AS150371,Pace Telecom and Brodcasting Private Limited,1115.1,1780214879.4140728
socks5,103.121.120.242,1080,Pakistan,PK,Karachi,elite,true,90.21,AS131275,Logon Broadband Pvt. Limited,1427.68,1780214868.9452276
