protocol,ip,port,country,country_code,city,anonymity,ssl,uptime_percent,asn,isp,latency_ms,last_checked
socks5,103.121.120.242,1080,Pakistan,PK,Karachi,elite,true,89.82,AS131275,Logon Broadband Pvt. Limited,1206.92,1780207794.4442303
socks5,154.57.213.237,1080,Pakistan,PK,Islamabad,elite,true,69.73,AS135407,Trans World Enterprise Services (Private) Limited,2027.8,1780207793.0169508
socks5,103.150.206.77,1080,Pakistan,PK,Faisalabad,elite,true,56.76,AS140594,Nadeem Abbas and Shayufta Rani,2334.05,1780207790.7873807
socks4,110.93.206.62,5678,Pakistan,PK,Karachi,elite,true,12.12,AS38193,TRANSWORLD ASSOCIATES (PVT) LIMITED,1790.66,1780207781.4523308
socks5,175.107.244.164,1080,Pakistan,PK,Karachi,elite,true,56.3,AS9541,Cyber Internet Services Pakistan,6944.29,1780207703.1831293
http,221.120.218.66,8080,Pakistan,PK,Tandlianwala,transparent,false,33.63,AS17557,PTCL ITI Lahore 11,4626.18,1780207631.5981946
http,103.205.178.226,8080,Pakistan,PK,Karachi,transparent,false,19.86,AS38713,Satcomm,759.17,1780207742.4198418
socks5,103.236.134.210,1080,Pakistan,PK,Karachi,elite,true,91.33,AS38193,TRANSWORLD ASSOCIATES (PVT) LIMITED,1770.57,1780207725.321753
http,202.165.232.238,8080,Pakistan,PK,Lahore,transparent,false,24.57,AS136384,Optix Pakistan (Pvt.) Limited,9844.54,1780207698.7733223
http,103.19.48.148,8080,Pakistan,PK,Islamabad,transparent,true,90.48,AS150371,Pace Telecom and Brodcasting Private Limited,9143.49,1780207659.6041508
