protocol,ip,port,country,country_code,city,anonymity,ssl,uptime_percent,asn,isp,latency_ms,last_checked
socks4,103.146.137.81,1081,Pakistan,PK,Karachi,elite,true,5.55,AS139879,Galaxy Broadband (pvt.) Ltd.,607.25,1780081774.47011
socks4,110.93.206.62,5678,Pakistan,PK,Karachi,elite,true,11.51,AS38193,TRANSWORLD ASSOCIATES (PVT) LIMITED,719.53,1780081763.8012831
socks5,103.121.120.242,1080,Pakistan,PK,Karachi,elite,true,94.83,AS131275,Logon Broadband Pvt. Limited,1203.83,1780081754.3106873
http,103.205.178.226,8080,Pakistan,PK,Karachi,transparent,false,18.75,AS38713,Satcomm,3674.17,1780081722.1025925
http,103.115.196.98,8080,Pakistan,PK,Lahore,transparent,false,17.9,AS152605,AMBITIONS COMMUNICATION SYSTEM (SMC-PRIVATE) LIMITED,1693.59,1780081671.9478538
http,43.251.253.40,8080,Pakistan,PK,Lahore,transparent,false,37.92,AS136384,Optix Pakistan (Pvt.) Limited,5534.19,1780081663.6644878
http,154.208.58.89,8080,Pakistan,PK,Lahore,elite,false,7.6,AS150750,IN CABLE INTERNET PRIVATE LIMITED,4243.41,1780081644.7419374
socks5,182.184.119.180,1080,Pakistan,PK,Karachi,elite,true,56.46,AS17557,Pakistan Telecommuication company limited,2129.5,1780081639.8432267
http,121.91.60.68,8080,Pakistan,PK,Rawalakot,transparent,false,8.77,AS138423,CMPak Limited,1797.31,1780081574.223754
socks5,154.57.213.237,1080,Pakistan,PK,Islamabad,elite,true,61.84,AS135407,Trans World Enterprise Services (Private) Limited,8410.1,1780081564.3427315
socks5,103.150.206.77,1080,Pakistan,PK,Faisalabad,elite,true,53.77,AS140594,Nadeem Abbas and Shayufta Rani,8086.68,1780081522.2064688
http,202.165.232.238,8080,Pakistan,PK,Lahore,transparent,false,24.55,AS136384,Optix Pakistan (Pvt.) Limited,4482.31,1780081768.8211024
http,202.154.241.199,808,Pakistan,PK,Islamabad,transparent,false,10.52,AS23966,LINKdotNET Telecom Limited,9542.94,1780081736.360606
