protocol,ip,port,country,country_code,city,anonymity,ssl,uptime_percent,asn,isp,latency_ms,last_checked
socks4,110.93.206.62,5678,Pakistan,PK,Karachi,elite,true,11.12,AS38193,TRANSWORLD ASSOCIATES (PVT) LIMITED,1733.09,1780003135.717433
http,110.39.183.34,8080,Pakistan,PK,Lahore,transparent,true,19.33,AS38264,Wateen Telecom Limited,2695.44,1780003125.0101974
socks5,103.150.206.77,1080,Pakistan,PK,Faisalabad,elite,true,53.32,AS140594,Nadeem Abbas and Shayufta Rani,898.46,1780003116.2364876
http,182.176.164.41,8080,Pakistan,PK,Lahore,transparent,false,14.2,AS17557,Pakistan Telecommuication company limited,8130.58,1780003094.9119272
socks5,154.57.213.237,1080,Pakistan,PK,Islamabad,elite,true,61.06,AS135407,Trans World Enterprise Services (Private) Limited,1023.13,1780003039.9492939
socks5,175.107.244.164,1080,Pakistan,PK,Karachi,elite,true,53.48,AS9541,Cyber Internet Services Pakistan,5003.94,1780002804.6270063
http,202.165.232.238,8080,Pakistan,PK,Lahore,transparent,false,24.48,AS136384,Optix Pakistan (Pvt.) Limited,9585.52,1780003136.8772154
