protocol,ip,port,country,country_code,city,anonymity,ssl,uptime_percent,asn,isp,latency_ms,last_checked
socks4,110.93.206.62,5678,Pakistan,PK,Karachi,elite,true,11.94,AS38193,TRANSWORLD ASSOCIATES (PVT) LIMITED,1733.33,1780164597.429443
socks5,154.57.213.237,1080,Pakistan,PK,Islamabad,elite,true,66.75,AS135407,Trans World Enterprise Services (Private) Limited,3755.89,1780164596.5161598
socks5,103.150.206.77,1080,Pakistan,PK,Faisalabad,elite,true,55.56,AS140594,Nadeem Abbas and Shayufta Rani,1970.63,1780164592.0078795
socks5,182.184.119.180,1080,Pakistan,PK,Karachi,elite,true,58.0,AS17557,Pakistan Telecommuication company limited,1036.67,1780164590.1756065
http,103.115.196.98,8080,Pakistan,PK,Lahore,transparent,false,17.93,AS152605,AMBITIONS COMMUNICATION SYSTEM (SMC-PRIVATE) LIMITED,10112.14,1780164561.8303394
http,58.27.206.37,8080,Pakistan,PK,Lahore,transparent,false,28.35,AS38264,Wateen Telecom (Pvt.) Ltd.,9023.65,1780164447.2876337
http,39.49.164.180,8080,Pakistan,PK,Lahore,transparent,false,30.58,AS17557,Pakistan Telecommuication company limited,18010.24,1780164434.6044526
http,103.205.178.226,8080,Pakistan,PK,Karachi,transparent,true,19.35,AS38713,Satcomm,635.11,1780164583.0515416
socks5,103.236.134.210,1080,Pakistan,PK,Karachi,elite,true,89.94,AS38193,TRANSWORLD ASSOCIATES (PVT) LIMITED,799.49,1780164572.9645464
http,103.253.18.6,8080,Pakistan,PK,Faisalabad,transparent,false,8.55,AS151983,Orbit Internet Service Provider Pvt Ltd,2664.15,1780164540.362211
http,43.251.253.40,8080,Pakistan,PK,Lahore,transparent,false,36.81,AS136384,Optix Pakistan (Pvt.) Limited,11938.27,1780164513.531932
