protocol,ip,port,country,country_code,city,anonymity,ssl,uptime_percent,asn,isp,latency_ms,last_checked
socks5,103.121.120.242,1080,Pakistan,PK,Karachi,elite,true,89.13,AS131275,Logon Broadband Pvt. Limited,977.7,1780178381.5433438
http,154.208.58.89,8080,Pakistan,PK,Lahore,elite,false,7.66,AS150750,IN CABLE INTERNET PRIVATE LIMITED,5498.48,1780178357.446808
socks5,154.57.213.237,1080,Pakistan,PK,Islamabad,elite,true,68.34,AS135407,Trans World Enterprise Services (Private) Limited,2389.89,1780178344.1018863
socks5,182.184.119.180,1080,Pakistan,PK,Karachi,elite,true,58.75,AS17557,Pakistan Telecommuication company limited,1792.85,1780178342.918095
socks5,103.150.206.77,1080,Pakistan,PK,Faisalabad,elite,true,56.09,AS140594,Nadeem Abbas and Shayufta Rani,1999.51,1780178322.5116115
socks5,175.107.244.164,1080,Pakistan,PK,Karachi,elite,true,55.4,AS9541,Cyber Internet Services Pakistan,4363.23,1780178317.7924433
http,221.120.218.66,8080,Pakistan,PK,Tandlianwala,transparent,false,33.89,AS17557,PTCL ITI Lahore 11,4710.77,1780178283.307127
http,103.115.196.98,8080,Pakistan,PK,Lahore,transparent,false,17.96,AS152605,AMBITIONS COMMUNICATION SYSTEM (SMC-PRIVATE) LIMITED,5509.29,1780178239.3918445
http,182.176.164.41,8080,Pakistan,PK,Lahore,transparent,false,14.39,AS17557,Pakistan Telecommuication company limited,8150.99,1780178219.1879022
socks5,103.236.134.210,1080,Pakistan,PK,Karachi,elite,true,90.61,AS38193,TRANSWORLD ASSOCIATES (PVT) LIMITED,3015.02,1780178389.334478
http,103.253.18.6,8080,Pakistan,PK,Faisalabad,transparent,true,8.57,AS151983,Orbit Internet Service Provider Pvt Ltd,3730.13,1780178362.2849166
http,58.27.206.37,8080,Pakistan,PK,Lahore,transparent,false,28.36,AS38264,Wateen Telecom (Pvt.) Ltd.,2512.76,1780178235.6024227
