protocol,ip,port,country,country_code,city,anonymity,ssl,uptime_percent,asn,isp,latency_ms,last_checked
socks4,103.146.137.65,1081,Pakistan,PK,Karachi,elite,true,5.15,AS139879,Galaxy Broadband (pvt.) Ltd.,601.87,1780104549.9834783
socks4,103.146.137.13,1081,Pakistan,PK,Karachi,elite,true,5.68,AS139879,Galaxy Broadband (pvt.) Ltd.,618.41,1780104537.8056653
socks5,175.107.244.164,1080,Pakistan,PK,Karachi,elite,true,53.64,AS9541,Cyber Internet Services Pakistan,1245.54,1780104537.7708592
socks5,182.184.119.180,1080,Pakistan,PK,Karachi,elite,true,56.51,AS17557,Pakistan Telecommuication company limited,907.66,1780104532.7386787
socks5,154.57.213.237,1080,Pakistan,PK,Islamabad,elite,true,62.12,AS135407,Trans World Enterprise Services (Private) Limited,2039.99,1780104530.4098644
socks4,103.146.137.101,1081,Pakistan,PK,Karachi,elite,true,6.47,AS139879,Galaxy Broadband (pvt.) Ltd.,958.66,1780104524.4844644
socks5,103.236.134.210,1080,Pakistan,PK,Karachi,elite,true,85.71,AS38193,TRANSWORLD ASSOCIATES (PVT) LIMITED,781.22,1780104230.4825764
