protocol,ip,port,country,country_code,city,anonymity,ssl,uptime_percent,asn,isp,latency_ms,last_checked
socks5,103.121.120.242,1080,Pakistan,PK,Karachi,elite,true,89.93,AS131275,Logon Broadband Pvt. Limited,1620.49,1780197569.7227936
socks4,103.146.137.113,1081,Pakistan,PK,Karachi,elite,true,5.92,AS139879,Galaxy Broadband (pvt.) Ltd.,607.24,1780197569.0416057
socks5,182.184.119.180,1080,Pakistan,PK,Karachi,elite,true,59.41,AS17557,Pakistan Telecommuication company limited,1346.1,1780197566.7228084
http,125.209.110.83,39617,Pakistan,PK,Karachi,elite,false,8.24,AS9260,Multinet 125-110/24,4597.74,1780197540.343869
socks5,175.107.244.164,1080,Pakistan,PK,Karachi,elite,true,56.02,AS9541,Cyber Internet Services Pakistan,15130.23,1780197533.7283442
socks5,154.57.213.237,1080,Pakistan,PK,Islamabad,elite,true,69.33,AS135407,Trans World Enterprise Services (Private) Limited,2141.91,1780197492.36622
http,154.208.58.89,8080,Pakistan,PK,Lahore,elite,false,7.67,AS150750,IN CABLE INTERNET PRIVATE LIMITED,12477.87,1780197463.7080705
http,43.245.131.90,8080,Pakistan,PK,Karachi,transparent,false,30.06,AS132165,Dynamic PPPoE Hub,7524.86,1780197543.1081567
socks5,103.236.134.210,1080,Pakistan,PK,Karachi,elite,true,91.44,AS38193,TRANSWORLD ASSOCIATES (PVT) LIMITED,880.1,1780197525.951574
http,202.165.232.238,8080,Pakistan,PK,Lahore,transparent,false,24.55,AS136384,Optix Pakistan (Pvt.) Limited,5757.42,1780197502.932824
http,58.27.206.37,8080,Pakistan,PK,Lahore,transparent,false,28.46,AS38264,Wateen Telecom (Pvt.) Ltd.,2888.9,1780197435.7437854
