protocol,ip,port,country,country_code,city,anonymity,ssl,uptime_percent,asn,isp,latency_ms,last_checked
socks4,103.146.137.65,1081,Pakistan,PK,Karachi,elite,true,5.21,AS139879,Galaxy Broadband (pvt.) Ltd.,612.63,1780127957.8995714
socks4,103.146.137.157,1081,Pakistan,PK,Karachi,elite,true,5.42,AS139879,Galaxy Broadband (pvt.) Ltd.,604.37,1780127953.6270008
socks4,103.146.137.253,1081,Pakistan,PK,Karachi,elite,true,5.38,AS139879,Galaxy Broadband (pvt.) Ltd.,619.75,1780127951.534095
http,154.208.58.89,8080,Pakistan,PK,Lahore,elite,false,7.62,AS150750,IN CABLE INTERNET PRIVATE LIMITED,6287.06,1780127931.4700675
http,43.245.131.90,8080,Pakistan,PK,Karachi,transparent,false,29.02,AS132165,Dynamic PPPoE Hub,2723.01,1780127923.3816504
socks5,154.57.213.237,1080,Pakistan,PK,Islamabad,elite,true,62.44,AS135407,Trans World Enterprise Services (Private) Limited,1057.91,1780127649.893472
