protocol,ip,port,country,country_code,city,anonymity,ssl,uptime_percent,asn,isp,latency_ms,last_checked
socks5,103.150.206.77,1080,Pakistan,PK,Faisalabad,elite,true,53.78,AS140594,Nadeem Abbas and Shayufta Rani,4375.59,1780082936.263322
socks4,103.146.137.109,1081,Pakistan,PK,Karachi,elite,true,5.09,AS139879,Galaxy Broadband (pvt.) Ltd.,991.46,1780082919.7834706
socks4,110.93.206.62,5678,Pakistan,PK,Karachi,elite,true,11.51,AS38193,TRANSWORLD ASSOCIATES (PVT) LIMITED,707.24,1780082917.8219035
http,103.115.196.98,8080,Pakistan,PK,Lahore,transparent,false,17.92,AS152605,AMBITIONS COMMUNICATION SYSTEM (SMC-PRIVATE) LIMITED,2217.28,1780082897.367193
socks5,154.57.213.237,1080,Pakistan,PK,Islamabad,elite,true,61.88,AS135407,Trans World Enterprise Services (Private) Limited,713.19,1780082895.7738416
socks5,103.121.120.242,1080,Pakistan,PK,Karachi,elite,true,94.89,AS131275,Logon Broadband Pvt. Limited,6426.03,1780082815.7403631
http,43.245.131.90,8080,Pakistan,PK,Karachi,transparent,false,29.01,AS132165,Dynamic PPPoE Hub,6209.87,1780082777.4920113
socks5,182.184.119.180,1080,Pakistan,PK,Karachi,elite,true,56.45,AS17557,Pakistan Telecommuication company limited,3848.23,1780082651.946455
