protocol,ip,port,country,country_code,city,anonymity,ssl,uptime_percent,asn,isp,latency_ms,last_checked
socks4,103.146.137.109,1081,Pakistan,PK,Karachi,elite,true,5.33,AS139879,Galaxy Broadband (pvt.) Ltd.,620.46,1780188578.522825
socks4,110.93.206.62,5678,Pakistan,PK,Karachi,elite,true,12.04,AS38193,TRANSWORLD ASSOCIATES (PVT) LIMITED,7923.6,1780188569.2473822
socks5,103.150.206.77,1080,Pakistan,PK,Faisalabad,elite,true,56.32,AS140594,Nadeem Abbas and Shayufta Rani,1850.91,1780188568.602062
socks5,182.184.119.180,1080,Pakistan,PK,Karachi,elite,true,59.07,AS17557,Pakistan Telecommuication company limited,2112.75,1780188557.942642
socks5,175.107.244.164,1080,Pakistan,PK,Karachi,elite,true,55.73,AS9541,Cyber Internet Services Pakistan,9052.34,1780188554.673498
http,121.91.60.68,8080,Pakistan,PK,Rawalakot,transparent,false,8.85,AS138423,CMPak Limited,2354.41,1780188551.8013468
socks5,103.121.120.242,1080,Pakistan,PK,Karachi,elite,true,89.49,AS131275,Logon Broadband Pvt. Limited,2151.18,1780188517.5986826
socks5,154.57.213.237,1080,Pakistan,PK,Islamabad,elite,true,68.9,AS135407,Trans World Enterprise Services (Private) Limited,2692.0,1780188490.2158792
http,103.205.178.226,8080,Pakistan,PK,Karachi,transparent,false,19.64,AS38713,Satcomm,2933.73,1780188586.7711494
socks5,103.236.134.210,1080,Pakistan,PK,Karachi,elite,true,91.09,AS38193,TRANSWORLD ASSOCIATES (PVT) LIMITED,2266.54,1780188549.2905452
http,202.69.38.82,8080,Pakistan,PK,Raiwind,transparent,false,5.77,AS23750,Gerrys Information Technology (PVT) Ltd,7996.75,1780188444.67484
http,58.27.206.37,8080,Pakistan,PK,Lahore,transparent,false,28.39,AS38264,Wateen Telecom (Pvt.) Ltd.,8149.46,1780188582.4006834
