protocol,ip,port,country,country_code,city,anonymity,ssl,uptime_percent,asn,isp,latency_ms,last_checked
socks4,110.93.206.62,5678,Pakistan,PK,Karachi,elite,true,11.4,AS38193,TRANSWORLD ASSOCIATES (PVT) LIMITED,694.85,1780066187.7376769
socks5,103.121.120.242,1080,Pakistan,PK,Karachi,elite,true,94.66,AS131275,Logon Broadband Pvt. Limited,791.42,1780066157.868205
socks5,154.57.213.237,1080,Pakistan,PK,Islamabad,elite,true,61.69,AS135407,Trans World Enterprise Services (Private) Limited,725.68,1780066138.2875226
http,154.208.58.89,8080,Pakistan,PK,Lahore,elite,false,7.59,AS150750,IN CABLE INTERNET PRIVATE LIMITED,9865.97,1780066045.0934918
socks5,182.184.119.180,1080,Pakistan,PK,Karachi,elite,true,56.45,AS17557,Pakistan Telecommuication company limited,4151.28,1780065784.9775288
http,202.154.241.199,808,Pakistan,PK,Islamabad,transparent,false,10.5,AS23966,LINKdotNET Telecom Limited,7044.98,1780066127.261059
http,103.253.18.6,8080,Pakistan,PK,Faisalabad,transparent,false,8.51,AS151983,Orbit Internet Service Provider Pvt Ltd,9859.63,1780066126.5272784
http,202.165.232.238,8080,Pakistan,PK,Lahore,transparent,false,24.55,AS136384,Optix Pakistan (Pvt.) Limited,7205.71,1780066071.219857
http,203.130.23.250,80,Pakistan,PK,Lahore,transparent,true,9.39,AS24435,"Supernet, PDS Limited",2265.4,1780066030.6297374
