protocol,ip,port,country,country_code,city,anonymity,ssl,uptime_percent,asn,isp,latency_ms,last_checked
socks4,110.93.206.62,5678,Pakistan,PK,Karachi,elite,true,11.25,AS38193,TRANSWORLD ASSOCIATES (PVT) LIMITED,7938.42,1780033459.3453023
socks5,103.121.120.242,1080,Pakistan,PK,Karachi,elite,true,92.48,AS131275,Logon Broadband Pvt. Limited,747.63,1780033452.089061
http,221.120.218.66,8080,Pakistan,PK,Tandlianwala,transparent,false,35.47,AS17557,PTCL ITI Lahore 11,8961.53,1780033426.8560677
socks5,175.107.244.164,1080,Pakistan,PK,Karachi,elite,true,53.39,AS9541,Cyber Internet Services Pakistan,1965.3,1780033423.4605088
socks5,182.184.119.180,1080,Pakistan,PK,Karachi,elite,true,56.3,AS17557,Pakistan Telecommuication company limited,7964.51,1780033406.8356442
http,121.91.60.68,8080,Pakistan,PK,Rawalakot,transparent,false,8.74,AS138423,CMPak Limited,3289.84,1780033382.187909
socks5,103.150.206.77,1080,Pakistan,PK,Faisalabad,elite,true,53.45,AS140594,Nadeem Abbas and Shayufta Rani,1905.78,1780033280.4634793
socks5,154.57.213.237,1080,Pakistan,PK,Islamabad,elite,true,61.39,AS135407,Trans World Enterprise Services (Private) Limited,1782.73,1780033247.4035454
