protocol,ip,port,country,country_code,city,anonymity,ssl,uptime_percent,asn,isp,latency_ms,last_checked
socks4,117.216.46.148,1080,India,IN,Thiruvananthapuram,elite,true,59.52,AS9829,BSNL Internet,2409.96,1780016365.071205
socks4,45.89.106.116,1082,India,IN,New Delhi,elite,true,96.0,AS153914,NETRANEX TECHNOLOGIES (INDIA) PRIVATE LIMITED,1041.34,1780016360.9236462
socks4,103.86.1.41,4145,India,IN,Bengaluru,elite,true,3.95,AS136371,Airwir Technologies Private Limited,1877.19,1780016357.7534606
socks4,45.89.106.116,1081,India,IN,New Delhi,elite,true,86.65,AS153914,NETRANEX TECHNOLOGIES (INDIA) PRIVATE LIMITED,1785.06,1780016356.645798
socks4,136.233.136.41,43314,India,IN,Mangaluru,elite,true,34.4,AS55836,Reliance Jio Infocomm Limited,840.73,1780016353.3421361
socks4,103.224.48.41,31433,India,IN,Kanpur,elite,true,4.33,AS134922,R TECHNOLOGIES,3986.28,1780016344.8261018
socks4,103.59.200.26,4145,India,IN,Mumbai,elite,true,2.08,AS134014,NET 4 U SERVICES PVT LTD,658.21,1780016338.8094752
socks4,210.16.86.105,5678,India,IN,Chennai,elite,true,44.43,AS134877,Sri Vari Network Private Limited,917.67,1780016405.7465947
