protocol,ip,port,country,country_code,city,anonymity,ssl,uptime_percent,asn,isp,latency_ms,last_checked
socks4,45.89.106.116,1082,India,IN,New Delhi,elite,true,85.17,AS153914,NETRANEX TECHNOLOGIES (INDIA) PRIVATE LIMITED,1486.53,1780121400.751655
socks4,103.210.28.154,31433,India,IN,Kanpur,elite,true,3.26,AS134922,R G TECHNOSOLUTIONS PVT LTD,2163.58,1780121400.23353
socks4,27.121.101.5,5678,India,IN,Nadiād,elite,true,12.53,AS45916,Gujarat Telelik Pvt Ltd,1810.14,1780121398.3957694
socks4,45.89.106.116,1081,India,IN,New Delhi,elite,true,81.87,AS153914,NETRANEX TECHNOLOGIES (INDIA) PRIVATE LIMITED,2234.28,1780121395.2727866
socks4,103.86.1.41,4145,India,IN,Bengaluru,elite,true,4.13,AS136371,Airwir Technologies Private Limited,842.5,1780121394.8761137
socks4,45.249.78.177,5678,India,IN,Mātsavaram,elite,true,5.16,AS18229,Tejasri Communications,1964.7,1780121394.6785557
socks4,103.81.117.225,4153,India,IN,Rajkot,elite,true,6.13,AS135851,Excogitate Technologies Pvt. Ltd,8081.04,1780121392.0600085
socks4,119.235.49.121,4153,India,IN,Guntur,elite,true,3.99,AS45582,"VAINAVI INDUSTIES LTD, INTERNET SERVICE PROVIDER, INDIA",8023.05,1780121391.9979877
socks4,136.233.136.41,43314,India,IN,Mangaluru,elite,true,35.46,AS55836,Reliance Jio Infocomm Limited,2489.88,1780121388.3520236
socks4,117.216.46.148,1080,India,IN,Thiruvananthapuram,elite,true,60.27,AS9829,BSNL Internet,3965.77,1780121387.0149486
socks4,103.224.48.38,31433,India,IN,Kanpur,elite,true,4.55,AS134922,R TECHNOLOGIES,888.9,1780121384.278074
socks4,45.126.169.233,4145,India,IN,Mumbai,elite,true,2.31,AS134014,NET 4 U SERVICES PVT LTD,720.59,1780121369.5094392
socks4,178.212.35.124,9100,India,IN,Mumbai,elite,true,53.38,AS141995,Contabo Asia Private Limited,12490.42,1780121364.9110668
socks4,210.16.86.105,5678,India,IN,Chennai,elite,true,45.43,AS134877,Sri Vari Network Private Limited,3956.37,1780121393.0139847
