protocol,ip,port,country,country_code,city,anonymity,ssl,uptime_percent,asn,isp,latency_ms,last_checked
socks4,45.89.106.116,1081,India,IN,New Delhi,elite,true,81.87,AS153914,NETRANEX TECHNOLOGIES (INDIA) PRIVATE LIMITED,3192.64,1780121099.651432
socks4,45.89.106.116,1082,India,IN,New Delhi,elite,true,85.2,AS153914,NETRANEX TECHNOLOGIES (INDIA) PRIVATE LIMITED,4146.43,1780121092.749347
socks4,43.228.95.138,5678,India,IN,Anakapalle,elite,true,5.32,AS18229,Viswaroopa Info Services India Private ltd,3941.07,1780121088.8805478
socks4,103.81.117.225,4153,India,IN,Rajkot,elite,true,6.13,AS135851,Excogitate Technologies Pvt. Ltd,7892.03,1780121088.2862012
socks4,103.86.1.41,4145,India,IN,Bengaluru,elite,true,4.13,AS136371,Airwir Technologies Private Limited,799.37,1780121083.627296
socks4,150.129.170.77,5678,India,IN,Nadiād,elite,true,12.63,AS45916,GTPL SK Network Pvt Ltd,7875.45,1780121073.697434
socks4,202.179.83.169,51951,India,IN,Mumbai,elite,true,46.11,AS138296,Ankhnet,3681.27,1780121072.0493526
socks4,136.233.136.41,43314,India,IN,Mangaluru,elite,true,35.45,AS55836,Reliance Jio Infocomm Limited,8432.98,1780121069.6949012
socks4,103.81.117.122,4153,India,IN,Rajkot,elite,true,6.08,AS135851,Excogitate Technologies Pvt. Ltd,3897.3,1780121068.3157156
socks4,210.16.86.105,5678,India,IN,Chennai,elite,true,45.43,AS134877,Sri Vari Network Private Limited,883.46,1780121085.8553457
