protocol,ip,port,country,country_code,city,anonymity,ssl,uptime_percent,asn,isp,latency_ms,last_checked
socks4,103.86.1.41,4145,India,IN,Bengaluru,elite,true,4.06,AS136371,Airwir Technologies Private Limited,768.71,1780076368.7687602
socks4,136.233.136.41,43314,India,IN,Mangaluru,elite,true,35.02,AS55836,Reliance Jio Infocomm Limited,4203.29,1780076363.7292614
socks4,45.89.106.116,1081,India,IN,New Delhi,elite,true,84.57,AS153914,NETRANEX TECHNOLOGIES (INDIA) PRIVATE LIMITED,1737.73,1780076362.0963948
socks4,150.129.170.65,5678,India,IN,Nadiād,elite,true,11.85,AS45916,GTPL SK Network Pvt Ltd,712.46,1780076358.548234
socks4,150.129.170.17,5678,India,IN,Nadiād,elite,true,12.42,AS45916,GTPL SK Network Pvt Ltd,1754.65,1780076355.2381785
socks4,103.81.117.122,4153,India,IN,Rajkot,elite,true,5.96,AS135851,Excogitate Technologies Pvt. Ltd,3829.48,1780076350.840219
socks4,45.89.106.116,1082,India,IN,New Delhi,elite,true,90.67,AS153914,NETRANEX TECHNOLOGIES (INDIA) PRIVATE LIMITED,4340.15,1780076350.612569
socks4,202.179.83.169,51951,India,IN,Mumbai,elite,true,45.89,AS138296,Ankhnet,1684.68,1780076350.3700354
socks4,117.216.46.148,1080,India,IN,Thiruvananthapuram,elite,true,59.97,AS9829,BSNL Internet,2367.12,1780076349.3612616
socks4,119.235.49.121,4153,India,IN,Guntur,elite,true,3.9,AS45582,"VAINAVI INDUSTIES LTD, INTERNET SERVICE PROVIDER, INDIA",3825.49,1780076312.308819
socks4,210.16.86.105,5678,India,IN,Chennai,elite,true,45.0,AS134877,Sri Vari Network Private Limited,8028.29,1780076399.6476886
