protocol,ip,port,country,country_code,city,anonymity,ssl,uptime_percent,asn,isp,latency_ms,last_checked
socks4,103.157.224.1,5678,India,IN,Bengaluru,elite,true,6.21,AS136171,NIXI,657.56,1780017000.7037585
socks4,43.228.95.138,5678,India,IN,Anakapalle,elite,true,5.05,AS18229,Viswaroopa Info Services India Private ltd,1976.32,1780016999.4712317
socks4,45.89.106.116,1081,India,IN,New Delhi,elite,true,86.75,AS153914,NETRANEX TECHNOLOGIES (INDIA) PRIVATE LIMITED,1015.43,1780016995.2553136
socks4,45.89.106.116,1082,India,IN,New Delhi,elite,true,96.09,AS153914,NETRANEX TECHNOLOGIES (INDIA) PRIVATE LIMITED,1012.45,1780016990.8953784
socks4,103.59.200.26,4145,India,IN,Mumbai,elite,true,2.08,AS134014,NET 4 U SERVICES PVT LTD,3730.44,1780016980.756086
socks4,178.212.35.124,9100,India,IN,Mumbai,elite,true,53.21,AS141995,Contabo Asia Private Limited,11687.19,1780016980.2515216
socks4,45.249.78.177,5678,India,IN,Mātsavaram,elite,true,4.87,AS18229,Tejasri Communications,911.41,1780016967.625676
socks4,103.81.117.122,4153,India,IN,Rajkot,elite,true,5.78,AS135851,Excogitate Technologies Pvt. Ltd,1825.09,1780016994.9468057
socks4,210.16.86.105,5678,India,IN,Chennai,elite,true,44.44,AS134877,Sri Vari Network Private Limited,1890.22,1780017010.3726187
