protocol,ip,port,country,country_code,city,anonymity,ssl,uptime_percent,asn,isp,latency_ms,last_checked
socks4,117.216.46.148,1080,India,IN,Thiruvananthapuram,elite,true,60.68,AS9829,BSNL Internet,2430.73,1780192734.2547407
socks4,136.233.136.41,43314,India,IN,Mangaluru,elite,true,36.19,AS55836,Reliance Jio Infocomm Limited,8039.18,1780192725.1598516
socks4,45.89.106.116,1081,India,IN,New Delhi,elite,true,78.81,AS153914,NETRANEX TECHNOLOGIES (INDIA) PRIVATE LIMITED,7700.22,1780192705.5171914
socks4,45.89.106.116,1082,India,IN,New Delhi,elite,true,82.39,AS153914,NETRANEX TECHNOLOGIES (INDIA) PRIVATE LIMITED,1602.37,1780192703.081515
socks4,119.235.49.121,4153,India,IN,Guntur,elite,true,4.12,AS45582,"VAINAVI INDUSTIES LTD, INTERNET SERVICE PROVIDER, INDIA",7971.02,1780192695.4867861
socks4,27.121.101.5,5678,India,IN,Nadiād,elite,true,12.87,AS45916,Gujarat Telelik Pvt Ltd,1866.31,1780192686.70746
socks4,202.179.83.169,51951,India,IN,Mumbai,elite,true,46.67,AS138296,Ankhnet,3688.35,1780192801.9060185
socks4,45.126.169.233,4145,India,IN,Mumbai,elite,true,2.37,AS134014,NET 4 U SERVICES PVT LTD,1820.51,1780192775.3977454
socks4,103.81.117.122,4153,India,IN,Rajkot,elite,true,6.28,AS135851,Excogitate Technologies Pvt. Ltd,3910.52,1780192770.1147478
