protocol,ip,port,country,country_code,city,anonymity,ssl,uptime_percent,asn,isp,latency_ms,last_checked
socks4,45.89.106.116,1081,India,IN,New Delhi,elite,true,87.63,AS153914,NETRANEX TECHNOLOGIES (INDIA) PRIVATE LIMITED,1945.5,1780034993.4208694
socks4,45.89.106.116,1082,India,IN,New Delhi,elite,true,95.38,AS153914,NETRANEX TECHNOLOGIES (INDIA) PRIVATE LIMITED,2680.34,1780034992.3144279
socks4,150.129.170.65,5678,India,IN,Nadiād,elite,true,11.39,AS45916,GTPL SK Network Pvt Ltd,8103.35,1780034984.7665315
socks4,27.121.101.5,5678,India,IN,Nadiād,elite,true,12.25,AS45916,Gujarat Telelik Pvt Ltd,1786.3,1780034981.3331103
socks4,136.233.136.41,43314,India,IN,Mangaluru,elite,true,34.56,AS55836,Reliance Jio Infocomm Limited,4393.71,1780034981.305306
socks4,202.179.83.169,51951,India,IN,Mumbai,elite,true,45.56,AS138296,Ankhnet,3714.64,1780034993.7149954
socks4,103.85.103.41,5678,India,IN,Bhiwandi,elite,true,4.83,AS135788,Vedant Broadband,7734.0,1780034990.3634846
socks4,103.86.1.41,4145,India,IN,Bengaluru,elite,true,3.98,AS136371,Airwir Technologies Private Limited,3825.92,1780034984.8057995
