protocol,ip,port,country,country_code,city,anonymity,ssl,uptime_percent,asn,isp,latency_ms,last_checked
socks4,45.89.106.116,1081,India,IN,New Delhi,elite,true,79.04,AS153914,NETRANEX TECHNOLOGIES (INDIA) PRIVATE LIMITED,2404.53,1780154087.9640968
socks4,27.121.101.5,5678,India,IN,Nadiād,elite,true,12.74,AS45916,Gujarat Telelik Pvt Ltd,7825.0,1780154080.0336518
socks4,136.233.136.41,43314,India,IN,Mangaluru,elite,true,35.85,AS55836,Reliance Jio Infocomm Limited,8554.48,1780154069.3380547
socks4,150.129.170.73,5678,India,IN,Nadiād,elite,true,11.86,AS45916,GTPL SK Network Pvt Ltd,1788.31,1780154067.39722
socks4,45.89.106.116,1082,India,IN,New Delhi,elite,true,82.31,AS153914,NETRANEX TECHNOLOGIES (INDIA) PRIVATE LIMITED,1956.06,1780154065.1974463
socks4,27.121.101.221,5678,India,IN,Nadiād,elite,true,12.11,AS45916,Gujarat Telelik Pvt Ltd,1743.62,1780154063.3291192
socks4,119.235.49.121,4153,India,IN,Guntur,elite,true,4.06,AS45582,"VAINAVI INDUSTIES LTD, INTERNET SERVICE PROVIDER, INDIA",790.29,1780154053.433312
socks4,159.65.158.30,8888,India,IN,Bengaluru,elite,true,31.6,AS14061,"DigitalOcean, LLC",3458.65,1780154047.9859962
socks4,202.179.83.169,51951,India,IN,Mumbai,elite,true,46.43,AS138296,Ankhnet,3684.17,1780154094.0013359
socks4,43.228.95.138,5678,India,IN,Anakapalle,elite,true,5.39,AS18229,Viswaroopa Info Services India Private ltd,3930.86,1780154093.2383256
socks4,103.224.48.38,31433,India,IN,Kanpur,elite,true,4.61,AS134922,R TECHNOLOGIES,894.83,1780154074.5580313
socks4,103.86.1.41,4145,India,IN,Bengaluru,elite,true,4.22,AS136371,Airwir Technologies Private Limited,819.88,1780154043.0763538
