protocol,ip,port,country,country_code,city,anonymity,ssl,uptime_percent,asn,isp,latency_ms,last_checked
socks5,59.66.28.115,6382,China,CN,Haidian,elite,true,83.04,AS4538,China Education and Research Network Center,2298.48,1779970110.8722074
socks5,221.176.85.226,1080,China,CN,Guangzhou,elite,true,12.17,AS9808,China Mobile communications corporation,1279.26,1779970080.870631
socks5,122.224.198.218,1080,China,CN,Hangzhou,elite,true,70.26,AS4134,Chinanet,4980.13,1779970030.7865443
socks5,42.192.173.202,20000,China,CN,Shanghai,elite,true,9.29,AS45090,China Internet Network Information Center,1730.49,1779969997.284827
socks5,117.175.168.195,1080,China,CN,Guangzhou,elite,true,40.62,AS9808,China Mobile communications corporation,1487.47,1779969881.9432197
socks5,120.133.82.62,44038,China,CN,Chaowai,elite,true,1.36,AS133119,China Unicom IP network,4760.78,1779969862.576082
socks5,203.25.208.163,1145,China,CN,Guangzhou,elite,true,62.18,AS139220,China Telecom,4535.44,1779969787.4855902
socks5,43.139.29.27,1111,China,CN,Guangzhou,elite,true,26.59,AS45090,Shenzhen Tencent Computer Systems Company Limited,1849.88,1779969765.3111675
socks5,120.220.197.195,59999,China,CN,Guangzhou,elite,true,58.36,AS9808,China Mobile communications corporation,8825.34,1779969760.0924563
socks5,221.225.50.57,8989,China,CN,Suzhou,elite,true,9.45,AS140292,CHINANET jiangsu province network,2823.02,1779969643.8729763
socks5,47.107.166.143,8000,China,CN,Shenzhen,elite,true,1.49,AS37963,Hangzhou Alibaba Advertising Co,9538.7,1779969186.794955
socks5,139.224.195.153,8008,China,CN,Shanghai,elite,true,0.81,AS37963,Addresses CNNIC,6532.94,1779969162.7903404
socks5,39.100.88.89,10000,China,CN,Beijing,elite,true,0.29,AS37963,Hangzhou Alibaba Advertising Co,6569.57,1779969158.2050934
socks5,114.215.127.92,8081,China,CN,Qingdao,elite,true,1.39,AS37963,China Internet Network Information Center,6604.37,1779969097.0563364
socks5,8.130.71.75,3129,China,CN,Beijing,elite,true,2.32,AS37963,"Hangzhou Alibaba Advertising Co., Ltd.",6571.62,1779969029.2572427
