protocol,ip,port,country,country_code,city,anonymity,ssl,uptime_percent,asn,isp,latency_ms,last_checked
socks5,221.202.27.194,10806,China,CN,Shenyang,elite,true,36.04,AS4837,CNC Group CHINA169 Liaoning Province Network,2095.77,1780071297.902758
socks5,59.66.28.115,6382,China,CN,Haidian,elite,true,71.64,AS4538,China Education and Research Network Center,1586.83,1780071281.5739565
socks5,117.175.168.195,1080,China,CN,Guangzhou,elite,true,51.1,AS9808,China Mobile communications corporation,2467.8,1780071273.0458813
socks5,223.111.182.16,1021,China,CN,Nanjing,elite,true,62.77,AS56046,China Mobile communications corporation,17091.58,1780071132.4985452
socks5,120.220.197.195,59999,China,CN,Guangzhou,elite,true,61.45,AS9808,China Mobile communications corporation,2603.07,1780071115.006035
socks5,122.224.198.218,1080,China,CN,Hangzhou,elite,true,70.45,AS4134,Chinanet,17525.65,1780071049.214552
socks5,221.225.50.11,8989,China,CN,Suzhou,elite,true,0.43,AS140292,CHINANET jiangsu province network,6739.86,1780070852.6087756
socks5,203.25.208.163,1111,China,CN,Guangzhou,elite,true,62.82,AS139220,China Telecom,1577.19,1780071299.2723944
socks5,59.66.28.73,6382,China,CN,Haidian,elite,true,19.58,AS4538,China Education and Research Network Center,1450.29,1780071295.6536233
socks5,106.75.250.161,7890,China,CN,Yangpu,elite,true,36.28,AS17621,UCLOUD,1580.49,1780071295.507642
socks5,203.25.208.163,1011,China,CN,Guangzhou,elite,true,62.05,AS139220,China Telecom,2530.03,1780071250.641395
socks5,203.25.208.163,1515,China,CN,Guangzhou,elite,true,61.73,AS139220,China Telecom,1482.38,1780071168.3009694
socks5,106.52.215.138,7890,China,CN,Guangzhou,elite,true,53.14,AS45090,Shenzhen Tencent Computer Systems Company Limited,1300.22,1780071160.3449013
