protocol,ip,port,country,country_code,city,anonymity,ssl,uptime_percent,asn,isp,latency_ms,last_checked
http,45.174.248.22,999,Mexico,MX,Morelia,transparent,false,3.36,AS265582,Wifmax S.A de C.V.,7489.27,1779983339.7024102
http,38.123.220.147,999,Mexico,MX,Loma Hermosa,transparent,true,66.17,AS174,Cogent Communications,426.29,1779983339.432945
http,38.194.250.174,999,Mexico,MX,Tepepatlaxco,transparent,true,26.73,AS28458,IENTC S de RL de CV,4177.44,1779983321.0567675
http,45.174.243.20,999,Mexico,MX,Champotón,transparent,false,12.09,AS265583,Sistemas Y Soluciones De Campeche SAS De CV,5027.25,1779983313.7197893
http,187.190.127.212,80,Mexico,MX,Puerto Vallarta,transparent,true,13.13,AS22884,Total Play Telecomunicaciones SA De CV,2361.47,1779983303.5667412
http,45.188.76.177,999,Mexico,MX,Villahermosa,transparent,false,24.51,AS265608,ONT NETWORKS SA de CV,3684.47,1779983301.8565018
http,45.174.243.142,999,Mexico,MX,Champotón,transparent,false,28.11,AS265583,Sistemas Y Soluciones De Campeche SAS De CV,6472.14,1779983297.6560237
http,45.174.92.44,8087,Mexico,MX,San Juan Bautista Tuxtla,transparent,true,37.74,AS28429,Enlace de Datos y Redes SA de CV,9441.34,1779983296.0878882
http,148.230.4.241,999,Mexico,MX,Naranjos,transparent,true,79.53,AS265606,Digy Networks,4644.33,1779983293.4242897
http,187.251.224.167,80,Mexico,MX,León,transparent,false,14.47,AS22884,Total Play Telecomunicaciones SA De CV,14834.01,1779983277.8694088
http,38.123.220.59,999,Mexico,MX,Loma Hermosa,transparent,false,28.99,AS174,Cogent Communications,14533.92,1779983271.8771148
http,38.49.148.149,999,Mexico,MX,Huamantla,transparent,false,14.2,AS28458,IENTC S de RL de CV,9250.92,1779983241.798457
http,45.190.78.20,999,Mexico,MX,Zapopan,transparent,false,20.32,AS265614,Meta Networks SA De CV,4124.9,1779983234.4814675
http,38.210.201.144,999,Mexico,MX,Aguascalientes,transparent,false,27.71,AS273250,Soluciones de Tecnologia Jah sa de Cv,12720.62,1779983233.753697
http,187.243.251.66,999,Mexico,MX,Ahome,transparent,false,13.13,AS13999,"Mega Cable, S.A. de C.V.",6651.8,1779983229.8519413
http,38.123.220.62,999,Mexico,MX,Loma Hermosa,transparent,false,24.27,AS174,Cogent Communications,10992.9,1779983221.6438856
http,187.102.236.177,8080,Mexico,MX,Parral,transparent,false,44.73,AS270114,Servicios De Infraestructura De Radiocomunicacion Y Redes Privadas De Datos Hype,11580.41,1779983217.8802555
http,5.102.109.41,999,Mexico,MX,San Juan del Río,transparent,true,36.73,AS270172,IPXO,4814.75,1779983214.611947
http,38.7.138.33,999,Mexico,MX,Uruapan,transparent,false,16.74,AS272387,Waves Links Servicios De Comunicaciones E Informatica SAS De CV,17700.61,1779983208.4039323
http,201.159.104.121,8081,Mexico,MX,General Escobedo,transparent,true,4.39,AS28539,Administradora de Servicios de Internet Sandur S.A. de C.V.,5398.26,1779983170.6118064
http,38.49.133.226,999,Mexico,MX,Silao,transparent,false,16.28,AS28458,IENTC S de RL de CV,4198.12,1779983136.609965
