protocol,ip,port,country,country_code,city,anonymity,ssl,uptime_percent,asn,isp,latency_ms,last_checked
http,148.230.15.194,999,Mexico,MX,Francisco I. Madero,transparent,true,14.77,AS265606,Digy Networks,1818.44,1779982176.88785
http,38.123.220.147,999,Mexico,MX,Loma Hermosa,transparent,true,66.04,AS174,Cogent Communications,420.89,1779982173.9312167
http,201.159.99.37,8081,Mexico,MX,General Escobedo,transparent,false,6.82,AS28539,Administradora de Servicios de Internet Sandur S.A. de C.V.,2858.47,1779982171.2806382
http,38.194.246.34,999,Mexico,MX,Los Ramírez,transparent,false,41.71,AS28458,IENTC S de RL de CV,3875.53,1779982171.0478344
http,45.188.76.107,999,Mexico,MX,Villahermosa,transparent,false,3.69,AS265608,ONT NETWORKS SA de CV,3044.48,1779982150.527935
http,5.102.109.41,999,Mexico,MX,San Juan del Río,transparent,true,36.73,AS270172,IPXO,3103.41,1779982143.5695133
http,38.65.174.107,999,Mexico,MX,Amealco de Bonfil,transparent,false,15.23,AS270158,Wantelco SAS de CV,5020.18,1779982139.1594443
http,38.49.150.131,999,Mexico,MX,Purísima de Cerro Grande,transparent,false,13.07,AS28458,IENTC S de RL de CV,4705.39,1779982138.8752997
http,45.231.170.137,999,Mexico,MX,Juárez,transparent,false,7.41,AS265547,"GigNet, S.A. de C.V.",5005.16,1779982138.132544
http,201.159.109.137,8081,Mexico,MX,General Escobedo,transparent,false,11.45,AS28539,Administradora de Servicios de Internet Sandur S.A. de C.V.,4470.31,1779982122.0744927
http,38.123.220.221,999,Mexico,MX,Loma Hermosa,transparent,false,26.19,AS174,Cogent Communications,8666.02,1779982105.7049277
http,45.174.92.44,8087,Mexico,MX,San Juan Bautista Tuxtla,transparent,false,37.73,AS28429,Enlace de Datos y Redes SA de CV,8838.75,1779982105.562897
http,38.35.247.146,999,Mexico,MX,Santas Marías,transparent,true,18.06,AS265509,Optoenlaces SA de CV,2802.17,1779982105.3682678
http,45.189.252.49,999,Mexico,MX,Alvarado,transparent,false,11.54,AS265613,Tracered SA De CV,9770.65,1779982104.1203928
http,38.35.247.144,999,Mexico,MX,La Viña,transparent,false,24.45,AS265509,Optoenlaces SA de CV,1728.22,1779982099.7973104
http,187.102.236.177,8080,Mexico,MX,Parral,transparent,false,45.28,AS270114,Servicios De Infraestructura De Radiocomunicacion Y Redes Privadas De Datos Hype,4397.91,1779982074.3278933
http,201.159.20.205,999,Mexico,MX,Mexicali,transparent,true,27.95,AS262913,"Konecta de Mexico, S. de R.L. de C.V.",5140.78,1779982062.6798754
http,187.251.222.69,8080,Mexico,MX,Acolman,transparent,false,7.11,AS22884,Total Play Telecomunicaciones SA De CV,3096.01,1779982060.6593335
