protocol,ip,port,country,country_code,city,anonymity,ssl,uptime_percent,asn,isp,latency_ms,last_checked
http,187.190.127.212,80,Mexico,MX,Puerto Vallarta,transparent,true,13.16,AS22884,Total Play Telecomunicaciones SA De CV,2194.09,1780109078.0958843
http,148.230.4.241,999,Mexico,MX,Naranjos,transparent,true,86.99,AS265606,Digy Networks,1486.19,1780109059.3165154
http,201.139.115.38,8082,Mexico,MX,Puebla City,elite,false,17.96,AS32098,Transtelco Inc,10887.73,1780109049.6120732
http,38.123.220.147,999,Mexico,MX,Loma Hermosa,transparent,true,65.72,AS174,Cogent Communications,1432.01,1780109048.2271132
http,187.251.224.167,80,Mexico,MX,León,transparent,false,14.51,AS22884,Total Play Telecomunicaciones SA De CV,1243.98,1780109045.685002
http,187.251.130.135,8080,Mexico,MX,Ciudad de Villa de Álvarez,transparent,false,11.6,AS22884,Total Play Telecomunicaciones SA De CV,5498.6,1780109036.0198085
http,201.159.111.121,8081,Mexico,MX,General Escobedo,transparent,false,14.31,AS28539,Administradora de Servicios de Internet Sandur S.A. de C.V.,8761.16,1780109021.963858
http,38.210.201.72,999,Mexico,MX,Aguascalientes,transparent,false,26.71,AS273250,Soluciones de Tecnologia Jah sa de Cv,1526.26,1780109013.6871107
http,201.139.115.206,8082,Mexico,MX,Puebla City,elite,false,9.17,AS32098,Transtelco Inc,6010.22,1780109011.671916
http,186.96.15.70,8080,Mexico,MX,Mexico City,transparent,false,7.33,AS22884,Total Play Telecomunicaciones SA De CV,3748.73,1780109007.3265872
http,189.196.18.150,999,Mexico,MX,Villa de Cos,transparent,false,6.65,AS13999,"Mega Cable, S.A. de C.V.",5890.66,1780108984.5730226
http,38.7.138.33,999,Mexico,MX,Uruapan,transparent,false,16.77,AS272387,Waves Links Servicios De Comunicaciones E Informatica SAS De CV,5094.88,1780108969.8078387
http,38.210.201.164,999,Mexico,MX,Aguascalientes,transparent,false,17.29,AS273250,Soluciones de Tecnologia Jah sa de Cv,3355.68,1780108939.915925
http,38.123.220.194,999,Mexico,MX,Santa Cruz,transparent,false,25.03,AS174,Cogent Communications,4491.0,1780108932.3251357
