protocol,ip,port,country,country_code,city,anonymity,ssl,uptime_percent,asn,isp,latency_ms,last_checked
http,38.7.21.118,999,Mexico,MX,Lázaro Cárdenas,transparent,false,25.25,AS28398,Internet Telefonia Y TV De Michoacan SA De CV,10495.48,1780229030.959225
http,187.190.114.40,999,Mexico,MX,Úrsulo Galván,transparent,false,40.73,AS22884,Total Play Telecomunicaciones SA De CV,10502.34,1780229020.5580566
http,154.16.41.18,5555,Mexico,MX,Campeche,elite,true,9.11,AS32159,Gung HO LLC,14700.39,1780229016.4501963
http,38.7.23.138,999,Mexico,MX,Huetamo de Núñez,transparent,false,28.39,AS28398,Internet Telefonia Y TV De Michoacan SA De CV,1995.16,1780229014.3451505
http,38.123.220.221,999,Mexico,MX,Loma Hermosa,transparent,false,26.9,AS174,Cogent Communications,1859.49,1780229012.2051241
http,38.35.247.253,999,Mexico,MX,La Viña,transparent,false,25.21,AS265509,Optoenlaces SA de CV,5532.05,1780229011.3986197
http,38.194.246.34,999,Mexico,MX,Los Ramírez,transparent,true,41.96,AS28458,IENTC S de RL de CV,509.3,1780229008.271399
http,38.194.245.231,3128,Mexico,MX,Tlacolula de Matamoros,transparent,false,3.23,AS28458,IENTC S de RL de CV,8691.7,1780228999.3703043
http,45.189.252.49,999,Mexico,MX,Alvarado,transparent,false,12.92,AS265613,Tracered SA De CV,559.1,1780228998.831608
http,154.27.196.242,999,Mexico,MX,Ciudad de Villa de Álvarez,transparent,true,43.5,AS270207,Cogent Communications,1496.99,1780228997.308205
http,131.196.245.120,999,Mexico,MX,La Cañada,transparent,true,21.47,AS265561,Lantointernet SA De CV,3475.22,1780228994.4599195
http,38.194.251.246,999,Mexico,MX,Mesas de Acosta,transparent,true,12.53,AS28458,IENTC S de RL de CV,5098.24,1780228993.343871
http,38.7.138.33,999,Mexico,MX,Uruapan,transparent,false,16.85,AS272387,Waves Links Servicios De Comunicaciones E Informatica SAS De CV,5196.64,1780228991.455199
http,201.159.97.25,8081,Mexico,MX,General Escobedo,transparent,false,9.17,AS28539,Administradora de Servicios de Internet Sandur S.A. de C.V.,10465.3,1780228964.9992385
http,45.174.175.242,999,Mexico,MX,Paraiso,transparent,false,29.26,AS28435,Javier Tamayo Garcia,5028.35,1780228945.872079
http,187.251.224.167,80,Mexico,MX,León,transparent,false,14.57,AS22884,Total Play Telecomunicaciones SA De CV,8524.83,1780228938.295907
http,38.32.4.58,999,Mexico,MX,Guadalajara,transparent,false,13.35,AS174,Cogent Communications,2934.11,1780228925.307999
http,38.7.16.194,999,Mexico,MX,Lázaro Cárdenas,transparent,false,16.97,AS28398,Internet Telefonia Y TV De Michoacan SA De CV,10654.02,1780228903.668745
http,38.210.201.56,999,Mexico,MX,Aguascalientes,transparent,false,29.41,AS273250,Soluciones de Tecnologia Jah sa de Cv,3031.22,1780228838.623845
http,201.150.6.201,8081,Mexico,MX,San Nicolás de los Garza,transparent,false,11.27,AS28539,Administradora de Servicios de Internet Sandur S.A. de C.V.,1545.03,1780229026.5247738
http,45.188.76.177,999,Mexico,MX,Villahermosa,transparent,false,24.76,AS265608,ONT NETWORKS SA de CV,8460.75,1780228998.976147
http,201.159.109.137,8081,Mexico,MX,General Escobedo,transparent,false,16.87,AS28539,Administradora de Servicios de Internet Sandur S.A. de C.V.,8299.3,1780228987.9973128
http,45.174.243.145,999,Mexico,MX,Champotón,transparent,false,30.06,AS265583,Sistemas Y Soluciones De Campeche SAS De CV,6132.8,1780228948.2519867
