protocol,ip,port,country,country_code,city,anonymity,ssl,uptime_percent,asn,isp,latency_ms,last_checked
http,102.68.135.147,8080,Libya,LY,Tripoli,transparent,true,11.3,AS21003,"LTT Autonomous System, Tripoli Libya",3453.08,1780152533.1362305
http,102.68.128.211,8080,Libya,LY,Tripoli,transparent,false,10.93,AS21003,"LTT Autonomous System, Tripoli Libya",6941.28,1780152514.5570817
http,102.68.131.31,8080,Libya,LY,Tripoli,transparent,false,11.18,AS21003,Rawafed,10631.13,1780152485.5558445
http,102.38.13.9,19000,Libya,LY,Tripoli,transparent,true,7.63,AS328539,Giga for Telecommunication and Technology Limited,8918.91,1780152451.9720542
http,102.38.7.110,1972,Libya,LY,Tripoli,transparent,false,15.15,AS328539,Giga for Telecommunication and Technology Limited,11921.45,1780152405.9703648
http,102.38.29.195,8080,Libya,LY,Tripoli,transparent,false,17.83,AS328539,GZA,5462.96,1780152398.4369204
http,165.16.59.65,8080,Libya,LY,Tripoli,transparent,true,9.67,AS37284,Aljeel Aljadeed For Technology,8418.34,1780152525.9015613
