protocol,ip,port,country,country_code,city,anonymity,ssl,uptime_percent,asn,isp,latency_ms,last_checked
http,102.68.128.212,8080,Libya,LY,Tripoli,transparent,false,19.04,AS21003,"LTT Autonomous System, Tripoli Libya",4703.72,1780172305.2135253
http,102.38.13.9,19000,Libya,LY,Tripoli,transparent,false,7.63,AS328539,Giga for Telecommunication and Technology Limited,7254.54,1780172235.849526
http,165.16.92.193,8080,Libya,LY,Tripoli,transparent,false,2.6,AS37284,Aljeel Aljadeed For Technology,8050.28,1780172201.8121943
http,165.16.27.43,1981,Libya,LY,Benghazi,transparent,false,8.6,AS37284,Aljeel Aljadeed For Technology,4693.76,1780172382.7078815
http,165.16.22.114,9999,Libya,LY,Benghazi,transparent,false,37.14,AS37284,Aljeel Aljadeed For Technology,9060.48,1780172369.4369948
