protocol,ip,port,country,country_code,city,anonymity,ssl,uptime_percent,asn,isp,latency_ms,last_checked
http,102.38.29.197,8080,Libya,LY,Tripoli,transparent,false,19.24,AS328539,GZA,4288.79,1780073676.90272
http,41.254.48.54,19333,Libya,LY,Tripoli,transparent,false,9.47,AS21003,LTT Network Backbone and POPs,3219.43,1780073646.2279096
http,62.68.48.22,8080,Libya,LY,Tripoli,transparent,false,13.36,AS21003,LTT Network Backbone and POPs,2352.33,1780073610.0818076
http,102.68.128.216,8080,Libya,LY,Tripoli,transparent,false,13.98,AS21003,"LTT Autonomous System, Tripoli Libya",14846.86,1780073556.4560165
http,165.16.22.114,9999,Libya,LY,Benghazi,transparent,false,41.01,AS37284,Aljeel Aljadeed For Technology,1019.15,1780073676.7901962
http,165.16.27.43,1981,Libya,LY,Benghazi,transparent,false,8.59,AS37284,Aljeel Aljadeed For Technology,4975.45,1780073510.258613
