protocol,ip,port,country,country_code,city,anonymity,ssl,uptime_percent,asn,isp,latency_ms,last_checked
http,41.254.48.54,19333,Libya,LY,Tripoli,transparent,false,9.48,AS21003,LTT Network Backbone and POPs,13067.09,1780123154.059036
http,102.68.135.157,8080,Libya,LY,Tripoli,anonymous,false,8.14,AS21003,"LTT Autonomous System, Tripoli Libya",7643.65,1780123145.39302
http,102.38.13.9,19000,Libya,LY,Tripoli,transparent,false,7.62,AS328539,Giga for Telecommunication and Technology Limited,7714.76,1780123138.8464308
http,154.73.28.79,8080,Libya,LY,Tripoli,transparent,false,21.32,AS21003,Rawafed,7541.66,1780123123.5256267
http,102.68.128.210,8080,Libya,LY,Tripoli,transparent,false,8.31,AS21003,"LTT Autonomous System, Tripoli Libya",4864.68,1780123113.6088052
http,154.73.28.89,8080,Libya,LY,Tripoli,transparent,false,11.8,AS21003,"LTT Autonomous System, Tripoli Libya",6138.01,1780123073.4174669
