protocol,ip,port,country,country_code,city,anonymity,ssl,uptime_percent,asn,isp,latency_ms,last_checked
http,102.38.13.9,19000,Libya,LY,Tripoli,transparent,false,7.61,AS328539,Giga for Telecommunication and Technology Limited,8940.77,1780059502.8755918
http,154.73.29.205,8080,Libya,LY,Tripoli,transparent,false,9.63,AS21003,Rawafed,710.37,1780059478.3171315
http,102.68.129.54,8080,Libya,LY,Tripoli,transparent,false,11.51,AS21003,"LTT Autonomous System, Tripoli Libya",1733.08,1780059476.3651202
http,165.16.27.43,1976,Libya,LY,Benghazi,transparent,false,17.17,AS37284,Aljeel Aljadeed For Technology,9149.05,1780059544.4199665
http,165.16.2.254,9999,Libya,LY,Benghazi,transparent,false,9.05,AS37284,Aljeel Aljadeed For Technology,5498.6,1780059456.9238572
http,165.16.46.193,8080,Libya,LY,Tripoli,transparent,false,2.81,AS37284,Aljeel Aljadeed For Technology,10536.42,1780059449.7273476
