protocol,ip,port,country,country_code,city,anonymity,ssl,uptime_percent,asn,isp,latency_ms,last_checked
http,42.96.19.211,1314,Vietnam,VN,Hanoi,elite,true,29.26,AS131423,HOALAC-VNNIC,680.38,1780091036.4099402
http,203.205.49.2,10019,Vietnam,VN,Mai Dich,elite,true,15.91,AS45903,CMC Telecom Infrastructure Company,11606.27,1780090997.749324
http,113.160.130.82,443,Vietnam,VN,Bắc Ninh,transparent,false,10.94,AS45899,VietNam Post and Telecom Corporation,5658.07,1780090993.2208395
http,14.241.133.207,8080,Vietnam,VN,Tra Que Vegetable Village,transparent,false,10.61,AS45899,VNPT,4232.64,1780090978.4770274
http,113.160.132.26,8080,Vietnam,VN,Bắc Ninh,elite,true,99.11,AS45899,VietNam Post and Telecom Corporation,581.42,1780090973.2063496
http,123.58.199.232,8168,Vietnam,VN,Ho Chi Minh City,elite,false,20.12,AS135377,UCLOUD INFORMATION TECHNOLOGY (HK) LIMITED,2736.64,1780090970.007961
http,203.205.49.2,10142,Vietnam,VN,Mai Dich,elite,false,10.31,AS45903,CMC Telecom Infrastructure Company,1881.16,1780090929.2926254
