protocol,ip,port,country,country_code,city,anonymity,ssl,uptime_percent,asn,isp,latency_ms,last_checked
http,102.68.128.218,8080,Libya,LY,Tripoli,transparent,false,6.84,AS21003,"LTT Autonomous System, Tripoli Libya",6211.54,1780229641.8066714
http,102.209.0.138,8080,Libya,LY,Benghazi,transparent,false,57.59,AS329435,Aljuman Aljadeed Limited Liability company,8622.98,1780229636.274445
http,165.16.58.131,8080,Libya,LY,Tripoli,transparent,false,21.47,AS37284,Aljeel Aljadeed For Technology,5479.39,1780229618.7000415
http,102.38.7.110,1972,Libya,LY,Tripoli,transparent,false,15.29,AS328539,Giga for Telecommunication and Technology Limited,3005.12,1780229530.4470623
http,165.16.27.43,1981,Libya,LY,Benghazi,transparent,false,8.61,AS37284,Aljeel Aljadeed For Technology,8170.35,1780229563.623665
