protocol,ip,port,country,country_code,city,anonymity,ssl,uptime_percent,asn,isp,latency_ms,last_checked
http,165.16.92.193,8103,Libya,LY,Tripoli,transparent,false,7.21,AS37284,Aljeel Aljadeed For Technology,5008.3,1779961108.249233
http,165.16.59.65,8080,Libya,LY,Tripoli,transparent,false,9.61,AS37284,Aljeel Aljadeed For Technology,9401.95,1779961071.9119549
http,102.38.7.110,1972,Libya,LY,Tripoli,transparent,false,14.97,AS328539,Giga for Telecommunication and Technology Limited,1973.02,1779961070.4767914
http,62.68.48.22,8080,Libya,LY,Tripoli,transparent,false,13.19,AS21003,LTT Network Backbone and POPs,1578.66,1779961064.382617
http,102.38.30.24,8080,Libya,LY,Tripoli,transparent,false,43.83,AS328539,GZA,2005.48,1779961062.9882648
