protocol,ip,port,country,country_code,city,anonymity,ssl,uptime_percent,asn,isp,latency_ms,last_checked
http,102.38.13.9,19000,Libya,LY,Tripoli,transparent,false,7.61,AS328539,Giga for Telecommunication and Technology Limited,7233.9,1779989978.618984
http,165.16.92.193,8102,Libya,LY,Tripoli,transparent,false,3.59,AS37284,Aljeel Aljadeed For Technology,9453.57,1779989977.7453287
http,102.68.135.157,8080,Libya,LY,Tripoli,anonymous,false,8.12,AS21003,"LTT Autonomous System, Tripoli Libya",7828.02,1779989947.6262927
http,102.68.128.212,8080,Libya,LY,Tripoli,transparent,false,18.91,AS21003,"LTT Autonomous System, Tripoli Libya",7852.99,1779989904.2576427
http,165.16.27.43,1981,Libya,LY,Benghazi,transparent,false,8.58,AS37284,Aljeel Aljadeed For Technology,6791.14,1779989876.535306
