protocol,ip,port,country,country_code,city,anonymity,ssl,uptime_percent,asn,isp,latency_ms,last_checked
http,165.16.27.43,1976,Libya,LY,Benghazi,transparent,false,17.15,AS37284,Aljeel Aljadeed For Technology,14820.54,1780036168.324247
http,102.38.13.9,18000,Libya,LY,Tripoli,transparent,true,4.44,AS328539,Giga for Telecommunication and Technology Limited,15038.68,1780036111.603337
http,154.73.28.205,8080,Libya,LY,Tripoli,transparent,false,9.93,AS21003,"LTT Autonomous System, Tripoli Libya",2078.79,1780036076.6122084
http,154.73.29.217,8080,Libya,LY,Tripoli,transparent,false,17.78,AS21003,Rawafed,10525.85,1780036059.9758718
http,102.38.13.9,19000,Libya,LY,Tripoli,transparent,false,7.61,AS328539,Giga for Telecommunication and Technology Limited,3320.81,1780036021.358551
http,165.16.92.193,8102,Libya,LY,Tripoli,transparent,false,3.67,AS37284,Aljeel Aljadeed For Technology,13034.74,1780036046.0397713
