protocol,ip,port,country,country_code,city,anonymity,ssl,uptime_percent,asn,isp,latency_ms,last_checked
http,62.68.48.22,8080,Libya,LY,Tripoli,transparent,false,13.38,AS21003,LTT Network Backbone and POPs,2389.8,1780120470.3838573
http,102.38.7.110,1972,Libya,LY,Tripoli,transparent,false,15.11,AS328539,Giga for Telecommunication and Technology Limited,1363.64,1780120467.8772154
http,165.16.2.234,9999,Libya,LY,Benghazi,transparent,true,7.64,AS37284,Aljeel Aljadeed For Technology,4020.83,1780120387.2627654
http,165.16.27.43,1981,Libya,LY,Benghazi,transparent,false,8.6,AS37284,Aljeel Aljadeed For Technology,6426.7,1780120382.699887
http,102.68.128.210,8080,Libya,LY,Tripoli,transparent,false,8.31,AS21003,"LTT Autonomous System, Tripoli Libya",1697.91,1780120367.2586224
http,102.68.128.217,8080,Libya,LY,Tripoli,transparent,false,6.08,AS21003,"LTT Autonomous System, Tripoli Libya",7486.37,1780120357.311973
