protocol,ip,port,country,country_code,city,anonymity,ssl,uptime_percent,asn,isp,latency_ms,last_checked
http,154.73.28.79,8080,Libya,LY,Tripoli,transparent,false,22.4,AS21003,Rawafed,6162.53,1780174130.563995
http,165.16.27.43,1981,Libya,LY,Benghazi,transparent,false,8.6,AS37284,Aljeel Aljadeed For Technology,5949.48,1780174121.9079163
http,102.38.13.9,19000,Libya,LY,Tripoli,transparent,false,7.63,AS328539,Giga for Telecommunication and Technology Limited,7031.08,1780174115.4578261
http,154.73.28.89,8080,Libya,LY,Tripoli,transparent,false,12.69,AS21003,"LTT Autonomous System, Tripoli Libya",9398.71,1780174089.8055909
http,102.38.13.8,18000,Libya,LY,Tripoli,transparent,false,2.56,AS328539,Giga for Telecommunication and Technology Limited,8006.76,1780173996.773908
