protocol,ip,port,country,country_code,city,anonymity,ssl,uptime_percent,asn,isp,latency_ms,last_checked
http,102.68.128.212,8080,Libya,LY,Tripoli,transparent,true,18.93,AS21003,"LTT Autonomous System, Tripoli Libya",2223.19,1780019337.8840435
http,102.38.13.9,19000,Libya,LY,Tripoli,transparent,false,7.61,AS328539,Giga for Telecommunication and Technology Limited,5556.7,1780019265.4085658
http,102.68.128.211,8080,Libya,LY,Tripoli,transparent,false,10.79,AS21003,"LTT Autonomous System, Tripoli Libya",6160.96,1780019253.236465
http,165.16.46.1,8080,Libya,LY,Tripoli,transparent,false,2.7,AS37284,Aljeel Aljadeed Technology,6929.74,1780019357.3398197
http,165.16.27.43,1976,Libya,LY,Benghazi,transparent,false,17.15,AS37284,Aljeel Aljadeed For Technology,2456.03,1780019346.2671869
http,165.16.92.193,8104,Libya,LY,Tripoli,transparent,false,7.96,AS37284,Aljeel Aljadeed For Technology,2375.74,1780019340.978786
