protocol,ip,port,country,country_code,city,anonymity,ssl,uptime_percent,asn,isp,latency_ms,last_checked
http,103.115.196.98,8080,Pakistan,PK,Lahore,transparent,false,17.99,AS152605,AMBITIONS COMMUNICATION SYSTEM (SMC-PRIVATE) LIMITED,3460.52,1780191581.1351645
http,103.198.154.196,8080,Pakistan,PK,Lahore,transparent,true,22.36,AS151330,PLAY BROADBAND (PRIVATE) LIMITED,3004.43,1780191539.5290065
http,202.165.232.238,8080,Pakistan,PK,Lahore,transparent,false,24.54,AS136384,Optix Pakistan (Pvt.) Limited,4629.9,1780191526.5050547
http,43.251.253.40,8080,Pakistan,PK,Lahore,transparent,false,36.66,AS136384,Optix Pakistan (Pvt.) Limited,12405.37,1780191516.3499868
http,103.253.18.6,8080,Pakistan,PK,Faisalabad,transparent,false,8.57,AS151983,Orbit Internet Service Provider Pvt Ltd,1868.75,1780191499.8189068
http,58.27.206.37,8080,Pakistan,PK,Lahore,transparent,false,28.41,AS38264,Wateen Telecom (Pvt.) Ltd.,10020.11,1780191443.5955229
