protocol,ip,port,country,country_code,city,anonymity,ssl,uptime_percent,asn,isp,latency_ms,last_checked
socks4,182.93.75.162,1080,Nepal,NP,Mahottari,elite,true,50.53,AS4007,Subisu Cablenet,3935.58,1780145669.2564578
socks4,118.91.175.146,5678,Nepal,NP,Kathmandu,elite,true,42.39,AS24550,Websurfer Nepal Communication System Pvt. Ltd,3987.91,1780145665.24975
http,103.1.93.184,55443,Nepal,NP,Kathmandu,elite,false,6.35,AS55915,Classic Tech Pvt. Ltd,1644.4,1780145648.441304
http,103.114.25.8,8088,Nepal,NP,Narayan,transparent,false,7.29,AS137580,Everest Wireless Network pvt. ltd,5974.95,1780145633.0972617
http,103.114.25.6,8088,Nepal,NP,Narayan,transparent,false,6.49,AS137580,Everest Wireless Network pvt. ltd,12252.28,1780145605.5370023
