protocol,ip,port,country,country_code,city,anonymity,ssl,uptime_percent,asn,isp,latency_ms,last_checked
socks4,83.56.15.57,5678,Spain,ES,San Fernando de Henares,elite,true,20.57,AS3352,Telefonica de Espana SAU,3277.57,1780034369.529034
http,79.117.134.12,3128,Spain,ES,Madrid,transparent,true,47.26,AS57269,Digi Spain Telecom S.L.U.,162.21,1780034358.280953
socks4,109.167.83.167,5678,Spain,ES,Huéneja,elite,true,41.01,AS29119,Aire Networks Del Mediterraneo SL Unipersonal,7465.08,1780034350.288888
http,45.13.185.217,3128,Spain,ES,Madrid,transparent,true,26.13,AS201446,Soluciones web on line s.l.,15004.63,1780034285.8223946
socks5,168.245.197.146,80,Spain,ES,Ocaña,elite,true,1.58,AS56882,Aire Networks Del Mediterraneo SL Unipersonal,316.41,1780034129.1631243
socks5,65.20.105.241,10001,Spain,ES,Madrid,elite,true,25.33,AS20473,"The Constant Company, LLC",678.06,1780033980.1278229
