protocol,ip,port,country,country_code,city,anonymity,ssl,uptime_percent,asn,isp,latency_ms,last_checked
socks4,83.56.15.57,5678,Spain,ES,San Fernando de Henares,elite,true,20.46,AS3352,Telefonica de Espana SAU,194.54,1780013344.7494543
http,185.44.232.30,53281,Spain,ES,Fuengirola,elite,false,4.18,AS200845,"AVATEL TELECOM, SA",10494.49,1780013309.3644023
http,88.1.150.79,3128,Spain,ES,Alovera,elite,true,23.55,AS3352,Telefonica de Espana SAU,559.87,1780013251.4243052
http,2.139.38.192,3128,Spain,ES,Madrid,transparent,false,36.56,AS3352,RIMA (Red IP Multi Acceso),4263.57,1780013250.8118443
socks5,168.245.197.146,80,Spain,ES,Ocaña,elite,true,1.56,AS56882,Aire Networks Del Mediterraneo SL Unipersonal,1598.26,1780013243.5751917
