protocol,ip,port,country,country_code,city,anonymity,ssl,uptime_percent,asn,isp,latency_ms,last_checked
socks4,109.167.83.167,5678,Spain,ES,Huéneja,elite,true,41.21,AS29119,Aire Networks Del Mediterraneo SL Unipersonal,295.47,1780051195.4560583
socks4,83.56.15.57,5678,Spain,ES,San Fernando de Henares,elite,true,20.68,AS3352,Telefonica de Espana SAU,7265.09,1780051186.9814699
http,79.117.134.12,3128,Spain,ES,Madrid,transparent,true,49.64,AS57269,Digi Spain Telecom S.L.U.,182.59,1780051174.7510846
http,193.38.224.169,8081,Spain,ES,Madrid,transparent,true,7.3,AS206276,Citelia s.a.,2095.18,1780051171.560144
socks5,85.117.248.36,1080,Spain,ES,Olot,elite,true,38.67,AS210086,Connecta 1876 SLU,333.83,1780050888.451663
socks4,65.20.105.241,10001,Spain,ES,Madrid,elite,true,39.15,AS20473,"The Constant Company, LLC",1164.35,1780051194.3086128
socks5,168.245.197.146,80,Spain,ES,Ocaña,elite,true,1.59,AS56882,Aire Networks Del Mediterraneo SL Unipersonal,857.82,1780051191.3660429
http,2.139.232.101,3128,Spain,ES,Magaluf,transparent,true,10.2,AS3352,RIMA (Red IP Multi Acceso),1255.54,1780051122.5506074
socks5,65.20.105.241,10001,Spain,ES,Madrid,elite,true,25.4,AS20473,"The Constant Company, LLC",2235.01,1780051116.6946764
