protocol,ip,port,country,country_code,city,anonymity,ssl,uptime_percent,asn,isp,latency_ms,last_checked
socks4,83.56.15.57,5678,Spain,ES,San Fernando de Henares,elite,true,20.45,AS3352,Telefonica de Espana SAU,1208.53,1780012166.7848241
socks4,109.167.83.167,5678,Spain,ES,Huéneja,elite,true,40.86,AS29119,Aire Networks Del Mediterraneo SL Unipersonal,332.72,1780012162.357192
http,83.97.79.114,8443,Spain,ES,Madrid,elite,false,22.92,AS62005,BlueVPS OU,5148.46,1780012140.9031198
http,90.174.128.42,3128,Spain,ES,Madrid,transparent,false,9.98,AS12479,Uni2,4923.91,1780012108.843327
socks5,168.245.197.146,80,Spain,ES,Ocaña,elite,true,1.56,AS56882,Aire Networks Del Mediterraneo SL Unipersonal,3308.45,1780012080.482749
