protocol,ip,port,country,country_code,city,anonymity,ssl,uptime_percent,asn,isp,latency_ms,last_checked
socks4,83.56.15.57,5678,Spain,ES,San Fernando de Henares,elite,true,20.82,AS3352,Telefonica de Espana SAU,1478.98,1780070692.1822891
socks4,109.167.83.167,5678,Spain,ES,Huéneja,elite,true,41.47,AS29119,Aire Networks Del Mediterraneo SL Unipersonal,1594.76,1780070690.5348327
socks5,83.97.79.114,8443,Spain,ES,Madrid,elite,true,26.73,AS62005,BlueVPS OU,3304.24,1780070681.8480937
socks4,65.20.105.241,10001,Spain,ES,Madrid,elite,true,39.47,AS20473,"The Constant Company, LLC",7420.77,1780070675.7856874
http,195.114.209.50,80,Spain,ES,Alcobendas,elite,false,66.18,AS57286,Gigas Hosting SL,5931.54,1780070620.7849333
socks5,168.245.197.146,80,Spain,ES,Ocaña,elite,true,1.61,AS56882,Aire Networks Del Mediterraneo SL Unipersonal,3756.69,1780070271.3559704
