protocol,ip,port,country,country_code,city,anonymity,ssl,uptime_percent,asn,isp,latency_ms,last_checked
http,185.140.232.27,1400,Iran,IR,Shiraz,transparent,false,5.44,AS43395,Pooya Parto Qeshm Cooperative Company,6793.62,1780171471.9357843
http,81.12.70.99,8080,Iran,IR,Tajrīsh,transparent,false,20.43,AS42337,Respina Networks & Beyond PJSC,12545.29,1780171460.6737494
http,109.230.89.126,3128,Iran,IR,Tehran,transparent,false,12.58,AS206065,Tose'h Fanavari Ertebabat Pasargad Arian Co. PJS,7151.91,1780171414.252104
http,80.210.229.98,8080,Iran,IR,Tehran,transparent,true,94.34,AS58224,Telecommunication Company of Tehran,9577.41,1780171400.2358773
http,46.209.30.11,8080,Iran,IR,Tehran,transparent,false,21.71,AS42337,Respina Networks & Beyond PJSC,7986.38,1780171393.4959779
http,2.188.229.150,7020,Iran,IR,Tabriz,transparent,false,6.31,AS212161,Ofogh Koroush Chain Store Public Joint Stock,12384.86,1780171387.271912
http,46.34.165.86,443,Iran,IR,Tehran,transparent,false,26.38,AS206065,Tose'h Fanavari Ertebabat Pasargad Arian Co. PJS,18887.37,1780171296.3239043
