protocol,ip,port,country,country_code,city,anonymity,ssl,uptime_percent,asn,isp,latency_ms,last_checked
socks5,103.121.120.242,1080,Pakistan,PK,Karachi,elite,true,93.69,AS131275,Logon Broadband Pvt. Limited,2004.49,1779974963.146095
socks5,175.107.244.164,1080,Pakistan,PK,Karachi,elite,true,53.73,AS9541,Cyber Internet Services Pakistan,1765.94,1779974961.8674862
socks5,182.184.119.180,1080,Pakistan,PK,Karachi,elite,true,56.18,AS17557,Pakistan Telecommuication company limited,3909.72,1779974937.3611166
socks5,154.57.213.237,1080,Pakistan,PK,Islamabad,elite,true,60.98,AS135407,Trans World Enterprise Services (Private) Limited,4030.35,1779974926.7310095
socks5,103.150.206.77,1080,Pakistan,PK,Faisalabad,elite,true,53.26,AS140594,Nadeem Abbas and Shayufta Rani,862.33,1779974851.307131
