protocol,ip,port,country,country_code,city,anonymity,ssl,uptime_percent,asn,isp,latency_ms,last_checked
socks5,103.150.206.77,1080,Pakistan,PK,Faisalabad,elite,true,56.92,AS140594,Nadeem Abbas and Shayufta Rani,2063.9,1780213794.7288315
socks5,154.57.213.237,1080,Pakistan,PK,Islamabad,elite,true,70.06,AS135407,Trans World Enterprise Services (Private) Limited,1508.81,1780213774.445201
socks5,182.184.119.180,1080,Pakistan,PK,Karachi,elite,true,59.96,AS17557,Pakistan Telecommuication company limited,2998.43,1780213764.333991
socks5,103.121.120.242,1080,Pakistan,PK,Karachi,elite,true,90.16,AS131275,Logon Broadband Pvt. Limited,1550.6,1780213728.4248192
socks5,103.236.134.210,1080,Pakistan,PK,Karachi,elite,true,91.58,AS38193,TRANSWORLD ASSOCIATES (PVT) LIMITED,882.63,1780213704.2814724
