protocol,ip,port,country,country_code,city,anonymity,ssl,uptime_percent,asn,isp,latency_ms,last_checked
socks5,103.121.120.242,1080,Pakistan,PK,Karachi,elite,true,89.93,AS131275,Logon Broadband Pvt. Limited,1620.49,1780197569.7227936
socks5,182.184.119.180,1080,Pakistan,PK,Karachi,elite,true,59.41,AS17557,Pakistan Telecommuication company limited,1346.1,1780197566.7228084
socks5,175.107.244.164,1080,Pakistan,PK,Karachi,elite,true,56.02,AS9541,Cyber Internet Services Pakistan,15130.23,1780197533.7283442
socks5,154.57.213.237,1080,Pakistan,PK,Islamabad,elite,true,69.33,AS135407,Trans World Enterprise Services (Private) Limited,2141.91,1780197492.36622
socks5,103.236.134.210,1080,Pakistan,PK,Karachi,elite,true,91.44,AS38193,TRANSWORLD ASSOCIATES (PVT) LIMITED,880.1,1780197525.951574
