protocol,ip,port,country,country_code,city,anonymity,ssl,uptime_percent,asn,isp,latency_ms,last_checked
socks5,103.121.120.242,1080,Pakistan,PK,Karachi,elite,true,89.61,AS131275,Logon Broadband Pvt. Limited,1184.48,1780192187.5056386
socks5,154.57.213.237,1080,Pakistan,PK,Islamabad,elite,true,69.07,AS135407,Trans World Enterprise Services (Private) Limited,4584.68,1780192174.4165156
socks5,175.107.244.164,1080,Pakistan,PK,Karachi,elite,true,55.87,AS9541,Cyber Internet Services Pakistan,4494.21,1780192161.6021082
socks5,103.150.206.77,1080,Pakistan,PK,Faisalabad,elite,true,56.42,AS140594,Nadeem Abbas and Shayufta Rani,2819.35,1780192146.6253343
socks5,103.236.134.210,1080,Pakistan,PK,Karachi,elite,true,91.21,AS38193,TRANSWORLD ASSOCIATES (PVT) LIMITED,2111.59,1780192135.2489002
socks5,182.184.119.180,1080,Pakistan,PK,Karachi,elite,true,59.18,AS17557,Pakistan Telecommuication company limited,3171.61,1780192130.1063426
