protocol,ip,port,country,country_code,city,anonymity,ssl,uptime_percent,asn,isp,latency_ms,last_checked
socks5,103.150.206.77,1080,Pakistan,PK,Faisalabad,elite,true,56.38,AS140594,Nadeem Abbas and Shayufta Rani,3655.4,1780190941.9225755
socks5,103.121.120.242,1080,Pakistan,PK,Karachi,elite,true,89.54,AS131275,Logon Broadband Pvt. Limited,828.48,1780190936.8128219
socks5,175.107.244.164,1080,Pakistan,PK,Karachi,elite,true,55.8,AS9541,Cyber Internet Services Pakistan,3433.15,1780190918.7153997
socks5,154.57.213.237,1080,Pakistan,PK,Islamabad,elite,true,69.03,AS135407,Trans World Enterprise Services (Private) Limited,4781.64,1780190864.9912038
socks5,103.236.134.210,1080,Pakistan,PK,Karachi,elite,true,91.14,AS38193,TRANSWORLD ASSOCIATES (PVT) LIMITED,833.67,1780190985.7856855
