protocol,ip,port,country,country_code,city,anonymity,ssl,uptime_percent,asn,isp,latency_ms,last_checked
socks5,103.150.206.77,1080,Pakistan,PK,Faisalabad,elite,true,56.85,AS140594,Nadeem Abbas and Shayufta Rani,905.93,1780211366.1048105
socks5,182.184.119.180,1080,Pakistan,PK,Karachi,elite,true,59.87,AS17557,Pakistan Telecommuication company limited,4385.33,1780211346.1544054
socks5,154.57.213.237,1080,Pakistan,PK,Islamabad,elite,true,69.91,AS135407,Trans World Enterprise Services (Private) Limited,3912.16,1780211300.7804513
socks5,103.121.120.242,1080,Pakistan,PK,Karachi,elite,true,90.02,AS131275,Logon Broadband Pvt. Limited,2023.98,1780211248.673101
socks5,103.236.134.210,1080,Pakistan,PK,Karachi,elite,true,91.49,AS38193,TRANSWORLD ASSOCIATES (PVT) LIMITED,2058.58,1780211353.0349016
