protocol,ip,port,country,country_code,city,anonymity,ssl,uptime_percent,asn,isp,latency_ms,last_checked
socks5,103.150.206.77,1080,Pakistan,PK,Faisalabad,elite,true,56.74,AS140594,Nadeem Abbas and Shayufta Rani,4611.11,1780207147.3128908
socks5,154.57.213.237,1080,Pakistan,PK,Islamabad,elite,true,69.69,AS135407,Trans World Enterprise Services (Private) Limited,8692.79,1780207124.8164809
socks5,175.107.244.164,1080,Pakistan,PK,Karachi,elite,true,56.29,AS9541,Cyber Internet Services Pakistan,3901.94,1780207114.2539146
socks5,103.121.120.242,1080,Pakistan,PK,Karachi,elite,true,89.81,AS131275,Logon Broadband Pvt. Limited,1058.93,1780207098.889661
socks5,182.184.119.180,1080,Pakistan,PK,Karachi,elite,true,59.72,AS17557,Pakistan Telecommuication company limited,5748.85,1780206991.4634771
socks5,103.236.134.210,1080,Pakistan,PK,Karachi,elite,true,91.3,AS38193,TRANSWORLD ASSOCIATES (PVT) LIMITED,797.49,1780207161.6850212
