protocol,ip,port,country,country_code,city,anonymity,ssl,uptime_percent,asn,isp,latency_ms,last_checked
socks5,103.150.206.77,1080,Pakistan,PK,Faisalabad,elite,true,56.3,AS140594,Nadeem Abbas and Shayufta Rani,4088.58,1780187983.6277945
socks5,175.107.244.164,1080,Pakistan,PK,Karachi,elite,true,55.7,AS9541,Cyber Internet Services Pakistan,8046.47,1780187942.5764325
socks5,103.121.120.242,1080,Pakistan,PK,Karachi,elite,true,89.45,AS131275,Logon Broadband Pvt. Limited,1605.39,1780187937.3672912
socks5,182.184.119.180,1080,Pakistan,PK,Karachi,elite,true,59.05,AS17557,Pakistan Telecommuication company limited,2803.53,1780187895.837477
socks5,154.57.213.237,1080,Pakistan,PK,Islamabad,elite,true,68.87,AS135407,Trans World Enterprise Services (Private) Limited,2798.33,1780187888.0626097
socks5,103.236.134.210,1080,Pakistan,PK,Karachi,elite,true,91.06,AS38193,TRANSWORLD ASSOCIATES (PVT) LIMITED,1244.78,1780187975.923422
