protocol,ip,port,country,country_code,city,anonymity,ssl,uptime_percent,asn,isp,latency_ms,last_checked
socks5,103.121.120.242,1080,Pakistan,PK,Karachi,elite,true,91.26,AS131275,Logon Broadband Pvt. Limited,5198.3,1780124358.8922672
socks5,154.57.213.237,1080,Pakistan,PK,Islamabad,elite,true,62.37,AS135407,Trans World Enterprise Services (Private) Limited,1112.76,1780124292.524413
socks5,103.236.134.210,1080,Pakistan,PK,Karachi,elite,true,89.94,AS38193,TRANSWORLD ASSOCIATES (PVT) LIMITED,894.39,1780124270.361312
socks5,103.150.206.77,1080,Pakistan,PK,Faisalabad,elite,true,53.98,AS140594,Nadeem Abbas and Shayufta Rani,934.63,1780124256.6608071
socks5,182.184.119.180,1080,Pakistan,PK,Karachi,elite,true,56.64,AS17557,Pakistan Telecommuication company limited,2070.66,1780124123.895035
