protocol,ip,port,country,country_code,city,anonymity,ssl,uptime_percent,asn,isp,latency_ms,last_checked
socks5,175.107.244.164,1080,Pakistan,PK,Karachi,elite,true,54.95,AS9541,Cyber Internet Services Pakistan,10006.2,1780170887.0181196
socks5,103.150.206.77,1080,Pakistan,PK,Faisalabad,elite,true,55.84,AS140594,Nadeem Abbas and Shayufta Rani,8107.3,1780170878.2076232
socks5,154.57.213.237,1080,Pakistan,PK,Islamabad,elite,true,67.62,AS135407,Trans World Enterprise Services (Private) Limited,1895.41,1780170864.975317
socks5,103.121.120.242,1080,Pakistan,PK,Karachi,elite,true,88.88,AS131275,Logon Broadband Pvt. Limited,1696.41,1780170859.8168044
socks5,182.184.119.180,1080,Pakistan,PK,Karachi,elite,true,58.3,AS17557,Pakistan Telecommuication company limited,8040.41,1780170859.1165123
socks5,103.236.134.210,1080,Pakistan,PK,Karachi,elite,true,90.27,AS38193,TRANSWORLD ASSOCIATES (PVT) LIMITED,809.6,1780170882.8456528
