protocol,ip,port,country,country_code,city,anonymity,ssl,uptime_percent,asn,isp,latency_ms,last_checked
socks5,154.57.213.237,1080,Pakistan,PK,Islamabad,elite,true,61.56,AS135407,Trans World Enterprise Services (Private) Limited,8625.42,1780045186.171584
socks5,175.107.244.164,1080,Pakistan,PK,Karachi,elite,true,53.43,AS9541,Cyber Internet Services Pakistan,791.17,1780045146.0496356
socks5,103.121.120.242,1080,Pakistan,PK,Karachi,elite,true,93.41,AS131275,Logon Broadband Pvt. Limited,761.31,1780045128.7141058
socks5,103.150.206.77,1080,Pakistan,PK,Faisalabad,elite,true,53.53,AS140594,Nadeem Abbas and Shayufta Rani,986.21,1780045084.9979904
socks5,182.184.119.180,1080,Pakistan,PK,Karachi,elite,true,56.32,AS17557,Pakistan Telecommuication company limited,1371.82,1780045000.1369708
