protocol,ip,port,country,country_code,city,anonymity,ssl,uptime_percent,asn,isp,latency_ms,last_checked
socks5,154.57.213.237,1080,Pakistan,PK,Islamabad,elite,true,62.13,AS135407,Trans World Enterprise Services (Private) Limited,1758.79,1780107524.0850365
socks5,182.184.119.180,1080,Pakistan,PK,Karachi,elite,true,56.54,AS17557,Pakistan Telecommuication company limited,8128.12,1780107487.4248514
socks5,103.236.134.210,1080,Pakistan,PK,Karachi,elite,true,85.71,AS38193,TRANSWORLD ASSOCIATES (PVT) LIMITED,2554.29,1780107423.8756752
socks5,175.107.244.164,1080,Pakistan,PK,Karachi,elite,true,53.62,AS9541,Cyber Internet Services Pakistan,2568.76,1780107413.355919
socks5,103.121.120.242,1080,Pakistan,PK,Karachi,elite,true,91.72,AS131275,Logon Broadband Pvt. Limited,7845.55,1780107112.5673716
