protocol,ip,port,country,country_code,city,anonymity,ssl,uptime_percent,asn,isp,latency_ms,last_checked
socks5,103.236.134.210,1080,Pakistan,PK,Karachi,elite,true,91.7,AS38193,TRANSWORLD ASSOCIATES (PVT) LIMITED,2129.43,1780216120.5854273
socks5,103.121.120.242,1080,Pakistan,PK,Karachi,elite,true,90.23,AS131275,Logon Broadband Pvt. Limited,2408.76,1780216111.5541472
socks5,182.184.119.180,1080,Pakistan,PK,Karachi,elite,true,60.06,AS17557,Pakistan Telecommuication company limited,6831.87,1780216082.4932432
socks5,154.57.213.237,1080,Pakistan,PK,Islamabad,elite,true,70.17,AS135407,Trans World Enterprise Services (Private) Limited,2857.67,1780216081.4600778
socks5,103.150.206.77,1080,Pakistan,PK,Faisalabad,elite,true,56.94,AS140594,Nadeem Abbas and Shayufta Rani,1200.89,1780216039.9678733
socks5,175.107.244.164,1080,Pakistan,PK,Karachi,elite,true,56.53,AS9541,Cyber Internet Services Pakistan,2798.1,1780216023.1713448
