protocol,ip,port,country,country_code,city,anonymity,ssl,uptime_percent,asn,isp,latency_ms,last_checked
socks5,103.236.134.210,1080,Pakistan,PK,Karachi,elite,true,92.09,AS38193,TRANSWORLD ASSOCIATES (PVT) LIMITED,4052.55,1780233270.1597247
socks5,103.121.120.242,1080,Pakistan,PK,Karachi,elite,true,90.39,AS131275,Logon Broadband Pvt. Limited,878.77,1780233249.900096
socks5,175.107.244.164,1080,Pakistan,PK,Karachi,elite,true,56.87,AS9541,Cyber Internet Services Pakistan,695.51,1780233235.7970498
socks5,182.184.119.180,1080,Pakistan,PK,Karachi,elite,true,60.57,AS17557,Pakistan Telecommuication company limited,1958.14,1780233221.7666788
socks5,154.57.213.237,1080,Pakistan,PK,Islamabad,elite,true,70.76,AS135407,Trans World Enterprise Services (Private) Limited,1968.86,1780233189.8949516
socks5,103.150.206.77,1080,Pakistan,PK,Faisalabad,elite,true,57.26,AS140594,Nadeem Abbas and Shayufta Rani,8299.01,1780233166.7902696
