protocol,ip,port,country,country_code,city,anonymity,ssl,uptime_percent,asn,isp,latency_ms,last_checked
socks5,103.150.206.77,1080,Pakistan,PK,Faisalabad,elite,true,53.37,AS140594,Nadeem Abbas and Shayufta Rani,3892.39,1780011502.4223049
socks5,182.184.119.180,1080,Pakistan,PK,Karachi,elite,true,56.24,AS17557,Pakistan Telecommuication company limited,1409.64,1780011494.564775
socks5,103.121.120.242,1080,Pakistan,PK,Karachi,elite,true,91.81,AS131275,Logon Broadband Pvt. Limited,3828.85,1780011493.823377
socks5,154.57.213.237,1080,Pakistan,PK,Islamabad,elite,true,61.19,AS135407,Trans World Enterprise Services (Private) Limited,735.81,1780011470.904001
socks5,175.107.244.164,1080,Pakistan,PK,Karachi,elite,true,53.48,AS9541,Cyber Internet Services Pakistan,7978.7,1780010872.4914515
