protocol,ip,port,country,country_code,city,anonymity,ssl,uptime_percent,asn,isp,latency_ms,last_checked
socks5,175.107.244.164,1080,Pakistan,PK,Karachi,elite,true,54.66,AS9541,Cyber Internet Services Pakistan,10732.73,1780165169.3298225
socks5,182.184.119.180,1080,Pakistan,PK,Karachi,elite,true,58.01,AS17557,Pakistan Telecommuication company limited,4628.08,1780165169.316114
socks5,154.57.213.237,1080,Pakistan,PK,Islamabad,elite,true,66.81,AS135407,Trans World Enterprise Services (Private) Limited,2763.66,1780165154.9852943
socks5,103.150.206.77,1080,Pakistan,PK,Faisalabad,elite,true,55.59,AS140594,Nadeem Abbas and Shayufta Rani,1864.89,1780165106.5027137
socks5,103.236.134.210,1080,Pakistan,PK,Karachi,elite,true,90.14,AS38193,TRANSWORLD ASSOCIATES (PVT) LIMITED,1823.35,1780165193.7265198
