protocol,ip,port,country,country_code,city,anonymity,ssl,uptime_percent,asn,isp,latency_ms,last_checked
socks5,103.150.206.77,1080,Pakistan,PK,Faisalabad,elite,true,56.71,AS140594,Nadeem Abbas and Shayufta Rani,1051.96,1780205953.5111973
socks5,175.107.244.164,1080,Pakistan,PK,Karachi,elite,true,56.22,AS9541,Cyber Internet Services Pakistan,8139.31,1780205939.3269565
socks5,182.184.119.180,1080,Pakistan,PK,Karachi,elite,true,59.68,AS17557,Pakistan Telecommuication company limited,8907.19,1780205935.9823318
socks5,154.57.213.237,1080,Pakistan,PK,Islamabad,elite,true,69.65,AS135407,Trans World Enterprise Services (Private) Limited,1080.94,1780205918.160092
socks5,103.121.120.242,1080,Pakistan,PK,Karachi,elite,true,89.75,AS131275,Logon Broadband Pvt. Limited,1403.32,1780205914.6906695
socks5,103.236.134.210,1080,Pakistan,PK,Karachi,elite,true,91.23,AS38193,TRANSWORLD ASSOCIATES (PVT) LIMITED,749.55,1780205914.2747018
