protocol,ip,port,country,country_code,city,anonymity,ssl,uptime_percent,asn,isp,latency_ms,last_checked
socks5,182.184.119.180,1080,Pakistan,PK,Karachi,elite,true,57.99,AS17557,Pakistan Telecommuication company limited,966.31,1780163365.1350102
socks5,103.121.120.242,1080,Pakistan,PK,Karachi,elite,true,88.55,AS131275,Logon Broadband Pvt. Limited,735.36,1780163362.7007642
socks5,103.150.206.77,1080,Pakistan,PK,Faisalabad,elite,true,55.49,AS140594,Nadeem Abbas and Shayufta Rani,877.88,1780163362.1548436
socks5,154.57.213.237,1080,Pakistan,PK,Islamabad,elite,true,66.56,AS135407,Trans World Enterprise Services (Private) Limited,7988.3,1780163361.2583692
socks5,103.236.134.210,1080,Pakistan,PK,Karachi,elite,true,89.88,AS38193,TRANSWORLD ASSOCIATES (PVT) LIMITED,8015.02,1780163383.005596
