protocol,ip,port,country,country_code,city,anonymity,ssl,uptime_percent,asn,isp,latency_ms,last_checked
socks5,103.236.134.210,1080,Pakistan,PK,Karachi,elite,true,89.74,AS38193,TRANSWORLD ASSOCIATES (PVT) LIMITED,1760.21,1780097360.458074
socks5,103.121.120.242,1080,Pakistan,PK,Karachi,elite,true,93.31,AS131275,Logon Broadband Pvt. Limited,1773.3,1780097338.2489958
socks5,154.57.213.237,1080,Pakistan,PK,Islamabad,elite,true,62.08,AS135407,Trans World Enterprise Services (Private) Limited,1999.83,1780097300.3230336
socks5,182.184.119.180,1080,Pakistan,PK,Karachi,elite,true,56.5,AS17557,Pakistan Telecommuication company limited,2077.83,1780096965.3200338
socks5,175.107.244.164,1080,Pakistan,PK,Karachi,elite,true,53.62,AS9541,Cyber Internet Services Pakistan,1779.7,1780096894.140709
