protocol,ip,port,country,country_code,city,anonymity,ssl,uptime_percent,asn,isp,latency_ms,last_checked
socks5,175.107.244.164,1080,Pakistan,PK,Karachi,elite,true,56.1,AS9541,Cyber Internet Services Pakistan,10692.07,1780200239.2852826
socks5,182.184.119.180,1080,Pakistan,PK,Karachi,elite,true,59.51,AS17557,Pakistan Telecommuication company limited,1101.64,1780200187.3013718
socks5,103.150.206.77,1080,Pakistan,PK,Faisalabad,elite,true,56.6,AS140594,Nadeem Abbas and Shayufta Rani,1814.01,1780200178.7711985
socks5,103.121.120.242,1080,Pakistan,PK,Karachi,elite,true,89.91,AS131275,Logon Broadband Pvt. Limited,774.0,1780200177.7107334
socks5,154.57.213.237,1080,Pakistan,PK,Islamabad,elite,true,69.43,AS135407,Trans World Enterprise Services (Private) Limited,3013.07,1780200173.6530654
socks5,103.236.134.210,1080,Pakistan,PK,Karachi,elite,true,91.5,AS38193,TRANSWORLD ASSOCIATES (PVT) LIMITED,1004.3,1780200191.9780908
