protocol,ip,port,country,country_code,city,anonymity,ssl,uptime_percent,asn,isp,latency_ms,last_checked
socks5,154.57.213.237,1080,Pakistan,PK,Islamabad,elite,true,61.56,AS135407,Trans World Enterprise Services (Private) Limited,3798.81,1780044576.8827753
socks5,103.121.120.242,1080,Pakistan,PK,Karachi,elite,true,93.37,AS131275,Logon Broadband Pvt. Limited,772.88,1780044478.04628
socks5,103.150.206.77,1080,Pakistan,PK,Faisalabad,elite,true,53.53,AS140594,Nadeem Abbas and Shayufta Rani,896.83,1780044470.7292733
socks5,175.107.244.164,1080,Pakistan,PK,Karachi,elite,true,53.41,AS9541,Cyber Internet Services Pakistan,1100.74,1780043990.268173
socks5,182.184.119.180,1080,Pakistan,PK,Karachi,elite,true,56.3,AS17557,Pakistan Telecommuication company limited,1116.46,1780044585.1876917
