protocol,ip,port,country,country_code,city,anonymity,ssl,uptime_percent,asn,isp,latency_ms,last_checked
socks5,103.121.120.242,1080,Pakistan,PK,Karachi,elite,true,89.35,AS131275,Logon Broadband Pvt. Limited,4314.31,1780184913.488842
socks5,154.57.213.237,1080,Pakistan,PK,Islamabad,elite,true,68.73,AS135407,Trans World Enterprise Services (Private) Limited,1608.17,1780184903.3936453
socks5,103.150.206.77,1080,Pakistan,PK,Faisalabad,elite,true,56.25,AS140594,Nadeem Abbas and Shayufta Rani,1704.32,1780184877.6786804
socks5,175.107.244.164,1080,Pakistan,PK,Karachi,elite,true,55.61,AS9541,Cyber Internet Services Pakistan,8633.15,1780184850.4077058
socks5,103.236.134.210,1080,Pakistan,PK,Karachi,elite,true,91.04,AS38193,TRANSWORLD ASSOCIATES (PVT) LIMITED,1770.06,1780184983.9383805
