protocol,ip,port,country,country_code,city,anonymity,ssl,uptime_percent,asn,isp,latency_ms,last_checked
socks5,103.121.120.242,1080,Pakistan,PK,Karachi,elite,true,94.64,AS131275,Logon Broadband Pvt. Limited,777.69,1780077501.2996302
socks5,103.150.206.77,1080,Pakistan,PK,Faisalabad,elite,true,53.73,AS140594,Nadeem Abbas and Shayufta Rani,876.91,1780077453.988403
socks5,182.184.119.180,1080,Pakistan,PK,Karachi,elite,true,56.46,AS17557,Pakistan Telecommuication company limited,1915.43,1780077349.7527041
socks5,175.107.244.164,1080,Pakistan,PK,Karachi,elite,true,53.53,AS9541,Cyber Internet Services Pakistan,3178.6,1780077312.2477696
socks5,154.57.213.237,1080,Pakistan,PK,Islamabad,elite,true,61.79,AS135407,Trans World Enterprise Services (Private) Limited,2137.63,1780077241.5193458
