protocol,ip,port,country,country_code,city,anonymity,ssl,uptime_percent,asn,isp,latency_ms,last_checked
socks5,154.57.213.237,1080,Pakistan,PK,Islamabad,elite,true,62.21,AS135407,Trans World Enterprise Services (Private) Limited,979.93,1780113559.173114
socks5,103.121.120.242,1080,Pakistan,PK,Karachi,elite,true,91.79,AS131275,Logon Broadband Pvt. Limited,1791.64,1780113538.7620773
socks5,175.107.244.164,1080,Pakistan,PK,Karachi,elite,true,53.66,AS9541,Cyber Internet Services Pakistan,3276.86,1780113512.3102205
socks5,103.150.206.77,1080,Pakistan,PK,Faisalabad,elite,true,53.9,AS140594,Nadeem Abbas and Shayufta Rani,2450.16,1780113314.906836
socks5,103.236.134.210,1080,Pakistan,PK,Karachi,elite,true,88.6,AS38193,TRANSWORLD ASSOCIATES (PVT) LIMITED,8036.63,1780113242.2864635
