protocol,ip,port,country,country_code,city,anonymity,ssl,uptime_percent,asn,isp,latency_ms,last_checked
socks5,175.107.244.164,1080,Pakistan,PK,Karachi,elite,true,55.75,AS9541,Cyber Internet Services Pakistan,5795.83,1780189182.9581501
socks5,154.57.213.237,1080,Pakistan,PK,Islamabad,elite,true,68.94,AS135407,Trans World Enterprise Services (Private) Limited,8174.79,1780189182.8912206
socks5,103.150.206.77,1080,Pakistan,PK,Faisalabad,elite,true,56.33,AS140594,Nadeem Abbas and Shayufta Rani,9016.23,1780189173.9349
socks5,103.121.120.242,1080,Pakistan,PK,Karachi,elite,true,89.53,AS131275,Logon Broadband Pvt. Limited,949.47,1780189156.2244558
socks5,103.236.134.210,1080,Pakistan,PK,Karachi,elite,true,91.14,AS38193,TRANSWORLD ASSOCIATES (PVT) LIMITED,1728.46,1780189144.55611
