protocol,ip,port,country,country_code,city,anonymity,ssl,uptime_percent,asn,isp,latency_ms,last_checked
socks5,154.57.213.237,1080,Pakistan,PK,Islamabad,elite,true,64.94,AS135407,Trans World Enterprise Services (Private) Limited,1801.78,1780152254.317656
socks5,175.107.244.164,1080,Pakistan,PK,Karachi,elite,true,54.63,AS9541,Cyber Internet Services Pakistan,3994.11,1780152253.680616
socks5,103.121.120.242,1080,Pakistan,PK,Karachi,elite,true,88.0,AS131275,Logon Broadband Pvt. Limited,748.65,1780152250.0746565
socks5,182.184.119.180,1080,Pakistan,PK,Karachi,elite,true,57.84,AS17557,Pakistan Telecommuication company limited,1977.12,1780152249.9735076
socks5,103.150.206.77,1080,Pakistan,PK,Faisalabad,elite,true,54.87,AS140594,Nadeem Abbas and Shayufta Rani,1999.42,1780152245.3443272
socks5,103.236.134.210,1080,Pakistan,PK,Karachi,elite,true,87.21,AS38193,TRANSWORLD ASSOCIATES (PVT) LIMITED,3841.32,1780152287.2860584
