protocol,ip,port,country,country_code,city,anonymity,ssl,uptime_percent,asn,isp,latency_ms,last_checked
socks5,103.150.206.77,1080,Pakistan,PK,Faisalabad,elite,true,56.18,AS140594,Nadeem Abbas and Shayufta Rani,8621.68,1780181965.4281628
socks5,175.107.244.164,1080,Pakistan,PK,Karachi,elite,true,55.56,AS9541,Cyber Internet Services Pakistan,11255.31,1780181931.6837974
socks5,154.57.213.237,1080,Pakistan,PK,Islamabad,elite,true,68.55,AS135407,Trans World Enterprise Services (Private) Limited,2255.97,1780181902.858592
socks5,103.121.120.242,1080,Pakistan,PK,Karachi,elite,true,89.42,AS131275,Logon Broadband Pvt. Limited,1818.93,1780181850.3178532
socks5,103.236.134.210,1080,Pakistan,PK,Karachi,elite,true,90.87,AS38193,TRANSWORLD ASSOCIATES (PVT) LIMITED,1256.52,1780181930.544264
