protocol,ip,port,country,country_code,city,anonymity,ssl,uptime_percent,asn,isp,latency_ms,last_checked
socks5,182.184.119.180,1080,Pakistan,PK,Karachi,elite,true,56.24,AS17557,Pakistan Telecommuication company limited,8612.96,1780000717.3806045
socks5,175.107.244.164,1080,Pakistan,PK,Karachi,elite,true,53.47,AS9541,Cyber Internet Services Pakistan,7865.97,1780000713.3551917
socks5,154.57.213.237,1080,Pakistan,PK,Islamabad,elite,true,61.05,AS135407,Trans World Enterprise Services (Private) Limited,3952.22,1780000685.534084
socks5,103.150.206.77,1080,Pakistan,PK,Faisalabad,elite,true,53.3,AS140594,Nadeem Abbas and Shayufta Rani,876.76,1780000622.5390182
socks5,103.121.120.242,1080,Pakistan,PK,Karachi,elite,true,91.71,AS131275,Logon Broadband Pvt. Limited,777.15,1780000621.3912292
