protocol,ip,port,country,country_code,city,anonymity,ssl,uptime_percent,asn,isp,latency_ms,last_checked
socks5,154.57.213.237,1080,Pakistan,PK,Islamabad,elite,true,68.84,AS135407,Trans World Enterprise Services (Private) Limited,8344.32,1780187366.9861603
socks5,175.107.244.164,1080,Pakistan,PK,Karachi,elite,true,55.68,AS9541,Cyber Internet Services Pakistan,8152.46,1780187357.884612
socks5,103.121.120.242,1080,Pakistan,PK,Karachi,elite,true,89.41,AS131275,Logon Broadband Pvt. Limited,838.47,1780187350.6706154
socks5,103.150.206.77,1080,Pakistan,PK,Faisalabad,elite,true,56.28,AS140594,Nadeem Abbas and Shayufta Rani,2245.75,1780187325.6612356
socks5,182.184.119.180,1080,Pakistan,PK,Karachi,elite,true,59.03,AS17557,Pakistan Telecommuication company limited,1856.82,1780187303.8186576
socks5,103.236.134.210,1080,Pakistan,PK,Karachi,elite,true,91.01,AS38193,TRANSWORLD ASSOCIATES (PVT) LIMITED,931.28,1780187323.7704868
