protocol,ip,port,country,country_code,city,anonymity,ssl,uptime_percent,asn,isp,latency_ms,last_checked
socks5,103.150.206.77,1080,Pakistan,PK,Faisalabad,elite,true,57.03,AS140594,Nadeem Abbas and Shayufta Rani,2411.71,1780220960.754623
socks5,154.57.213.237,1080,Pakistan,PK,Islamabad,elite,true,70.33,AS135407,Trans World Enterprise Services (Private) Limited,988.34,1780220904.5133748
socks5,175.107.244.164,1080,Pakistan,PK,Karachi,elite,true,56.67,AS9541,Cyber Internet Services Pakistan,9545.12,1780220890.3836892
socks5,103.121.120.242,1080,Pakistan,PK,Karachi,elite,true,90.38,AS131275,Logon Broadband Pvt. Limited,1981.53,1780220852.6615953
socks5,103.236.134.210,1080,Pakistan,PK,Karachi,elite,true,91.83,AS38193,TRANSWORLD ASSOCIATES (PVT) LIMITED,1142.87,1780220997.341974
