protocol,ip,port,country,country_code,city,anonymity,ssl,uptime_percent,asn,isp,latency_ms,last_checked
socks4,80.191.40.130,5678,Iran,IR,Tehran,elite,true,65.38,AS58224,Telecommunication Company of Iran,353.93,1780108784.91324
socks4,5.160.187.174,1080,Iran,IR,Tehran,elite,true,73.23,AS42337,Respina Networks & Beyond PJSC,563.22,1780108784.5256777
socks4,78.38.67.95,4153,Iran,IR,Tehran,elite,true,29.2,AS58224,Iran Telecommunication Company PJS,497.41,1780108782.5042646
socks4,5.160.103.246,8080,Iran,IR,Tehran,elite,true,61.63,AS42337,Respina Networks & Beyond PJSC,539.42,1780108781.395955
socks4,217.219.162.114,5678,Iran,IR,Babol,elite,true,76.93,AS58224,Iran Telecommunication Company PJS,3714.67,1780108779.2776089
socks4,94.182.199.250,8080,Iran,IR,Tehran,elite,true,29.33,AS31549,Aria Shatel PJSC,1538.62,1780108774.6172779
socks4,46.100.47.254,1080,Iran,IR,Tehran,elite,true,62.97,AS58224,Iran Telecommunication Company PJS,3429.89,1780108772.7516053
socks4,93.118.135.176,1080,Iran,IR,Tehran,elite,true,31.25,AS58224,Iran Telecommunication Company PJS,1447.72,1780108770.523922
socks4,81.91.157.134,5678,Iran,IR,Tehran,elite,true,48.84,AS206065,Tose'h Fanavari Ertebabat Pasargad Arian Co. PJS,468.26,1780108764.849427
http,185.118.153.110,8080,Iran,IR,Tehran,transparent,false,25.32,AS62250,SINA ATINET Company (Ltd),764.84,1780108764.4359593
http,109.230.89.126,3128,Iran,IR,Tehran,transparent,false,10.87,AS206065,Tose'h Fanavari Ertebabat Pasargad Arian Co. PJS,8751.02,1780108759.3707824
http,46.148.41.9,8090,Iran,IR,Shāhīn Shahr,transparent,false,14.37,AS47376,Web Gostaran Bandar Company,17222.47,1780108727.402843
http,185.140.232.27,1400,Iran,IR,Shiraz,transparent,false,5.18,AS43395,Pooya Parto Qeshm Cooperative Company,11567.3,1780108711.303975
