protocol,ip,port,country,country_code,city,anonymity,ssl,uptime_percent,asn,isp,latency_ms,last_checked
socks4,46.100.47.254,1080,Iran,IR,Tehran,elite,true,64.22,AS58224,Iran Telecommunication Company PJS,424.81,1780151670.0387833
socks4,217.219.162.114,5678,Iran,IR,Babol,elite,true,75.86,AS58224,Iran Telecommunication Company PJS,1187.78,1780151667.9707296
socks4,5.160.187.174,1080,Iran,IR,Tehran,elite,true,73.77,AS42337,Respina Networks & Beyond PJSC,7815.52,1780151651.410936
socks4,78.38.67.95,4153,Iran,IR,Tehran,elite,true,29.62,AS58224,Iran Telecommunication Company PJS,7673.68,1780151644.2892928
http,80.210.62.146,3128,Iran,IR,Tehran,elite,false,34.48,AS58224,TIC,9055.41,1780151643.743922
socks4,94.182.199.250,8080,Iran,IR,Tehran,elite,true,29.86,AS31549,Aria Shatel PJSC,1502.87,1780151624.4307804
http,185.100.45.93,8080,Iran,IR,Tehran,transparent,true,64.29,AS200645,Gilass Rayaneh Sirjan Co,816.66,1780151599.619909
http,2.188.229.150,7020,Iran,IR,Tabriz,transparent,false,6.29,AS212161,Ofogh Koroush Chain Store Public Joint Stock,8724.28,1780151597.3479471
http,195.181.40.34,8080,Iran,IR,Babol,transparent,false,9.55,AS58224,Iran Telecommunication Company PJS,4091.19,1780151554.3393667
http,46.34.165.86,443,Iran,IR,Tehran,transparent,false,26.31,AS206065,Tose'h Fanavari Ertebabat Pasargad Arian Co. PJS,9497.82,1780151535.515882
http,46.209.199.145,8090,Iran,IR,Tehran,transparent,false,6.21,AS42337,RSPN,10774.88,1780151529.303881
http,91.241.21.237,9812,Iran,IR,Tehran,transparent,false,3.38,AS59442,GOSTARESH-E-ERTEBATAT-E MABNA COMPANY (Private Joint Stock),5667.06,1780151478.5438907
