protocol,ip,port,country,country_code,city,anonymity,ssl,uptime_percent,asn,isp,latency_ms,last_checked
socks4,46.100.47.254,1080,Iran,IR,Tehran,elite,true,38.1,AS58224,Iran Telecommunication Company PJS,408.18,1780040048.8678749
socks4,5.160.103.246,8080,Iran,IR,Tehran,elite,true,54.65,AS42337,Respina Networks & Beyond PJSC,480.99,1780040044.420993
socks4,5.160.187.174,1080,Iran,IR,Tehran,elite,true,41.28,AS42337,Respina Networks & Beyond PJSC,671.35,1780040041.2999854
socks4,78.38.67.95,4153,Iran,IR,Tehran,elite,true,29.56,AS58224,Iran Telecommunication Company PJS,471.12,1780040022.6335607
http,195.181.40.34,8080,Iran,IR,Babol,transparent,false,8.82,AS58224,Iran Telecommunication Company PJS,10820.33,1780039973.5000777
http,93.126.23.193,8080,Iran,IR,Isfahan,transparent,true,8.21,AS210392,TCIGLN,2349.1,1780039958.5491738
http,46.34.165.86,443,Iran,IR,Tehran,transparent,false,25.9,AS206065,Tose'h Fanavari Ertebabat Pasargad Arian Co. PJS,11225.83,1780039848.8957582
http,91.241.21.237,9812,Iran,IR,Tehran,transparent,false,3.09,AS59442,GOSTARESH-E-ERTEBATAT-E MABNA COMPANY (Private Joint Stock),9397.7,1780040365.7854693
