protocol,ip,port,country,country_code,city,anonymity,ssl,uptime_percent,asn,isp,latency_ms,last_checked
socks4,217.219.162.114,5678,Iran,IR,Babol,elite,true,76.24,AS58224,Iran Telecommunication Company PJS,1610.65,1780117779.1125505
socks4,5.160.103.246,8080,Iran,IR,Tehran,elite,true,62.09,AS42337,Respina Networks & Beyond PJSC,1799.56,1780117773.7455952
socks4,94.182.199.250,8080,Iran,IR,Tehran,elite,true,29.37,AS31549,Aria Shatel PJSC,7787.56,1780117772.8812554
socks4,151.232.18.66,5678,Iran,IR,Tehran,elite,true,48.54,AS58224,Iran Telecommunication Company PJS,475.76,1780117767.5510514
socks4,84.241.3.199,1080,Iran,IR,Tehran,elite,true,25.84,AS31549,SHATEL Network,7657.69,1780117765.0126925
http,31.25.92.114,8080,Iran,IR,Mashhad,transparent,false,20.41,AS202391,Cooperative Afra ertebatat-e-sabet-e Rasa Co,1951.97,1780117759.3011346
http,185.118.153.110,8080,Iran,IR,Tehran,transparent,false,25.37,AS62250,SINA ATINET Company (Ltd),5344.12,1780117756.7998946
socks4,78.38.67.95,4153,Iran,IR,Tehran,elite,true,29.47,AS58224,Iran Telecommunication Company PJS,7992.53,1780117754.31332
http,46.148.41.9,8090,Iran,IR,Shāhīn Shahr,transparent,false,14.47,AS47376,Web Gostaran Bandar Company,12620.31,1780117746.4373372
http,195.181.40.34,8080,Iran,IR,Babol,transparent,false,9.29,AS58224,Iran Telecommunication Company PJS,12009.44,1780117703.2415938
http,91.241.21.237,9812,Iran,IR,Tehran,transparent,false,3.29,AS59442,GOSTARESH-E-ERTEBATAT-E MABNA COMPANY (Private Joint Stock),11194.54,1780117635.186869
