protocol,ip,port,country,country_code,city,anonymity,ssl,uptime_percent,asn,isp,latency_ms,last_checked
http,5.202.120.123,3128,Iran,IR,Tehran,elite,false,27.45,AS49100,Pishgaman Toseeh Ertebatat Company (Private Joint Stock),771.92,1780084793.80612
socks4,5.160.187.174,1080,Iran,IR,Tehran,elite,true,71.09,AS42337,Respina Networks & Beyond PJSC,4061.9,1780084790.3894012
socks4,81.91.157.134,5678,Iran,IR,Tehran,elite,true,48.63,AS206065,Tose'h Fanavari Ertebabat Pasargad Arian Co. PJS,462.58,1780084787.6656775
socks4,5.160.103.246,8080,Iran,IR,Tehran,elite,true,60.98,AS42337,Respina Networks & Beyond PJSC,3557.63,1780084787.3591719
socks4,80.191.40.130,5678,Iran,IR,Tehran,elite,true,63.43,AS58224,Telecommunication Company of Iran,1730.03,1780084782.6394355
socks4,217.219.162.114,5678,Iran,IR,Babol,elite,true,77.44,AS58224,Iran Telecommunication Company PJS,3673.05,1780084754.4543984
http,46.34.165.86,443,Iran,IR,Tehran,transparent,false,26.02,AS206065,Tose'h Fanavari Ertebabat Pasargad Arian Co. PJS,12993.21,1780084734.4167197
http,46.209.30.11,8080,Iran,IR,Tehran,transparent,false,20.98,AS42337,Respina Networks & Beyond PJSC,6837.89,1780084692.3115246
