protocol,ip,port,country,country_code,city,anonymity,ssl,uptime_percent,asn,isp,latency_ms,last_checked
socks4,80.191.40.130,5678,Iran,IR,Tehran,elite,true,68.05,AS58224,Telecommunication Company of Iran,3443.59,1780148083.2938187
socks4,93.118.135.176,1080,Iran,IR,Tehran,elite,true,32.21,AS58224,Iran Telecommunication Company PJS,3559.87,1780148075.762423
http,2.188.229.150,7020,Iran,IR,Tabriz,transparent,false,6.29,AS212161,Ofogh Koroush Chain Store Public Joint Stock,19183.01,1780148055.3495362
http,185.100.45.93,8080,Iran,IR,Tehran,transparent,true,70.0,AS200645,Gilass Rayaneh Sirjan Co,10876.84,1780148005.8958313
http,85.9.87.26,8080,Iran,IR,Tehran,transparent,false,8.87,AS47376,Web Gostaran Bandar Company,12677.29,1780147997.981756
http,46.209.30.11,8080,Iran,IR,Tehran,transparent,false,21.48,AS42337,Respina Networks & Beyond PJSC,7836.62,1780147931.8759334
