protocol,ip,port,country,country_code,city,anonymity,ssl,uptime_percent,asn,isp,latency_ms,last_checked
socks4,84.241.3.199,1080,Iran,IR,Tehran,elite,true,9.54,AS31549,SHATEL Network,3456.49,1780076978.239866
socks4,78.38.67.95,4153,Iran,IR,Tehran,elite,true,29.14,AS58224,Iran Telecommunication Company PJS,3468.93,1780076977.4422116
socks4,81.91.157.134,5678,Iran,IR,Tehran,elite,true,48.42,AS206065,Tose'h Fanavari Ertebabat Pasargad Arian Co. PJS,445.84,1780076974.335299
socks4,217.219.162.114,5678,Iran,IR,Babol,elite,true,77.11,AS58224,Iran Telecommunication Company PJS,686.69,1780076972.5332894
socks4,5.160.103.246,8080,Iran,IR,Tehran,elite,true,60.02,AS42337,Respina Networks & Beyond PJSC,486.42,1780076968.421493
socks4,151.232.18.66,5678,Iran,IR,Tehran,elite,true,46.3,AS58224,Iran Telecommunication Company PJS,4126.68,1780076965.2639692
socks4,80.191.40.130,5678,Iran,IR,Tehran,elite,true,63.01,AS58224,Telecommunication Company of Iran,7650.92,1780076962.1653674
http,185.140.232.27,1400,Iran,IR,Shiraz,transparent,false,5.06,AS43395,Pooya Parto Qeshm Cooperative Company,1403.66,1780076955.93638
socks4,5.160.187.174,1080,Iran,IR,Tehran,elite,true,68.61,AS42337,Respina Networks & Beyond PJSC,1288.86,1780076931.9066606
http,46.148.41.9,8090,Iran,IR,Shāhīn Shahr,transparent,false,14.21,AS47376,Web Gostaran Bandar Company,8568.34,1780076916.6476889
http,46.34.165.86,443,Iran,IR,Tehran,transparent,false,26.01,AS206065,Tose'h Fanavari Ertebabat Pasargad Arian Co. PJS,7148.8,1780076857.6321666
