protocol,ip,port,country,country_code,city,anonymity,ssl,uptime_percent,asn,isp,latency_ms,last_checked
socks4,151.232.18.66,5678,Iran,IR,Tehran,elite,true,41.24,AS58224,Iran Telecommunication Company PJS,447.6,1780025670.4280167
socks4,80.191.40.130,5678,Iran,IR,Tehran,elite,true,50.04,AS58224,Telecommunication Company of Iran,435.09,1780025665.2891095
socks4,217.219.162.114,5678,Iran,IR,Babol,elite,true,75.66,AS58224,Iran Telecommunication Company PJS,541.18,1780025659.9782305
socks4,81.91.157.134,5678,Iran,IR,Tehran,elite,true,43.34,AS206065,Tose'h Fanavari Ertebabat Pasargad Arian Co. PJS,448.98,1780025658.073407
socks4,5.160.103.246,8080,Iran,IR,Tehran,elite,true,52.66,AS42337,Respina Networks & Beyond PJSC,1496.09,1780025634.965165
http,46.34.165.86,443,Iran,IR,Tehran,transparent,false,25.84,AS206065,Tose'h Fanavari Ertebabat Pasargad Arian Co. PJS,10412.33,1780025575.5356922
http,81.12.70.99,8080,Iran,IR,Tajrīsh,transparent,false,17.07,AS42337,Respina Networks & Beyond PJSC,6991.74,1780025533.153294
http,93.126.6.70,3128,Iran,IR,Isfahan,elite,false,73.91,AS44375,AsmanFaraz- IUT,11350.34,1780025648.883362
http,91.241.21.237,9812,Iran,IR,Tehran,transparent,false,3.03,AS59442,GOSTARESH-E-ERTEBATAT-E MABNA COMPANY (Private Joint Stock),7408.22,1780025582.455664
