protocol,ip,port,country,country_code,city,anonymity,ssl,uptime_percent,asn,isp,latency_ms,last_checked
socks4,151.232.18.66,5678,Iran,IR,Tehran,elite,true,40.95,AS58224,Iran Telecommunication Company PJS,428.48,1780017574.5734203
socks4,5.160.103.246,8080,Iran,IR,Tehran,elite,true,52.12,AS42337,Respina Networks & Beyond PJSC,831.27,1780017573.9615653
socks4,217.219.162.114,5678,Iran,IR,Babol,elite,true,75.72,AS58224,Iran Telecommunication Company PJS,3636.13,1780017558.4566596
socks4,80.191.40.130,5678,Iran,IR,Tehran,elite,true,49.09,AS58224,Telecommunication Company of Iran,3439.31,1780017555.9624407
http,93.126.23.193,8080,Iran,IR,Isfahan,transparent,false,7.63,AS210392,TCIGLN,1690.26,1780017474.2161186
http,109.230.89.126,3128,Iran,IR,Tehran,transparent,false,6.1,AS206065,Tose'h Fanavari Ertebabat Pasargad Arian Co. PJS,12876.54,1780017434.967003
http,185.140.232.27,1400,Iran,IR,Shiraz,transparent,true,4.87,AS43395,Pooya Parto Qeshm Cooperative Company,10194.74,1780017411.81658
