protocol,ip,port,country,country_code,city,anonymity,ssl,uptime_percent,asn,isp,latency_ms,last_checked
socks4,217.219.162.114,5678,Iran,IR,Babol,elite,true,75.96,AS58224,Iran Telecommunication Company PJS,1125.49,1780004973.9528115
socks4,81.91.157.134,5678,Iran,IR,Tehran,elite,true,42.8,AS206065,Tose'h Fanavari Ertebabat Pasargad Arian Co. PJS,2453.12,1780004969.7494352
socks4,178.252.149.46,4153,Iran,IR,Tehran,elite,true,5.31,AS51074,GOSTARESH-E-ERTEBATAT-E MABNA COMPANY (Private Joint Stock),766.11,1780004966.1133535
socks4,80.191.40.130,5678,Iran,IR,Tehran,elite,true,47.21,AS58224,Telecommunication Company of Iran,387.3,1780004951.6085978
http,2.188.229.150,7020,Iran,IR,Tabriz,transparent,false,6.2,AS212161,Ofogh Koroush Chain Store Public Joint Stock,8043.16,1780004938.319829
http,80.210.62.146,3128,Iran,IR,Tehran,elite,false,47.14,AS58224,TIC,8554.23,1780004928.7145805
http,193.178.203.140,8080,Iran,IR,Isfahan,transparent,false,7.12,AS44375,AsmanFaraz ISDP,2742.52,1780004886.8068469
http,46.209.30.11,8080,Iran,IR,Tehran,transparent,false,20.46,AS42337,Respina Networks & Beyond PJSC,6811.77,1780004853.7382145
