protocol,ip,port,country,country_code,city,anonymity,ssl,uptime_percent,asn,isp,latency_ms,last_checked
socks4,78.38.67.95,4153,Iran,IR,Tehran,elite,true,29.57,AS58224,Iran Telecommunication Company PJS,1575.91,1780130949.670959
socks4,217.219.162.114,5678,Iran,IR,Babol,elite,true,76.1,AS58224,Iran Telecommunication Company PJS,4702.99,1780130947.6800318
socks4,80.191.40.130,5678,Iran,IR,Tehran,elite,true,67.3,AS58224,Telecommunication Company of Iran,415.41,1780130944.2716208
socks4,81.91.157.134,5678,Iran,IR,Tehran,elite,true,49.59,AS206065,Tose'h Fanavari Ertebabat Pasargad Arian Co. PJS,512.28,1780130943.9072664
socks4,94.182.199.250,8080,Iran,IR,Tehran,elite,true,29.63,AS31549,Aria Shatel PJSC,7537.84,1780130933.272679
socks4,178.252.149.46,4153,Iran,IR,Tehran,elite,true,7.88,AS51074,GOSTARESH-E-ERTEBATAT-E MABNA COMPANY (Private Joint Stock),2414.14,1780130927.4593587
http,46.209.30.11,8080,Iran,IR,Tehran,transparent,false,21.36,AS42337,Respina Networks & Beyond PJSC,10713.28,1780130926.396602
http,91.241.21.237,9812,Iran,IR,Tehran,transparent,false,3.34,AS59442,GOSTARESH-E-ERTEBATAT-E MABNA COMPANY (Private Joint Stock),15298.93,1780130850.1042652
http,46.209.199.145,8090,Iran,IR,Tehran,transparent,false,6.17,AS42337,RSPN,11202.05,1780130849.5297031
http,185.118.153.110,8080,Iran,IR,Tehran,transparent,false,25.46,AS62250,SINA ATINET Company (Ltd),9011.98,1780130822.3832872
