protocol,ip,port,country,country_code,city,anonymity,ssl,uptime_percent,asn,isp,latency_ms,last_checked
http,47.250.159.65,18081,Malaysia,MY,Kuala Lumpur,elite,true,1.29,AS45102,"Alibaba (US) Technology Co., Ltd.",2328.25,1780022979.6511717
http,219.93.101.62,80,Malaysia,MY,Kota Kinabalu,anonymous,false,89.87,AS4788,ADSL Streamyx Telekom Malaysia,674.29,1780022979.0478842
http,219.93.101.63,80,Malaysia,MY,Kota Kinabalu,anonymous,false,78.11,AS4788,ADSL Streamyx Telekom Malaysia,622.62,1780022976.9796672
http,175.139.233.78,80,Malaysia,MY,Puchong,anonymous,false,71.31,AS4788,TM TECHNOLOGY SERVICES SDN BHD,7694.99,1780022958.6947467
http,219.93.101.60,80,Malaysia,MY,Kota Kinabalu,anonymous,false,80.48,AS4788,ADSL Streamyx Telekom Malaysia,667.42,1780022956.3373153
