protocol,ip,port,country,country_code,city,anonymity,ssl,uptime_percent,asn,isp,latency_ms,last_checked
http,219.93.101.60,80,Malaysia,MY,Kota Kinabalu,anonymous,false,80.52,AS4788,ADSL Streamyx Telekom Malaysia,691.58,1780073691.2856736
http,219.93.101.63,80,Malaysia,MY,Kota Kinabalu,anonymous,false,78.2,AS4788,ADSL Streamyx Telekom Malaysia,641.0,1780073667.7740498
http,219.93.101.62,80,Malaysia,MY,Kota Kinabalu,anonymous,false,89.89,AS4788,ADSL Streamyx Telekom Malaysia,651.29,1780073622.7195644
http,175.144.60.126,8080,Malaysia,MY,Ampang,transparent,false,24.52,AS4788,TM TECHNOLOGY SERVICES SDN BHD,3018.65,1780073581.3662777
http,47.250.177.202,8080,Malaysia,MY,Kuala Lumpur,elite,true,1.03,AS45102,"Alibaba (US) Technology Co., Ltd.",2382.37,1780073519.6966736
