protocol,ip,port,country,country_code,city,anonymity,ssl,uptime_percent,asn,isp,latency_ms,last_checked
socks4,46.100.47.254,1080,Iran,IR,Tehran,elite,true,60.3,AS58224,Iran Telecommunication Company PJS,1438.25,1780073701.6115227
socks4,81.91.157.134,5678,Iran,IR,Tehran,elite,true,48.2,AS206065,Tose'h Fanavari Ertebabat Pasargad Arian Co. PJS,515.41,1780073698.113894
socks4,80.191.40.130,5678,Iran,IR,Tehran,elite,true,62.38,AS58224,Telecommunication Company of Iran,1414.73,1780073686.543373
socks4,217.219.162.114,5678,Iran,IR,Babol,elite,true,76.94,AS58224,Iran Telecommunication Company PJS,647.35,1780073681.9023688
socks4,5.160.187.174,1080,Iran,IR,Tehran,elite,true,67.69,AS42337,Respina Networks & Beyond PJSC,592.98,1780073675.84864
