protocol,ip,port,country,country_code,city,anonymity,ssl,uptime_percent,asn,isp,latency_ms,last_checked
socks4,81.91.157.134,5678,Iran,IR,Tehran,elite,true,43.63,AS206065,Tose'h Fanavari Ertebabat Pasargad Arian Co. PJS,524.67,1780028686.3766932
socks4,80.191.40.130,5678,Iran,IR,Tehran,elite,true,50.85,AS58224,Telecommunication Company of Iran,1448.53,1780028683.6045563
socks4,46.100.47.254,1080,Iran,IR,Tehran,elite,true,7.97,AS58224,Iran Telecommunication Company PJS,477.17,1780028682.364883
socks4,217.219.162.114,5678,Iran,IR,Babol,elite,true,75.78,AS58224,Iran Telecommunication Company PJS,3633.43,1780028681.6935332
socks4,5.160.187.174,1080,Iran,IR,Tehran,elite,true,11.18,AS42337,Respina Networks & Beyond PJSC,647.55,1780028677.466769
socks4,5.160.103.246,8080,Iran,IR,Tehran,elite,true,53.07,AS42337,Respina Networks & Beyond PJSC,542.9,1780028674.7989967
socks4,178.252.149.46,4153,Iran,IR,Tehran,elite,true,7.02,AS51074,GOSTARESH-E-ERTEBATAT-E MABNA COMPANY (Private Joint Stock),19396.23,1780028641.6987872
