protocol,ip,port,country,country_code,city,anonymity,ssl,uptime_percent,asn,isp,latency_ms,last_checked
socks4,46.100.47.254,1080,Iran,IR,Tehran,elite,true,66.4,AS58224,Iran Telecommunication Company PJS,717.1,1780193974.2982647
socks4,80.191.40.131,5678,Iran,IR,Tehran,elite,true,73.93,AS58224,Telecommunication Company of Iran,1470.18,1780193950.72234
socks4,217.219.162.114,5678,Iran,IR,Babol,elite,true,76.4,AS58224,Iran Telecommunication Company PJS,7745.77,1780193950.3805263
socks4,81.91.157.134,5678,Iran,IR,Tehran,elite,true,49.33,AS206065,Tose'h Fanavari Ertebabat Pasargad Arian Co. PJS,440.61,1780193924.6388254
socks4,93.118.135.176,1080,Iran,IR,Tehran,elite,true,33.08,AS58224,Iran Telecommunication Company PJS,7486.58,1780193944.6069386
socks4,5.160.187.174,1080,Iran,IR,Tehran,elite,true,75.55,AS42337,Respina Networks & Beyond PJSC,673.09,1780193997.2562857
