protocol,ip,port,country,country_code,city,anonymity,ssl,uptime_percent,asn,isp,latency_ms,last_checked
socks4,80.191.40.130,5678,Iran,IR,Tehran,elite,true,60.98,AS58224,Telecommunication Company of Iran,416.79,1780063801.3963485
socks4,81.91.157.134,5678,Iran,IR,Tehran,elite,true,47.45,AS206065,Tose'h Fanavari Ertebabat Pasargad Arian Co. PJS,464.27,1780063799.9659047
socks4,46.100.47.254,1080,Iran,IR,Tehran,elite,true,56.84,AS58224,Iran Telecommunication Company PJS,430.24,1780063799.1471794
socks4,217.219.162.114,5678,Iran,IR,Babol,elite,true,76.83,AS58224,Iran Telecommunication Company PJS,1887.47,1780063794.977321
socks4,5.160.187.174,1080,Iran,IR,Tehran,elite,true,62.91,AS42337,Respina Networks & Beyond PJSC,8086.33,1780063794.4117663
socks4,5.160.103.246,8080,Iran,IR,Tehran,elite,true,58.14,AS42337,Respina Networks & Beyond PJSC,501.77,1780063793.4363205
socks4,178.252.149.46,4153,Iran,IR,Tehran,elite,true,7.97,AS51074,GOSTARESH-E-ERTEBATAT-E MABNA COMPANY (Private Joint Stock),5625.67,1780063763.5758047
