protocol,ip,port,country,country_code,city,anonymity,ssl,uptime_percent,asn,isp,latency_ms,last_checked
socks4,5.160.187.174,1080,Iran,IR,Tehran,elite,true,73.59,AS42337,Respina Networks & Beyond PJSC,794.0,1780154088.7282424
socks4,81.91.157.134,5678,Iran,IR,Tehran,elite,true,50.23,AS206065,Tose'h Fanavari Ertebabat Pasargad Arian Co. PJS,483.04,1780154087.9110746
socks4,93.118.135.176,1080,Iran,IR,Tehran,elite,true,32.23,AS58224,Iran Telecommunication Company PJS,7622.48,1780154082.224877
socks4,78.38.67.95,4153,Iran,IR,Tehran,elite,true,29.7,AS58224,Iran Telecommunication Company PJS,7709.19,1780154080.8344204
socks4,217.219.162.114,5678,Iran,IR,Babol,elite,true,75.83,AS58224,Iran Telecommunication Company PJS,1244.52,1780154073.4965017
socks4,80.191.40.130,5678,Iran,IR,Tehran,elite,true,68.18,AS58224,Telecommunication Company of Iran,551.92,1780154042.2977145
