protocol,ip,port,country,country_code,city,anonymity,ssl,uptime_percent,asn,isp,latency_ms,last_checked
socks4,183.88.240.139,4153,Thailand,TH,Pattaya,elite,true,43.68,AS45758,Triple T Broadband Public Company Limited,1412.8,1780177762.50673
socks4,125.25.57.57,4153,Thailand,TH,Bangkok,elite,true,42.89,AS23969,TOT Public Company Limited,2170.36,1780177760.2446125
socks4,159.192.139.42,5678,Thailand,TH,Chon Buri,elite,true,11.78,AS131090,National Telecom Public Company Limited,1200.65,1780177758.3993702
socks4,110.77.236.192,4145,Thailand,TH,Bangkok,elite,true,67.1,AS131090,National Telecom Public Company Limited,1082.76,1780177755.698809
socks4,125.26.4.197,4145,Thailand,TH,Khwaeng Thung Song Hong,elite,true,11.84,AS23969,TOT Public Company Limited,4053.83,1780177745.756049
socks4,49.229.36.211,4153,Thailand,TH,Bangkok,elite,true,16.38,AS45458,AIS-Corporate,4077.68,1780177802.4106083
