protocol,ip,port,country,country_code,city,anonymity,ssl,uptime_percent,asn,isp,latency_ms,last_checked
socks4,183.88.240.139,4153,Thailand,TH,Pattaya,elite,true,43.27,AS45758,Triple T Broadband Public Company Limited,1996.69,1780130341.7724242
socks4,159.192.139.42,5678,Thailand,TH,Chon Buri,elite,true,11.56,AS131090,National Telecom Public Company Limited,2185.55,1780130334.2151158
socks4,125.25.57.57,4153,Thailand,TH,Bangkok,elite,true,42.35,AS23969,TOT Public Company Limited,863.78,1780130332.8883324
socks4,125.26.4.197,4145,Thailand,TH,Khwaeng Thung Song Hong,elite,true,11.65,AS23969,TOT Public Company Limited,7976.74,1780130330.3665178
socks4,159.192.121.240,4145,Thailand,TH,Bang Khae,elite,true,11.78,AS131090,National Telecom Public Company Limited,1105.22,1780130328.8917785
socks4,1.179.151.165,31948,Thailand,TH,Ban Phru Nai,elite,true,10.33,AS131293,TOT Public Company Limited,4056.49,1780130328.5795915
