protocol,ip,port,country,country_code,city,anonymity,ssl,uptime_percent,asn,isp,latency_ms,last_checked
socks4,49.229.36.214,4153,Thailand,TH,Bangkok,elite,true,16.12,AS45458,AIS-Corporate,1936.86,1780115340.3951192
socks4,1.179.172.45,31225,Thailand,TH,Bangkok,elite,true,15.04,AS131293,TOT Public Company Limited,2042.21,1780115335.6695561
socks4,183.88.240.139,4153,Thailand,TH,Pattaya,elite,true,43.11,AS45758,Triple T Broadband Public Company Limited,4013.56,1780115334.3742704
socks4,159.192.139.42,5678,Thailand,TH,Chon Buri,elite,true,11.48,AS131090,National Telecom Public Company Limited,1194.73,1780115332.7212844
socks4,182.53.96.56,4145,Thailand,TH,Khwaeng Thung Song Hong,elite,true,11.15,AS23969,TOT Public Company Limited,802.46,1780115321.7983856
socks4,125.25.57.57,4153,Thailand,TH,Bangkok,elite,true,42.11,AS23969,TOT Public Company Limited,1882.2,1780115321.5092082
socks4,1.179.151.165,31948,Thailand,TH,Ban Phru Nai,elite,true,10.28,AS131293,TOT Public Company Limited,4052.33,1780115316.4561355
