protocol,ip,port,country,country_code,city,anonymity,ssl,uptime_percent,asn,isp,latency_ms,last_checked
socks4,182.53.96.56,4145,Thailand,TH,Khwaeng Thung Song Hong,elite,true,11.02,AS23969,TOT Public Company Limited,816.4,1780082391.2772388
socks4,1.179.172.45,31225,Thailand,TH,Bangkok,elite,true,14.92,AS131293,TOT Public Company Limited,4025.32,1780082382.6494815
socks4,125.26.4.197,4145,Thailand,TH,Khwaeng Thung Song Hong,elite,true,11.41,AS23969,TOT Public Company Limited,3895.21,1780082380.658666
socks4,125.25.57.57,4153,Thailand,TH,Bangkok,elite,true,41.77,AS23969,TOT Public Company Limited,3958.1,1780082375.597665
socks4,159.192.139.42,5678,Thailand,TH,Chon Buri,elite,true,11.35,AS131090,National Telecom Public Company Limited,8407.85,1780082370.3758526
