protocol,ip,port,country,country_code,city,anonymity,ssl,uptime_percent,asn,isp,latency_ms,last_checked
socks4,1.179.172.45,31225,Thailand,TH,Bangkok,elite,true,14.68,AS131293,TOT Public Company Limited,2049.05,1780022362.3744817
socks4,183.88.240.139,4153,Thailand,TH,Pattaya,elite,true,42.15,AS45758,Triple T Broadband Public Company Limited,1018.5,1780022361.3171844
socks4,159.192.139.42,5678,Thailand,TH,Chon Buri,elite,true,11.06,AS131090,National Telecom Public Company Limited,1177.04,1780022359.0097945
socks4,118.172.47.97,51327,Thailand,TH,Tha Kham,elite,true,8.47,AS23969,TOT Public Company Limited,8142.37,1780022349.38303
socks4,1.179.151.165,31948,Thailand,TH,Ban Phru Nai,elite,true,9.97,AS131293,TOT Public Company Limited,2132.14,1780022348.3372636
socks4,182.53.96.56,4145,Thailand,TH,Khwaeng Thung Song Hong,elite,true,10.77,AS23969,TOT Public Company Limited,8033.09,1780022325.1189375
