protocol,ip,port,country,country_code,city,anonymity,ssl,uptime_percent,asn,isp,latency_ms,last_checked
socks4,159.192.139.42,5678,Thailand,TH,Chon Buri,elite,true,11.34,AS131090,National Telecom Public Company Limited,1119.39,1780078786.3762517
socks4,182.53.96.56,4145,Thailand,TH,Khwaeng Thung Song Hong,elite,true,11.0,AS23969,TOT Public Company Limited,798.7,1780078781.3852615
socks4,1.179.172.45,31225,Thailand,TH,Bangkok,elite,true,14.9,AS131293,TOT Public Company Limited,2076.14,1780078781.2857895
socks4,49.229.36.214,4153,Thailand,TH,Bangkok,elite,true,15.85,AS45458,AIS-Corporate,4005.82,1780078773.6794543
socks4,1.20.235.153,5678,Thailand,TH,Buriram,elite,true,50.29,AS23969,TOT Public Company Limited,1818.23,1780078769.2832775
socks4,1.179.151.165,31948,Thailand,TH,Ban Phru Nai,elite,true,10.16,AS131293,TOT Public Company Limited,2033.54,1780078764.2935264
socks4,183.88.240.139,4153,Thailand,TH,Pattaya,elite,true,42.59,AS45758,Triple T Broadband Public Company Limited,4041.46,1780078761.725315
