protocol,ip,port,country,country_code,city,anonymity,ssl,uptime_percent,asn,isp,latency_ms,last_checked
socks4,1.179.151.165,31948,Thailand,TH,Ban Phru Nai,elite,true,9.86,AS131293,TOT Public Company Limited,2011.89,1779991197.7110965
socks4,118.172.47.97,51327,Thailand,TH,Tha Kham,elite,true,8.38,AS23969,TOT Public Company Limited,1839.55,1779991189.8371859
socks4,183.88.240.139,4153,Thailand,TH,Pattaya,elite,true,41.69,AS45758,Triple T Broadband Public Company Limited,8244.7,1779991187.857568
socks4,1.179.172.45,31225,Thailand,TH,Bangkok,elite,true,14.57,AS131293,TOT Public Company Limited,4067.91,1779991184.5456507
socks4,182.53.96.56,4145,Thailand,TH,Khwaeng Thung Song Hong,elite,true,10.68,AS23969,TOT Public Company Limited,1812.33,1779991174.9492238
