protocol,ip,port,country,country_code,city,anonymity,ssl,uptime_percent,asn,isp,latency_ms,last_checked
socks4,183.88.240.139,4153,Thailand,TH,Pattaya,elite,true,42.51,AS45758,Triple T Broadband Public Company Limited,2022.21,1780066796.920609
socks4,1.20.235.153,5678,Thailand,TH,Buriram,elite,true,50.07,AS23969,TOT Public Company Limited,809.68,1780066795.4932702
socks4,125.26.4.197,4145,Thailand,TH,Khwaeng Thung Song Hong,elite,true,11.33,AS23969,TOT Public Company Limited,3890.28,1780066795.4411998
socks4,1.179.172.45,31225,Thailand,TH,Bangkok,elite,true,14.86,AS131293,TOT Public Company Limited,1102.2,1780066793.573267
socks4,49.229.36.214,4153,Thailand,TH,Bangkok,elite,true,15.75,AS45458,AIS-Corporate,8230.06,1780066783.8371375
socks4,182.53.96.56,4145,Thailand,TH,Khwaeng Thung Song Hong,elite,true,10.94,AS23969,TOT Public Company Limited,1815.48,1780066782.9291131
