protocol,ip,port,country,country_code,city,anonymity,ssl,uptime_percent,asn,isp,latency_ms,last_checked
socks4,1.179.151.165,31948,Thailand,TH,Ban Phru Nai,elite,true,10.1,AS131293,TOT Public Company Limited,2112.3,1780064075.001922
socks4,183.88.240.139,4153,Thailand,TH,Pattaya,elite,true,42.46,AS45758,Triple T Broadband Public Company Limited,1961.2,1780064071.7160256
socks4,118.172.47.97,51327,Thailand,TH,Tha Kham,elite,true,8.62,AS23969,TOT Public Company Limited,834.32,1780064068.5030527
socks4,49.229.36.211,4153,Thailand,TH,Bangkok,elite,true,15.6,AS45458,AIS-Corporate,928.2,1780064065.6893218
socks4,1.20.235.153,5678,Thailand,TH,Buriram,elite,true,50.03,AS23969,TOT Public Company Limited,7879.38,1780064062.242321
socks4,159.192.139.42,5678,Thailand,TH,Chon Buri,elite,true,11.27,AS131090,National Telecom Public Company Limited,2228.35,1780064060.4540393
socks4,49.229.36.214,4153,Thailand,TH,Bangkok,elite,true,15.73,AS45458,AIS-Corporate,979.53,1780064056.3275228
socks4,125.26.4.197,4145,Thailand,TH,Khwaeng Thung Song Hong,elite,true,11.31,AS23969,TOT Public Company Limited,867.0,1780064051.8358305
