protocol,ip,port,country,country_code,city,anonymity,ssl,uptime_percent,asn,isp,latency_ms,last_checked
socks4,1.179.172.45,31225,Thailand,TH,Bangkok,elite,true,14.7,AS131293,TOT Public Company Limited,1015.64,1780026278.8673284
socks4,125.26.4.197,4145,Thailand,TH,Khwaeng Thung Song Hong,elite,true,11.06,AS23969,TOT Public Company Limited,1891.38,1780026262.7636793
socks4,1.179.151.165,31948,Thailand,TH,Ban Phru Nai,elite,true,9.99,AS131293,TOT Public Company Limited,2028.53,1780026255.6652887
socks4,183.88.240.139,4153,Thailand,TH,Pattaya,elite,true,42.2,AS45758,Triple T Broadband Public Company Limited,9434.2,1780026291.6292834
socks4,182.53.96.56,4145,Thailand,TH,Khwaeng Thung Song Hong,elite,true,10.79,AS23969,TOT Public Company Limited,3834.61,1780026279.1804867
socks4,159.192.121.240,4145,Thailand,TH,Bang Khae,elite,true,11.45,AS131090,National Telecom Public Company Limited,2084.18,1780026256.606517
