protocol,ip,port,country,country_code,city,anonymity,ssl,uptime_percent,asn,isp,latency_ms,last_checked
socks4,125.26.4.197,4145,Thailand,TH,Khwaeng Thung Song Hong,elite,true,11.85,AS23969,TOT Public Company Limited,972.24,1780180779.6783829
socks4,110.77.236.192,4145,Thailand,TH,Bangkok,elite,true,72.67,AS131090,National Telecom Public Company Limited,1046.47,1780180767.4072902
socks4,118.172.47.97,51327,Thailand,TH,Tha Kham,elite,true,8.97,AS23969,TOT Public Company Limited,3865.54,1780180765.2572546
socks4,1.179.151.165,31948,Thailand,TH,Ban Phru Nai,elite,true,10.5,AS131293,TOT Public Company Limited,2153.43,1780180764.0017335
socks4,1.179.172.45,31225,Thailand,TH,Bangkok,elite,true,15.3,AS131293,TOT Public Company Limited,8421.73,1780180753.979372
