protocol,ip,port,country,country_code,city,anonymity,ssl,uptime_percent,asn,isp,latency_ms,last_checked
socks4,159.192.121.240,4145,Thailand,TH,Bang Khae,elite,true,11.36,AS131090,National Telecom Public Company Limited,1116.46,1779986400.5711432
socks4,49.229.36.214,4153,Thailand,TH,Bangkok,elite,true,15.39,AS45458,AIS-Corporate,1928.24,1779986397.073626
socks4,125.25.57.57,4153,Thailand,TH,Bangkok,elite,true,40.97,AS23969,TOT Public Company Limited,824.54,1779986396.357162
socks4,1.179.172.45,31225,Thailand,TH,Bangkok,elite,true,14.55,AS131293,TOT Public Company Limited,4042.57,1779986379.3406043
socks4,159.192.139.42,5678,Thailand,TH,Chon Buri,elite,true,10.94,AS131090,National Telecom Public Company Limited,8369.65,1779986377.3736808
socks4,183.88.240.139,4153,Thailand,TH,Pattaya,elite,true,41.67,AS45758,Triple T Broadband Public Company Limited,935.83,1779986372.3924596
