protocol,ip,port,country,country_code,city,anonymity,ssl,uptime_percent,asn,isp,latency_ms,last_checked
http,179.60.53.26,999,Ecuador,EC,Machala,elite,true,13.23,AS52468,Stealth Telecom del Ecuador,7790.09,1780234422.4333022
http,190.12.150.244,999,Ecuador,EC,Quininde,transparent,true,42.57,AS271795,Servitelconet Cia. Ltda.,6385.15,1780234416.6849728
http,186.5.94.206,999,Ecuador,EC,Santo Domingo de los Colorados,transparent,true,72.54,AS27947,Telconet S.A,5022.95,1780234391.7918882
http,200.24.153.79,8080,Ecuador,EC,Cuenca,transparent,true,68.27,AS52468,Negocios Y Telefonia Nedetel S.A,5546.44,1780234375.376416
http,205.235.1.38,999,Ecuador,EC,Guayaquil,transparent,true,45.39,AS23031,Telecu Telecomunicaciones Del Ecuador Telecusa S.A.S.,10482.05,1780234325.8929286
