protocol,ip,port,country,country_code,city,anonymity,ssl,uptime_percent,asn,isp,latency_ms,last_checked
socks4,60.54.19.46,1080,Malaysia,MY,Petaling Jaya,elite,true,15.25,AS4788,TM TECHNOLOGY SERVICES SDN BHD,1040.07,1780109686.303819
http,219.93.101.63,80,Malaysia,MY,Kota Kinabalu,anonymous,false,78.29,AS4788,ADSL Streamyx Telekom Malaysia,624.17,1780109671.3964803
http,219.93.101.60,80,Malaysia,MY,Kota Kinabalu,anonymous,false,80.57,AS4788,ADSL Streamyx Telekom Malaysia,657.76,1780109669.0041358
http,219.93.101.62,80,Malaysia,MY,Kota Kinabalu,anonymous,false,89.91,AS4788,ADSL Streamyx Telekom Malaysia,704.16,1780109656.7298145
socks5,47.250.159.65,443,Malaysia,MY,Kuala Lumpur,elite,true,2.08,AS45102,"Alibaba (US) Technology Co., Ltd.",6539.65,1780109340.0944176
