protocol,ip,port,country,country_code,city,anonymity,ssl,uptime_percent,asn,isp,latency_ms,last_checked
http,219.93.101.63,80,Malaysia,MY,Kota Kinabalu,anonymous,false,78.14,AS4788,ADSL Streamyx Telekom Malaysia,673.56,1780041544.2247496
http,219.93.101.60,80,Malaysia,MY,Kota Kinabalu,anonymous,false,80.49,AS4788,ADSL Streamyx Telekom Malaysia,612.19,1780041526.8352904
http,219.93.101.62,80,Malaysia,MY,Kota Kinabalu,anonymous,false,89.88,AS4788,ADSL Streamyx Telekom Malaysia,660.59,1780041526.6638753
http,175.138.75.137,8080,Malaysia,MY,Kuala Lumpur,transparent,true,8.11,AS4788,TM TECHNOLOGY SERVICES SDN BHD,3152.19,1780041475.6759543
socks5,47.250.159.65,18081,Malaysia,MY,Kuala Lumpur,elite,true,2.22,AS45102,"Alibaba (US) Technology Co., Ltd.",6372.92,1780041239.4466465
