protocol,ip,port,country,country_code,city,anonymity,ssl,uptime_percent,asn,isp,latency_ms,last_checked
http,43.155.208.105,80,South Korea,KR,Seoul,elite,true,98.31,AS132203,Shenzhen Tencent Computer Systems Company Limited,742.33,1780071286.2265618
http,1.231.81.166,3128,South Korea,KR,Jongno-gu,transparent,true,94.13,AS9318,SK Broadband Co Ltd,1029.48,1780071275.9165394
http,8.213.151.128,3128,South Korea,KR,Seoul,elite,true,90.33,AS45102,"Alibaba (US) Technology Co., Ltd.",681.27,1780071175.1088543
http,43.155.238.7,3128,South Korea,KR,Seoul,transparent,true,38.01,AS132203,Shenzhen Tencent Computer Systems Company Limited,715.58,1780071284.931605
http,210.223.44.230,3128,South Korea,KR,Seoul,anonymous,true,77.95,AS4766,Korea Telecom,4287.84,1780071208.9784741
