protocol,ip,port,country,country_code,city,anonymity,ssl,uptime_percent,asn,isp,latency_ms,last_checked
http,43.155.208.105,80,South Korea,KR,Seoul,elite,true,98.33,AS132203,Shenzhen Tencent Computer Systems Company Limited,744.68,1780103308.9768827
http,8.213.134.213,8889,South Korea,KR,Seoul,elite,true,0.85,AS45102,"Alibaba (US) Technology Co., Ltd.",2454.64,1780103306.4571214
http,1.231.81.166,3128,South Korea,KR,Jongno-gu,transparent,true,94.14,AS9318,SK Broadband Co Ltd,1770.89,1780103293.9443002
http,8.213.151.128,3128,South Korea,KR,Seoul,elite,true,90.34,AS45102,"Alibaba (US) Technology Co., Ltd.",680.36,1780103283.3744094
http,210.223.44.230,3128,South Korea,KR,Seoul,anonymous,true,77.95,AS4766,Korea Telecom,8242.21,1780103343.811848
