protocol,ip,port,country,country_code,city,anonymity,ssl,uptime_percent,asn,isp,latency_ms,last_checked
http,43.155.238.7,3128,South Korea,KR,Seoul,transparent,true,36.95,AS132203,Shenzhen Tencent Computer Systems Company Limited,11960.55,1780150435.4798205
http,1.231.81.166,3128,South Korea,KR,Jongno-gu,transparent,true,94.17,AS9318,SK Broadband Co Ltd,1004.53,1780150431.3564882
http,8.213.134.213,5060,South Korea,KR,Seoul,elite,true,0.6,AS45102,"Alibaba (US) Technology Co., Ltd.",3455.69,1780150385.4941044
http,175.194.173.105,3128,South Korea,KR,Goyang-si,elite,true,13.23,AS4766,Korea Telecom,4161.82,1780150378.5598698
http,8.220.205.172,30001,South Korea,KR,Seoul,elite,true,0.83,AS45102,"Alibaba (US) Technology Co., Ltd.",2448.03,1780150360.0159998
