protocol,ip,port,country,country_code,city,anonymity,ssl,uptime_percent,asn,isp,latency_ms,last_checked
http,1.231.81.166,3128,South Korea,KR,Jongno-gu,transparent,true,94.18,AS9318,SK Broadband Co Ltd,4466.8,1780178940.4638143
http,8.213.151.128,3128,South Korea,KR,Seoul,elite,true,90.36,AS45102,"Alibaba (US) Technology Co., Ltd.",673.53,1780178867.6345096
http,43.155.208.105,80,South Korea,KR,Seoul,elite,true,97.29,AS132203,Shenzhen Tencent Computer Systems Company Limited,5252.56,1780178826.3139694
http,43.128.145.26,1080,South Korea,KR,Seoul,elite,true,96.59,AS132203,Shenzhen Tencent Computer Systems Company Limited,1088.45,1780178969.9442568
http,106.10.55.212,1121,South Korea,KR,Seongnam-si,transparent,true,32.8,AS135354,NAVER Cloud Corp,935.71,1780178937.915215
