protocol,ip,port,country,country_code,city,anonymity,ssl,uptime_percent,asn,isp,latency_ms,last_checked
http,8.213.151.128,3128,South Korea,KR,Seoul,elite,true,90.34,AS45102,"Alibaba (US) Technology Co., Ltd.",1168.87,1780103950.5543137
http,43.128.145.26,1080,South Korea,KR,Seoul,elite,true,98.25,AS132203,Shenzhen Tencent Computer Systems Company Limited,4203.95,1780103948.766186
http,43.155.208.105,80,South Korea,KR,Seoul,elite,true,98.31,AS132203,Shenzhen Tencent Computer Systems Company Limited,3167.56,1780103933.1122074
http,1.231.81.166,3128,South Korea,KR,Jongno-gu,transparent,true,94.14,AS9318,SK Broadband Co Ltd,7651.05,1780103895.9496713
http,8.213.128.6,111,South Korea,KR,Seoul,elite,true,0.92,AS45102,"Alibaba (US) Technology Co., Ltd.",9507.13,1780103843.8277228
http,210.223.44.230,3128,South Korea,KR,Seoul,anonymous,true,77.95,AS4766,Korea Telecom,1015.24,1780103973.7198513
