protocol,ip,port,country,country_code,city,anonymity,ssl,uptime_percent,asn,isp,latency_ms,last_checked
http,43.155.208.105,80,South Korea,KR,Seoul,elite,true,98.33,AS132203,Shenzhen Tencent Computer Systems Company Limited,751.88,1780065581.7796843
http,1.231.81.166,3128,South Korea,KR,Jongno-gu,transparent,true,94.12,AS9318,SK Broadband Co Ltd,940.71,1780065574.2638605
http,8.213.128.6,888,South Korea,KR,Seoul,elite,true,0.95,AS45102,"Alibaba (US) Technology Co., Ltd.",5501.31,1780065569.3719053
http,43.155.206.118,3128,South Korea,KR,Seoul,transparent,true,41.91,AS132203,Shenzhen Tencent Computer Systems Company Limited,3499.61,1780065565.2811537
http,43.128.145.26,1080,South Korea,KR,Seoul,elite,true,98.67,AS132203,Shenzhen Tencent Computer Systems Company Limited,741.17,1780065559.4234004
http,125.129.15.95,3128,South Korea,KR,Seongdong-gu,elite,true,36.97,AS4766,Korea Telecom,1024.31,1780065548.0238974
http,210.223.44.230,3128,South Korea,KR,Seoul,anonymous,true,77.94,AS4766,Korea Telecom,2913.64,1780065603.4667265
