protocol,ip,port,country,country_code,city,anonymity,ssl,uptime_percent,asn,isp,latency_ms,last_checked
http,1.231.81.166,3128,South Korea,KR,Jongno-gu,transparent,true,94.12,AS9318,SK Broadband Co Ltd,1020.53,1780064989.4024632
http,8.213.151.128,3128,South Korea,KR,Seoul,elite,true,90.32,AS45102,"Alibaba (US) Technology Co., Ltd.",682.91,1780064986.2095523
http,43.155.208.105,80,South Korea,KR,Seoul,elite,true,98.33,AS132203,Shenzhen Tencent Computer Systems Company Limited,1164.63,1780064953.2675612
http,43.128.145.26,1080,South Korea,KR,Seoul,elite,true,98.67,AS132203,Shenzhen Tencent Computer Systems Company Limited,1513.37,1780064916.2266958
http,43.155.238.7,3128,South Korea,KR,Seoul,transparent,true,37.75,AS132203,Shenzhen Tencent Computer Systems Company Limited,11943.03,1780064913.619227
http,210.223.44.230,3128,South Korea,KR,Seoul,anonymous,true,77.94,AS4766,Korea Telecom,1157.79,1780064930.688091
