protocol,ip,port,country,country_code,city,anonymity,ssl,uptime_percent,asn,isp,latency_ms,last_checked
http,8.213.151.128,3128,South Korea,KR,Seoul,elite,true,90.33,AS45102,"Alibaba (US) Technology Co., Ltd.",671.6,1780083579.3007443
http,43.128.145.26,1080,South Korea,KR,Seoul,elite,true,98.46,AS132203,Shenzhen Tencent Computer Systems Company Limited,740.3,1780083568.1891181
http,43.155.208.105,80,South Korea,KR,Seoul,elite,true,98.23,AS132203,Shenzhen Tencent Computer Systems Company Limited,7951.48,1780083565.4613857
http,121.135.144.141,8099,South Korea,KR,Seocho-gu,elite,true,9.72,AS4766,Korea Telecom,12574.9,1780083547.5038493
http,1.231.81.166,3128,South Korea,KR,Jongno-gu,transparent,true,94.13,AS9318,SK Broadband Co Ltd,5683.77,1780083534.043665
