protocol,ip,port,country,country_code,city,anonymity,ssl,uptime_percent,asn,isp,latency_ms,last_checked
http,8.213.151.128,3128,South Korea,KR,Seoul,elite,true,90.36,AS45102,"Alibaba (US) Technology Co., Ltd.",675.35,1780192201.5955572
http,1.231.81.166,3128,South Korea,KR,Jongno-gu,transparent,true,94.18,AS9318,SK Broadband Co Ltd,4110.62,1780192146.285716
http,43.128.145.26,1080,South Korea,KR,Seoul,elite,true,96.63,AS132203,Shenzhen Tencent Computer Systems Company Limited,798.68,1780192088.2846043
http,43.155.238.7,3128,South Korea,KR,Seoul,transparent,true,36.9,AS132203,Shenzhen Tencent Computer Systems Company Limited,748.0,1780192147.8234565
http,106.10.55.212,1121,South Korea,KR,Seongnam-si,transparent,true,32.98,AS135354,NAVER Cloud Corp,999.43,1780192114.8892682
http,43.155.208.105,80,South Korea,KR,Seoul,elite,true,97.36,AS132203,Shenzhen Tencent Computer Systems Company Limited,758.29,1780192103.3204122
