protocol,ip,port,country,country_code,city,anonymity,ssl,uptime_percent,asn,isp,latency_ms,last_checked
http,125.25.33.181,8080,Thailand,TH,Bangkok,transparent,false,35.69,AS23969,TOT Public Company Limited,5431.98,1780161815.0598464
http,118.172.184.25,8180,Thailand,TH,Chiang Mai,transparent,false,4.63,AS23969,TOT Public Company Limited,10048.46,1780161795.2292619
http,182.53.143.200,8180,Thailand,TH,Ko Kut,transparent,false,4.98,AS23969,TOT Public Company Limited,4959.76,1780161738.2881434
http,183.88.212.184,8080,Thailand,TH,Pattaya,transparent,false,5.44,AS45758,Triple T Broadband Public Company Limited,4565.8,1780161726.9319777
http,183.88.213.178,8080,Thailand,TH,Phanom Sarakham,transparent,true,14.28,AS45758,Triple T Broadband Public Company Limited,1947.8,1780161711.4593725
http,161.82.141.220,8080,Thailand,TH,Pattaya,transparent,false,3.47,AS132280,Symphony Communication Public Company Limited,1955.04,1780161698.7121024
http,110.49.53.69,8081,Thailand,TH,Bangkok,transparent,false,5.23,AS45458,Advanced Wireless Network Company Limited,4534.45,1780161664.39841
http,203.172.225.227,8080,Thailand,TH,Pom Prap Sattru Phai,transparent,false,9.83,AS23974,Ministry of Education - EMISC,3818.16,1780161885.5279315
http,106.0.168.138,8080,Thailand,TH,Siao,transparent,true,9.63,AS23974,Ministry of Education - EMISC,3605.11,1780161855.2359233
http,202.28.194.139,31280,Thailand,TH,Ratchathewi,elite,true,99.91,AS4621,Office of Info.Tech. Admin. for Educational Development,586.42,1780161813.1740384
