protocol,ip,port,country,country_code,city,anonymity,ssl,uptime_percent,asn,isp,latency_ms,last_checked
http,8.213.195.191,10000,Thailand,TH,Bangkok,elite,true,0.8,AS45102,Alibaba Cloud (Singapore) Private Limited,2402.8,1779982774.701202
http,184.82.161.85,8080,Thailand,TH,Roi Et,transparent,true,49.84,AS133481,AIS-Fibre,2471.28,1779982772.3839257
http,43.251.205.146,8080,Thailand,TH,Bangkok,transparent,true,37.19,AS134100,"United Information Highway Co., Ltd.",2566.8,1779982766.6850743
http,202.29.215.78,8080,Thailand,TH,Ratchathewi,transparent,false,9.92,AS4621,Office of Info.Tech. Admin. for Educational Development,7787.7,1779982756.3307986
http,110.49.34.126,32650,Thailand,TH,Chon Buri,elite,false,5.87,AS45458,Advanced Wireless Network Company Limited,8143.29,1779982744.632989
http,184.22.131.209,8080,Thailand,TH,Bangkok,transparent,false,35.63,AS133481,AIS-Fibre,2873.24,1779982742.4999442
http,182.53.143.200,8180,Thailand,TH,Ko Kut,transparent,false,4.96,AS23969,TOT Public Company Limited,5324.51,1779982729.6369019
http,106.0.168.138,8080,Thailand,TH,Siao,transparent,false,9.57,AS23974,Ministry of Education - EMISC,3644.19,1779982720.0628276
http,8.213.222.247,18081,Thailand,TH,Bangkok,elite,false,0.69,AS45102,"Alibaba (US) Technology Co., Ltd.",2388.78,1779982713.6602159
http,8.213.222.247,8443,Thailand,TH,Bangkok,elite,true,0.83,AS45102,"Alibaba (US) Technology Co., Ltd.",2394.01,1779982703.63714
http,183.88.231.188,34599,Thailand,TH,Bangkok,transparent,false,7.27,AS45758,Triple T Broadband Public Company Limited,5574.8,1779982697.430403
http,183.88.213.178,8080,Thailand,TH,Phanom Sarakham,transparent,false,14.16,AS45758,Triple T Broadband Public Company Limited,2675.61,1779982667.321899
http,202.28.194.139,31280,Thailand,TH,Ratchathewi,elite,true,99.92,AS4621,Office of Info.Tech. Admin. for Educational Development,601.97,1779982773.1088238
http,203.172.225.227,8080,Thailand,TH,Pom Prap Sattru Phai,transparent,false,9.77,AS23974,Ministry of Education - EMISC,1711.77,1779982772.4392629
http,203.150.128.25,8080,Thailand,TH,Bangkok,transparent,false,2.58,AS4618,Internet Thailand Company Ltd,4139.61,1779982731.4767554
http,203.150.128.57,8080,Thailand,TH,Bangkok,transparent,true,49.11,AS4618,Internet Thailand Company Ltd,4226.11,1779982687.427381
