protocol,ip,port,country,country_code,city,anonymity,ssl,uptime_percent,asn,isp,latency_ms,last_checked
http,223.207.103.99,8080,Thailand,TH,Udon Thani,transparent,true,16.43,AS45758,Triple T Broadband Public Company Limited,4105.56,1780127368.8881521
http,182.52.66.38,8080,Thailand,TH,Bangkok,transparent,false,15.09,AS23969,TOT Public Company Limited,5862.92,1780127366.4918208
http,118.173.107.123,8080,Thailand,TH,Nakhon Phanom,transparent,false,21.74,AS23969,TOT Public Company Limited,4864.31,1780127358.723805
http,49.48.66.22,8080,Thailand,TH,Prasat,transparent,false,31.7,AS45758,Triple T Broadband Public Company Limited,4718.91,1780127350.7789423
http,61.19.30.194,8188,Thailand,TH,Khlong San,transparent,false,34.32,AS9931,Data Comm. Dept. National Telecom Public Company Limited,21383.27,1780127333.2918696
http,43.251.205.146,8080,Thailand,TH,Bangkok,transparent,false,37.04,AS134100,"United Information Highway Co., Ltd.",2047.8,1780127290.5354884
http,1.0.171.213,8080,Thailand,TH,Phuket,transparent,false,6.78,AS23969,TOT Public Company Limited,5692.41,1780127286.8242095
http,202.28.194.139,31280,Thailand,TH,Ratchathewi,elite,true,99.92,AS4621,Office of Info.Tech. Admin. for Educational Development,623.24,1780127390.3922803
