protocol,ip,port,country,country_code,city,anonymity,ssl,uptime_percent,asn,isp,latency_ms,last_checked
http,202.28.194.139,31280,Thailand,TH,Ratchathewi,elite,true,99.92,AS4621,Office of Info.Tech. Admin. for Educational Development,562.23,1780115334.5833216
http,1.1.220.100,8080,Thailand,TH,Nan,transparent,false,6.79,AS23969,TOT Public Company Limited,14888.5,1780115314.8078098
http,110.164.128.124,8080,Thailand,TH,Lak Si,transparent,false,12.89,AS45758,Triple T Broadband Public Company Limited,2441.17,1780115314.6289003
http,113.53.60.22,8080,Thailand,TH,Pattaya,transparent,false,12.28,AS23969,TOT Public Company Limited,14221.38,1780115304.663762
http,202.183.236.219,8080,Thailand,TH,Sikao,transparent,false,10.02,AS45458,Advanced Wireless Network Company Limited,555.31,1780115299.8078825
http,203.150.128.242,8080,Thailand,TH,Bangkok,transparent,false,39.63,AS4618,Internet Thailand Company Ltd,3034.4,1780115298.7878482
http,182.53.202.208,8080,Thailand,TH,Chiang Mai,anonymous,false,17.92,AS23969,TOT Public Company Limited,5502.84,1780115251.334025
http,110.171.40.132,8080,Thailand,TH,Bangkok,transparent,false,7.01,AS17552,True Internet Corporation CO. Ltd.,1675.21,1780115229.4547687
http,101.109.42.253,8080,Thailand,TH,Bangkok,transparent,false,38.07,AS23969,TOT Public Company Limited,760.11,1780115227.455955
http,203.150.166.170,8080,Thailand,TH,Khon Kaen,transparent,false,4.72,AS4618,Internet Thailand Company Ltd.,7726.65,1780115310.584056
