protocol,ip,port,country,country_code,city,anonymity,ssl,uptime_percent,asn,isp,latency_ms,last_checked
http,202.28.194.139,31280,Thailand,TH,Ratchathewi,elite,true,99.92,AS4621,Office of Info.Tech. Admin. for Educational Development,566.27,1779961765.8804197
http,8.213.195.191,202,Thailand,TH,Bangkok,elite,false,0.87,AS45102,Alibaba Cloud (Singapore) Private Limited,4066.25,1779961759.6356397
http,43.251.205.146,8080,Thailand,TH,Bangkok,transparent,false,37.11,AS134100,"United Information Highway Co., Ltd.",8132.01,1779961738.4580157
http,203.150.172.151,8080,Thailand,TH,Ban Lam Luk Ka,transparent,false,5.14,AS4618,Internet Thailand Company Ltd.,4523.29,1779961736.8818905
http,184.22.131.209,8080,Thailand,TH,Bangkok,transparent,true,35.75,AS133481,AIS-Fibre,4288.47,1779961721.5078561
http,118.174.112.182,8080,Thailand,TH,Lampang,transparent,false,68.75,AS23969,TOT Public Company Limited,4885.67,1779961699.5350454
http,8.213.197.208,1337,Thailand,TH,Bangkok,elite,false,0.91,AS45102,"Alibaba (US) Technology Co., Ltd.",2390.37,1779961693.5897393
http,125.25.33.181,8080,Thailand,TH,Bangkok,transparent,false,43.33,AS23969,TOT Public Company Limited,1961.1,1779961668.463872
http,8.213.197.208,5060,Thailand,TH,Bangkok,elite,true,0.79,AS45102,"Alibaba (US) Technology Co., Ltd.",2407.65,1779961634.3946695
