protocol,ip,port,country,country_code,city,anonymity,ssl,uptime_percent,asn,isp,latency_ms,last_checked
http,202.28.194.139,31280,Thailand,TH,Ratchathewi,elite,true,99.91,AS4621,Office of Info.Tech. Admin. for Educational Development,563.49,1780153769.2638278
http,182.52.233.54,8080,Thailand,TH,Khwaeng Thung Song Hong,transparent,true,39.55,AS23969,TOT Public Company Limited,3652.99,1780153758.222234
http,101.109.42.253,8080,Thailand,TH,Bangkok,transparent,false,40.17,AS23969,TOT Public Company Limited,3942.55,1780153745.3303447
http,183.88.213.178,8080,Thailand,TH,Phanom Sarakham,transparent,false,14.27,AS45758,Triple T Broadband Public Company Limited,2557.37,1780153745.0609663
http,125.27.192.162,8081,Thailand,TH,Khwaeng Thung Song Hong,transparent,false,11.21,AS23974,TOT Public Company Limited,4641.45,1780153743.2599506
http,43.251.205.146,8080,Thailand,TH,Bangkok,transparent,true,37.08,AS134100,"United Information Highway Co., Ltd.",1690.09,1780153732.4297817
http,49.48.66.22,8080,Thailand,TH,Prasat,transparent,false,31.77,AS45758,Triple T Broadband Public Company Limited,3178.89,1780153709.3992894
http,61.19.145.66,8080,Thailand,TH,Khlong San,transparent,false,5.34,AS9931,National Telecom Public Company Limited,6940.05,1780153670.2770293
http,101.51.131.47,8080,Thailand,TH,Nakhon Pathom,transparent,false,33.88,AS23969,TOT Public Company Limited,9669.0,1780153663.595853
http,183.88.214.84,8080,Thailand,TH,Nakhon Ratchasima,transparent,false,8.79,AS45758,Triple T Broadband Public Company Limited,9469.1,1780153647.6220386
http,124.122.115.165,8080,Thailand,TH,Bangkok,transparent,false,13.45,AS17552,"True Internet Co., Ltd.",9560.51,1780153647.3345315
http,81.31.234.70,80,Thailand,TH,Bangkok,transparent,false,7.71,AS149766,Y.U.T Corporate Company Limited,4082.15,1780153642.1878357
http,106.0.168.138,8080,Thailand,TH,Siao,transparent,false,9.63,AS23974,Ministry of Education - EMISC,3832.36,1780153765.6799595
http,203.172.201.226,8080,Thailand,TH,Yasothon,transparent,true,7.72,AS23974,Ministry of Education - EMISC,3595.89,1780153744.7804513
http,203.150.166.174,8080,Thailand,TH,Khon Kaen,transparent,true,4.69,AS4618,Internet Thailand Company Ltd.,20538.51,1780153642.2271473
