protocol,ip,port,country,country_code,city,anonymity,ssl,uptime_percent,asn,isp,latency_ms,last_checked
http,171.7.35.183,8080,Thailand,TH,Bangkok,transparent,false,36.18,AS45758,Triple T Broadband Public Company Limited,6287.19,1780064367.465516
http,8.213.222.247,20000,Thailand,TH,Bangkok,elite,false,0.63,AS45102,"Alibaba (US) Technology Co., Ltd.",2385.68,1780064360.5742476
http,8.213.222.247,8443,Thailand,TH,Bangkok,elite,false,0.83,AS45102,"Alibaba (US) Technology Co., Ltd.",2388.37,1780064358.3720496
http,125.27.192.162,8081,Thailand,TH,Khwaeng Thung Song Hong,transparent,false,11.17,AS23974,TOT Public Company Limited,2748.87,1780064357.0656524
http,150.95.26.146,7080,Thailand,TH,Bangkok,elite,true,9.06,AS135161,GMO-Z.COM PTE. LTD.,13172.67,1780064349.835078
http,61.19.30.194,8188,Thailand,TH,Khlong San,transparent,false,34.7,AS9931,Data Comm. Dept. National Telecom Public Company Limited,6711.06,1780064283.2031863
http,180.180.175.11,8080,Thailand,TH,Krathum Baen,transparent,false,10.48,AS23969,TOT Public Company Limited,10610.55,1780064238.7918148
http,150.107.29.165,3128,Thailand,TH,On Nut,transparent,false,5.71,AS136523,POPIDC,16783.24,1780064235.2518315
http,49.48.71.119,8080,Thailand,TH,Prasat,transparent,false,26.61,AS45758,Triple T Broadband Public Company Limited,2883.91,1780064227.4318566
http,202.28.194.139,31280,Thailand,TH,Ratchathewi,elite,true,99.91,AS4621,Office of Info.Tech. Admin. for Educational Development,591.01,1780064389.7954328
http,203.150.128.242,8080,Thailand,TH,Bangkok,transparent,false,44.72,AS4618,Internet Thailand Company Ltd,5761.78,1780064310.5613234
http,106.0.168.138,8080,Thailand,TH,Siao,transparent,false,9.6,AS23974,Ministry of Education - EMISC,8178.49,1780064266.3254254
