protocol,ip,port,country,country_code,city,anonymity,ssl,uptime_percent,asn,isp,latency_ms,last_checked
http,150.95.26.146,7080,Thailand,TH,Bangkok,elite,true,9.06,AS135161,GMO-Z.COM PTE. LTD.,14927.18,1780067345.9905267
http,61.19.30.194,8188,Thailand,TH,Khlong San,transparent,true,34.78,AS9931,Data Comm. Dept. National Telecom Public Company Limited,584.71,1780067335.5020132
http,110.171.40.132,8080,Thailand,TH,Bangkok,transparent,false,6.99,AS17552,True Internet Corporation CO. Ltd.,9042.3,1780067316.639881
http,118.175.30.26,8080,Thailand,TH,Khwaeng Thung Song Hong,transparent,true,9.44,AS131293,TOT Public Company Limited,5605.12,1780067311.5468717
http,49.48.66.22,8080,Thailand,TH,Prasat,transparent,false,32.13,AS45758,Triple T Broadband Public Company Limited,4327.61,1780067306.1160233
http,223.205.28.151,8080,Thailand,TH,Pattaya,transparent,true,59.53,AS45758,Triple T Broadband Public Company Limited,3648.51,1780067293.7298734
http,182.52.233.54,8080,Thailand,TH,Khwaeng Thung Song Hong,transparent,false,42.55,AS23969,TOT Public Company Limited,4848.09,1780067278.819922
http,81.31.234.70,80,Thailand,TH,Bangkok,transparent,false,7.67,AS149766,Y.U.T Corporate Company Limited,14230.38,1780067156.9284022
http,202.28.194.139,31280,Thailand,TH,Ratchathewi,elite,true,99.91,AS4621,Office of Info.Tech. Admin. for Educational Development,574.44,1780067385.3342166
http,106.0.168.138,8080,Thailand,TH,Siao,transparent,false,9.6,AS23974,Ministry of Education - EMISC,4728.8,1780067369.9663396
http,182.52.66.38,8080,Thailand,TH,Bangkok,transparent,true,12.54,AS23969,TOT Public Company Limited,10204.49,1780067366.848057
http,203.172.201.226,8080,Thailand,TH,Yasothon,transparent,false,7.7,AS23974,Ministry of Education - EMISC,5213.96,1780067348.428742
http,203.150.128.25,8080,Thailand,TH,Bangkok,transparent,false,20.79,AS4618,Internet Thailand Company Ltd,2692.24,1780067344.1942677
http,203.150.128.155,8080,Thailand,TH,Bangkok,transparent,false,13.4,AS4618,Internet Thailand Company Ltd,1877.6,1780067322.365703
http,203.150.172.151,8080,Thailand,TH,Ban Lam Luk Ka,transparent,false,5.15,AS4618,Internet Thailand Company Ltd.,12852.02,1780067288.2866268
http,203.146.80.98,8080,Thailand,TH,Nong Saeng,transparent,false,23.34,AS45458,Advanced Wireless Network Company Limited,10951.46,1780067247.4839838
