protocol,ip,port,country,country_code,city,anonymity,ssl,uptime_percent,asn,isp,latency_ms,last_checked
http,8.213.222.157,104,Thailand,TH,Bangkok,elite,false,1.01,AS45102,"Alibaba (US) Technology Co., Ltd.",2554.69,1780051173.6362393
http,110.164.128.124,8080,Thailand,TH,Lak Si,transparent,false,12.87,AS45758,Triple T Broadband Public Company Limited,2548.87,1780051173.3460033
http,8.213.222.157,4000,Thailand,TH,Bangkok,elite,false,0.77,AS45102,"Alibaba (US) Technology Co., Ltd.",2843.84,1780051173.29212
http,150.107.29.165,3128,Thailand,TH,On Nut,transparent,true,5.65,AS136523,POPIDC,14099.71,1780051146.1393976
http,49.48.71.119,8080,Thailand,TH,Prasat,transparent,false,26.65,AS45758,Triple T Broadband Public Company Limited,1528.42,1780051144.978803
http,223.204.193.82,8080,Thailand,TH,Pattaya,transparent,false,13.8,AS45758,Triple T Broadband Public Company Limited,4375.65,1780051141.1210313
http,43.251.205.146,8080,Thailand,TH,Bangkok,transparent,false,37.31,AS134100,"United Information Highway Co., Ltd.",6462.31,1780051117.3598454
http,223.204.177.198,3128,Thailand,TH,Pattani,transparent,true,56.13,AS45758,Triple T Broadband Public Company Limited,571.04,1780051116.398955
http,180.180.175.11,8080,Thailand,TH,Krathum Baen,transparent,false,10.46,AS23969,TOT Public Company Limited,3575.16,1780051103.1947894
http,8.213.222.247,18081,Thailand,TH,Bangkok,elite,false,0.69,AS45102,"Alibaba (US) Technology Co., Ltd.",4380.41,1780051095.7309356
http,101.109.119.24,8080,Thailand,TH,Khwaeng Thung Song Hong,transparent,false,5.23,AS23969,TOT Public Company Limited,11574.13,1780051052.3545423
http,150.95.26.146,7080,Thailand,TH,Bangkok,elite,false,9.05,AS135161,GMO-Z.COM PTE. LTD.,7398.34,1780050963.8933523
http,203.150.128.25,8080,Thailand,TH,Bangkok,transparent,true,19.65,AS4618,Internet Thailand Company Ltd,2755.03,1780051173.916078
http,203.172.136.211,8080,Thailand,TH,Hang Dong,transparent,true,9.98,AS23974,Ministry of Education - EMISC,5076.51,1780051153.550601
http,203.150.128.155,8080,Thailand,TH,Bangkok,transparent,true,11.85,AS4618,Internet Thailand Company Ltd,1528.24,1780051145.4038854
http,202.28.194.139,31280,Thailand,TH,Ratchathewi,elite,true,99.91,AS4621,Office of Info.Tech. Admin. for Educational Development,597.32,1780051095.323543
http,203.146.80.98,8080,Thailand,TH,Nong Saeng,transparent,true,23.29,AS45458,Advanced Wireless Network Company Limited,20389.12,1780051051.4376826
http,203.150.172.151,8080,Thailand,TH,Ban Lam Luk Ka,transparent,true,5.15,AS4618,Internet Thailand Company Ltd.,16632.84,1780051023.4752073
