protocol,ip,port,country,country_code,city,anonymity,ssl,uptime_percent,asn,isp,latency_ms,last_checked
http,183.88.231.188,34599,Thailand,TH,Bangkok,transparent,false,7.28,AS45758,Triple T Broadband Public Company Limited,11653.41,1780072469.3360925
http,110.171.40.132,8080,Thailand,TH,Bangkok,transparent,true,7.0,AS17552,True Internet Corporation CO. Ltd.,19068.48,1780072464.927945
http,49.48.68.205,8080,Thailand,TH,Prasat,transparent,true,22.95,AS45758,Triple T Broadband Public Company Limited,586.99,1780072460.2269354
http,180.180.123.40,8080,Thailand,TH,Ratchathewi,transparent,false,3.28,AS23969,TOT Public Company Limited,11484.65,1780072415.392082
http,103.10.228.119,8080,Thailand,TH,Ban Mai Khao,transparent,true,8.11,AS131090,CATBB,6390.72,1780072386.975855
http,49.48.71.119,8080,Thailand,TH,Prasat,transparent,false,26.65,AS45758,Triple T Broadband Public Company Limited,4652.7,1780072352.767833
http,180.180.218.250,8080,Thailand,TH,Rayong,transparent,false,4.96,AS23969,TOT Public Company Limited,7468.97,1780072334.8680794
http,101.109.119.24,8080,Thailand,TH,Khwaeng Thung Song Hong,transparent,false,5.23,AS23969,TOT Public Company Limited,9717.28,1780072328.319628
http,171.7.35.183,8080,Thailand,TH,Bangkok,transparent,false,36.7,AS45758,Triple T Broadband Public Company Limited,6597.5,1780072215.7358193
http,202.28.194.139,31280,Thailand,TH,Ratchathewi,elite,true,99.91,AS4621,Office of Info.Tech. Admin. for Educational Development,551.77,1780072469.208246
http,203.146.80.98,8080,Thailand,TH,Nong Saeng,transparent,false,23.39,AS45458,Advanced Wireless Network Company Limited,7598.55,1780072396.5938482
http,203.172.136.211,8080,Thailand,TH,Hang Dong,transparent,true,10.0,AS23974,Ministry of Education - EMISC,3563.29,1780072351.0198505
