protocol,ip,port,country,country_code,city,anonymity,ssl,uptime_percent,asn,isp,latency_ms,last_checked
http,202.28.194.139,31280,Thailand,TH,Ratchathewi,elite,true,99.92,AS4621,Office of Info.Tech. Admin. for Educational Development,569.2,1779968643.9763477
http,118.174.112.182,8080,Thailand,TH,Lampang,transparent,false,64.38,AS23969,TOT Public Company Limited,1711.09,1779968638.2854133
http,182.53.202.208,8080,Thailand,TH,Chiang Mai,anonymous,true,17.92,AS23969,TOT Public Company Limited,1127.12,1779968624.4990444
http,180.180.218.250,8080,Thailand,TH,Rayong,transparent,false,4.95,AS23969,TOT Public Company Limited,17654.12,1779968624.376197
http,182.53.143.200,8180,Thailand,TH,Ko Kut,transparent,false,4.96,AS23969,TOT Public Company Limited,12352.21,1779968588.5447035
http,8.213.215.187,194,Thailand,TH,Bangkok,elite,false,0.69,AS45102,"Alibaba (US) Technology Co., Ltd.",2398.31,1779968536.9731987
http,183.88.231.188,34599,Thailand,TH,Bangkok,transparent,false,7.27,AS45758,Triple T Broadband Public Company Limited,11299.32,1779968507.8954868
http,202.183.236.218,8080,Thailand,TH,Sikao,transparent,false,12.34,AS45458,Advanced Wireless Network Company Limited,6631.93,1779968426.7358382
