protocol,ip,port,country,country_code,city,anonymity,ssl,uptime_percent,asn,isp,latency_ms,last_checked
http,202.28.194.139,31280,Thailand,TH,Ratchathewi,elite,true,99.91,AS4621,Office of Info.Tech. Admin. for Educational Development,597.73,1780154961.9502563
http,103.10.228.119,8080,Thailand,TH,Ban Mai Khao,transparent,false,8.16,AS131090,CATBB,6889.21,1780154933.6574597
http,223.207.103.99,8080,Thailand,TH,Udon Thani,transparent,false,16.43,AS45758,Triple T Broadband Public Company Limited,3493.92,1780154917.0975986
http,1.0.170.50,8080,Thailand,TH,Phuket,transparent,false,4.82,AS23969,TOT Public Company Limited,7684.9,1780154901.5726008
http,203.146.80.98,8080,Thailand,TH,Nong Saeng,transparent,false,23.51,AS45458,Advanced Wireless Network Company Limited,9464.72,1780154871.6643898
http,203.150.128.242,8080,Thailand,TH,Bangkok,transparent,false,38.16,AS4618,Internet Thailand Company Ltd,4457.23,1780154867.6311436
http,223.204.193.82,8080,Thailand,TH,Pattaya,transparent,true,19.4,AS45758,Triple T Broadband Public Company Limited,2217.66,1780154835.9479623
http,124.122.115.165,8080,Thailand,TH,Bangkok,transparent,false,13.45,AS17552,"True Internet Co., Ltd.",1183.62,1780154788.9495416
