protocol,ip,port,country,country_code,city,anonymity,ssl,uptime_percent,asn,isp,latency_ms,last_checked
http,124.121.58.80,8080,Thailand,TH,Bangkok,transparent,true,80.36,AS17552,TRUEBB,3133.32,1780178368.5838525
http,124.121.182.92,8080,Thailand,TH,Bangkok,transparent,false,62.5,AS17552,TRUE,9610.66,1780178349.3678114
http,125.27.192.162,8081,Thailand,TH,Khwaeng Thung Song Hong,transparent,false,11.23,AS23974,TOT Public Company Limited,4256.71,1780178336.427792
http,223.207.103.99,8080,Thailand,TH,Udon Thani,transparent,true,16.43,AS45758,Triple T Broadband Public Company Limited,2798.08,1780178323.3408568
http,101.109.42.253,8080,Thailand,TH,Bangkok,transparent,false,41.14,AS23969,TOT Public Company Limited,5400.47,1780178296.5771465
http,43.251.205.146,8080,Thailand,TH,Bangkok,transparent,false,37.16,AS134100,"United Information Highway Co., Ltd.",1673.81,1780178296.4878013
http,118.173.107.123,8080,Thailand,TH,Nakhon Phanom,transparent,false,21.97,AS23969,TOT Public Company Limited,6339.42,1780178295.0918896
http,83.118.60.147,8213,Thailand,TH,Bang Rak,anonymous,false,8.2,AS132280,Symphony Communication Public Company Limited,8934.82,1780178286.4757962
http,1.0.171.213,8080,Thailand,TH,Phuket,transparent,false,6.79,AS23969,TOT Public Company Limited,7450.45,1780178274.520494
http,118.175.30.26,8080,Thailand,TH,Khwaeng Thung Song Hong,transparent,false,9.55,AS131293,TOT Public Company Limited,3100.27,1780178263.8814
http,202.28.194.139,31280,Thailand,TH,Ratchathewi,elite,true,99.91,AS4621,Office of Info.Tech. Admin. for Educational Development,598.28,1780178385.9345293
http,203.172.136.211,8080,Thailand,TH,Hang Dong,transparent,false,10.04,AS23974,Ministry of Education - EMISC,10211.26,1780178368.2078319
http,203.146.80.102,8080,Thailand,TH,Nong Saeng,transparent,false,12.88,AS45458,Advanced Wireless Network Company Limited,5519.11,1780178230.40784
http,49.48.205.240,8080,Thailand,TH,Phitsanulok,transparent,true,69.57,AS45758,Triple T Broadband Public Company Limited,2594.28,1780178366.295807
