protocol,ip,port,country,country_code,city,anonymity,ssl,uptime_percent,asn,isp,latency_ms,last_checked
http,182.52.233.54,8080,Thailand,TH,Khwaeng Thung Song Hong,transparent,true,43.24,AS23969,TOT Public Company Limited,12960.4,1780000144.018512
http,182.52.66.38,8080,Thailand,TH,Bangkok,transparent,true,4.11,AS23969,TOT Public Company Limited,4341.57,1780000128.9054346
http,110.49.53.69,8081,Thailand,TH,Bangkok,transparent,false,5.21,AS45458,Advanced Wireless Network Company Limited,5518.36,1780000120.0765371
http,150.107.29.165,3128,Thailand,TH,On Nut,transparent,true,5.45,AS136523,POPIDC,16151.2,1780000050.1217756
http,49.48.71.119,8080,Thailand,TH,Prasat,transparent,false,26.61,AS45758,Triple T Broadband Public Company Limited,3193.73,1780000029.03225
http,101.109.119.24,8080,Thailand,TH,Khwaeng Thung Song Hong,transparent,false,5.22,AS23969,TOT Public Company Limited,5350.41,1780000012.9678888
http,124.122.115.165,8080,Thailand,TH,Bangkok,transparent,false,13.43,AS17552,"True Internet Co., Ltd.",6210.61,1779999950.2782907
http,202.28.194.139,31280,Thailand,TH,Ratchathewi,elite,true,99.91,AS4621,Office of Info.Tech. Admin. for Educational Development,596.5,1780000197.3129156
http,203.150.128.242,8080,Thailand,TH,Bangkok,transparent,false,46.44,AS4618,Internet Thailand Company Ltd,1903.08,1780000184.275457
http,203.150.128.25,8080,Thailand,TH,Bangkok,transparent,false,7.13,AS4618,Internet Thailand Company Ltd,8821.38,1780000133.034722
http,203.150.172.151,8080,Thailand,TH,Ban Lam Luk Ka,transparent,false,5.14,AS4618,Internet Thailand Company Ltd.,7273.16,1780000110.4023879
