protocol,ip,port,country,country_code,city,anonymity,ssl,uptime_percent,asn,isp,latency_ms,last_checked
http,182.52.229.165,8080,Thailand,TH,Pluak Daeng,transparent,false,5.85,AS23969,TOT Public Company Limited,5175.19,1780235652.8199599
http,43.251.205.146,8080,Thailand,TH,Bangkok,transparent,true,37.56,AS134100,"United Information Highway Co., Ltd.",3657.51,1780235649.811828
http,124.122.115.165,8080,Thailand,TH,Bangkok,transparent,false,13.47,AS17552,"True Internet Co., Ltd.",8499.84,1780235597.1747782
http,106.0.168.138,8080,Thailand,TH,Siao,transparent,false,9.67,AS23974,Ministry of Education - EMISC,5839.62,1780235581.3154309
http,8.213.222.247,20000,Thailand,TH,Bangkok,elite,false,0.64,AS45102,"Alibaba (US) Technology Co., Ltd.",6965.93,1780235521.7890072
http,223.204.177.198,3128,Thailand,TH,Pattani,transparent,false,27.52,AS45758,Triple T Broadband Public Company Limited,13407.41,1780235521.765169
http,8.213.222.247,8888,Thailand,TH,Bangkok,elite,false,0.64,AS45102,"Alibaba (US) Technology Co., Ltd.",10174.45,1780235518.5787272
http,202.28.194.139,31280,Thailand,TH,Ratchathewi,elite,true,99.91,AS4621,Office of Info.Tech. Admin. for Educational Development,603.82,1780235690.1668923
http,203.172.136.211,8080,Thailand,TH,Hang Dong,transparent,true,10.08,AS23974,Ministry of Education - EMISC,3620.32,1780235679.9790154
http,203.172.225.227,8080,Thailand,TH,Pom Prap Sattru Phai,transparent,false,9.86,AS23974,Ministry of Education - EMISC,3923.18,1780235672.5064557
http,203.150.113.103,8080,Thailand,TH,Ang Thong,transparent,false,51.88,AS4618,Internet Thailand Company Ltd.,4190.22,1780235661.9603655
http,49.48.144.31,8080,Thailand,TH,Khon Kaen,transparent,true,45.43,AS45758,Triple T Broadband Public Company Limited,5614.59,1780235689.5738835
http,49.48.68.205,8080,Thailand,TH,Prasat,transparent,true,23.33,AS45758,Triple T Broadband Public Company Limited,3598.32,1780235686.789983
