protocol,ip,port,country,country_code,city,anonymity,ssl,uptime_percent,asn,isp,latency_ms,last_checked
http,223.204.193.82,8080,Thailand,TH,Pattaya,transparent,false,20.16,AS45758,Triple T Broadband Public Company Limited,7950.51,1780161217.3303063
http,101.109.119.24,8080,Thailand,TH,Khwaeng Thung Song Hong,transparent,false,5.24,AS23969,TOT Public Company Limited,4950.34,1780161215.3746395
http,117.18.127.239,8080,Thailand,TH,Nong Muang,transparent,true,59.09,AS56309,READYIDC CO,7018.69,1780161176.4644036
http,43.251.205.146,8080,Thailand,TH,Bangkok,transparent,false,37.1,AS134100,"United Information Highway Co., Ltd.",9281.92,1780161155.3999393
http,203.150.128.155,8080,Thailand,TH,Bangkok,transparent,true,17.29,AS4618,Internet Thailand Company Ltd,2997.84,1780161295.651547
http,202.28.194.139,31280,Thailand,TH,Ratchathewi,elite,true,99.91,AS4621,Office of Info.Tech. Admin. for Educational Development,587.66,1780161290.6339083
