protocol,ip,port,country,country_code,city,anonymity,ssl,uptime_percent,asn,isp,latency_ms,last_checked
http,180.180.175.11,8080,Thailand,TH,Krathum Baen,transparent,false,10.42,AS23969,TOT Public Company Limited,10331.75,1780010330.4413974
http,171.7.35.183,8080,Thailand,TH,Bangkok,transparent,true,20.59,AS45758,Triple T Broadband Public Company Limited,6361.73,1780010320.92223
http,150.107.29.165,3128,Thailand,TH,On Nut,transparent,true,5.54,AS136523,POPIDC,14985.67,1780010312.6638784
http,182.52.66.38,8080,Thailand,TH,Bangkok,transparent,false,5.84,AS23969,TOT Public Company Limited,3887.85,1780010297.5379694
http,110.164.128.124,8080,Thailand,TH,Lak Si,transparent,false,12.81,AS45758,Triple T Broadband Public Company Limited,9676.59,1780010290.422276
http,106.0.168.138,8080,Thailand,TH,Siao,transparent,false,9.58,AS23974,Ministry of Education - EMISC,3513.19,1780010262.527646
http,8.213.197.208,6969,Thailand,TH,Bangkok,elite,false,1.73,AS45102,"Alibaba (US) Technology Co., Ltd.",9516.71,1780010212.7772064
http,203.150.128.25,8080,Thailand,TH,Bangkok,transparent,false,9.74,AS4618,Internet Thailand Company Ltd,2732.4,1780010378.3849957
http,202.28.194.139,31280,Thailand,TH,Ratchathewi,elite,true,99.91,AS4621,Office of Info.Tech. Admin. for Educational Development,574.92,1780010357.570284
http,203.150.128.155,8080,Thailand,TH,Bangkok,transparent,true,5.23,AS4618,Internet Thailand Company Ltd,16845.56,1780010236.215163
