protocol,ip,port,country,country_code,city,anonymity,ssl,uptime_percent,asn,isp,latency_ms,last_checked
http,8.213.222.157,41,Thailand,TH,Bangkok,elite,false,0.69,AS45102,"Alibaba (US) Technology Co., Ltd.",2396.74,1780081182.7529898
http,8.213.222.157,4145,Thailand,TH,Bangkok,elite,true,0.67,AS45102,"Alibaba (US) Technology Co., Ltd.",9596.94,1780081166.935332
http,125.27.192.162,8081,Thailand,TH,Khwaeng Thung Song Hong,transparent,true,11.18,AS23974,TOT Public Company Limited,12723.26,1780081166.6639845
http,101.51.131.47,8080,Thailand,TH,Nakhon Pathom,transparent,false,34.62,AS23969,TOT Public Company Limited,3690.53,1780081147.8870401
http,202.28.194.139,31280,Thailand,TH,Ratchathewi,elite,true,99.91,AS4621,Office of Info.Tech. Admin. for Educational Development,591.12,1780081146.1237268
http,223.207.103.99,8080,Thailand,TH,Udon Thani,transparent,false,16.47,AS45758,Triple T Broadband Public Company Limited,8107.63,1780081105.5158353
