protocol,ip,port,country,country_code,city,anonymity,ssl,uptime_percent,asn,isp,latency_ms,last_checked
http,202.28.194.139,31280,Thailand,TH,Ratchathewi,elite,true,99.91,AS4621,Office of Info.Tech. Admin. for Educational Development,564.68,1780078154.4225292
http,49.48.66.22,8080,Thailand,TH,Prasat,transparent,false,32.3,AS45758,Triple T Broadband Public Company Limited,10607.91,1780078140.6895568
http,1.1.220.100,8080,Thailand,TH,Nan,transparent,false,6.79,AS23969,TOT Public Company Limited,2404.73,1780078118.7631528
http,182.52.66.38,8080,Thailand,TH,Bangkok,transparent,true,13.33,AS23969,TOT Public Company Limited,2057.64,1780078109.3689146
http,81.31.234.70,80,Thailand,TH,Bangkok,transparent,false,7.68,AS149766,Y.U.T Corporate Company Limited,7934.02,1780078107.071927
http,118.173.107.123,8080,Thailand,TH,Nakhon Phanom,transparent,false,21.79,AS23969,TOT Public Company Limited,6586.72,1780078098.3254886
http,125.25.33.181,8080,Thailand,TH,Bangkok,transparent,true,40.7,AS23969,TOT Public Company Limited,12520.43,1780078026.7384667
http,203.172.225.227,8080,Thailand,TH,Pom Prap Sattru Phai,transparent,false,9.81,AS23974,Ministry of Education - EMISC,2548.63,1780078119.4745808
