protocol,ip,port,country,country_code,city,anonymity,ssl,uptime_percent,asn,isp,latency_ms,last_checked
http,110.164.175.110,8080,Thailand,TH,Bangkok,transparent,false,9.58,AS45758,Triple T Broadband Public Company Limited,5369.48,1780000747.5879025
http,203.146.80.98,8080,Thailand,TH,Nong Saeng,transparent,false,23.1,AS45458,Advanced Wireless Network Company Limited,7032.44,1780000742.3315027
http,182.52.66.38,8080,Thailand,TH,Bangkok,transparent,true,4.28,AS23969,TOT Public Company Limited,2518.46,1780000728.8786588
http,150.95.26.146,7080,Thailand,TH,Bangkok,elite,false,9.03,AS135161,GMO-Z.COM PTE. LTD.,10027.34,1780000716.9959414
http,101.109.119.24,8080,Thailand,TH,Khwaeng Thung Song Hong,transparent,false,5.22,AS23969,TOT Public Company Limited,9008.72,1780000706.4158795
http,182.53.143.200,8180,Thailand,TH,Ko Kut,transparent,false,4.96,AS23969,TOT Public Company Limited,11854.61,1780000703.7239418
http,180.180.175.11,8080,Thailand,TH,Krathum Baen,transparent,true,10.41,AS23969,TOT Public Company Limited,3166.08,1780000689.343891
http,180.180.218.250,8080,Thailand,TH,Rayong,transparent,false,4.95,AS23969,TOT Public Company Limited,12049.06,1780000627.5722551
http,202.28.194.139,31280,Thailand,TH,Ratchathewi,elite,true,99.91,AS4621,Office of Info.Tech. Admin. for Educational Development,603.17,1780000794.2733946
http,203.150.172.151,8080,Thailand,TH,Ban Lam Luk Ka,transparent,false,5.14,AS4618,Internet Thailand Company Ltd.,10579.92,1780000737.551861
