protocol,ip,port,country,country_code,city,anonymity,ssl,uptime_percent,asn,isp,latency_ms,last_checked
http,203.150.128.155,8080,Thailand,TH,Bangkok,transparent,true,7.42,AS4618,Internet Thailand Company Ltd,3448.69,1780018757.9559426
http,202.28.194.139,31280,Thailand,TH,Ratchathewi,elite,true,99.91,AS4621,Office of Info.Tech. Admin. for Educational Development,589.53,1780018744.98207
http,203.146.80.102,8080,Thailand,TH,Nong Saeng,transparent,false,12.7,AS45458,Advanced Wireless Network Company Limited,6895.15,1780018722.4020622
http,202.183.236.221,8080,Thailand,TH,Sikao,transparent,false,4.72,AS45458,Advanced Wireless Network Company Limited,10205.61,1780018705.526061
http,49.48.71.119,8080,Thailand,TH,Prasat,transparent,false,26.65,AS45758,Triple T Broadband Public Company Limited,4307.74,1780018693.3600638
http,182.52.233.54,8080,Thailand,TH,Khwaeng Thung Song Hong,transparent,false,42.85,AS23969,TOT Public Company Limited,3976.55,1780018688.056987
http,61.19.30.194,8188,Thailand,TH,Khlong San,transparent,false,34.48,AS9931,Data Comm. Dept. National Telecom Public Company Limited,14236.4,1780018679.7718618
http,203.150.128.25,8080,Thailand,TH,Bangkok,transparent,true,12.3,AS4618,Internet Thailand Company Ltd,5877.52,1780018752.2320373
http,203.172.225.227,8080,Thailand,TH,Pom Prap Sattru Phai,transparent,false,9.79,AS23974,Ministry of Education - EMISC,5206.16,1780018735.4678261
