protocol,ip,port,country,country_code,city,anonymity,ssl,uptime_percent,asn,isp,latency_ms,last_checked
http,202.28.194.139,31280,Thailand,TH,Ratchathewi,elite,true,99.91,AS4621,Office of Info.Tech. Admin. for Educational Development,581.3,1780156159.9547794
http,202.183.236.221,8080,Thailand,TH,Sikao,transparent,false,4.73,AS45458,Advanced Wireless Network Company Limited,6698.72,1780156158.4918668
http,180.180.218.250,8080,Thailand,TH,Rayong,transparent,true,4.97,AS23969,TOT Public Company Limited,11514.79,1780156158.076596
http,223.204.193.82,8080,Thailand,TH,Pattaya,transparent,false,19.5,AS45758,Triple T Broadband Public Company Limited,2250.34,1780156148.799684
http,1.20.207.205,8080,Thailand,TH,Ban Chang,transparent,false,4.78,AS23969,TOT Public Company Limited,4700.4,1780156141.3761625
http,110.171.40.132,8080,Thailand,TH,Bangkok,transparent,false,7.02,AS17552,True Internet Corporation CO. Ltd.,6455.8,1780156116.262253
http,125.27.192.162,8081,Thailand,TH,Khwaeng Thung Song Hong,transparent,false,11.22,AS23974,TOT Public Company Limited,7483.83,1780156110.5575454
http,8.213.222.157,8999,Thailand,TH,Bangkok,elite,false,1.52,AS45102,"Alibaba (US) Technology Co., Ltd.",4201.34,1780156011.9559298
