protocol,ip,port,country,country_code,city,anonymity,ssl,uptime_percent,asn,isp,latency_ms,last_checked
http,202.28.194.139,31280,Thailand,TH,Ratchathewi,elite,true,99.9,AS4621,Office of Info.Tech. Admin. for Educational Development,594.83,1779988179.5332847
http,203.150.172.151,8080,Thailand,TH,Ban Lam Luk Ka,transparent,false,5.14,AS4618,Internet Thailand Company Ltd.,7751.15,1779988152.9363294
http,1.0.171.213,8080,Thailand,TH,Phuket,transparent,false,6.76,AS23969,TOT Public Company Limited,9115.59,1779988115.4794781
http,125.25.33.181,8080,Thailand,TH,Bangkok,transparent,false,40.4,AS23969,TOT Public Company Limited,6135.92,1779988087.5962045
http,1.1.189.58,8080,Thailand,TH,Bangkok,transparent,false,6.02,AS23969,TOT Public Company Limited,14071.19,1779988053.496901
