protocol,ip,port,country,country_code,city,anonymity,ssl,uptime_percent,asn,isp,latency_ms,last_checked
http,103.10.228.119,8080,Thailand,TH,Ban Mai Khao,transparent,false,8.11,AS131090,CATBB,3664.19,1780066155.031822
http,223.205.28.151,8080,Thailand,TH,Pattaya,transparent,false,60.12,AS45758,Triple T Broadband Public Company Limited,8669.03,1780066150.960101
http,8.213.222.157,5060,Thailand,TH,Bangkok,elite,false,0.62,AS45102,"Alibaba (US) Technology Co., Ltd.",2388.48,1780066122.8825006
http,8.213.222.157,45,Thailand,TH,Bangkok,elite,false,0.83,AS45102,"Alibaba (US) Technology Co., Ltd.",2401.05,1780066119.81915
http,124.122.115.165,8080,Thailand,TH,Bangkok,transparent,false,13.44,AS17552,"True Internet Co., Ltd.",2549.73,1780066104.198848
http,171.7.35.183,8080,Thailand,TH,Bangkok,transparent,true,36.05,AS45758,Triple T Broadband Public Company Limited,5570.49,1780066087.4284189
http,203.146.80.98,8080,Thailand,TH,Nong Saeng,transparent,false,23.34,AS45458,Advanced Wireless Network Company Limited,4401.99,1780066080.4920208
http,182.53.143.200,8180,Thailand,TH,Ko Kut,transparent,false,4.97,AS23969,TOT Public Company Limited,5302.56,1780066074.859664
http,8.213.195.191,6379,Thailand,TH,Bangkok,elite,false,0.99,AS45102,Alibaba Cloud (Singapore) Private Limited,5407.67,1780066051.6075642
http,8.213.195.191,8999,Thailand,TH,Bangkok,elite,false,2.07,AS45102,Alibaba Cloud (Singapore) Private Limited,5426.01,1780066050.374794
http,8.213.222.247,9999,Thailand,TH,Bangkok,elite,false,0.51,AS45102,"Alibaba (US) Technology Co., Ltd.",9456.38,1780065970.6669972
http,202.28.194.139,31280,Thailand,TH,Ratchathewi,elite,true,99.91,AS4621,Office of Info.Tech. Admin. for Educational Development,598.21,1780066192.7658913
http,203.172.225.227,8080,Thailand,TH,Pom Prap Sattru Phai,transparent,false,9.8,AS23974,Ministry of Education - EMISC,1599.31,1780066175.9605117
http,106.0.168.138,8080,Thailand,TH,Siao,transparent,true,9.6,AS23974,Ministry of Education - EMISC,574.83,1780066162.7789707
http,203.150.128.155,8080,Thailand,TH,Bangkok,transparent,false,13.27,AS4618,Internet Thailand Company Ltd,3659.24,1780066088.6452196
http,203.172.201.226,8080,Thailand,TH,Yasothon,transparent,false,7.7,AS23974,Ministry of Education - EMISC,3391.81,1780066083.3455694
