protocol,ip,port,country,country_code,city,anonymity,ssl,uptime_percent,asn,isp,latency_ms,last_checked
http,43.251.205.146,8080,Thailand,TH,Bangkok,transparent,true,37.16,AS134100,"United Information Highway Co., Ltd.",2961.01,1780099127.9031608
http,202.28.194.139,31280,Thailand,TH,Ratchathewi,elite,true,99.91,AS4621,Office of Info.Tech. Admin. for Educational Development,588.74,1780099106.9634953
http,61.19.145.66,8080,Thailand,TH,Khlong San,transparent,false,5.34,AS9931,National Telecom Public Company Limited,12067.57,1780099103.6733797
http,203.150.128.155,8080,Thailand,TH,Bangkok,transparent,false,14.76,AS4618,Internet Thailand Company Ltd,10739.31,1780099070.5422733
http,1.0.171.213,8080,Thailand,TH,Phuket,transparent,false,6.78,AS23969,TOT Public Company Limited,5580.23,1780099059.8562963
http,49.48.81.197,8080,Thailand,TH,Nakhon Ratchasima,transparent,true,25.52,AS45758,Triple T Broadband Public Company Limited,2361.38,1780099051.9571261
http,203.172.136.211,8080,Thailand,TH,Hang Dong,transparent,true,10.01,AS23974,Ministry of Education - EMISC,1686.59,1780098952.7004921
