protocol,ip,port,country,country_code,city,anonymity,ssl,uptime_percent,asn,isp,latency_ms,last_checked
http,223.205.28.151,8080,Thailand,TH,Pattaya,transparent,false,60.0,AS45758,Triple T Broadband Public Company Limited,1262.91,1780067958.6504385
http,49.48.66.22,8080,Thailand,TH,Prasat,transparent,true,32.14,AS45758,Triple T Broadband Public Company Limited,1977.76,1780067946.6170032
http,8.213.215.187,1081,Thailand,TH,Bangkok,elite,false,0.89,AS45102,"Alibaba (US) Technology Co., Ltd.",5879.17,1780067923.9650903
http,8.213.215.187,202,Thailand,TH,Bangkok,elite,false,0.89,AS45102,"Alibaba (US) Technology Co., Ltd.",9631.03,1780067920.252438
http,61.19.30.194,8188,Thailand,TH,Khlong San,transparent,false,34.8,AS9931,Data Comm. Dept. National Telecom Public Company Limited,7948.18,1780067796.5467215
http,202.28.194.139,31280,Thailand,TH,Ratchathewi,elite,true,99.91,AS4621,Office of Info.Tech. Admin. for Educational Development,604.12,1780067989.8162427
http,203.150.166.170,8080,Thailand,TH,Khon Kaen,transparent,false,4.72,AS4618,Internet Thailand Company Ltd.,15747.21,1780067973.2004113
http,106.0.168.138,8080,Thailand,TH,Siao,transparent,false,9.6,AS23974,Ministry of Education - EMISC,5836.74,1780067957.7411492
http,203.172.136.211,8080,Thailand,TH,Hang Dong,transparent,false,9.99,AS23974,Ministry of Education - EMISC,2510.19,1780067957.4759314
http,203.150.128.25,8080,Thailand,TH,Bangkok,transparent,true,20.79,AS4618,Internet Thailand Company Ltd,8554.24,1780067863.6268384
