protocol,ip,port,country,country_code,city,anonymity,ssl,uptime_percent,asn,isp,latency_ms,last_checked
http,202.28.194.139,31280,Thailand,TH,Ratchathewi,elite,true,99.92,AS4621,Office of Info.Tech. Admin. for Educational Development,561.26,1779968065.9465659
http,118.173.107.123,8080,Thailand,TH,Nakhon Phanom,transparent,false,21.25,AS23969,TOT Public Company Limited,5065.58,1779968046.9558291
http,43.251.205.146,8080,Thailand,TH,Bangkok,transparent,true,37.17,AS134100,"United Information Highway Co., Ltd.",3033.94,1779968045.2958782
http,184.22.131.209,8080,Thailand,TH,Bangkok,transparent,false,35.73,AS133481,AIS-Fibre,6122.29,1779968040.980184
http,203.150.128.242,8080,Thailand,TH,Bangkok,transparent,false,48.51,AS4618,Internet Thailand Company Ltd,9937.63,1779968017.333991
http,203.146.80.98,8080,Thailand,TH,Nong Saeng,transparent,false,23.09,AS45458,Advanced Wireless Network Company Limited,1489.32,1779968010.7445216
http,150.107.29.165,3128,Thailand,TH,On Nut,transparent,true,5.3,AS136523,POPIDC,5274.94,1779967985.9671545
http,8.213.222.247,312,Thailand,TH,Bangkok,elite,false,0.6,AS45102,"Alibaba (US) Technology Co., Ltd.",2387.58,1779967970.312159
http,8.213.222.247,8888,Thailand,TH,Bangkok,elite,false,0.63,AS45102,"Alibaba (US) Technology Co., Ltd.",2387.36,1779967969.8278804
http,182.52.233.54,8080,Thailand,TH,Khwaeng Thung Song Hong,transparent,false,43.52,AS23969,TOT Public Company Limited,1831.88,1779967966.338435
http,110.164.128.124,8080,Thailand,TH,Lak Si,transparent,false,12.76,AS45758,Triple T Broadband Public Company Limited,1803.66,1779967947.4999127
http,125.25.33.181,8080,Thailand,TH,Bangkok,transparent,false,40.38,AS23969,TOT Public Company Limited,2289.93,1779967942.468007
http,1.1.189.58,8080,Thailand,TH,Bangkok,transparent,false,6.02,AS23969,TOT Public Company Limited,5159.93,1779967900.4802353
http,118.175.30.26,8080,Thailand,TH,Khwaeng Thung Song Hong,transparent,false,9.29,AS131293,TOT Public Company Limited,6471.83,1779967839.3146307
http,203.150.128.57,8080,Thailand,TH,Bangkok,transparent,false,49.88,AS4618,Internet Thailand Company Ltd,14380.94,1779967993.923042
