protocol,ip,port,country,country_code,city,anonymity,ssl,uptime_percent,asn,isp,latency_ms,last_checked
http,124.121.182.92,8080,Thailand,TH,Bangkok,transparent,true,57.48,AS17552,TRUE,615.23,1780212576.3913636
http,125.25.124.119,8080,Thailand,TH,Bangkok,transparent,true,80.0,AS23969,TOT Public Company Limited,3732.68,1780212569.965498
http,182.53.202.208,8080,Thailand,TH,Chiang Mai,anonymous,false,17.98,AS23969,TOT Public Company Limited,4665.63,1780212563.801002
http,182.52.233.54,8080,Thailand,TH,Khwaeng Thung Song Hong,transparent,false,39.18,AS23969,TOT Public Company Limited,10139.24,1780212551.9129946
http,124.121.58.80,8080,Thailand,TH,Bangkok,transparent,true,58.44,AS17552,TRUEBB,10235.55,1780212536.3297043
http,125.25.33.181,8080,Thailand,TH,Bangkok,transparent,false,37.67,AS23969,TOT Public Company Limited,7651.29,1780212474.9294295
http,150.107.29.165,3128,Thailand,TH,On Nut,transparent,false,6.21,AS136523,POPIDC,11638.98,1780212449.592797
http,110.171.40.132,8080,Thailand,TH,Bangkok,transparent,false,7.06,AS17552,True Internet Corporation CO. Ltd.,13342.85,1780212404.4878328
http,8.213.215.187,8443,Thailand,TH,Bangkok,elite,true,0.87,AS45102,"Alibaba (US) Technology Co., Ltd.",2390.68,1780212380.7526112
http,202.183.236.218,8080,Thailand,TH,Sikao,transparent,false,12.27,AS45458,Advanced Wireless Network Company Limited,6215.1,1780212533.6825495
http,202.29.215.78,8080,Thailand,TH,Ratchathewi,transparent,false,10.14,AS4621,Office of Info.Tech. Admin. for Educational Development,11973.52,1780212531.3961122
http,202.28.194.139,31280,Thailand,TH,Ratchathewi,elite,true,99.91,AS4621,Office of Info.Tech. Admin. for Educational Development,577.19,1780212517.4044588
http,202.183.236.219,8080,Thailand,TH,Sikao,transparent,false,10.04,AS45458,Advanced Wireless Network Company Limited,6778.36,1780212503.6862323
http,43.251.205.146,8080,Thailand,TH,Bangkok,transparent,false,37.46,AS134100,"United Information Highway Co., Ltd.",4963.48,1780212492.2986197
http,203.150.128.155,8080,Thailand,TH,Bangkok,transparent,true,21.2,AS4618,Internet Thailand Company Ltd,12857.79,1780212443.9830606
http,49.48.46.197,8080,Thailand,TH,Bang Lamung,transparent,false,56.47,AS45758,Triple T Broadband Public Company Limited,5718.79,1780212551.347291
