protocol,ip,port,country,country_code,city,anonymity,ssl,uptime_percent,asn,isp,latency_ms,last_checked
http,203.150.128.57,8080,Thailand,TH,Bangkok,transparent,true,48.97,AS4618,Internet Thailand Company Ltd,11839.48,1779984861.936114
http,106.0.168.138,8080,Thailand,TH,Siao,transparent,true,9.57,AS23974,Ministry of Education - EMISC,3633.96,1779984860.3424108
http,203.150.128.25,8080,Thailand,TH,Bangkok,transparent,false,3.37,AS4618,Internet Thailand Company Ltd,9480.7,1779984851.3763335
http,202.183.236.219,8080,Thailand,TH,Sikao,transparent,false,10.04,AS45458,Advanced Wireless Network Company Limited,8270.89,1779984843.543134
http,203.146.80.102,8080,Thailand,TH,Nong Saeng,transparent,false,12.68,AS45458,Advanced Wireless Network Company Limited,12449.88,1779984826.2878551
http,202.28.194.139,31280,Thailand,TH,Ratchathewi,elite,true,99.93,AS4621,Office of Info.Tech. Admin. for Educational Development,598.3,1779984810.4673042
http,184.22.131.209,8080,Thailand,TH,Bangkok,transparent,false,35.64,AS133481,AIS-Fibre,3145.76,1779984782.4139209
http,118.173.107.123,8080,Thailand,TH,Nakhon Phanom,transparent,false,21.31,AS23969,TOT Public Company Limited,5027.03,1779984742.9311316
