protocol,ip,port,country,country_code,city,anonymity,ssl,uptime_percent,asn,isp,latency_ms,last_checked
http,117.18.127.244,8080,Thailand,TH,Nong Muang,transparent,true,18.29,AS56309,READYIDC CO,577.4,1780169359.9493086
http,101.109.119.24,8080,Thailand,TH,Khwaeng Thung Song Hong,transparent,false,5.24,AS23969,TOT Public Company Limited,9046.06,1780169353.5318382
http,8.213.222.157,8999,Thailand,TH,Bangkok,elite,false,1.53,AS45102,"Alibaba (US) Technology Co., Ltd.",2392.82,1780169346.5730915
http,8.213.222.157,5060,Thailand,TH,Bangkok,elite,true,0.62,AS45102,"Alibaba (US) Technology Co., Ltd.",6503.92,1780169329.9848838
http,182.52.233.54,8080,Thailand,TH,Khwaeng Thung Song Hong,transparent,false,39.35,AS23969,TOT Public Company Limited,6973.86,1780169301.2234023
http,110.171.40.132,8080,Thailand,TH,Bangkok,transparent,false,7.03,AS17552,True Internet Corporation CO. Ltd.,7455.87,1780169297.3745215
http,183.88.212.184,8080,Thailand,TH,Pattaya,transparent,false,5.44,AS45758,Triple T Broadband Public Company Limited,11752.53,1780169285.8480506
http,1.20.207.205,8080,Thailand,TH,Ban Chang,transparent,false,5.35,AS23969,TOT Public Company Limited,6054.57,1780169253.6680043
http,103.10.228.119,8080,Thailand,TH,Ban Mai Khao,transparent,false,8.17,AS131090,CATBB,2865.2,1780169243.5544531
http,223.207.103.99,8080,Thailand,TH,Udon Thani,transparent,false,16.43,AS45758,Triple T Broadband Public Company Limited,3192.47,1780169218.3161614
http,180.180.175.11,8080,Thailand,TH,Krathum Baen,transparent,true,10.55,AS23969,TOT Public Company Limited,584.62,1780169217.414222
http,202.183.236.220,8080,Thailand,TH,Sikao,transparent,false,4.63,AS45458,Advanced Wireless Network Company Limited,8532.87,1780169194.0478892
http,81.31.234.70,80,Thailand,TH,Bangkok,transparent,false,7.71,AS149766,Y.U.T Corporate Company Limited,2853.06,1780169156.7533135
http,150.95.26.146,7080,Thailand,TH,Bangkok,elite,false,9.08,AS135161,GMO-Z.COM PTE. LTD.,21438.42,1780169150.755375
http,49.48.68.205,8080,Thailand,TH,Prasat,transparent,true,23.09,AS45758,Triple T Broadband Public Company Limited,7262.27,1780169332.450777
http,106.0.168.138,8080,Thailand,TH,Siao,transparent,false,9.63,AS23974,Ministry of Education - EMISC,8535.5,1780169308.759692
http,202.28.194.139,31280,Thailand,TH,Ratchathewi,elite,true,99.91,AS4621,Office of Info.Tech. Admin. for Educational Development,576.63,1780169282.1393373
http,106.0.158.114,8080,Thailand,TH,Pom Prap Sattru Phai,transparent,false,5.85,AS23974,Ministry of Education - EMISC,2760.3,1780169265.3599443
http,203.150.128.242,8080,Thailand,TH,Bangkok,transparent,false,38.64,AS4618,Internet Thailand Company Ltd,1874.56,1780169234.5518832
http,203.146.80.102,8080,Thailand,TH,Nong Saeng,transparent,false,12.86,AS45458,Advanced Wireless Network Company Limited,5027.54,1780169222.2761219
