protocol,ip,port,country,country_code,city,anonymity,ssl,uptime_percent,asn,isp,latency_ms,last_checked
http,101.109.133.170,8080,Thailand,TH,Mueang Samut Prakan,transparent,true,52.32,AS23969,TOT Public Company Limited,8000.95,1780227448.692821
http,180.180.175.11,8080,Thailand,TH,Krathum Baen,transparent,false,10.6,AS23969,TOT Public Company Limited,9196.27,1780227423.2878902
http,83.118.60.147,8213,Thailand,TH,Bang Rak,anonymous,false,8.27,AS132280,Symphony Communication Public Company Limited,20244.29,1780227416.2286122
http,203.150.113.103,8080,Thailand,TH,Ang Thong,transparent,true,54.23,AS4618,Internet Thailand Company Ltd.,2122.76,1780227592.603801
http,106.0.168.138,8080,Thailand,TH,Siao,transparent,true,9.66,AS23974,Ministry of Education - EMISC,4816.09,1780227529.6598353
http,202.28.194.139,31280,Thailand,TH,Ratchathewi,elite,true,99.91,AS4621,Office of Info.Tech. Admin. for Educational Development,573.86,1780227488.507437
http,49.48.68.205,8080,Thailand,TH,Prasat,transparent,true,23.34,AS45758,Triple T Broadband Public Company Limited,614.68,1780227601.4439313
http,49.48.44.43,8080,Thailand,TH,Bang Lamung,transparent,true,58.63,AS45758,Triple T Broadband Public Company Limited,522.95,1780227580.827837
http,49.48.144.31,8080,Thailand,TH,Khon Kaen,transparent,true,48.77,AS45758,Triple T Broadband Public Company Limited,6280.5,1780227558.6541402
http,49.48.81.197,8080,Thailand,TH,Nakhon Ratchasima,transparent,false,25.18,AS45758,Triple T Broadband Public Company Limited,16412.1,1780227542.9060113
http,61.19.30.194,8188,Thailand,TH,Khlong San,transparent,false,34.58,AS9931,Data Comm. Dept. National Telecom Public Company Limited,4219.78,1780227424.371312
