protocol,ip,port,country,country_code,city,anonymity,ssl,uptime_percent,asn,isp,latency_ms,last_checked
http,184.22.131.209,8080,Thailand,TH,Bangkok,transparent,false,35.68,AS133481,AIS-Fibre,3416.83,1779975860.377524
http,202.183.236.221,8080,Thailand,TH,Sikao,transparent,true,4.72,AS45458,Advanced Wireless Network Company Limited,5593.78,1779975859.0331755
http,110.171.40.132,8080,Thailand,TH,Bangkok,transparent,false,6.98,AS17552,True Internet Corporation CO. Ltd.,8613.3,1779975847.2558718
http,125.26.99.41,8080,Thailand,TH,Chanthaburi,transparent,false,7.6,AS23969,TOT Public Company Limited,8659.6,1779975845.7959318
http,8.213.222.157,8999,Thailand,TH,Bangkok,elite,false,1.49,AS45102,"Alibaba (US) Technology Co., Ltd.",2392.69,1779975840.9492352
http,202.183.236.218,8080,Thailand,TH,Sikao,transparent,false,12.34,AS45458,Advanced Wireless Network Company Limited,4276.92,1779975830.2956066
http,202.28.194.139,31280,Thailand,TH,Ratchathewi,elite,true,99.92,AS4621,Office of Info.Tech. Admin. for Educational Development,620.39,1779975817.9133182
http,8.213.222.157,41,Thailand,TH,Bangkok,elite,true,0.68,AS45102,"Alibaba (US) Technology Co., Ltd.",2402.89,1779975804.762381
http,101.51.131.47,8080,Thailand,TH,Nakhon Pathom,transparent,false,35.1,AS23969,TOT Public Company Limited,5869.63,1779975779.9542415
http,125.27.192.162,8081,Thailand,TH,Khwaeng Thung Song Hong,transparent,false,11.12,AS23974,TOT Public Company Limited,1873.36,1779975769.6239486
