protocol,ip,port,country,country_code,city,anonymity,ssl,uptime_percent,asn,isp,latency_ms,last_checked
http,5.102.109.41,999,Mexico,MX,San Juan del Río,transparent,true,36.81,AS270172,IPXO,3855.78,1780165749.9125035
http,38.194.246.34,999,Mexico,MX,Los Ramírez,transparent,true,41.89,AS28458,IENTC S de RL de CV,5391.91,1780165744.9193456
http,38.123.220.221,999,Mexico,MX,Loma Hermosa,transparent,true,26.48,AS174,Cogent Communications,3965.98,1780165738.852134
http,187.190.114.40,999,Mexico,MX,Úrsulo Galván,transparent,true,40.6,AS22884,Total Play Telecomunicaciones SA De CV,6187.03,1780165736.2364473
http,187.251.224.167,8081,Mexico,MX,León,transparent,true,14.16,AS22884,Total Play Telecomunicaciones SA De CV,2243.34,1780165734.5661395
http,38.123.220.194,999,Mexico,MX,Santa Cruz,transparent,true,25.08,AS174,Cogent Communications,2434.75,1780165712.3185225
http,148.230.4.146,999,Mexico,MX,Naranjos,transparent,true,23.72,AS265606,Digy Networks,10363.03,1780165693.1719453
http,38.210.201.108,999,Mexico,MX,Aguascalientes,transparent,true,28.01,AS273250,Soluciones de Tecnologia Jah sa de Cv,1940.39,1780165653.0453207
http,38.210.201.56,999,Mexico,MX,Aguascalientes,transparent,true,29.07,AS273250,Soluciones de Tecnologia Jah sa de Cv,9133.48,1780165643.9158423
http,170.78.208.1,999,Mexico,MX,San Juan del Río,transparent,true,29.24,AS270158,Wantelco SAS de CV,7238.8,1780165619.3953075
http,187.216.141.46,3128,Mexico,MX,Unión de Tabiqueros del Río Grande de Morelia,transparent,true,7.72,AS8151,Uninet S.A. de C.V.,496.3,1780165586.5420082
http,187.251.230.15,8080,Mexico,MX,Dos Ríos,transparent,true,11.02,AS22884,Total Play Telecomunicaciones SA De CV,4607.86,1780165510.3444033
http,201.159.96.49,8081,Mexico,MX,General Escobedo,transparent,true,6.04,AS28539,Administradora de Servicios de Internet Sandur S.A. de C.V.,5861.19,1780165751.8686597
http,201.139.115.206,8082,Mexico,MX,Puebla City,elite,true,9.27,AS32098,Transtelco Inc,4973.04,1780165747.476098
http,45.177.178.194,999,Mexico,MX,Pedro Escobedo,transparent,true,37.71,AS270158,Wantelco SAS de CV,5153.07,1780165702.9159832
http,38.7.23.138,999,Mexico,MX,Huetamo de Núñez,transparent,true,28.29,AS28398,Internet Telefonia Y TV De Michoacan SA De CV,9477.47,1780165653.0307121
