protocol,ip,port,country,country_code,city,anonymity,ssl,uptime_percent,asn,isp,latency_ms,last_checked
http,187.245.214.11,999,Mexico,MX,Comitán,transparent,true,8.99,AS13999,"Mega Cable, S.A. de C.V.",618.92,1780135735.266352
http,38.224.223.173,999,Mexico,MX,Cunduacán,transparent,true,29.07,AS28435,Cogent Communications,5265.45,1780135732.414413
http,187.251.224.167,8081,Mexico,MX,León,transparent,true,14.15,AS22884,Total Play Telecomunicaciones SA De CV,8355.65,1780135732.1007795
http,187.190.127.212,8081,Mexico,MX,Puerto Vallarta,transparent,true,14.38,AS22884,Total Play Telecomunicaciones SA De CV,2177.91,1780135729.8411639
http,45.188.76.238,999,Mexico,MX,Villahermosa,transparent,true,3.75,AS265608,ONT NETWORKS SA de CV,6935.26,1780135718.0463412
http,187.251.130.135,8080,Mexico,MX,Ciudad de Villa de Álvarez,transparent,true,11.61,AS22884,Total Play Telecomunicaciones SA De CV,2376.6,1780135699.2714555
http,38.49.133.226,999,Mexico,MX,Silao,transparent,true,16.31,AS28458,IENTC S de RL de CV,1187.31,1780135686.8214493
http,38.194.246.34,999,Mexico,MX,Los Ramírez,transparent,true,41.87,AS28458,IENTC S de RL de CV,6619.28,1780135655.5442998
http,187.190.114.60,999,Mexico,MX,Praxedis Guerrero,transparent,true,6.87,AS22884,Total Play Telecomunicaciones SA De CV,2437.93,1780135593.439852
http,201.159.109.137,8081,Mexico,MX,General Escobedo,transparent,true,14.88,AS28539,Administradora de Servicios de Internet Sandur S.A. de C.V.,2261.77,1780135674.7620957
http,45.168.238.193,8443,Mexico,MX,San Juan del Río,transparent,true,22.99,AS270158,Wantelco SAS de CV,7269.46,1780135662.0568876
http,201.159.96.49,8081,Mexico,MX,General Escobedo,transparent,true,5.73,AS28539,Administradora de Servicios de Internet Sandur S.A. de C.V.,10142.82,1780135571.6833658
