protocol,ip,port,country,country_code,city,anonymity,ssl,uptime_percent,asn,isp,latency_ms,last_checked
http,45.174.243.24,999,Mexico,MX,Champotón,transparent,true,11.34,AS265583,Sistemas Y Soluciones De Campeche SAS De CV,2159.66,1780233244.233751
http,192.249.55.114,3128,Mexico,MX,Reynosa,transparent,true,27.46,AS55025,Bluezone Internet Inc,3329.46,1780233243.0011053
http,177.229.197.94,999,Mexico,MX,Tapachula,transparent,true,24.09,AS13999,"Mega Cable, S.A. de C.V.",1658.9,1780233242.3358898
http,38.194.246.34,999,Mexico,MX,Los Ramírez,transparent,true,41.96,AS28458,IENTC S de RL de CV,7613.18,1780233239.2665052
http,201.159.97.25,8081,Mexico,MX,General Escobedo,transparent,true,9.18,AS28539,Administradora de Servicios de Internet Sandur S.A. de C.V.,8997.98,1780233237.3321078
http,45.174.243.142,999,Mexico,MX,Champotón,transparent,true,28.75,AS265583,Sistemas Y Soluciones De Campeche SAS De CV,1574.3,1780233222.4095306
http,187.216.141.46,3128,Mexico,MX,Unión de Tabiqueros del Río Grande de Morelia,transparent,true,8.0,AS8151,Uninet S.A. de C.V.,8707.87,1780233156.1093922
http,38.49.142.174,999,Mexico,MX,Noria de Camarena,transparent,true,14.91,AS28458,IENTC S de RL de CV,1032.6,1780233107.8943214
