protocol,ip,port,country,country_code,city,anonymity,ssl,uptime_percent,asn,isp,latency_ms,last_checked
http,38.49.148.147,999,Mexico,MX,Huamantla,transparent,true,10.15,AS28458,IENTC S de RL de CV,5193.19,1780021143.3616605
http,45.190.76.17,999,Mexico,MX,Zapopan,transparent,true,10.82,AS265614,Meta Networks SA De CV,1092.5,1780021109.9814065
http,187.102.236.177,8080,Mexico,MX,Parral,transparent,true,38.87,AS270114,Servicios De Infraestructura De Radiocomunicacion Y Redes Privadas De Datos Hype,4049.43,1780021068.2671034
http,148.230.4.241,999,Mexico,MX,Naranjos,transparent,true,83.6,AS265606,Digy Networks,3775.31,1780021043.871835
http,201.150.6.201,8081,Mexico,MX,San Nicolás de los Garza,transparent,true,11.01,AS28539,Administradora de Servicios de Internet Sandur S.A. de C.V.,2454.36,1780021191.319679
