protocol,ip,port,country,country_code,city,anonymity,ssl,uptime_percent,asn,isp,latency_ms,last_checked
http,148.230.4.241,999,Mexico,MX,Naranjos,transparent,true,84.28,AS265606,Digy Networks,3265.04,1780039422.9336777
http,38.49.148.147,999,Mexico,MX,Huamantla,transparent,true,10.16,AS28458,IENTC S de RL de CV,5452.53,1780039398.4318123
http,187.102.236.177,8080,Mexico,MX,Parral,transparent,true,41.84,AS270114,Servicios De Infraestructura De Radiocomunicacion Y Redes Privadas De Datos Hype,8563.46,1780039398.3558185
http,38.7.23.138,999,Mexico,MX,Huetamo de Núñez,transparent,true,28.17,AS28398,Internet Telefonia Y TV De Michoacan SA De CV,5238.03,1780039375.7263236
http,187.243.251.66,999,Mexico,MX,Ahome,transparent,true,13.23,AS13999,"Mega Cable, S.A. de C.V.",2183.18,1780039371.3068595
http,177.241.119.191,8080,Mexico,MX,Grajales,transparent,true,10.77,AS13999,"Mega Cable, S.A. de C.V.",5037.0,1780039359.0289245
http,201.159.111.121,8081,Mexico,MX,General Escobedo,transparent,true,14.24,AS28539,Administradora de Servicios de Internet Sandur S.A. de C.V.,8375.67,1780039357.5332713
http,187.251.224.167,8081,Mexico,MX,León,transparent,true,14.13,AS22884,Total Play Telecomunicaciones SA De CV,8453.21,1780039325.5020487
http,38.123.220.108,999,Mexico,MX,Manzana Sexta Parte Centro,transparent,true,22.71,AS174,Cogent Communications,2591.36,1780039279.2991152
http,201.139.115.38,8082,Mexico,MX,Puebla City,elite,true,17.93,AS32098,Transtelco Inc,7646.36,1780039764.6232605
