protocol,ip,port,country,country_code,city,anonymity,ssl,uptime_percent,asn,isp,latency_ms,last_checked
http,38.123.220.147,999,Mexico,MX,Loma Hermosa,transparent,true,65.78,AS174,Cogent Communications,419.24,1779980067.3616521
http,148.230.4.241,999,Mexico,MX,Naranjos,transparent,true,78.91,AS265606,Digy Networks,2689.56,1779980061.5798876
http,201.150.6.201,8081,Mexico,MX,San Nicolás de los Garza,transparent,true,10.96,AS28539,Administradora de Servicios de Internet Sandur S.A. de C.V.,4650.5,1779980057.3999135
http,131.196.245.120,999,Mexico,MX,La Cañada,transparent,true,20.43,AS265561,Lantointernet SA De CV,6776.06,1779980003.300993
http,38.210.201.108,999,Mexico,MX,Aguascalientes,transparent,true,28.27,AS273250,Soluciones de Tecnologia Jah sa de Cv,7853.07,1779979987.1456416
