protocol,ip,port,country,country_code,city,anonymity,ssl,uptime_percent,asn,isp,latency_ms,last_checked
http,38.123.220.147,999,Mexico,MX,Loma Hermosa,transparent,true,64.08,AS174,Cogent Communications,438.11,1779964794.683086
http,38.210.202.114,999,Mexico,MX,Aguascalientes,transparent,true,36.29,AS273250,Soluciones de Tecnologia Jah sa de Cv,4597.57,1779964773.6880395
http,187.190.114.59,999,Mexico,MX,Pueblillo,transparent,true,17.97,AS22884,Total Play Telecomunicaciones SA De CV,7949.32,1779964771.1318884
http,168.194.0.249,252,Mexico,MX,Nuevo Laredo,transparent,true,56.69,AS28411,Aire Cable S.A. de C.V.,4413.29,1779964736.3969266
http,45.174.92.44,8087,Mexico,MX,San Juan Bautista Tuxtla,transparent,true,37.57,AS28429,Enlace de Datos y Redes SA de CV,6455.98,1779964684.2998722
http,187.190.58.152,8081,Mexico,MX,Mazatlán,transparent,true,15.02,AS22884,Total Play Telecomunicaciones SA De CV,4100.79,1779964652.7170117
