protocol,ip,port,country,country_code,city,anonymity,ssl,uptime_percent,asn,isp,latency_ms,last_checked
http,187.190.58.152,8081,Mexico,MX,Mazatlán,transparent,true,15.16,AS22884,Total Play Telecomunicaciones SA De CV,5001.06,1780209278.9324927
http,38.194.246.34,999,Mexico,MX,Los Ramírez,transparent,true,41.94,AS28458,IENTC S de RL de CV,4094.55,1780209272.306849
http,177.242.137.182,999,Mexico,MX,Metepec,transparent,true,11.22,AS262916,"Mega Cable, S.A. de C.V.",8438.52,1780209257.947896
http,38.210.201.72,999,Mexico,MX,Aguascalientes,transparent,true,26.01,AS273250,Soluciones de Tecnologia Jah sa de Cv,4339.22,1780209220.8799202
http,38.210.201.108,999,Mexico,MX,Aguascalientes,transparent,true,28.16,AS273250,Soluciones de Tecnologia Jah sa de Cv,4304.03,1780209215.9289138
http,148.230.4.241,999,Mexico,MX,Naranjos,transparent,true,89.17,AS265606,Digy Networks,1826.45,1780209196.6567824
http,187.251.224.167,80,Mexico,MX,León,transparent,true,14.56,AS22884,Total Play Telecomunicaciones SA De CV,2351.94,1780209189.616448
http,45.177.178.242,999,Mexico,MX,Pedro Escobedo,transparent,true,22.21,AS270158,Wantelco SAS de CV,5337.07,1780209183.9621208
http,38.224.223.173,999,Mexico,MX,Cunduacán,transparent,true,29.34,AS28435,Cogent Communications,10803.81,1780209151.040263
http,201.150.6.201,8081,Mexico,MX,San Nicolás de los Garza,transparent,true,11.24,AS28539,Administradora de Servicios de Internet Sandur S.A. de C.V.,3516.28,1780209259.7118685
