protocol,ip,port,country,country_code,city,anonymity,ssl,uptime_percent,asn,isp,latency_ms,last_checked
http,131.222.252.71,8080,Türkiye,TR,Antakya,transparent,true,19.24,AS216472,High Speed For Internet Services L.L.C,2420.46,1780148067.8127415
http,185.200.37.238,8080,Türkiye,TR,Antakya,transparent,true,12.95,AS202561,High Speed Telekomunikasyon ve Hab. Hiz. Ltd. Sti.,9413.06,1780148013.8558993
http,176.88.65.190,8080,Türkiye,TR,Kilis,transparent,true,20.56,AS34984,Superonline Iletisim Hizmetleri A.S.,12175.71,1780148001.2633927
http,85.105.165.223,3310,Türkiye,TR,Istanbul,elite,true,97.8,AS9121,Turk Telekomunikasyon A.S,674.62,1780147988.9790154
http,109.224.242.209,8080,Turkey,TR,Antakya,transparent,true,11.37,AS216472,High Speed For Internet Services L.L.C,9459.47,1780147917.9750712
