protocol,ip,port,country,country_code,city,anonymity,ssl,uptime_percent,asn,isp,latency_ms,last_checked
socks5,38.76.206.162,1080,India,IN,Mumbai,elite,true,90.59,AS401701,JOY SERVICES,1657.09,1780118313.191639
socks5,45.89.106.116,1081,India,IN,New Delhi,elite,true,69.06,AS153914,NETRANEX TECHNOLOGIES (INDIA) PRIVATE LIMITED,1057.53,1780118312.6451814
socks5,150.129.115.253,6667,India,IN,Surat,elite,true,22.23,AS45916,Gtpl Solanki Cable Network Pvt Ltd,5355.78,1780118295.2938542
socks5,163.53.204.178,9813,India,IN,Bhavāni,elite,true,42.37,AS58898,Rainbow communications India Pvt Ltd,4064.45,1780118265.9243047
socks5,45.89.106.116,1082,India,IN,New Delhi,elite,true,74.36,AS153914,NETRANEX TECHNOLOGIES (INDIA) PRIVATE LIMITED,1840.62,1780118101.501528
