protocol,ip,port,country,country_code,city,anonymity,ssl,uptime_percent,asn,isp,latency_ms,last_checked
socks5,45.89.106.116,1082,India,IN,New Delhi,elite,true,74.36,AS153914,NETRANEX TECHNOLOGIES (INDIA) PRIVATE LIMITED,11916.02,1780177170.5046573
socks5,150.129.115.253,6667,India,IN,Surat,elite,true,23.98,AS45916,Gtpl Solanki Cable Network Pvt Ltd,1892.18,1780177161.6174514
socks5,178.212.35.124,9100,India,IN,Mumbai,elite,true,39.37,AS141995,Contabo Asia Private Limited,16772.15,1780177157.0786862
socks5,163.53.204.178,9813,India,IN,Bhavāni,elite,true,46.58,AS58898,Rainbow communications India Pvt Ltd,1101.13,1780177156.4021807
socks5,45.89.106.116,1081,India,IN,New Delhi,elite,true,65.61,AS153914,NETRANEX TECHNOLOGIES (INDIA) PRIVATE LIMITED,12811.87,1780177155.799882
socks5,103.163.244.106,1080,India,IN,Panipat,elite,true,49.95,AS132746,Infolink System,4066.66,1780177140.9625957
socks5,38.76.206.162,1080,India,IN,Mumbai,elite,true,93.79,AS401701,JOY SERVICES,3674.78,1780177077.3145716
