protocol,ip,port,country,country_code,city,anonymity,ssl,uptime_percent,asn,isp,latency_ms,last_checked
socks5,150.129.115.253,6667,India,IN,Surat,elite,true,24.18,AS45916,Gtpl Solanki Cable Network Pvt Ltd,5144.49,1780183754.84437
socks5,38.76.206.162,1080,India,IN,Mumbai,elite,true,93.86,AS401701,JOY SERVICES,4583.52,1780183754.7931252
socks5,103.163.244.106,1080,India,IN,Panipat,elite,true,50.04,AS132746,Infolink System,1187.62,1780183745.4964077
socks5,45.89.106.116,1082,India,IN,New Delhi,elite,true,75.49,AS153914,NETRANEX TECHNOLOGIES (INDIA) PRIVATE LIMITED,2265.2,1780183692.8471487
socks5,178.212.35.124,9100,India,IN,Mumbai,elite,true,39.51,AS141995,Contabo Asia Private Limited,9113.65,1780183692.1601436
socks5,45.89.106.116,1081,India,IN,New Delhi,elite,true,66.81,AS153914,NETRANEX TECHNOLOGIES (INDIA) PRIVATE LIMITED,3087.58,1780183661.0763247
socks5,163.53.204.178,9813,India,IN,Bhavāni,elite,true,46.91,AS58898,Rainbow communications India Pvt Ltd,8663.11,1780183690.6268163
