protocol,ip,port,country,country_code,city,anonymity,ssl,uptime_percent,asn,isp,latency_ms,last_checked
socks5,178.212.35.124,9100,India,IN,Mumbai,elite,true,38.58,AS141995,Contabo Asia Private Limited,1582.82,1780112947.4841254
socks5,45.89.106.116,1082,India,IN,New Delhi,elite,true,73.96,AS153914,NETRANEX TECHNOLOGIES (INDIA) PRIVATE LIMITED,6343.06,1780112921.590475
socks5,38.76.206.162,1080,India,IN,Mumbai,elite,true,90.77,AS401701,JOY SERVICES,6283.8,1780112915.8796303
socks5,103.163.244.106,1080,India,IN,Panipat,elite,true,49.25,AS132746,Infolink System,4109.16,1780112885.798819
socks5,150.129.115.253,6667,India,IN,Surat,elite,true,22.2,AS45916,Gtpl Solanki Cable Network Pvt Ltd,2209.3,1780112868.8149858
socks5,45.89.106.116,1081,India,IN,New Delhi,elite,true,68.66,AS153914,NETRANEX TECHNOLOGIES (INDIA) PRIVATE LIMITED,18936.55,1780112861.65122
