protocol,ip,port,country,country_code,city,anonymity,ssl,uptime_percent,asn,isp,latency_ms,last_checked
socks5,45.89.106.116,1082,India,IN,New Delhi,elite,true,76.51,AS153914,NETRANEX TECHNOLOGIES (INDIA) PRIVATE LIMITED,2937.38,1780189776.001633
socks5,178.212.35.124,9100,India,IN,Mumbai,elite,true,39.58,AS141995,Contabo Asia Private Limited,16489.8,1780189755.8927956
socks5,38.76.206.162,1080,India,IN,Mumbai,elite,true,93.69,AS401701,JOY SERVICES,2066.18,1780189745.8799655
socks5,45.89.106.116,1081,India,IN,New Delhi,elite,true,68.22,AS153914,NETRANEX TECHNOLOGIES (INDIA) PRIVATE LIMITED,2630.56,1780189732.570024
socks5,159.65.158.30,8888,India,IN,Bengaluru,elite,true,27.97,AS14061,"DigitalOcean, LLC",15479.35,1780189676.628703
socks5,163.53.204.178,9813,India,IN,Bhavāni,elite,true,47.2,AS58898,Rainbow communications India Pvt Ltd,1006.45,1780189720.7526648
