protocol,ip,port,country,country_code,city,anonymity,ssl,uptime_percent,asn,isp,latency_ms,last_checked
http,116.171.106.111,3443,China,CN,Jinrongjie,elite,true,47.29,AS4837,China Unicom CHINA169 Network,2124.64,1780130900.9004533
http,59.66.16.189,6382,China,CN,Haidian,elite,true,56.41,AS4538,China Education and Research Network Center,2165.81,1780130893.767888
http,36.156.142.27,8083,China,CN,Nanjing,transparent,true,1.45,AS56046,China Mobile Communications Corporation,9950.58,1780130888.6350663
http,59.66.26.63,6382,China,CN,Haidian,elite,true,62.85,AS4538,China Education and Research Network Center,677.87,1780130888.306439
http,123.112.212.33,9000,China,CN,Beijing,transparent,true,24.34,AS4808,China Unicom Beijing Province Network,10456.36,1780130878.8702347
http,122.224.198.218,808,China,CN,Hangzhou,elite,true,81.51,AS4134,Chinanet,5375.13,1780130875.9986703
