protocol,ip,port,country,country_code,city,anonymity,ssl,uptime_percent,asn,isp,latency_ms,last_checked
http,59.66.28.115,6382,China,CN,Haidian,elite,true,80.7,AS4538,China Education and Research Network Center,671.12,1780064067.1615968
http,59.66.16.99,6382,China,CN,Haidian,elite,true,67.26,AS4538,China Education and Research Network Center,778.23,1780064064.3419573
http,113.142.152.75,8088,China,CN,Xincheng,elite,true,3.68,AS134768,CHINANET SHAANXI province Cloud Base network,2377.87,1780064058.3392878
http,122.224.198.218,808,China,CN,Hangzhou,elite,true,81.85,AS4134,Chinanet,5255.61,1780063996.9881842
http,140.246.125.194,9099,China,CN,Jinan,elite,true,17.37,AS58519,Cloud Computing Corporation,4066.13,1780063866.8276055
