protocol,ip,port,country,country_code,city,anonymity,ssl,uptime_percent,asn,isp,latency_ms,last_checked
socks5,103.169.254.155,1080,Indonesia,ID,Ciputat,elite,true,53.31,AS142370,PT Master Star Network,8396.12,1779973184.9283113
socks5,45.123.142.175,1080,Indonesia,ID,Mekarsari,elite,true,77.57,AS152026,PT Anten Sarana Teknologi,8811.68,1779973154.0615997
socks5,103.191.218.119,69,Indonesia,ID,Kuningan,elite,true,63.51,AS149930,PT Replay Inti Media,1276.84,1779973115.7969775
socks5,103.165.128.74,1080,Indonesia,ID,West Jakarta,elite,true,38.94,AS17995,PT iForte Global Internet,8707.12,1779973114.4268456
socks5,103.134.220.49,1080,Indonesia,ID,Mungkid,elite,true,54.07,AS138810,PT GLOBAL MEDIA PRATAMA SOLUSINDO,1078.72,1779973104.2481248
socks5,45.198.20.148,1080,Indonesia,ID,Jakarta,elite,true,60.04,AS140457,PT IKHLAS CIPTA TEKNOLOGI,1742.43,1779973091.1103709
socks5,103.111.136.82,8199,Indonesia,ID,Banjarmasin,elite,true,45.85,AS136093,PT Mitra Lintas Multimedia,2236.13,1779973008.4167337
socks5,103.119.60.219,1080,Indonesia,ID,Bogor,elite,true,41.13,AS63859,PT. Eka Mas Republik,2488.44,1779972950.2770932
socks5,8.215.15.163,8123,Indonesia,ID,Jakarta,elite,true,2.51,AS45102,"Alibaba (US) Technology Co., Ltd.",6551.68,1779972932.263645
socks5,157.66.57.98,8010,Indonesia,ID,Tanahwangko,elite,true,14.69,AS150985,YADICA,5592.98,1779972911.7111893
socks5,103.191.218.163,69,Indonesia,ID,Kuningan,elite,true,11.4,AS149930,PT Replay Inti Media,2135.54,1779972893.4472508
socks5,8.215.15.163,8010,Indonesia,ID,Jakarta,elite,true,1.86,AS45102,"Alibaba (US) Technology Co., Ltd.",6655.36,1779972795.53522
socks5,223.25.109.146,8199,Indonesia,ID,Somba,elite,true,58.97,AS149718,SinergiNet,15228.46,1779972724.422557
socks5,8.215.3.250,104,Indonesia,ID,Jakarta,elite,true,2.1,AS45102,Alibaba Cloud (Singapore) Private Limited,6504.1,1779972706.2715766
socks5,149.129.226.9,5441,Indonesia,ID,Jakarta,elite,true,2.03,AS45102,Alibaba.com Singapore E-Commerce Private Limited,6950.15,1779972558.6114163
socks5,149.129.226.9,8008,Indonesia,ID,Jakarta,elite,true,1.95,AS45102,Alibaba.com Singapore E-Commerce Private Limited,14040.77,1779972551.6121538
