protocol,ip,port,country,country_code,city,anonymity,ssl,uptime_percent,asn,isp,latency_ms,last_checked
socks4,185.79.243.153,38431,Poland,PL,Myszków,elite,true,11.21,AS206957,PHU Kario-Sat Sp. z o.o.,1166.45,1780084135.0160456
http,178.212.144.7,80,Poland,PL,Sokółka,elite,false,98.96,AS51436,IDEALAN Spolka Jawna - Piekarski,51.8,1780084134.2504885
socks4,45.144.49.156,1080,Poland,PL,Warsaw,elite,true,65.97,AS49791,3hcloud,161.03,1780084133.7675486
socks4,185.160.13.112,1080,Poland,PL,Łaziska Górne,elite,true,61.27,AS197274,Slaska Siec Metropolitalna Sp. z o.o,1136.58,1780084128.5778072
socks4,185.32.4.65,4153,Poland,PL,Chociwel,elite,true,6.91,AS60645,AS Consulting Sp. z o. o.,3146.66,1780084105.6045477
socks4,78.31.93.76,1080,Poland,PL,Racibórz,elite,true,4.24,AS30813,Fione Spolka z Ogranicznona Odpowiedzialnoscia Spolka Komandytowa,3194.64,1780084101.9053793
socks5,45.144.49.156,1080,Poland,PL,Warsaw,elite,true,52.39,AS49791,3hcloud,215.96,1780083998.7999318
socks4,212.126.5.246,42344,Poland,PL,Poznan,elite,true,4.25,AS8364,"Institute of Bioorganic Chemistry Polish Academy of Science, Poznan Supercomput",3156.89,1780084186.8500843
