protocol,ip,port,country,country_code,city,anonymity,ssl,uptime_percent,asn,isp,latency_ms,last_checked
socks4,46.171.28.162,59311,Poland,PL,Krzywa Góra,elite,true,10.11,AS5617,Orange Polska Spolka Akcyjna,1150.92,1780193972.0101519
socks4,185.32.6.121,4153,Poland,PL,Ińsko,elite,true,11.76,AS60645,AS Consulting Sp. z o. o.,7287.51,1780193964.9815254
http,178.212.144.7,80,Poland,PL,Sokółka,elite,false,98.97,AS51436,IDEALAN Spolka Jawna - Piekarski,51.64,1780193964.813004
socks4,91.150.189.122,60647,Poland,PL,Rzeszów,elite,true,16.08,AS42673,Skyware Sp. z o.o.,3332.17,1780193960.519429
socks4,185.32.4.65,4153,Poland,PL,Chociwel,elite,true,7.27,AS60645,AS Consulting Sp. z o. o.,1109.69,1780193953.4268026
socks4,185.32.4.126,4153,Poland,PL,Chociwel,elite,true,29.87,AS60645,AS Consulting Sp. z o. o.,7461.33,1780193949.845207
socks4,185.79.243.153,38431,Poland,PL,Myszków,elite,true,11.47,AS206957,PHU Kario-Sat Sp. z o.o.,141.47,1780193947.0461566
http,85.198.229.194,80,Poland,PL,Bytom,transparent,false,25.66,AS30851,Sileman Sp. z o.o.,5143.66,1780193865.5739582
socks5,45.144.49.156,1080,Poland,PL,Warsaw,elite,true,61.82,AS49791,3hcloud,296.03,1780193822.2670774
socks4,185.160.13.112,1080,Poland,PL,Łaziska Górne,elite,true,61.96,AS197274,Slaska Siec Metropolitalna Sp. z o.o,241.99,1780194000.0177212
socks4,212.126.5.246,42344,Poland,PL,Poznan,elite,true,4.42,AS8364,"Institute of Bioorganic Chemistry Polish Academy of Science, Poznan Supercomput",1092.8,1780193986.82265
socks4,212.126.5.245,42344,Poland,PL,Poznan,elite,true,4.62,AS8364,"Institute of Bioorganic Chemistry Polish Academy of Science, Poznan Supercomput",3183.22,1780193978.268006
socks4,45.144.49.156,1080,Poland,PL,Warsaw,elite,true,67.19,AS49791,3hcloud,226.94,1780193959.428829
socks4,94.40.127.166,4145,Poland,PL,Torun,elite,true,3.86,AS20960,TK Telekom sp. z o.o.,1116.66,1780193939.0893195
