protocol,ip,port,country,country_code,city,anonymity,ssl,uptime_percent,asn,isp,latency_ms,last_checked
socks4,91.150.189.122,60647,Poland,PL,Rzeszów,elite,true,15.93,AS42673,Skyware Sp. z o.o.,1418.71,1780153779.8895159
http,178.212.144.7,80,Poland,PL,Sokółka,elite,false,98.96,AS51436,IDEALAN Spolka Jawna - Piekarski,55.15,1780153777.681699
socks4,185.160.13.112,1080,Poland,PL,Łaziska Górne,elite,true,61.75,AS197274,Slaska Siec Metropolitalna Sp. z o.o,128.01,1780153774.2703564
socks4,45.144.49.156,1080,Poland,PL,Warsaw,elite,true,66.72,AS49791,3hcloud,173.69,1780153769.4027202
socks4,185.32.6.121,4153,Poland,PL,Ińsko,elite,true,11.63,AS60645,AS Consulting Sp. z o. o.,126.92,1780153762.171627
socks4,46.171.28.162,59311,Poland,PL,Krzywa Góra,elite,true,10.0,AS5617,Orange Polska Spolka Akcyjna,3171.42,1780153757.4290457
socks4,78.31.93.76,1080,Poland,PL,Racibórz,elite,true,4.26,AS30813,Fione Spolka z Ogranicznona Odpowiedzialnoscia Spolka Komandytowa,1195.24,1780153719.9291425
http,84.205.28.220,8080,Poland,PL,Szczecinek,transparent,false,10.02,AS31608,Gawex Media Sp.zoo,7383.46,1780153714.2439275
socks4,212.126.5.246,42344,Poland,PL,Poznan,elite,true,4.37,AS8364,"Institute of Bioorganic Chemistry Polish Academy of Science, Poznan Supercomput",89.54,1780153789.3331273
