protocol,ip,port,country,country_code,city,anonymity,ssl,uptime_percent,asn,isp,latency_ms,last_checked
socks4,177.26.112.65,5678,Brazil,BR,São Paulo,elite,true,45.62,AS26599,Vivo,2106.19,1780028682.3738177
socks4,138.186.133.161,4153,Brazil,BR,Sapé,elite,true,6.69,AS53160,Unidasnet Comunicacoes Ltda,1972.48,1780028676.6478777
socks4,187.86.153.254,30660,Brazil,BR,Pelotas,elite,true,11.91,AS53066,VETORIALNET INF. E SERVIÇOS DE INTERNET LTDA,2114.17,1780028675.7052505
socks4,138.94.28.234,40658,Brazil,BR,Cantagalo,elite,true,10.87,AS264100,RIO CABLE TELECOM LTDA,8299.13,1780028671.801146
socks4,200.14.57.4,4153,Brazil,BR,Pedreiras,elite,true,41.32,AS270441,CONNECT PEDREIRAS SERVIÇOS DE INFORMATICA LTDA,8172.23,1780028663.4411638
socks4,177.67.176.91,4153,Brazil,BR,Araçu,elite,true,12.29,AS262523,Help Desk NET Telecomunicacoes Ltda ME,2140.55,1780028660.0159354
socks4,170.79.153.200,5678,Brazil,BR,Alto do Rodrigues,elite,true,34.0,AS266294,A Z DE ARAUJO NETO ME,893.62,1780028658.5405767
socks4,200.188.246.122,60606,Brazil,BR,Florianópolis,elite,true,50.94,AS11844,Empresa Catarinense de Tecnologia em Telecom. Ltda,2089.48,1780028697.685302
