protocol,ip,port,country,country_code,city,anonymity,ssl,uptime_percent,asn,isp,latency_ms,last_checked
socks4,138.94.28.234,40658,Brazil,BR,Cantagalo,elite,true,10.87,AS264100,RIO CABLE TELECOM LTDA,1001.69,1780027493.9248447
socks4,187.86.153.254,30660,Brazil,BR,Pelotas,elite,true,11.9,AS53066,VETORIALNET INF. E SERVIÇOS DE INTERNET LTDA,1254.41,1780027492.7951624
socks4,189.90.118.105,4153,Brazil,BR,Cantagalo,elite,true,45.59,AS262808,Brasilnet Telecomunicações Ltda ME,4071.93,1780027479.778485
socks4,177.126.89.63,4145,Brazil,BR,Palmas,elite,true,41.93,AS262352,Nova Telecom Ltda,8946.69,1780027471.9332254
socks4,177.67.176.91,4153,Brazil,BR,Araçu,elite,true,12.23,AS262523,Help Desk NET Telecomunicacoes Ltda ME,8302.1,1780027468.2391431
socks4,167.234.227.210,10808,Brazil,BR,São Paulo,elite,true,28.52,AS31898,Oracle Corporation,859.01,1780027500.4318774
socks4,200.14.57.4,4153,Brazil,BR,Pedreiras,elite,true,41.3,AS270441,CONNECT PEDREIRAS SERVIÇOS DE INFORMATICA LTDA,1970.97,1780027498.9533172
socks4,200.188.246.122,60606,Brazil,BR,Florianópolis,elite,true,50.92,AS11844,Empresa Catarinense de Tecnologia em Telecom. Ltda,1063.04,1780027493.637554
