protocol,ip,port,country,country_code,city,anonymity,ssl,uptime_percent,asn,isp,latency_ms,last_checked
socks4,187.86.153.254,30660,Brazil,BR,Pelotas,elite,true,12.15,AS53066,VETORIALNET INF. E SERVIÇOS DE INTERNET LTDA,2097.89,1780093796.8943217
socks4,200.188.246.122,60606,Brazil,BR,Florianópolis,elite,true,51.36,AS11844,Empresa Catarinense de Tecnologia em Telecom. Ltda,2066.11,1780093791.4382966
socks4,167.234.227.210,10808,Brazil,BR,São Paulo,elite,true,29.39,AS31898,Oracle Corporation,4156.89,1780093785.547543
socks4,200.14.57.4,4153,Brazil,BR,Pedreiras,elite,true,42.38,AS270441,CONNECT PEDREIRAS SERVIÇOS DE INFORMATICA LTDA,3976.72,1780093780.4299088
socks4,143.208.130.155,5678,Brazil,BR,Paulista,elite,true,43.85,AS264091,Lanservi Tecnologia,3963.08,1780093778.0483055
socks4,190.109.72.17,33633,Brazil,BR,São Geraldo do Araguaia,elite,true,5.41,AS264231,RG.COM - INFORMATICA & COMUNICACAO LTDA - ME,1943.12,1780093769.056111
socks4,206.42.51.78,4153,Brazil,BR,João Pessoa,elite,true,19.76,AS28126,Brisanet Servicos De Telecomunicacoes S.A,1843.85,1780093796.243518
