protocol,ip,port,country,country_code,city,anonymity,ssl,uptime_percent,asn,isp,latency_ms,last_checked
socks4,170.79.153.200,5678,Brazil,BR,Alto do Rodrigues,elite,true,34.18,AS266294,A Z DE ARAUJO NETO ME,889.72,1780051762.7333531
socks4,200.14.57.4,4153,Brazil,BR,Pedreiras,elite,true,41.71,AS270441,CONNECT PEDREIRAS SERVIÇOS DE INFORMATICA LTDA,8190.51,1780051749.2434812
socks4,138.94.28.234,40658,Brazil,BR,Cantagalo,elite,true,10.98,AS264100,RIO CABLE TELECOM LTDA,3307.45,1780051730.366907
socks4,189.90.118.105,4153,Brazil,BR,Cantagalo,elite,true,45.88,AS262808,Brasilnet Telecomunicações Ltda ME,2023.38,1780051728.5934331
socks4,177.67.176.91,4153,Brazil,BR,Araçu,elite,true,12.25,AS262523,Help Desk NET Telecomunicacoes Ltda ME,1118.39,1780051707.8996747
socks4,200.188.246.122,60606,Brazil,BR,Florianópolis,elite,true,51.19,AS11844,Empresa Catarinense de Tecnologia em Telecom. Ltda,4089.63,1780051781.6065881
