protocol,ip,port,country,country_code,city,anonymity,ssl,uptime_percent,asn,isp,latency_ms,last_checked
http,14.225.240.23,8562,Vietnam,VN,Ho Chi Minh City,elite,true,43.09,AS135905,Vietnam Posts and Telecommunications Group,2161.4,1780109687.9838398
http,203.205.49.2,10251,Vietnam,VN,Mai Dich,elite,true,10.63,AS45903,CMC Telecom Infrastructure Company,6293.64,1780109676.8532043
http,103.147.35.27,3128,Vietnam,VN,Dich Vong,transparent,true,18.4,AS135905,International Data Service Joint Stock Company,3872.57,1780109672.4288847
http,113.176.92.71,3128,Vietnam,VN,Cà Mau,transparent,true,56.76,AS45899,VNPT,4762.2,1780109661.3851967
http,137.59.47.73,3128,Vietnam,VN,Mai Dich,transparent,true,76.79,AS131429,MOBIFONECNTT,1322.24,1780109608.987747
http,113.160.132.26,8080,Vietnam,VN,Bắc Ninh,elite,true,99.12,AS45899,VietNam Post and Telecom Corporation,988.26,1780109588.3786523
