protocol,ip,port,country,country_code,city,anonymity,ssl,uptime_percent,asn,isp,latency_ms,last_checked
http,137.59.47.73,3128,Vietnam,VN,Mai Dich,transparent,true,76.57,AS131429,MOBIFONECNTT,640.51,1780007068.4579382
http,113.176.92.71,3128,Vietnam,VN,Cà Mau,transparent,true,56.54,AS45899,VNPT,681.79,1780007057.396324
http,14.225.8.195,3218,Vietnam,VN,Hanoi,transparent,true,16.86,AS135905,Vietnam Posts and Telecommunications Group,5540.4,1780007027.7875984
http,14.225.240.23,8562,Vietnam,VN,Ho Chi Minh City,elite,true,42.96,AS135905,Vietnam Posts and Telecommunications Group,7349.78,1780007023.4079335
http,128.14.92.86,22886,Vietnam,VN,Hanoi,elite,true,92.73,AS21859,Zenlayer Inc,9892.18,1780006992.891855
http,113.160.132.26,8080,Vietnam,VN,Bắc Ninh,elite,true,99.11,AS45899,VietNam Post and Telecom Corporation,676.96,1780006939.5922444
http,203.205.49.2,10168,Vietnam,VN,Mai Dich,elite,true,10.3,AS45903,CMC Telecom Infrastructure Company,1421.49,1780007092.6922164
http,203.205.49.2,10009,Vietnam,VN,Mai Dich,elite,true,10.15,AS45903,CMC Telecom Infrastructure Company,1282.97,1780006967.5327444
