protocol,ip,port,country,country_code,city,anonymity,ssl,uptime_percent,asn,isp,latency_ms,last_checked
http,103.147.35.27,3128,Vietnam,VN,Dich Vong,transparent,true,18.55,AS135905,International Data Service Joint Stock Company,14670.18,1780159426.6732826
http,113.160.132.26,8080,Vietnam,VN,Bắc Ninh,elite,true,99.12,AS45899,VietNam Post and Telecom Corporation,732.38,1780159408.442628
http,110.172.29.131,3128,Vietnam,VN,Quận Mười Một,transparent,true,10.59,AS135918,CONTABO,15143.49,1780159367.4513073
http,203.205.49.2,10146,Vietnam,VN,Mai Dich,elite,true,9.3,AS45903,CMC Telecom Infrastructure Company,1729.7,1780159364.0497603
http,203.205.49.2,10019,Vietnam,VN,Mai Dich,elite,true,16.21,AS45903,CMC Telecom Infrastructure Company,5074.58,1780159356.809675
http,14.225.240.23,8562,Vietnam,VN,Ho Chi Minh City,elite,true,43.13,AS135905,Vietnam Posts and Telecommunications Group,2263.34,1780159343.317139
http,42.96.17.77,3128,Vietnam,VN,Quận Một,transparent,true,85.38,AS131423,Long Van System Solution,6037.95,1780159328.3919847
http,128.14.92.93,22881,Vietnam,VN,Hanoi,elite,true,29.36,AS21859,Zenlayer Inc,9911.01,1780159308.216647
http,203.205.49.2,10009,Vietnam,VN,Mai Dich,elite,true,10.54,AS45903,CMC Telecom Infrastructure Company,3351.71,1780159421.2119346
