protocol,ip,port,country,country_code,city,anonymity,ssl,uptime_percent,asn,isp,latency_ms,last_checked
http,113.160.132.26,8080,Vietnam,VN,Bắc Ninh,elite,true,99.11,AS45899,VietNam Post and Telecom Corporation,1611.78,1780067355.017294
http,103.147.35.27,3128,Vietnam,VN,Dich Vong,transparent,true,18.34,AS135905,International Data Service Joint Stock Company,12924.72,1780067350.252468
http,103.166.182.144,3128,Vietnam,VN,Dich Vong,transparent,true,13.34,AS135905,ZOZO,14511.22,1780067315.8078778
http,110.172.28.217,3128,Vietnam,VN,Quận Mười Một,transparent,true,36.22,AS135918,CONTABO,14709.97,1780067264.6901248
http,103.216.127.67,3128,Vietnam,VN,Quận Mười,transparent,true,44.39,AS154552,VinhNam Commercial informatics service corporation,12699.58,1780067343.3784132
http,203.205.49.2,10236,Vietnam,VN,Mai Dich,elite,true,10.73,AS45903,CMC Telecom Infrastructure Company,1817.5,1780067316.7860847
