protocol,ip,port,country,country_code,city,anonymity,ssl,uptime_percent,asn,isp,latency_ms,last_checked
http,157.66.198.193,39189,Vietnam,VN,Da Nang,transparent,true,2.59,AS151872,Cloud Data Technology and Communication Company Limited,1655.52,1779972586.5144384
http,137.59.47.73,3128,Vietnam,VN,Mai Dich,transparent,true,76.47,AS131429,MOBIFONECNTT,3839.6,1779972561.5652778
http,113.160.132.26,8080,Vietnam,VN,Bắc Ninh,elite,true,99.1,AS45899,VietNam Post and Telecom Corporation,609.48,1779972539.749781
http,203.205.49.2,10168,Vietnam,VN,Mai Dich,elite,true,10.04,AS45903,CMC Telecom Infrastructure Company,7536.33,1779972518.3972688
http,103.147.35.27,3128,Vietnam,VN,Dich Vong,transparent,true,18.09,AS135905,International Data Service Joint Stock Company,8843.43,1779972504.5432315
http,113.176.92.71,3128,Vietnam,VN,Cà Mau,transparent,true,56.14,AS45899,VNPT,688.31,1779972503.0733647
http,110.172.28.217,3128,Vietnam,VN,Quận Mười Một,transparent,true,36.49,AS135918,CONTABO,21737.98,1779972489.2260919
http,14.225.240.23,8562,Vietnam,VN,Ho Chi Minh City,elite,true,42.93,AS135905,Vietnam Posts and Telecommunications Group,4193.66,1779972450.9607534
http,203.205.49.2,10235,Vietnam,VN,Mai Dich,elite,true,10.45,AS45903,CMC Telecom Infrastructure Company,11045.42,1779972546.5691552
