protocol,ip,port,country,country_code,city,anonymity,ssl,uptime_percent,asn,isp,latency_ms,last_checked
http,14.225.240.23,8562,Vietnam,VN,Ho Chi Minh City,elite,true,43.06,AS135905,Vietnam Posts and Telecommunications Group,3079.45,1780096176.425336
http,128.14.92.90,22889,Vietnam,VN,Hanoi,elite,true,68.38,AS21859,Zenlayer Inc,7234.62,1780096161.0619493
http,113.160.132.26,8080,Vietnam,VN,Bắc Ninh,elite,true,99.12,AS45899,VietNam Post and Telecom Corporation,668.47,1780096138.886659
http,103.82.23.118,5247,Vietnam,VN,Dich Vong,elite,true,2.66,AS135905,Vietnam Posts and Telecommunications Group,613.62,1780096117.4658947
http,137.59.47.73,3128,Vietnam,VN,Mai Dich,transparent,true,76.76,AS131429,MOBIFONECNTT,8601.06,1780096101.0131366
http,203.205.49.2,10228,Vietnam,VN,Mai Dich,elite,true,9.47,AS45903,CMC Telecom Infrastructure Company,14331.06,1780096067.4022074
