protocol,ip,port,country,country_code,city,anonymity,ssl,uptime_percent,asn,isp,latency_ms,last_checked
http,137.59.47.73,3128,Vietnam,VN,Mai Dich,transparent,true,76.89,AS131429,MOBIFONECNTT,608.4,1780157378.0135758
http,113.160.132.26,8080,Vietnam,VN,Bắc Ninh,elite,true,99.12,AS45899,VietNam Post and Telecom Corporation,754.2,1780157366.781755
http,128.14.92.89,22891,Vietnam,VN,Hanoi,elite,true,67.45,AS21859,Zenlayer Inc,7611.67,1780157285.819854
http,42.96.17.77,3128,Vietnam,VN,Quận Một,transparent,true,84.06,AS131423,Long Van System Solution,1852.34,1780157276.8742304
http,160.30.113.24,3128,Vietnam,VN,Quận Ba,elite,true,18.53,AS135918,MAYCHUMANG,10297.28,1780157266.5399714
http,118.69.183.149,8080,Vietnam,VN,Ho Chi Minh City,transparent,true,8.46,AS18403,Vietnam Internet Network Information Center,1782.75,1780157184.6899297
http,203.205.49.2,10091,Vietnam,VN,Mai Dich,elite,true,9.15,AS45903,CMC Telecom Infrastructure Company,1305.23,1780157398.595248
http,203.205.49.2,10101,Vietnam,VN,Mai Dich,elite,true,29.53,AS45903,CMC Telecom Infrastructure Company,2369.35,1780157340.6723766
http,103.216.127.67,3128,Vietnam,VN,Quận Mười,transparent,true,40.25,AS154552,VinhNam Commercial informatics service corporation,10558.73,1780157315.159926
http,163.223.230.92,39089,Vietnam,VN,Phù Mỹ,transparent,true,4.03,AS135983,Tino Group Joint Stock Company,3842.49,1780157312.7260962
