protocol,ip,port,country,country_code,city,anonymity,ssl,uptime_percent,asn,isp,latency_ms,last_checked
http,203.205.49.2,10142,Vietnam,VN,Mai Dich,elite,true,10.33,AS45903,CMC Telecom Infrastructure Company,3790.73,1780108185.2062485
http,137.59.47.73,3128,Vietnam,VN,Mai Dich,transparent,true,76.79,AS131429,MOBIFONECNTT,3879.73,1780108177.7364876
http,113.176.92.71,3128,Vietnam,VN,Cà Mau,transparent,true,56.73,AS45899,VNPT,7277.44,1780108170.4289558
http,113.160.132.26,8080,Vietnam,VN,Bắc Ninh,elite,true,99.12,AS45899,VietNam Post and Telecom Corporation,8772.68,1780108154.9119081
http,14.225.240.23,8562,Vietnam,VN,Ho Chi Minh City,elite,true,43.08,AS135905,Vietnam Posts and Telecommunications Group,7269.72,1780108112.9960935
