protocol,ip,port,country,country_code,city,anonymity,ssl,uptime_percent,asn,isp,latency_ms,last_checked
http,14.225.240.23,8562,Vietnam,VN,Ho Chi Minh City,elite,true,42.98,AS135905,Vietnam Posts and Telecommunications Group,1617.64,1780019331.4152408
http,137.59.47.73,3128,Vietnam,VN,Mai Dich,transparent,true,76.61,AS131429,MOBIFONECNTT,1331.76,1780019317.299525
http,113.176.92.71,3128,Vietnam,VN,Cà Mau,transparent,true,56.72,AS45899,VNPT,799.68,1780019289.741914
http,113.160.132.26,8080,Vietnam,VN,Bắc Ninh,elite,true,99.11,AS45899,VietNam Post and Telecom Corporation,835.91,1780019257.2436867
http,103.82.23.118,5182,Vietnam,VN,Dich Vong,elite,true,1.91,AS135905,Vietnam Posts and Telecommunications Group,911.55,1780019354.7690926
