protocol,ip,port,country,country_code,city,anonymity,ssl,uptime_percent,asn,isp,latency_ms,last_checked
socks5,38.180.78.54,10001,Brazil,BR,São Paulo,elite,true,71.79,AS9009,M247 Europe SRL,957.43,1780236587.8341355
socks5,177.52.25.34,1080,Brazil,BR,Itápolis,elite,true,56.94,AS262282,Maria Luciana Machado E CIA Ltda-me,2410.78,1780236587.7014666
socks5,177.10.66.14,1080,Brazil,BR,Santo Antônio das Missões,elite,true,53.76,AS53234,SILVEIRA & ZIQUINATTI LTDA,1462.0,1780236547.3335428
socks5,187.63.9.62,63253,Brazil,BR,Arraial do Cabo,elite,true,43.43,AS28658,Gigalink de Nova Friburgo Soluções em Rede Multimi,2704.27,1780236540.5396833
socks5,186.26.95.249,61445,Brazil,BR,São João de Meriti,elite,true,48.67,AS270938,SAT TELECOM E CONSULTORIA EM TI Ltda,11043.69,1780236524.4514754
socks5,204.216.136.58,9050,Brazil,BR,Vinhedo,elite,true,27.81,AS31898,Oracle Corporation,15722.38,1780236521.377865
