protocol,ip,port,country,country_code,city,anonymity,ssl,uptime_percent,asn,isp,latency_ms,last_checked
socks5,177.52.25.34,1080,Brazil,BR,Itápolis,elite,true,51.54,AS262282,Maria Luciana Machado E CIA Ltda-me,2357.8,1780037946.9429228
socks5,186.26.95.249,61445,Brazil,BR,São João de Meriti,elite,true,44.81,AS270938,SAT TELECOM E CONSULTORIA EM TI Ltda,4188.85,1780037943.5907845
socks5,177.10.66.14,1080,Brazil,BR,Santo Antônio das Missões,elite,true,51.25,AS53234,SILVEIRA & ZIQUINATTI LTDA,4311.65,1780037914.845243
socks5,167.234.227.210,10808,Brazil,BR,São Paulo,elite,true,18.61,AS31898,Oracle Corporation,17722.98,1780037447.4717426
socks5,187.63.9.62,63253,Brazil,BR,Arraial do Cabo,elite,true,38.91,AS28658,Gigalink de Nova Friburgo Soluções em Rede Multimi,2539.01,1780037341.3485563
