protocol,ip,port,country,country_code,city,anonymity,ssl,uptime_percent,asn,isp,latency_ms,last_checked
socks5,177.52.25.34,1080,Brazil,BR,Itápolis,elite,true,51.87,AS262282,Maria Luciana Machado E CIA Ltda-me,8609.98,1780063760.6545384
socks5,177.10.66.14,1080,Brazil,BR,Santo Antônio das Missões,elite,true,51.36,AS53234,SILVEIRA & ZIQUINATTI LTDA,1286.62,1780063759.055728
socks5,187.63.9.62,63253,Brazil,BR,Arraial do Cabo,elite,true,39.11,AS28658,Gigalink de Nova Friburgo Soluções em Rede Multimi,4360.17,1780063670.7088704
socks5,167.234.227.210,10808,Brazil,BR,São Paulo,elite,true,18.87,AS31898,Oracle Corporation,1437.9,1780063665.6375856
socks5,186.26.95.249,61445,Brazil,BR,São João de Meriti,elite,true,45.03,AS270938,SAT TELECOM E CONSULTORIA EM TI Ltda,4934.25,1780063629.6554077
socks5,204.216.136.58,9050,Brazil,BR,Vinhedo,elite,true,23.67,AS31898,Oracle Corporation,15289.15,1780063637.44883
