protocol,ip,port,country,country_code,city,anonymity,ssl,uptime_percent,asn,isp,latency_ms,last_checked
socks5,38.180.78.54,10001,Brazil,BR,São Paulo,elite,true,76.34,AS9009,M247 Europe SRL,3456.26,1780203556.6070776
socks5,187.63.9.62,63253,Brazil,BR,Arraial do Cabo,elite,true,42.38,AS28658,Gigalink de Nova Friburgo Soluções em Rede Multimi,4971.72,1780203552.0085402
socks5,177.52.25.34,1080,Brazil,BR,Itápolis,elite,true,55.63,AS262282,Maria Luciana Machado E CIA Ltda-me,1763.71,1780203521.6987712
socks5,186.26.95.249,61445,Brazil,BR,São João de Meriti,elite,true,47.47,AS270938,SAT TELECOM E CONSULTORIA EM TI Ltda,1561.62,1780203517.452848
socks5,177.10.66.14,1080,Brazil,BR,Santo Antônio das Missões,elite,true,53.22,AS53234,SILVEIRA & ZIQUINATTI LTDA,3276.31,1780203511.0258749
socks5,204.216.136.58,9050,Brazil,BR,Vinhedo,elite,true,27.19,AS31898,Oracle Corporation,10011.29,1780203557.0229616
