protocol,ip,port,country,country_code,city,anonymity,ssl,uptime_percent,asn,isp,latency_ms,last_checked
http,45.89.106.12,8080,India,IN,New Delhi,transparent,true,99.92,AS153914,NETRANEX TECHNOLOGIES (INDIA) PRIVATE LIMITED,306.43,1779996572.9890158
http,45.89.106.116,1082,India,IN,New Delhi,elite,true,82.5,AS153914,NETRANEX TECHNOLOGIES (INDIA) PRIVATE LIMITED,5216.58,1779996533.9954147
http,116.212.182.74,8081,India,IN,Bengaluru,transparent,true,6.48,AS55839,Microsense Private Limited,1325.6,1779996527.2086613
http,103.48.68.126,83,India,IN,Hyderabad,transparent,true,8.15,AS136290,Country Online Services PVT LTD,9306.9,1779996519.0631702
http,103.158.242.58,84,India,IN,Hyderabad,transparent,true,38.44,AS133271,Willaegis Online Private Limited,380.03,1779996494.4055014
http,103.41.32.182,58080,India,IN,Mumbai,transparent,true,17.03,AS138296,Juweriyah Networks Private Limited,9672.75,1779996494.3852754
http,45.89.106.116,1081,India,IN,New Delhi,elite,true,76.78,AS153914,NETRANEX TECHNOLOGIES (INDIA) PRIVATE LIMITED,11418.2,1779996478.81687
http,14.143.222.113,57718,India,IN,Chennai,anonymous,true,99.34,AS4755,Tata Communications Limited,1040.09,1779996470.2355475
http,115.247.115.38,8080,India,IN,Indore,transparent,true,8.39,AS55836,Reliance Jio Infocomm Limited,2371.31,1779996463.18625
http,152.67.191.232,6800,India,IN,Hyderabad,transparent,true,87.75,AS31898,Oracle Corporation,394.08,1779996462.0023918
http,202.140.62.212,8080,India,IN,Bengaluru,transparent,true,7.02,AS45769,Karuturi Telecom Pvt Ltd,7721.59,1779996437.4081173
http,103.69.243.162,43826,India,IN,Mumbai,elite,true,18.44,AS135762,Clear Beam Communications Pvt. Ltd.,10897.31,1779996544.1923206
http,210.16.85.42,8080,India,IN,Chennai,transparent,true,8.07,AS134877,Sri Vari Network Private Limited,9447.98,1779996501.3365166
