protocol,ip,port,country,country_code,city,anonymity,ssl,uptime_percent,asn,isp,latency_ms,last_checked
http,45.89.106.12,8080,India,IN,New Delhi,transparent,true,99.92,AS153914,NETRANEX TECHNOLOGIES (INDIA) PRIVATE LIMITED,297.53,1780000779.2762377
http,152.67.191.232,6800,India,IN,Hyderabad,transparent,true,87.78,AS31898,Oracle Corporation,397.93,1780000771.3638718
http,45.89.106.116,1081,India,IN,New Delhi,elite,true,76.86,AS153914,NETRANEX TECHNOLOGIES (INDIA) PRIVATE LIMITED,2555.53,1780000752.975993
http,111.92.88.27,3128,India,IN,Kochi,transparent,true,60.19,AS17465,Asianet Satellite Communications Pvt Ltd,14628.81,1780000752.494835
http,103.158.242.58,84,India,IN,Hyderabad,transparent,true,38.53,AS133271,Willaegis Online Private Limited,380.06,1780000736.332546
http,45.119.113.65,83,India,IN,Hyderabad,transparent,true,5.82,AS59185,Netrun Technologies PVT LTD,12075.82,1780000728.8208854
http,14.143.222.113,57718,India,IN,Chennai,anonymous,true,99.32,AS4755,Tata Communications Limited,340.56,1780000708.6921725
http,103.48.71.142,82,India,IN,Malkajgiri,transparent,true,6.28,AS136290,Country Online Services PVT LTD,12322.25,1780000688.642038
http,160.30.83.10,83,India,IN,Chennai,transparent,true,6.84,AS151749,Virtel Communications Private Limited,3190.94,1780000682.3020954
http,45.89.106.116,1082,India,IN,New Delhi,elite,true,85.51,AS153914,NETRANEX TECHNOLOGIES (INDIA) PRIVATE LIMITED,749.35,1780000680.9158633
http,103.24.127.129,8080,India,IN,Hyderabad,transparent,true,13.71,AS141303,Pioneer Elabs Ltd.,13604.05,1780000765.2907968
http,103.8.119.70,8080,India,IN,Puducherry,transparent,true,17.29,AS135225,Smart NET India PVT LTD,7264.28,1780000709.6784458
