protocol,ip,port,country,country_code,city,anonymity,ssl,uptime_percent,asn,isp,latency_ms,last_checked
socks4,91.150.189.122,60647,Poland,PL,Rzeszów,elite,true,16.0,AS42673,Skyware Sp. z o.o.,1384.65,1780168788.5909648
socks4,185.79.243.153,38431,Poland,PL,Myszków,elite,true,11.42,AS206957,PHU Kario-Sat Sp. z o.o.,7292.03,1780168781.7696471
socks4,46.171.28.162,59311,Poland,PL,Krzywa Góra,elite,true,10.04,AS5617,Orange Polska Spolka Akcyjna,1131.06,1780168768.9435074
socks4,37.131.164.94,59341,Poland,PL,Strzelce Krajeńskie,elite,true,16.31,AS35745,KSU Provector Network,199.56,1780168765.8932862
socks4,212.126.5.246,42344,Poland,PL,Poznan,elite,true,4.39,AS8364,"Institute of Bioorganic Chemistry Polish Academy of Science, Poznan Supercomput",83.07,1780168795.1056316
socks4,213.25.70.1,3629,Poland,PL,Miasteczko Śląskie,elite,true,2.67,AS5617,Orange Polska Spolka Akcyjna,1108.46,1780168765.198772
