protocol,ip,port,country,country_code,city,anonymity,ssl,uptime_percent,asn,isp,latency_ms,last_checked
socks4,46.171.28.162,59311,Poland,PL,Krzywa Góra,elite,true,10.04,AS5617,Orange Polska Spolka Akcyjna,1149.32,1780168196.4733474
socks4,45.144.49.156,1080,Poland,PL,Warsaw,elite,true,66.85,AS49791,3hcloud,258.85,1780168180.31724
socks4,185.79.243.153,38431,Poland,PL,Myszków,elite,true,11.41,AS206957,PHU Kario-Sat Sp. z o.o.,1178.53,1780168170.4892752
socks4,185.32.6.121,4153,Poland,PL,Ińsko,elite,true,11.69,AS60645,AS Consulting Sp. z o. o.,1147.86,1780168166.9662912
socks4,78.31.93.76,1080,Poland,PL,Racibórz,elite,true,4.26,AS30813,Fione Spolka z Ogranicznona Odpowiedzialnoscia Spolka Komandytowa,7317.61,1780168166.09323
socks4,212.126.5.249,42344,Poland,PL,Poznan,elite,true,17.27,AS8364,"Institute of Bioorganic Chemistry Polish Academy of Science, Poznan Supercomput",79.27,1780168202.7226963
