protocol,ip,port,country,country_code,city,anonymity,ssl,uptime_percent,asn,isp,latency_ms,last_checked
socks4,45.144.49.156,1080,Poland,PL,Warsaw,elite,true,67.67,AS49791,3hcloud,322.18,1780232651.349062
socks4,91.150.189.122,60647,Poland,PL,Rzeszów,elite,true,16.21,AS42673,Skyware Sp. z o.o.,1384.23,1780232649.6050782
socks4,185.160.13.112,1080,Poland,PL,Łaziska Górne,elite,true,62.23,AS197274,Slaska Siec Metropolitalna Sp. z o.o,186.15,1780232633.7267985
socks4,185.79.243.153,38431,Poland,PL,Myszków,elite,true,11.56,AS206957,PHU Kario-Sat Sp. z o.o.,301.82,1780232632.6402283
socks4,185.32.4.65,4153,Poland,PL,Chociwel,elite,true,7.39,AS60645,AS Consulting Sp. z o. o.,1202.07,1780232624.3743963
socks4,212.126.5.245,42344,Poland,PL,Poznan,elite,true,4.67,AS8364,"Institute of Bioorganic Chemistry Polish Academy of Science, Poznan Supercomput",7280.47,1780232683.9592586
