protocol,ip,port,country,country_code,city,anonymity,ssl,uptime_percent,asn,isp,latency_ms,last_checked
socks4,185.32.6.121,4153,Poland,PL,Ińsko,elite,true,11.89,AS60645,AS Consulting Sp. z o. o.,141.3,1780219176.6885443
socks4,46.171.28.162,59311,Poland,PL,Krzywa Góra,elite,true,10.18,AS5617,Orange Polska Spolka Akcyjna,173.8,1780219171.372448
socks4,185.79.243.153,38431,Poland,PL,Myszków,elite,true,11.53,AS206957,PHU Kario-Sat Sp. z o.o.,7393.04,1780219162.0771716
socks4,185.160.13.112,1080,Poland,PL,Łaziska Górne,elite,true,62.14,AS197274,Slaska Siec Metropolitalna Sp. z o.o,327.56,1780219150.4440703
socks4,185.32.4.65,4153,Poland,PL,Chociwel,elite,true,7.36,AS60645,AS Consulting Sp. z o. o.,7319.41,1780219144.1763701
socks4,212.126.5.245,42344,Poland,PL,Poznan,elite,true,4.65,AS8364,"Institute of Bioorganic Chemistry Polish Academy of Science, Poznan Supercomput",1123.81,1780219201.531044
socks4,212.126.5.249,42344,Poland,PL,Poznan,elite,true,17.67,AS8364,"Institute of Bioorganic Chemistry Polish Academy of Science, Poznan Supercomput",93.13,1780219200.212886
socks4,45.144.49.156,1080,Poland,PL,Warsaw,elite,true,67.56,AS49791,3hcloud,198.92,1780219190.5631664
