protocol,ip,port,country,country_code,city,anonymity,ssl,uptime_percent,asn,isp,latency_ms,last_checked
socks4,51.83.226.103,9055,Poland,PL,Warsaw,elite,true,34.1,AS16276,OVH SAS,776.74,1780139057.4528303
socks4,185.32.4.126,4153,Poland,PL,Chociwel,elite,true,29.45,AS60645,AS Consulting Sp. z o. o.,1132.03,1780139050.9818494
socks4,185.79.243.153,38431,Poland,PL,Myszków,elite,true,11.34,AS206957,PHU Kario-Sat Sp. z o.o.,148.06,1780139048.4810383
socks4,78.31.93.76,1080,Poland,PL,Racibórz,elite,true,4.25,AS30813,Fione Spolka z Ogranicznona Odpowiedzialnoscia Spolka Komandytowa,7229.36,1780139043.8851955
socks4,46.171.28.162,59311,Poland,PL,Krzywa Góra,elite,true,9.93,AS5617,Orange Polska Spolka Akcyjna,1148.37,1780139018.8432074
socks4,185.160.13.112,1080,Poland,PL,Łaziska Górne,elite,true,61.61,AS197274,Slaska Siec Metropolitalna Sp. z o.o,135.14,1780139057.4802203
socks4,45.144.49.156,1080,Poland,PL,Warsaw,elite,true,66.59,AS49791,3hcloud,177.35,1780139053.8710551
socks4,212.126.5.246,42344,Poland,PL,Poznan,elite,true,4.34,AS8364,"Institute of Bioorganic Chemistry Polish Academy of Science, Poznan Supercomput",84.68,1780139052.4441953
