protocol,ip,port,country,country_code,city,anonymity,ssl,uptime_percent,asn,isp,latency_ms,last_checked
socks4,185.160.13.112,1080,Poland,PL,Łaziska Górne,elite,true,60.68,AS197274,Slaska Siec Metropolitalna Sp. z o.o,131.2,1780016366.837061
socks4,185.32.6.121,4153,Poland,PL,Ińsko,elite,true,11.01,AS60645,AS Consulting Sp. z o. o.,113.77,1780016357.8743086
socks4,94.40.127.166,4145,Poland,PL,Torun,elite,true,3.8,AS20960,TK Telekom sp. z o.o.,1120.61,1780016346.6298707
socks4,212.126.5.249,42344,Poland,PL,Poznan,elite,true,15.25,AS8364,"Institute of Bioorganic Chemistry Polish Academy of Science, Poznan Supercomput",3117.6,1780016408.324768
socks4,213.25.70.1,3629,Poland,PL,Miasteczko Śląskie,elite,true,2.62,AS5617,Orange Polska Spolka Akcyjna,1127.66,1780016405.0869062
