protocol,ip,port,country,country_code,city,anonymity,ssl,uptime_percent,asn,isp,latency_ms,last_checked
socks4,46.171.28.162,59311,Poland,PL,Krzywa Góra,elite,true,10.17,AS5617,Orange Polska Spolka Akcyjna,258.56,1780213800.128452
socks4,185.160.13.112,1080,Poland,PL,Łaziska Górne,elite,true,62.1,AS197274,Slaska Siec Metropolitalna Sp. z o.o,1162.64,1780213798.9031951
socks4,45.144.49.156,1080,Poland,PL,Warsaw,elite,true,67.49,AS49791,3hcloud,494.61,1780213796.2552102
socks4,185.32.4.126,4153,Poland,PL,Chociwel,elite,true,30.04,AS60645,AS Consulting Sp. z o. o.,3193.96,1780213793.4635627
socks4,185.32.4.65,4153,Poland,PL,Chociwel,elite,true,7.34,AS60645,AS Consulting Sp. z o. o.,114.12,1780213789.4600947
socks4,185.79.243.153,38431,Poland,PL,Myszków,elite,true,11.51,AS206957,PHU Kario-Sat Sp. z o.o.,3206.04,1780213768.8848932
socks4,91.150.189.122,60647,Poland,PL,Rzeszów,elite,true,16.15,AS42673,Skyware Sp. z o.o.,234.25,1780213738.8334837
socks4,212.126.5.245,42344,Poland,PL,Poznan,elite,true,4.64,AS8364,"Institute of Bioorganic Chemistry Polish Academy of Science, Poznan Supercomput",3145.03,1780213792.2240498
