protocol,ip,port,country,country_code,city,anonymity,ssl,uptime_percent,asn,isp,latency_ms,last_checked
socks4,185.79.243.153,38431,Poland,PL,Myszków,elite,true,11.28,AS206957,PHU Kario-Sat Sp. z o.o.,145.01,1780119000.3388345
socks4,185.160.13.112,1080,Poland,PL,Łaziska Górne,elite,true,61.48,AS197274,Slaska Siec Metropolitalna Sp. z o.o,1131.43,1780118996.8691258
socks4,46.171.28.162,59311,Poland,PL,Krzywa Góra,elite,true,9.84,AS5617,Orange Polska Spolka Akcyjna,128.33,1780118995.355316
socks4,45.144.49.156,1080,Poland,PL,Warsaw,elite,true,66.17,AS49791,3hcloud,144.38,1780118978.7473972
socks4,185.32.6.121,4153,Poland,PL,Ińsko,elite,true,11.39,AS60645,AS Consulting Sp. z o. o.,7341.11,1780118971.26129
socks4,91.150.189.122,60647,Poland,PL,Rzeszów,elite,true,15.75,AS42673,Skyware Sp. z o.o.,7339.17,1780118967.2854147
socks4,212.126.5.245,42344,Poland,PL,Poznan,elite,true,4.5,AS8364,"Institute of Bioorganic Chemistry Polish Academy of Science, Poznan Supercomput",3135.73,1780118973.6351244
