protocol,ip,port,country,country_code,city,anonymity,ssl,uptime_percent,asn,isp,latency_ms,last_checked
socks4,45.144.49.156,1080,Poland,PL,Warsaw,elite,true,66.57,AS49791,3hcloud,182.34,1780136998.8588626
socks4,185.32.4.126,4153,Poland,PL,Chociwel,elite,true,29.39,AS60645,AS Consulting Sp. z o. o.,1134.02,1780136998.2452798
socks4,46.171.28.162,59311,Poland,PL,Krzywa Góra,elite,true,9.92,AS5617,Orange Polska Spolka Akcyjna,3145.95,1780136992.748319
socks4,185.32.6.121,4153,Poland,PL,Ińsko,elite,true,11.49,AS60645,AS Consulting Sp. z o. o.,1139.71,1780136988.7361705
socks4,51.83.226.103,9055,Poland,PL,Warsaw,elite,true,34.11,AS16276,OVH SAS,1659.5,1780136980.6765523
socks4,185.79.243.153,38431,Poland,PL,Myszków,elite,true,11.33,AS206957,PHU Kario-Sat Sp. z o.o.,3155.89,1780136974.3869972
socks4,213.25.70.1,3629,Poland,PL,Miasteczko Śląskie,elite,true,2.67,AS5617,Orange Polska Spolka Akcyjna,7361.64,1780136991.5889838
socks4,212.126.5.249,42344,Poland,PL,Poznan,elite,true,16.96,AS8364,"Institute of Bioorganic Chemistry Polish Academy of Science, Poznan Supercomput",82.61,1780136989.3133242
