protocol,ip,port,country,country_code,city,anonymity,ssl,uptime_percent,asn,isp,latency_ms,last_checked
socks4,51.83.226.103,9055,Poland,PL,Warsaw,elite,true,34.01,AS16276,OVH SAS,1174.93,1780126174.9975698
socks4,185.32.4.65,4153,Poland,PL,Chociwel,elite,true,7.07,AS60645,AS Consulting Sp. z o. o.,113.37,1780126174.4900603
socks4,91.150.189.122,60647,Poland,PL,Rzeszów,elite,true,15.78,AS42673,Skyware Sp. z o.o.,1454.8,1780126172.8291018
socks4,46.171.28.162,59311,Poland,PL,Krzywa Góra,elite,true,9.88,AS5617,Orange Polska Spolka Akcyjna,1122.14,1780126156.8835886
socks4,94.40.127.166,4145,Poland,PL,Torun,elite,true,3.83,AS20960,TK Telekom sp. z o.o.,3141.23,1780126165.0324798
socks4,212.126.5.249,42344,Poland,PL,Poznan,elite,true,16.83,AS8364,"Institute of Bioorganic Chemistry Polish Academy of Science, Poznan Supercomput",3138.08,1780126175.2913828
