protocol,ip,port,country,country_code,city,anonymity,ssl,uptime_percent,asn,isp,latency_ms,last_checked
socks4,185.32.4.65,4153,Poland,PL,Chociwel,elite,true,7.05,AS60645,AS Consulting Sp. z o. o.,1119.7,1780123199.84759
socks4,91.150.189.122,60647,Poland,PL,Rzeszów,elite,true,15.77,AS42673,Skyware Sp. z o.o.,1214.62,1780123198.4903712
socks4,185.160.13.112,1080,Poland,PL,Łaziska Górne,elite,true,61.51,AS197274,Slaska Siec Metropolitalna Sp. z o.o,130.11,1780123197.832642
socks4,46.171.28.162,59311,Poland,PL,Krzywa Góra,elite,true,9.86,AS5617,Orange Polska Spolka Akcyjna,124.71,1780123196.3535724
socks4,185.79.243.153,38431,Poland,PL,Myszków,elite,true,11.3,AS206957,PHU Kario-Sat Sp. z o.o.,7255.38,1780123195.3870282
socks4,45.144.49.156,1080,Poland,PL,Warsaw,elite,true,66.26,AS49791,3hcloud,137.25,1780123195.2123518
socks4,212.126.5.245,42344,Poland,PL,Poznan,elite,true,4.51,AS8364,"Institute of Bioorganic Chemistry Polish Academy of Science, Poznan Supercomput",7369.91,1780123189.3372471
socks4,212.126.5.249,42344,Poland,PL,Poznan,elite,true,16.79,AS8364,"Institute of Bioorganic Chemistry Polish Academy of Science, Poznan Supercomput",89.63,1780123179.540266
