protocol,ip,port,country,country_code,city,anonymity,ssl,uptime_percent,asn,isp,latency_ms,last_checked
socks4,185.79.243.153,38431,Poland,PL,Myszków,elite,true,11.07,AS206957,PHU Kario-Sat Sp. z o.o.,1156.36,1780029898.7294803
socks4,78.31.93.76,1080,Poland,PL,Racibórz,elite,true,4.21,AS30813,Fione Spolka z Ogranicznona Odpowiedzialnoscia Spolka Komandytowa,3204.3,1780029896.5150466
socks4,46.171.28.162,59311,Poland,PL,Krzywa Góra,elite,true,9.45,AS5617,Orange Polska Spolka Akcyjna,7270.65,1780029881.5497022
socks4,37.131.164.94,59341,Poland,PL,Strzelce Krajeńskie,elite,true,15.41,AS35745,KSU Provector Network,1200.2,1780029868.642693
socks4,185.32.6.121,4153,Poland,PL,Ińsko,elite,true,11.05,AS60645,AS Consulting Sp. z o. o.,122.35,1780029863.89419
socks4,45.144.49.156,1080,Poland,PL,Warsaw,elite,true,64.72,AS49791,3hcloud,189.92,1780029903.8012145
socks4,213.25.70.1,3629,Poland,PL,Miasteczko Śląskie,elite,true,2.62,AS5617,Orange Polska Spolka Akcyjna,3140.86,1780029898.8555686
socks4,212.126.5.246,42344,Poland,PL,Poznan,elite,true,4.15,AS8364,"Institute of Bioorganic Chemistry Polish Academy of Science, Poznan Supercomput",87.72,1780029896.9279227
