protocol,ip,port,country,country_code,city,anonymity,ssl,uptime_percent,asn,isp,latency_ms,last_checked
socks4,185.160.13.112,1080,Poland,PL,Łaziska Górne,elite,true,61.43,AS197274,Slaska Siec Metropolitalna Sp. z o.o,119.42,1780115343.590732
socks4,94.40.127.166,4145,Poland,PL,Torun,elite,true,3.82,AS20960,TK Telekom sp. z o.o.,7198.93,1780115338.2480543
socks4,46.171.28.162,59311,Poland,PL,Krzywa Góra,elite,true,9.83,AS5617,Orange Polska Spolka Akcyjna,1276.22,1780115328.341324
socks4,185.32.4.126,4153,Poland,PL,Chociwel,elite,true,29.22,AS60645,AS Consulting Sp. z o. o.,3147.81,1780115326.5326958
socks4,212.126.5.249,42344,Poland,PL,Poznan,elite,true,16.68,AS8364,"Institute of Bioorganic Chemistry Polish Academy of Science, Poznan Supercomput",1126.26,1780115397.5938647
