protocol,ip,port,country,country_code,city,anonymity,ssl,uptime_percent,asn,isp,latency_ms,last_checked
socks4,185.160.13.112,1080,Poland,PL,Łaziska Górne,elite,true,61.33,AS197274,Slaska Siec Metropolitalna Sp. z o.o,118.15,1780091700.9205906
socks4,45.144.49.156,1080,Poland,PL,Warsaw,elite,true,66.03,AS49791,3hcloud,178.36,1780091697.4544337
socks4,91.150.189.122,60647,Poland,PL,Rzeszów,elite,true,15.63,AS42673,Skyware Sp. z o.o.,225.79,1780091697.2583854
socks4,46.171.28.162,59311,Poland,PL,Krzywa Góra,elite,true,9.73,AS5617,Orange Polska Spolka Akcyjna,7567.38,1780091688.2548778
socks4,212.126.5.249,42344,Poland,PL,Poznan,elite,true,16.29,AS8364,"Institute of Bioorganic Chemistry Polish Academy of Science, Poznan Supercomput",3124.96,1780091688.5341356
