protocol,ip,port,country,country_code,city,anonymity,ssl,uptime_percent,asn,isp,latency_ms,last_checked
socks4,94.40.127.166,4145,Poland,PL,Torun,elite,true,3.79,AS20960,TK Telekom sp. z o.o.,114.76,1779968667.614623
socks4,91.150.189.122,60647,Poland,PL,Rzeszów,elite,true,15.07,AS42673,Skyware Sp. z o.o.,1247.63,1779968663.9638793
socks4,78.31.93.76,1080,Poland,PL,Racibórz,elite,true,4.17,AS30813,Fione Spolka z Ogranicznona Odpowiedzialnoscia Spolka Komandytowa,3216.44,1779968649.0123203
socks4,88.218.206.170,22,Poland,PL,Łęczyca,elite,true,66.58,AS215467,Skhron OU,1737.0,1779968636.8546307
socks4,185.79.243.153,38431,Poland,PL,Myszków,elite,true,10.92,AS206957,PHU Kario-Sat Sp. z o.o.,1166.12,1779968626.217197
socks4,212.126.5.246,42344,Poland,PL,Poznan,elite,true,4.09,AS8364,"Institute of Bioorganic Chemistry Polish Academy of Science, Poznan Supercomput",1110.08,1779968711.9694142
socks4,213.25.70.1,3629,Poland,PL,Miasteczko Śląskie,elite,true,2.6,AS5617,Orange Polska Spolka Akcyjna,3152.81,1779968660.2760828
