protocol,ip,port,country,country_code,city,anonymity,ssl,uptime_percent,asn,isp,latency_ms,last_checked
socks4,46.171.28.162,59311,Poland,PL,Krzywa Góra,elite,true,9.87,AS5617,Orange Polska Spolka Akcyjna,122.88,1780125600.7861636
socks4,185.79.243.153,38431,Poland,PL,Myszków,elite,true,11.3,AS206957,PHU Kario-Sat Sp. z o.o.,1184.89,1780125600.3173063
socks4,45.144.49.156,1080,Poland,PL,Warsaw,elite,true,66.32,AS49791,3hcloud,159.83,1780125596.5583365
socks4,51.83.226.103,9055,Poland,PL,Warsaw,elite,true,33.99,AS16276,OVH SAS,8720.65,1780125593.805959
socks4,185.32.4.65,4153,Poland,PL,Chociwel,elite,true,7.06,AS60645,AS Consulting Sp. z o. o.,3139.7,1780125584.4496949
socks4,37.131.164.94,59341,Poland,PL,Strzelce Krajeńskie,elite,true,16.14,AS35745,KSU Provector Network,163.31,1780125582.012084
socks4,91.150.189.122,60647,Poland,PL,Rzeszów,elite,true,15.78,AS42673,Skyware Sp. z o.o.,7439.79,1780125580.38027
socks4,185.32.4.126,4153,Poland,PL,Chociwel,elite,true,29.26,AS60645,AS Consulting Sp. z o. o.,3155.26,1780125551.5175579
socks4,212.126.5.246,42344,Poland,PL,Poznan,elite,true,4.32,AS8364,"Institute of Bioorganic Chemistry Polish Academy of Science, Poznan Supercomput",7256.54,1780125596.1013353
socks4,212.126.5.249,42344,Poland,PL,Poznan,elite,true,16.82,AS8364,"Institute of Bioorganic Chemistry Polish Academy of Science, Poznan Supercomput",79.08,1780125586.8981292
