protocol,ip,port,country,country_code,city,anonymity,ssl,uptime_percent,asn,isp,latency_ms,last_checked
socks4,91.150.189.122,60647,Poland,PL,Rzeszów,elite,true,16.07,AS42673,Skyware Sp. z o.o.,3526.64,1780189196.2774312
socks4,185.32.6.121,4153,Poland,PL,Ińsko,elite,true,11.75,AS60645,AS Consulting Sp. z o. o.,7255.78,1780189178.0692651
socks4,46.171.28.162,59311,Poland,PL,Krzywa Góra,elite,true,10.1,AS5617,Orange Polska Spolka Akcyjna,214.56,1780189160.6011035
socks4,185.79.243.153,38431,Poland,PL,Myszków,elite,true,11.46,AS206957,PHU Kario-Sat Sp. z o.o.,7420.11,1780189159.7635221
socks4,78.31.93.76,1080,Poland,PL,Racibórz,elite,true,4.27,AS30813,Fione Spolka z Ogranicznona Odpowiedzialnoscia Spolka Komandytowa,3411.07,1780189135.2732475
socks4,45.144.49.156,1080,Poland,PL,Warsaw,elite,true,67.12,AS49791,3hcloud,180.0,1780189182.001871
socks4,185.160.13.112,1080,Poland,PL,Łaziska Górne,elite,true,61.92,AS197274,Slaska Siec Metropolitalna Sp. z o.o,3171.79,1780189180.6307755
socks4,212.126.5.245,42344,Poland,PL,Poznan,elite,true,4.61,AS8364,"Institute of Bioorganic Chemistry Polish Academy of Science, Poznan Supercomput",3119.29,1780189173.3694875
socks4,212.126.5.249,42344,Poland,PL,Poznan,elite,true,17.38,AS8364,"Institute of Bioorganic Chemistry Polish Academy of Science, Poznan Supercomput",3202.84,1780189183.8797047
socks4,213.25.70.1,3629,Poland,PL,Miasteczko Śląskie,elite,true,2.68,AS5617,Orange Polska Spolka Akcyjna,7378.92,1780189129.3075757
socks4,51.83.226.103,9055,Poland,PL,Warsaw,elite,true,34.34,AS16276,OVH SAS,18146.95,1780189187.9021015
