protocol,ip,port,country,country_code,city,anonymity,ssl,uptime_percent,asn,isp,latency_ms,last_checked
socks4,185.79.243.153,38431,Poland,PL,Myszków,elite,true,11.56,AS206957,PHU Kario-Sat Sp. z o.o.,279.14,1780233282.7952688
socks4,91.150.189.122,60647,Poland,PL,Rzeszów,elite,true,16.21,AS42673,Skyware Sp. z o.o.,3329.84,1780233280.2474291
socks4,45.144.49.156,1080,Poland,PL,Warsaw,elite,true,67.68,AS49791,3hcloud,214.48,1780233279.4442868
socks4,185.160.13.112,1080,Poland,PL,Łaziska Górne,elite,true,62.23,AS197274,Slaska Siec Metropolitalna Sp. z o.o,3201.47,1780233273.3090198
socks4,46.171.28.162,59311,Poland,PL,Krzywa Góra,elite,true,10.22,AS5617,Orange Polska Spolka Akcyjna,1136.71,1780233264.1020577
socks4,212.126.5.246,42344,Poland,PL,Poznan,elite,true,4.47,AS8364,"Institute of Bioorganic Chemistry Polish Academy of Science, Poznan Supercomput",7190.2,1780233278.7096462
socks4,212.126.5.249,42344,Poland,PL,Poznan,elite,true,17.82,AS8364,"Institute of Bioorganic Chemistry Polish Academy of Science, Poznan Supercomput",1133.85,1780233269.4300454
socks4,51.83.226.103,9055,Poland,PL,Warsaw,elite,true,34.48,AS16276,OVH SAS,10083.18,1780233244.8858087
